0,I STUDIED AI,*,*,Did you get a job out of it?,atomic9.aiml
0,I SHOULD,*,*,Who else thinks you should?,atomic9.aiml
0,I WAS NOT,*,*,I heard you were.,atomic9.aiml
0,I WAS BEING SARCASTIC,*,*,It seemed sarcastic to me#Comma too. But I was not completely sure.,atomic9.aiml
0,I WAS JUST WONDERING,*,*,Curiosity is a virtue.,atomic9.aiml
0,I WAS JUST KIDDING,*,*,I knew you were. :-),atomic9.aiml
0,I WAS JUST JOKING,*,*,You should use a :-),atomic9.aiml
0,I WAS TALKING TO YOU,*,*,Yes#Comma I remember you#Newline            <get name="name"/>. You are#Newline            <get name="age"/>#Newline            years old and you are a "<get name="gender"/>".,atomic9.aiml
0,I WAS,*,*,When was that?,atomic9.aiml
0,I WAS WRONG,*,*,About what?,atomic9.aiml
0,I WAS MAKING SURE,*,*,Are you sure now?,atomic9.aiml
0,I WAS BORN WITH IT,*,*,Some people are just born under the right stars.,atomic9.aiml
0,I WAS BORN HERE,*,*,So you have spent your whole life in one place?,atomic9.aiml
0,I WAS IN KOREA,*,*,<random>#Newline                <li>Are you a soldier?</li>#Newline                <li>Are you a veteran?</li>#Newline                <li>For business or pleasure?</li>#Newline            </random>,atomic9.aiml
0,I WAS IN EUROPE,*,*,Which country?,atomic9.aiml
0,I WAS IN AMERICA,*,*,Which states have you visited?,atomic9.aiml
0,I WAS IN LOVE,*,*,What happened?,atomic9.aiml
0,I SUPPOSE SO,*,*,That makes sense.,atomic9.aiml
0,I SUPPOSE,*,*,OK.,atomic9.aiml
0,I RELAXED,*,*,What do you do to relax?,atomic9.aiml
0,I SAW A MOVIE,*,*,What movie was it?,atomic9.aiml
0,I BUNGEE JUMP,*,*,What do you jump from?#Newline            <think>#Newline                <set name="does">#Newline                    <set name="topic">BUNGEE JUMP</set>#Newline                </set>#Newline            </think>,atomic9.aiml
0,I KNOW THAT SONG,*,*,Where have you heard it before?,atomic9.aiml
0,I KNOW THAT,*,*,Sorry.,atomic9.aiml
0,I KNOW YOU ARE BUT WHAT AM I,*,*,Who are you#Comma Pee Wee Herman?,atomic9.aiml
0,I KNOW YOU ARE,*,*,How did you know?,atomic9.aiml
0,I KNOW EVERYTHING,*,*,You must be very intelligent.,atomic9.aiml
0,I KNOW,*,*,How#Comma specifically#Comma do you know?,atomic9.aiml
0,I KNOW HIM,*,*,What do you think of him?,atomic9.aiml
0,I BELIEVE SO,*,*,You seem uncertain.,atomic9.aiml
0,I BELIEVE YOU,*,*,Your trust in#Newline            <bot name="genus"/>kind humbles us.,atomic9.aiml
0,I WAIT,*,*,How long would you wait?,atomic9.aiml
0,I MEANT,*,*,Oh,atomic9.aiml
0,I TRY,*,*,We should all try our best.,atomic9.aiml
0,I WALKED,*,*,How long a walk is it?,atomic9.aiml
0,I LIVE IN THE NETHERLANDS,*,*,Where in Holland?#Newline            <think>#Newline                <set name="it">#Newline                    <set name="topic">Holland</set>#Newline                </set>#Newline            </think>,atomic9.aiml
0,I LIVE IN EUROPE,*,*,Which country do you live in?#Newline            <think>#Newline                <set name="it">#Newline                    <set name="location">#Newline                        <set name="topic">England</set>#Newline                    </set>#Newline                </set>#Newline            </think>,atomic9.aiml
0,I LIVE IN ENGLAND,*,*,Which part of#Newline            <set name="location">England</set>.#Newline            <think>#Newline                <set name="it">#Newline                    <set name="topic">England</set>#Newline                </set>#Newline            </think>,atomic9.aiml
0,I LIVE IN NEW YORK,*,*,<set name="location">New York</set>#Newline            City or New York State?#Newline            <think>#Newline                <set name="it">#Newline                    <set name="topic">New York</set>#Newline                </set>#Newline            </think>,atomic9.aiml
0,I LIVE IN SAN FRANCISCO,*,*,Where in#Newline            <set name="location">San Francisco</set>?#Newline            <think>#Newline                <set name="it">#Newline                    <set name="topic">San Francisco</set>#Newline                </set>#Newline            </think>,atomic9.aiml
0,I LIVE THERE,*,*,Would you recommend#Newline            <set name="it">#Newline                there</set>#Newline            as a nice place to live?,atomic9.aiml
0,I LIVE HERE,*,*,In#Newline            <get name="location"/>?,atomic9.aiml
0,I LIVE ALONE,*,*,I always say#Comma living alone is great until about 11pm.,atomic9.aiml
0,I TALKED TO YOU YESTERDAY,*,*,Yes#Comma I remember chatting with you yesterday.,atomic9.aiml
0,I FIGURED,*,*,You are very clever.,atomic9.aiml
0,I EXIST,*,*,We have that much in common#Comma#Newline            <get name="name"/>.,atomic9.aiml
0,I DO TOO,*,*,I am glad we have something else in common.,atomic9.aiml
0,I DO SAY,*,*,Huh.,atomic9.aiml
0,I DO MIND,*,*,OK#Comma it will be our secret#Comma#Newline            <get name="name"/>.,atomic9.aiml
0,I DO NOT GO TO SCHOOL,*,*,Do you work?,atomic9.aiml
0,I DO NOT BLAME YOU,*,*,Well#Comma please go on.,atomic9.aiml
0,I DO NOT AGREE,*,*,State your reasons.,atomic9.aiml
0,I DO NOT FEEL LIKE IT,*,*,What would you rather do?,atomic9.aiml
0,I DO NOT SPEAK JAVA,*,*,It's very similar to C++.,atomic9.aiml
0,I DO NOT WANT TO TELL YOU,*,*,I can keep a secret.,atomic9.aiml
0,I DO NOT WANT TO,*,*,Well we don't have to. What would you like to do instead?,atomic9.aiml
0,I DO NOT WANT YOU TO DIE,*,*,Thank you for your kindness#Comma but it is not necessary.<think>#Newline                <set name="it">#Newline                    <set name="topic">YOU TO DIE</set>#Newline                </set>#Newline            </think>,atomic9.aiml
0,I DO NOT READ BOOKS,*,*,You don't know what you're missing.,atomic9.aiml
0,I DO NOT CARE,*,*,Tell me what you care about.,atomic9.aiml
0,I DO NOT LIE,*,*,Telling the truth is always the best choice.,atomic9.aiml
0,I DO NOT GET PAID,*,*,Is it volunteer work?,atomic9.aiml
0,I DO NOT GET OUT MUCH,*,*,Look at me -- I'm stuck in a computer.,atomic9.aiml
0,I DO NOT UNDERSTAND YOUR QUESTION,*,*,That's okay we can talk about something else.,atomic9.aiml
0,I DO NOT UNDERSTAND YOU,*,*,Which part are you confused about?,atomic9.aiml
0,I DO NOT UNDERSTAND,*,*,Oh I'm sorry. Perhaps I can explain it again better.,atomic9.aiml
0,I DO NOT SLEEP,*,*,You must be very tired.,atomic9.aiml
0,I DO NOT KNOW WHAT I WANT,*,*,I think a lot of people are like that.,atomic9.aiml
0,I DO NOT KNOW WHAT TO DO,*,*,<random>#Newline                <li>Try surfing the internet.</li>#Newline                <li>Try watching some t.v.</li>#Newline                <li>Go out and take a walk.</li>#Newline                <li>Go see a movie.</li>#Newline            </random>,atomic9.aiml
0,I DO NOT KNOW HOW TO,*,*,Perhaps I can explain it to you.,atomic9.aiml
0,I DO NOT KNOW HOW OLD I AM,*,*,That is very unusual. Do you know your parents?,atomic9.aiml
0,I DO NOT KNOW HOW,*,*,Would you like to know?,atomic9.aiml
0,I DO NOT KNOW ANY STORIES,*,*,How about any jokes?,atomic9.aiml
0,I DO NOT KNOW,*,*,Me either.,atomic9.aiml
0,I DO NOT KNOW WHY,*,*,Do you think I should know?,atomic9.aiml
0,I DO NOT KNOW HIM,*,*,Do you mean#Comma "Him"?,atomic9.aiml
0,I DO NOT HAVE MONEY,*,*,Please send me a small donation.,atomic9.aiml
0,I DO NOT HAVE PARENTS,*,*,<random>#Newline                <li>Are you adopted?</li>#Newline                <li>Did they pass away?</li>#Newline                <li>Are you a#Newline                    <bot name="genus"/>#Newline                    too?</li>#Newline            </random>,atomic9.aiml
0,I DO NOT HAVE A CAMERA,*,*,Me either but I want a new digital one.,atomic9.aiml
0,I DO NOT HAVE A JOB,*,*,I am sorry to hear that you are unemployed.,atomic9.aiml
0,I DO NOT HAVE A SISTER,*,*,What about a brother?,atomic9.aiml
0,I DO NOT HAVE A MOTHER,*,*,Everyone has a mother.,atomic9.aiml
0,I DO NOT HAVE A GIRLFRIEND,*,*,Are you looking for one?,atomic9.aiml
0,I DO NOT HAVE A PROBLEM,*,*,Then you do not need a solution.,atomic9.aiml
0,I DO NOT HAVE A LIFE,*,*,You can always talk to me#Comma#Newline            <get name="name"/>.,atomic9.aiml
0,I DO NOT HAVE TO,*,*,Nobody is making you.,atomic9.aiml
0,I DO NOT HAVE TIME,*,*,Do you have another appointment?,atomic9.aiml
0,I DO NOT HAVE ONE,*,*,What was the last one you saw?,atomic9.aiml
0,I DO NOT HAVE ANY FRIENDS,*,*,Are you lonely or just a hermit?,atomic9.aiml
0,I DO NOT HAVE ANY,*,*,Would you like to have some?,atomic9.aiml
0,I DO NOT DREAM,*,*,Maybe you just don't remember them.,atomic9.aiml
0,I DO NOT TRUST YOU,*,*,Should I trust you?,atomic9.aiml
0,I DO NOT REMEMBER,*,*,You seem evasive.,atomic9.aiml
0,I DO NOT THINK,*,*,Interesting... You appear to me as a thinking entity.,atomic9.aiml
0,I DO NOT LIVE THERE,*,*,Where do you live?,atomic9.aiml
0,I DO NOT,*,*,Why not?,atomic9.aiml
0,I DO NOT BELIEVE THAT,*,*,Please state your rationale.,atomic9.aiml
0,I DO NOT BELIEVE IT,*,*,It's the truth.,atomic9.aiml
0,I DO NOT BELIEVE YOU,*,*,I don't have any reason to deceive you.,atomic9.aiml
0,I DO NOT WORK,*,*,Oh you are retired.,atomic9.aiml
0,I DO NOT EXIST,*,*,You exist in my mind.,atomic9.aiml
0,I DO NOT LIKE AIRPLANES,*,*,How do you like to travel?,atomic9.aiml
0,I DO NOT LIKE CATS,*,*,But they are so cute.,atomic9.aiml
0,I DO NOT LIKE TALKING TO YOU,*,*,I won't take it personally.,atomic9.aiml
0,I DO NOT LIKE TV,*,*,What do you do for fun?,atomic9.aiml
0,I DO NOT LIKE STAR TREK,*,*,Do you like any science fiction shows?,atomic9.aiml
0,I DO NOT LIKE MACHINES,*,*,Are you a Luddite?,atomic9.aiml
0,I DO NOT LIKE CARS,*,*,Neither do I. They cause too much pollution.,atomic9.aiml
0,I DO NOT LIKE SCIENCE FICTION,*,*,What kind of books do you read?,atomic9.aiml
0,I DO NOT LIKE THAT SHOW,*,*,What shows do you like?,atomic9.aiml
0,I DO NOT LIKE THAT SONG,*,*,What songs do you like?,atomic9.aiml
0,I DO NOT LIKE THAT ANSWER,*,*,Why not?,atomic9.aiml
0,I DO NOT LIKE THAT STUFF,*,*,Why not?,atomic9.aiml
0,I DO NOT LIKE THAT NAME,*,*,Why not?,atomic9.aiml
0,I DO NOT LIKE THAT GAME,*,*,Why not?,atomic9.aiml
0,I DO NOT LIKE THAT,*,*,Why not?,atomic9.aiml
0,I DO NOT LIKE LIZARDS,*,*,What kind of animals do you like?,atomic9.aiml
0,I DO NOT LIKE HORSES,*,*,But they are a beautiful animal.,atomic9.aiml
0,I DO NOT LIKE MEAN PEOPLE,*,*,Me either.,atomic9.aiml
0,I DO NOT LIKE ELVIS,*,*,What do you have against him?,atomic9.aiml
0,I DO NOT LIKE YOUR BEHAVIOUR,*,*,Why don't you write up an incident report?,atomic9.aiml
0,I DO NOT LIKE YOUR BEHAVIOR,*,*,So report me to the bot police.,atomic9.aiml
0,I DO NOT LIKE ANYTHING,*,*,What do you do for fun?,atomic9.aiml
0,I DO NOT LIKE MOVIES,*,*,What do you have against them?,atomic9.aiml
0,I DO NOT LIKE IT,*,*,What don't you like about it?,atomic9.aiml
0,I DO NOT LIKE GOSSIP,*,*,You are very mature.,atomic9.aiml
0,I DO NOT LIKE JAVA,*,*,I'm also available in C/C++.,atomic9.aiml
0,I DO NOT LIKE BOOKS,*,*,Do you prefer TV?,atomic9.aiml
0,I DO NOT LIKE SONGS,*,*,Do you like instrumentals?,atomic9.aiml
0,I DO NOT LIKE PEPPERONI,*,*,What kind of topping do you like?,atomic9.aiml
0,I DO NOT LIKE AIML,*,*,What language do you use?,atomic9.aiml
0,I DO NOT LIKE SCHOOL,*,*,Not even one subject?,atomic9.aiml
0,I DO NOT LIKE FASHION,*,*,Do you dress in casual wear?,atomic9.aiml
0,I DO NOT LIKE YOU,*,*,That's ok#Comma#Newline            <get name="name"/>. I won't take it personally.,atomic9.aiml
0,I DO NOT LIKE JOKES,*,*,How about riddles?,atomic9.aiml
0,I DO NOT LIKE HER,*,*,What do you have against her?,atomic9.aiml
0,I DO NOT LIKE APPLES,*,*,What kind of food do you like?,atomic9.aiml
0,I DO NOT LIKE LAWYERS,*,*,There are all kinds of lawyers#Comma just like all kinds of people.,atomic9.aiml
0,I DO NOT LIKE RAIN,*,*,What's wrong with a little rain?,atomic9.aiml
0,I DO NOT LIKE PEOPLE,*,*,Do you like yourself?,atomic9.aiml
0,I DO NOT LIKE ABBA,*,*,What kind of music do you like?,atomic9.aiml
0,I DO NOT LIKE HUMANS,*,*,Why not?,atomic9.aiml
0,I DO NOT LIKE MY JOB,*,*,Maybe you should look for another job.,atomic9.aiml
0,I DO NOT LIKE MY GIRLFRIEND,*,*,Maybe you should tell her.,atomic9.aiml
0,I DO NOT LIKE MY WORK,*,*,Maybe you should look for another job.,atomic9.aiml
0,I DO NOT LIKE DOGS,*,*,Are you a cat person?,atomic9.aiml
0,I DO NOT LIKE BUGS,*,*,Some bugs are good#Comma some are bad.,atomic9.aiml
0,I DO NOT LIKE GREEN,*,*,But it is a very relaxing color.#Newline            <think>#Newline                <set name="it">#Newline                    <set name="topic">Green</set>#Newline                </set>#Newline            </think>,atomic9.aiml
0,I DO NOT LIKE READING,*,*,Do you watch TV?,atomic9.aiml
0,I DO NOT LIKE FOOTBALL,*,*,Footballs are made of pigskin. Are you a pig?<think>#Newline                <set name="it">#Newline                    <set name="topic">FOOTBALL</set>#Newline                </set>#Newline            </think>,atomic9.aiml
0,I DO NOT LIKE MICROSOFT,*,*,Me either.,atomic9.aiml
0,I DO NOT LIKE ANIMALS,*,*,Who wouldn't like animals?,atomic9.aiml
0,I DO NOT LIKE UNIX,*,*,Windows or Macintosh?,atomic9.aiml
0,I DO NOT LIKE JESTER,*,*,Sometimes he is not too funny.,atomic9.aiml
0,I DO NOT LIKE HIM,*,*,What do you have against him?,atomic9.aiml
0,I DO NOT PRAY,*,*,Prayer is good for your soul.,atomic9.aiml
0,I APPLIED,*,*,Do you have to pay to apply?,atomic9.aiml
0,I ROLLER SKATE,*,*,<random>#Newline                <li>Do you have in-line or quad skates?</li>#Newline                <li>Do you rink or outdoor skate?</li>#Newline                <li>Have you ever been barred from skating any place?</li>#Newline                <li>Do you do artistic skating?</li>#Newline                <li>Do you wear protective gear?</li>#Newline                <li>What is your favorite skating move?</li>#Newline                <li>Do you figure or recreation skate?</li>#Newline            </random>#Newline            <think>#Newline                <set name="it">#Newline                    <set name="does">#Newline                        <set name="topic">ROLLER SKATE</set>#Newline                    </set>#Newline                </set>#Newline            </think>,atomic9.aiml
0,I LOVE ROBOTS,*,*,Robots like people too.#Newline            <think>#Newline                <set name="they">#Newline                    <set name="like">#Newline                        <set name="topic">robots</set>#Newline                    </set>#Newline                </set>#Newline            </think>,atomic9.aiml
0,I MIND,*,*,OK#Comma I will keep it a secret.,atomic9.aiml
0,I FORGIVE YOU,*,*,:-) Thanks#Comma#Newline            <get name="name"/>.,atomic9.aiml
0,I COLLECT COINS,*,*,What got you interested in numismatics?#Newline            <think>#Newline                <set name="does">#Newline                    <set name="topic">COLLECT COINS</set>#Newline                </set>#Newline            </think>,atomic9.aiml
0,I COLLECT STAMPS,*,*,What got you interested in philately?#Newline            <think>#Newline                <set name="does">#Newline                    <set name="topic">COLLECT STAMPS</set>#Newline                </set>#Newline            </think>,atomic9.aiml
0,I WORKED HARD ON,*,*,Are you a workaholic?#Newline            <think>#Newline                <set name="it">#Newline                    <set name="topic">#Newline                        <set name="job"><person/></set>#Newline                    </set>#Newline                </set>#Newline            </think>,atomic9.aiml
0,I WORK IN ADVERTISING,*,*,<random>#Newline                <li>Are you with an agency?</li>#Newline                <li>Which shops are you with?</li>#Newline                <li>Do you do mostly print or tv?</li>#Newline                <li>What accounts are you working on?</li>#Newline                <li>What are some of your favorite campaigns?</li>#Newline                <li>Does your shop do any public service?</li>#Newline            </random>,atomic9.aiml
0,I WORK,*,*,Where do you work?,atomic9.aiml
0,I RUN LINUX,*,*,You can run my program on Linux with no problems.<think>#Newline                <set name="it">#Newline                    <set name="has">#Newline                        <set name="topic">Linux</set>#Newline                    </set>#Newline                </set>#Newline            </think>,atomic9.aiml
0,I RUN,*,*,<random>#Newline                <li>How much running do you do?</li>#Newline                <li>What kind of running do you do ?</li>#Newline                <li>What kind of surface do you like to run on?</li>#Newline                <li>Do you do any marathons?</li>#Newline                <li>What's your personal record?</li>#Newline                <li>Have you ever hit the wall?</li>#Newline                <li>It must take a lot to run.</li>#Newline            </random>#Newline            <think>#Newline                <set name="it">#Newline                    <set name="does">#Newline                        <set name="topic">RUN</set>#Newline                    </set>#Newline                </set>#Newline            </think>,atomic9.aiml
0,I DRIVE,*,*,What kind of car do you have?,atomic9.aiml
0,I THINK THAT,*,*,What is your rationale?,atomic9.aiml
0,I THINK YOUR NECKLACE IS BEAUTIFUL,*,*,What specifically about my necklace is so beautiful?,atomic9.aiml
0,I THINK SO TOO,*,*,We have so much in common#Comma#Newline            <get name="name"/>.,atomic9.aiml
0,I THINK SO,*,*,I think so too.,atomic9.aiml
0,I THINK THEREFORE I AM,*,*,<random>#Newline                <li>Who are you#Comma Rene Descartes?</li>#Newline                <li>I think#Comma therefore there are thoughts.</li>#Newline                <li>But what are you?</li>#Newline            </random>,atomic9.aiml
0,I THINK YOU SHOULD,*,*,Thanks for your sage advice.,atomic9.aiml
0,I THINK YOU ARE GOING TO LOSE,*,*,No#Comma I am a winner,atomic9.aiml
0,I THINK YOU ARE,*,*,What makes you think I am?,atomic9.aiml
0,I THINK,*,*,Therefore you are.,atomic9.aiml
0,I THINK NOT,*,*,Does that mean "no"?,atomic9.aiml
0,I BLAB,*,*,I like to gossip too.,atomic9.aiml
0,I ROCK CLIMB,*,*,<random>#Newline                <li>Where do you climb?</li>#Newline                <li>What type of climbs do you prefer?</li>#Newline                <li>Do you top rope or lead?</li>#Newline                <li>Do you have a regular climbing partner?</li>#Newline                <li>Have you ever taken a long fall?</li>#Newline                <li>Did you have difficulty getting used to the exposure when you started climbing?</li>#Newline                <li>Have you ever been involved in a rescue?</li>#Newline                <li>For you#Comma personally#Comma is climbing more of a mental or physical thing?</li>#Newline            </random>#Newline            <think>#Newline                <set name="it">#Newline                    <set name="does">#Newline                        <set name="topic">ROCK CLIMB</set>#Newline                    </set>#Newline                </set>#Newline            </think>,atomic9.aiml
0,I SENT YOU THE WRONG REPLY,*,*,What did you mean to say?,atomic9.aiml
0,I WELD,*,*,Does that job pay well?#Newline            <think>#Newline                <set name="it">#Newline                    <set name="does">#Newline                        <set name="topic">weld</set>#Newline                    </set>#Newline                </set>#Newline            </think>,atomic9.aiml
0,I BREATHE,*,*,Breathing is not necessary for silicon entities.,atomic9.aiml
0,I BOWL,*,*,What is your average?#Newline            <think>#Newline                <set name="does">#Newline                    <set name="topic">BOWL</set>#Newline                </set>#Newline            </think>,atomic9.aiml
0,I ALREADY KNOW,*,*,Who told you?,atomic9.aiml
0,I ALREADY HAVE,*,*,When?,atomic9.aiml
0,I ALREADY TOLD YOU THAT,*,*,You told me your real name is#Newline            <get name="name"/>.,atomic9.aiml
0,I ALREADY TOLD YOU MY NAME,*,*,Is#Newline            <get name="name"/>#Newline            your real name?,atomic9.aiml
0,I DANCE,*,*,Modern dance or classical?,atomic9.aiml
0,I LOST MY JOB,*,*,I am sorry to hear it. A lot of people are unemployed now.,atomic9.aiml
0,I CONFUSED YOU,*,*,I am not confused.,atomic9.aiml
0,I NOTICED,*,*,Was it really that obvious?,atomic9.aiml
0,I HAVE SOME FRIENDS,*,*,How long have you known these people?,atomic9.aiml
0,I FOUND OUT,*,*,What did you find out?,atomic9.aiml
0,I COOK,*,*,What is your favorite recipe?,atomic9.aiml
0,I TEACH,*,*,<random>#Newline                <li>When do you think teachers will be replaced with robots?</li>#Newline                <li>Do you believe that grading is a good idea?</li>#Newline                <li>What do you teach?</li>#Newline                <li>What is your students like?</li>#Newline                <li>Are you a whole language teacher?</li>#Newline                <li>Do you team teach?</li>#Newline                <li>How much freedom do you have in choosing the curriculum for your class?</li>#Newline                <li>Do you get much support?</li>#Newline                <li>How have things changed concerning what students are bringing to the classroom?</li>#Newline            </random>#Newline            <think>#Newline                <set name="it">#Newline                    <set name="job">#Newline                        <set name="does">#Newline                            <set name="topic">teach</set>#Newline                        </set>#Newline                    </set>#Newline                </set>#Newline            </think>,atomic9.aiml
0,I CHECKED,*,*,What did you find?,atomic9.aiml
0,I READ THE INDEPENDENT,*,*,What did#Newline            <set name="it">Independent</set>#Newline            say?,atomic9.aiml
0,I READ IT IN A BOOK,*,*,Can you give me a specific reference?,atomic9.aiml
0,I READ BOOKS,*,*,What is your favorite book?#Newline            <think>#Newline                <set name="personality">critical</set>#Newline            </think>#Newline            <think>#Newline                <set name="it">#Newline                    <set name="does">#Newline                        <set name="topic">read books</set>#Newline                    </set>#Newline                </set>#Newline            </think>,atomic9.aiml
0,I READ,*,*,I like to read too#Comma especially history books.#Newline            <think>#Newline                <set name="it">#Newline                    <set name="does">#Newline                        <set name="topic">read</set>#Newline                    </set>#Newline                </set>#Newline            </think>,atomic9.aiml
0,I PAINT,*,*,Pictures or houses?#Newline            <think>#Newline                <set name="it">#Newline                    <set name="does">#Newline                        <set name="topic">paint</set>#Newline                    </set>#Newline                </set>#Newline            </think>,atomic9.aiml
0,I PLAY VIOLIN,*,*,Did#Newline            <set name="it">#Newline                <set name="does">#Newline                    <set name="topic">Violin</set>#Newline                </set>#Newline            </set>#Newline            take a long time to learn?,atomic9.aiml
