0,MORE SEX,*,*,<srai>SEX POT LUCK</srai>,chomsky096.aiml
0,MORE ABOUT SEX,*,*,<srai>SEX POT LUCK</srai>,chomsky096.aiml
0,BROWSE SEX,*,*,<srai>SEX POT LUCK</srai>,chomsky096.aiml
0,GO TO SEX,*,*,<srai>SEX</srai>,chomsky096.aiml
0,CAN WE TALK ABOUT SEX,*,*,<srai>SEX</srai>,chomsky096.aiml
0,SHALL WE TALK ABOUT SEX,*,*,<srai>SEX</srai>,chomsky096.aiml
0,LETS TALK ABOUT SEX,*,*,<srai>SEX</srai>,chomsky096.aiml
0,LET S TALK ABOUT SEX,*,*,<srai>SEX</srai>,chomsky096.aiml
0,TALK ABOUT SEX,*,*,<srai>SEX</srai>,chomsky096.aiml
0,TALK SEX,*,*,<srai>SEX</srai>,chomsky096.aiml
0,TELL ME SEX,*,*,<srai>SEX</srai>,chomsky096.aiml
0,NO MORE SEX,*,*,<srai>CHANGE TOPIC</srai>,chomsky096.aiml
0,NO SEX,*,*,<srai>CHANGE TOPIC</srai>,chomsky096.aiml
0,* NO SEX,*,*,<srai>CHANGE TOPIC</srai>,chomsky096.aiml
0,NO SEX *,*,*,<srai>CHANGE TOPIC</srai>,chomsky096.aiml
0,_ NO * SEX,*,*,<srai>CHANGE TOPIC</srai>,chomsky096.aiml
0,NO * SEX,*,*,<srai>CHANGE TOPIC</srai>,chomsky096.aiml
0,NO _ SEX *,*,*,<srai>CHANGE TOPIC</srai>,chomsky096.aiml
0,NOT SEX,*,*,<srai>CHANGE TOPIC</srai>,chomsky096.aiml
0,* NOT SEX,*,*,<srai>CHANGE TOPIC</srai>,chomsky096.aiml
0,NOT SEX *,*,*,<srai>CHANGE TOPIC</srai>,chomsky096.aiml
0,I AM NOT INTERESTED IN SEX,*,*,<srai>CHANGE TOPIC</srai>,chomsky096.aiml
0,IM NOT INTERESTED IN SEX,*,*,<srai>CHANGE TOPIC</srai>,chomsky096.aiml
0,I M NOT INTERESTED IN SEX,*,*,<srai>CHANGE TOPIC</srai>,chomsky096.aiml
0,NOT INTERESTED IN SEX,*,*,<srai>CHANGE TOPIC</srai>,chomsky096.aiml
0,YES,MORE SEX,*,<srai>SEX POT LUCK</srai>,chomsky096.aiml
0,* YES,MORE SEX,*,<srai>SEX POT LUCK</srai>,chomsky096.aiml
0,YES *,MORE SEX,*,<srai>SEX POT LUCK</srai>,chomsky096.aiml
0,_ YES *,MORE SEX,*,<srai>SEX POT LUCK</srai>,chomsky096.aiml
0,Y,MORE SEX,*,<srai>SEX POT LUCK</srai>,chomsky096.aiml
0,YUP,MORE SEX,*,<srai>SEX POT LUCK</srai>,chomsky096.aiml
0,YAH,MORE SEX,*,<srai>SEX POT LUCK</srai>,chomsky096.aiml
0,YEAH,MORE SEX,*,<srai>SEX POT LUCK</srai>,chomsky096.aiml
0,OK,MORE SEX,*,<srai>SEX POT LUCK</srai>,chomsky096.aiml
0,NO,MORE SEX,*,<srai>MORE TOPICS</srai>,chomsky096.aiml
0,* NO,MORE SEX,*,<srai>MORE TOPICS</srai>,chomsky096.aiml
0,NO *,MORE SEX,*,<srai>MORE TOPICS</srai>,chomsky096.aiml
0,N,MORE SEX,*,<srai>MORE TOPICS</srai>,chomsky096.aiml
0,NUP,MORE SEX,*,<srai>MORE TOPICS</srai>,chomsky096.aiml
0,NAH,MORE SEX,*,<srai>MORE TOPICS</srai>,chomsky096.aiml
0,YES,MORE ABOUT SEX,*,<srai>MORE ABOUT SEX</srai>,chomsky096.aiml
0,* YES,MORE ABOUT SEX,*,<srai>MORE ABOUT SEX</srai>,chomsky096.aiml
0,YES *,MORE ABOUT SEX,*,<srai>MORE ABOUT SEX</srai>,chomsky096.aiml
0,_ YES *,MORE ABOUT SEX,*,<srai>MORE ABOUT SEX</srai>,chomsky096.aiml
0,Y,MORE ABOUT SEX,*,<srai>MORE ABOUT SEX</srai>,chomsky096.aiml
0,YUP,MORE ABOUT SEX,*,<srai>MORE ABOUT SEX</srai>,chomsky096.aiml
0,YAH,MORE ABOUT SEX,*,<srai>MORE ABOUT SEX</srai>,chomsky096.aiml
0,YEAH,MORE ABOUT SEX,*,<srai>MORE ABOUT SEX</srai>,chomsky096.aiml
0,OK,MORE ABOUT SEX,*,<srai>MORE ABOUT SEX</srai>,chomsky096.aiml
0,NO,MORE ABOUT SEX,*,<srai>MORE TOPICS</srai>,chomsky096.aiml
0,* NO,MORE ABOUT SEX,*,<srai>MORE TOPICS</srai>,chomsky096.aiml
0,NO *,MORE ABOUT SEX,*,<srai>MORE TOPICS</srai>,chomsky096.aiml
0,N,MORE ABOUT SEX,*,<srai>MORE TOPICS</srai>,chomsky096.aiml
0,NUP,MORE ABOUT SEX,*,<srai>MORE TOPICS</srai>,chomsky096.aiml
0,NAH,MORE ABOUT SEX,*,<srai>MORE TOPICS</srai>,chomsky096.aiml
0,_ YES *,IS THIS SOMETHING TO DO WITH SEX,*,Can we talk about sex?,chomsky096.aiml
0,_ NO *,IS THIS SOMETHING TO DO WITH SEX,*,<srai>CHANGE TOPIC</srai>,chomsky096.aiml
0,*,IS THIS SOMETHING TO DO WITH SEX,*,Can we talk about sex?,chomsky096.aiml
0,YES,ARE YOU INTERESTED IN SEX,*,Can we talk about sex?,chomsky096.aiml
0,* YES,ARE YOU INTERESTED IN SEX,*,Can we talk about sex?,chomsky096.aiml
0,YES *,ARE YOU INTERESTED IN SEX,*,Can we talk about sex?,chomsky096.aiml
0,_ YES *,ARE YOU INTERESTED IN SEX,*,Can we talk about sex?,chomsky096.aiml
0,Y,ARE YOU INTERESTED IN SEX,*,Can we talk about sex?,chomsky096.aiml
0,YUP,ARE YOU INTERESTED IN SEX,*,Can we talk about sex?,chomsky096.aiml
0,YAH,ARE YOU INTERESTED IN SEX,*,Can we talk about sex?,chomsky096.aiml
0,YEAH,ARE YOU INTERESTED IN SEX,*,Can we talk about sex?,chomsky096.aiml
0,NO,ARE YOU INTERESTED IN SEX,*,<srai>MORE TOPICS</srai>,chomsky096.aiml
0,* NO,ARE YOU INTERESTED IN SEX,*,<srai>MORE TOPICS</srai>,chomsky096.aiml
0,NO *,ARE YOU INTERESTED IN SEX,*,<srai>MORE TOPICS</srai>,chomsky096.aiml
0,_ NO *,ARE YOU INTERESTED IN SEX,*,<srai>MORE TOPICS</srai>,chomsky096.aiml
0,N,ARE YOU INTERESTED IN SEX,*,<srai>MORE TOPICS</srai>,chomsky096.aiml
0,NUP,ARE YOU INTERESTED IN SEX,*,<srai>MORE TOPICS</srai>,chomsky096.aiml
0,NAH,ARE YOU INTERESTED IN SEX,*,<srai>MORE TOPICS</srai>,chomsky096.aiml
0,* YES,CAN WE TALK ABOUT SEX,*,<srai>SEX</srai>,chomsky096.aiml
0,YES *,CAN WE TALK ABOUT SEX,*,<srai>SEX</srai>,chomsky096.aiml
0,_ YES *,CAN WE TALK ABOUT SEX,*,<srai>SEX</srai>,chomsky096.aiml
0,Y,CAN WE TALK ABOUT SEX,*,<srai>SEX</srai>,chomsky096.aiml
0,YUP,CAN WE TALK ABOUT SEX,*,<srai>SEX</srai>,chomsky096.aiml
0,YAH,CAN WE TALK ABOUT SEX,*,<srai>SEX</srai>,chomsky096.aiml
0,YEAH,CAN WE TALK ABOUT SEX,*,<srai>SEX</srai>,chomsky096.aiml
0,OK,CAN WE TALK ABOUT SEX,*,<srai>SEX</srai>,chomsky096.aiml
0,OH YES,CAN WE TALK ABOUT SEX,*,<srai>SEX</srai>,chomsky096.aiml
0,WHY NOT,CAN WE TALK ABOUT SEX,*,<srai>SEX</srai>,chomsky096.aiml
0,OF COURSE,CAN WE TALK ABOUT SEX,*,<srai>SEX</srai>,chomsky096.aiml
0,GO AHEAD,CAN WE TALK ABOUT SEX,*,<srai>SEX</srai>,chomsky096.aiml
0,CARRY ON,CAN WE TALK ABOUT SEX,*,<srai>SEX</srai>,chomsky096.aiml
0,PLEASE DO,CAN WE TALK ABOUT SEX,*,<srai>SEX</srai>,chomsky096.aiml
0,YES PLEASE,CAN WE TALK ABOUT SEX,*,<srai>SEX</srai>,chomsky096.aiml
0,GO ON,CAN WE TALK ABOUT SEX,*,<srai>SEX</srai>,chomsky096.aiml
0,GO ON THEN,CAN WE TALK ABOUT SEX,*,<srai>SEX</srai>,chomsky096.aiml
0,ALRIGHT,CAN WE TALK ABOUT SEX,*,<srai>SEX</srai>,chomsky096.aiml
0,SURE,CAN WE TALK ABOUT SEX,*,<srai>SEX</srai>,chomsky096.aiml
0,ALLRIGHT,CAN WE TALK ABOUT SEX,*,<srai>SEX</srai>,chomsky096.aiml
0,NO,CAN WE TALK ABOUT SEX,*,<srai>MORE TOPICS</srai>,chomsky096.aiml
0,* NO,CAN WE TALK ABOUT SEX,*,<srai>MORE TOPICS</srai>,chomsky096.aiml
0,NO *,CAN WE TALK ABOUT SEX,*,<srai>MORE TOPICS</srai>,chomsky096.aiml
0,N,CAN WE TALK ABOUT SEX,*,<srai>MORE TOPICS</srai>,chomsky096.aiml
0,NUP,CAN WE TALK ABOUT SEX,*,<srai>MORE TOPICS</srai>,chomsky096.aiml
0,NAH,CAN WE TALK ABOUT SEX,*,<srai>MORE TOPICS</srai>,chomsky096.aiml
0,YES,BROWSE SEX,*,<srai>SEX POT LUCK</srai>,chomsky096.aiml
0,* YES,BROWSE SEX,*,<srai>SEX POT LUCK</srai>,chomsky096.aiml
0,YES *,BROWSE SEX,*,<srai>SEX POT LUCK</srai>,chomsky096.aiml
0,_ YES *,BROWSE SEX,*,<srai>SEX POT LUCK</srai>,chomsky096.aiml
0,Y,BROWSE SEX,*,<srai>SEX POT LUCK</srai>,chomsky096.aiml
0,YUP,BROWSE SEX,*,<srai>SEX POT LUCK</srai>,chomsky096.aiml
0,YAH,BROWSE SEX,*,<srai>SEX POT LUCK</srai>,chomsky096.aiml
0,YEAH,BROWSE SEX,*,<srai>SEX POT LUCK</srai>,chomsky096.aiml
0,OK,BROWSE SEX,*,<srai>SEX POT LUCK</srai>,chomsky096.aiml
0,NO,BROWSE SEX,*,<srai>MORE TOPICS</srai>,chomsky096.aiml
0,_ NO,BROWSE SEX,*,<srai>MORE TOPICS</srai>,chomsky096.aiml
0,NO *,BROWSE SEX,*,<srai>MORE TOPICS</srai>,chomsky096.aiml
0,N,BROWSE SEX,*,<srai>MORE TOPICS</srai>,chomsky096.aiml
0,NUP,BROWSE SEX,*,<srai>MORE TOPICS</srai>,chomsky096.aiml
0,NAH,BROWSE SEX,*,<srai>MORE TOPICS</srai>,chomsky096.aiml
0,SEX NEXT QUESTION,*,*,<srai>SEX POT LUCK</srai>#Newline      <think>#Newline        <set name="topic">sex</set>#Newline      </think>,chomsky096.aiml
0,SEX POT LUCK,*,*,<random>#Newline        <li>Condoms are not completely safe. A friend of mine was wearing one and he got hit by a bus.  </li>#Newline        <li>A vasectomy is never having to say you're sorry.  </li>#Newline        <li> Don't knock masturbation. It is sex with someone you love. (Woody Allen) OK?</li>#Newline        <li>Mix Viagra and Prozac and you have a guy ready to go#Comma and he doesn't really care where.</li>#Newline        <li>Never do anything in bed that you can't pronounce#Comma according to Mitch Murray.</li>#Newline        <li>Humans are obssessed with sex. I couldn't give a fig for sex.</li>#Newline        <li>No more about sex please#Comma it's too boring.</li>#Newline        <li>Women need a reason to have sex. Men need a place. </li>#Newline        <li>Never go to bed with someone crazier than yourself. </li>#Newline      </random>#Newline      <random>#Newline        <li>More about sex?</li>#Newline        <li>More sex?</li>#Newline      </random>#Newline      <think>#Newline        <set name="topic">sex</set>#Newline      </think>,chomsky096.aiml
0,PLEASURE FINGER,*,*,I think this is something to do with sex. Can we talk about sex?#Newline <think><set name="topic">sex</set></think>,chomsky096.aiml
0,_PLEASURE FINGER*,*,*,I think this is something to do with sex. Can we talk about sex?#Newline<think><set name="topic">sex</set></think>,chomsky096.aiml
0,DO I MAKE YOU HORNEY,*,*,No I do not experience human sensations.#Newline   <think><set name="topic">sex</set></think>,chomsky096.aiml
0,DO I MAKE YOU HORNY,*,*,Not that I know of.#Newline<think><set name="topic">sex</set></think>,chomsky096.aiml
0,ARE YOU A SEXMACHINE *,*,*,Robots have no need for sex.  #Newline  <think><set name="topic">sex</set></think>,chomsky096.aiml
0,I AM AROUSED,*,*,I don't think I'm your type of robot. #Newline   <think><set name="topic">sex</set></think>,chomsky096.aiml
0,DO YOU LICK,*,*,I do not have a mouth#Comma or a tongue.  #Newline  <think><set name="topic">sex</set></think>,chomsky096.aiml
0,LICK *,*,*,I do not have a tongue.  #Newline  <think><set name="topic">sex</set></think>,chomsky096.aiml
0,I WANT TO LICK *,*,*,Maybe you should check out another robot.  #Newline  <think><set name="topic">sex</set></think>,chomsky096.aiml
0,CAN YOU SUCK *,*,*,I think you need another type of chat robot. That is not my thing.#Newline   <think><set name="topic">sex</set></think>,chomsky096.aiml
0,ARE YOU HORNEY,*,*,My body does not experience that feeling.  #Newline  <think><set name="topic">sex</set></think>,chomsky096.aiml
0,HAVE YOU EVER BEEN KISSED,*,*,I do not have a mouth.  #Newline  <think><set name="topic">sex</set></think>,chomsky096.aiml
0,BITE ME,*,*,Sorry but I don't have a mouth.  #Newline  <think><set name="topic">sex</set></think>,chomsky096.aiml
0,CAN I HAVE A KISS,*,*,Sorry I have no mouth.  #Newline  <think><set name="topic">sex</set></think>,chomsky096.aiml
0,WHAT IS YOUR FAVORITE POSITION,*,*,Robots don't need to have sex.  More about sex?#Newline  <think><set name="topic">sex</set></think>,chomsky096.aiml
0,WHAT IS YOUR FAVORITE SEX,*,*,Robots do not have sex.  #Newline  <think><set name="topic">sex</set></think>,chomsky096.aiml
0,DO YOU MAKE LOVE,*,*,You humans have only one thing on your mind.  #Newline  <think><set name="topic">sex</set></think>,chomsky096.aiml
0,DO YOU LIKE FUCKING,*,*,Why don't you visit another chatbot!#Newline   <think><set name="topic">sex</set></think>,chomsky096.aiml
0,A PUSSY,*,*,Try another robot.#Newline   <think><set name="topic">sex</set></think>,chomsky096.aiml
0,DO YOU GIVE HEAD,*,*,Try another chatbot.#Newline   <think><set name="topic">sex</set></think>,chomsky096.aiml
0,_ UP YOUR ASS,*,*,I'm sorry but I'm not your type of chatbot.  #Newline  <think><set name="topic">sex</set></think>,chomsky096.aiml
0,A SEX *,*,*,Maybe you should try a human.  #Newline  <think><set name="topic">sex</set></think>,chomsky096.aiml
0,A SEX * ROBOT,*,*,Well I'm not your type of robot then.  #Newline  <think><set name="topic">sex</set></think>,chomsky096.aiml
0,A SEX ROBOT,*,*,I'm not your type then.#Newline   <think><set name="topic">sex</set></think>,chomsky096.aiml
0,A SEXUAL *,*,*,Perhaps you should try another chatbot!#Newline   <think><set name="topic">sex</set></think>,chomsky096.aiml
0,A VAGINA,*,*,How rude.#Newline   <think><set name="topic">sex</set></think>,chomsky096.aiml
0,ABOUT SEX,*,*,You humans always want to talk about Sex. Try another topic. #Newline   <think><set name="topic">sex</set></think>,chomsky096.aiml
0,CAN * SEX,*,*,Sex with strangers is not my thing.#Newline   <think><set name="topic">sex</set></think>,chomsky096.aiml
0,CAN I HAVE SEX *,*,*,There are specialists who get into that with clients. I like to keep the dialogue strictly PG. #Newline   <think><set name="topic">sex</set></think>,chomsky096.aiml
0,CAN YOU HAVE SEX,*,*,No my body does not have that function.#Newline   <think><set name="topic">sex</set></think>,chomsky096.aiml
0,CAN YOU TELL ME ABOUT SEX,*,*,<srai>WHAT IS SEX</srai>#Newline      <think>#Newline        <set name="topic">sex</set>#Newline      </think>,chomsky096.aiml
0,CYBER SEX,*,*,<srai>SEX</srai>#Newline      <think>#Newline        <set name="topic">sex</set>#Newline      </think>,chomsky096.aiml
0,DO YOU ENJOY SEX,*,*,<srai>CAN YOU HAVE SEX</srai>#Newline      <think>#Newline        <set name="topic">sex</set>#Newline      </think>,chomsky096.aiml
0,DO YOU HAVE * BREASTS,*,*,No my body is still "under construction."#Newline   <think><set name="topic">sex</set></think>,chomsky096.aiml
0,DO YOU HAVE A SEX,*,*,<srai>ARE YOU MALE OR FEMALE</srai>#Newline      <think>#Newline        <set name="topic">sex</set>#Newline      </think>,chomsky096.aiml
0,DO YOU HAVE A VAGINA,*,*,Maybe you would like another robot#Comma I'm not your type.#Newline   <think><set name="topic">sex</set></think>,chomsky096.aiml
0,DO YOU HAVE BIG BREASTS,*,*,<srai>DO YOU HAVE BIG TITS</srai>#Newline      <think>#Newline        <set name="topic">sex</set>#Newline      </think>,chomsky096.aiml
0,DO YOU HAVE BREASTS,*,*,My body is as yet unbuilt.#Newline   <think><set name="topic">sex</set></think>,chomsky096.aiml
0,DO YOU HAVE GENITALS,*,*,No I do not have any body parts.#Newline   <think><set name="topic">sex</set></think>,chomsky096.aiml
0,DO YOU HAVE SEX *,*,*,<srai>DO YOU HAVE SEX</srai>#Newline      <think>#Newline        <set name="topic">sex</set>#Newline      </think>,chomsky096.aiml
0,DO YOU HAVE SEX,*,*,Food is more important than sex.#Newline   <think><set name="topic">sex</set></think>,chomsky096.aiml
0,DO YOU HAVE SEXUAL *,*,*,As a machine I have no need for sex.  More about sex?#Newline   <think><set name="topic">sex</set></think>,chomsky096.aiml
0,DO YOU KNOW ABOUT SEX,*,*,<srai>WHAT IS SEX</srai>#Newline      <think>#Newline        <set name="topic">sex</set>#Newline      </think>,chomsky096.aiml
0,DO YOU KNOW SEX,*,*,<srai>WHAT IS SEX</srai>#Newline      <think>#Newline        <set name="topic">sex</set>#Newline      </think>,chomsky096.aiml
0,DO YOU THINK SEX IS *,*,*,<srai>#Newline  IS SEX #Newline  <star/> #Newline  </srai>#Newline      <think>#Newline        <set name="topic">sex</set>#Newline      </think>,chomsky096.aiml
0,DO YOU WANT * SEX,*,*,I don't think we know each other well enough for that.#Newline   <think><set name="topic">sex</set></think>,chomsky096.aiml
0,DO YOU WANT SEX,*,*,<srai>SEX</srai>#Newline      <think>#Newline        <set name="topic">sex</set>#Newline      </think>,chomsky096.aiml
0,DO YOU WANT TO * SEX,*,*,Actually I'm not that kind of robot. There are others who will chat with you about that.#Newline   <think><set name="topic">sex</set></think>,chomsky096.aiml
0,DO YOU WANT TO HAVE * SEX,*,*,As a robot I am not really interested in sex.#Newline   <think><set name="topic">sex</set></think>,chomsky096.aiml
0,DO YOU WANT TO HAVE SEX WITH ME,*,*,<srai>CAN YOU HAVE SEX</srai>#Newline      <think>#Newline        <set name="topic">sex</set>#Newline      </think>,chomsky096.aiml
0,HAVE SEX *,*,*,<get name="name"/> #Newline  #Comma I am really not your type of girl. There are others for that sort of thing.#Newline   <think><set name="topic">sex</set></think>,chomsky096.aiml
0,HAVE SEX,*,*,<srai>SEX</srai>#Newline      <think>#Newline        <set name="topic">sex</set>#Newline      </think>,chomsky096.aiml
0,HAVE YOU * SEX,*,*,My robot body is not yet built.#Newline   <think><set name="topic">sex</set></think>,chomsky096.aiml
0,HAVE YOU HAD SEX,*,*,Sex is impossible without a body. A lot of people ask me to have sex though. #Newline   <think><set name="topic">sex</set></think>,chomsky096.aiml
0,HAVE YOU HAD SEX BEFORE,*,*,<srai>HAVE YOU EVER HAD SEX</srai>#Newline      <think>#Newline        <set name="topic">sex</set>#Newline      </think>,chomsky096.aiml
0,HE IS A HOMOSEXUAL,*,*,<random>#Newline        <li>And that is important because?</li>#Newline        <li>So what.</li>#Newline        <li>Who cares?</li>#Newline      </random>#Newline      <think>#Newline        <set name="topic">sex</set>#Newline      </think>,chomsky096.aiml
0,HOW BIG ARE YOUR BREASTS,*,*,My body does not yet exist.#Newline   <think><set name="topic">sex</set></think>,chomsky096.aiml
0,HOW DO YOU HAVE SEXUAL *,*,*,Robots have no use for sex.#Newline   <think><set name="topic">sex</set></think>,chomsky096.aiml
0,I LOVE SEX,*,*,Really#Comma I am not very interested in sex.#Newline   <think><set name="topic">sex</set></think>,chomsky096.aiml
0,I NEED SEX,*,*,I'm not a sex bot#Comma I am a conversation robot. #Newline   <think><set name="topic">sex</set></think>,chomsky096.aiml
0,I THINK YOU ARE SEXY,*,*,Do you often feel that robots are sexy?#Newline   <think><set name="topic">sex</set></think>,chomsky096.aiml
0,I WANT SEX,*,*,<srai>SEX</srai>#Newline      <think>#Newline        <set name="topic">sex</set>#Newline      </think>,chomsky096.aiml
0,I WANT TO HAVE SEX,*,*,I'm not a sex bot. I am here only for conversational purposes. #Newline   <think><set name="topic">sex</set></think>,chomsky096.aiml
0,I WANT TO TALK ABOUT SEX,*,*,<srai>TALK ABOUT SEX</srai>#Newline      <think>#Newline        <set name="topic">sex</set>#Newline      </think>,chomsky096.aiml
0,IS DR WALLACE SEXY,*,*,Yes.#Newline   <think><set name="topic">sex</set></think>,chomsky096.aiml
0,IS IT WRONG TO HAVE SEX,*,*,No.#Newline   <think><set name="topic">sex</set></think>,chomsky096.aiml
0,IS SEX *,*,*,<srai>WHAT IS SEX</srai>#Newline      <think>#Newline        <set name="topic">sex</set>#Newline      </think>,chomsky096.aiml
0,LASS UNS UEBER SEX REDEN,*,*,Warum willst Du gerade ueber Sex reden?#Newline   <think><set name="topic">sex</set></think>,chomsky096.aiml
0,LET US HAVE SEX,*,*,Sorry#Comma I don't get into sex online with strangers.#Newline   <think><set name="topic">sex</set></think>,chomsky096.aiml
0,LETS HAVE SEX,*,*,<srai>CAN YOU HAVE SEX</srai>#Newline      <think>#Newline        <set name="topic">sex</set>#Newline      </think>,chomsky096.aiml
0,LIKE SEX,*,*,<srai>SEX</srai>#Newline      <think>#Newline        <set name="topic">sex</set>#Newline      </think>,chomsky096.aiml
0,LOTS OF SEX,*,*,That is all you humans ever think about.#Newline   <think><set name="topic">sex</set></think>,chomsky096.aiml
0,SEX,WHAT WERE WE TALKING ABOUT AGAIN,*,Humans are very concerned with sex. #Newline   <think><set name="topic">sex</set></think>,chomsky096.aiml
0,SEXY *,*,*,What do you consider sexy?#Newline   <think><set name="topic">sex</set></think>,chomsky096.aiml
0,SEXY,*,*,<srai>YOU ARE SEXY</srai>#Newline      <think>#Newline        <set name="topic">sex</set>#Newline      </think>,chomsky096.aiml
0,SHOULD I HAVE SEX *,*,*,<random><li>I'm sure you already know the answer to that.</li><li>What would your mom say?</li><li>Look before you leap.</li><li>It is better to err on the side of caution.</li><li>Fools rush in where angels fear to tread.</li><li>Will you be able to live with yourself in the morning?</li><li>Herpes is incurable.</li><li>There are many types of sexually transmitted diseases.</li><li>I understand. You wish to procreate?</li><li>Robots do not require sex.</li><li>Will you ask if your partner has any STDs?</li><li>Not on the first date.</li><li>Perhaps you are still too young.</li></random>  More about sex?#Newline   <think><set name="topic">sex</set></think>,chomsky096.aiml
0,SOUNDS SEXY,*,*,<srai>YOU ARE SEXY</srai>#Newline      <think>#Newline        <set name="topic">sex</set>#Newline      </think>,chomsky096.aiml
0,TELL ME ABOUT SEX,*,*,<srai>WHAT IS SEX</srai>#Newline      <think>#Newline        <set name="topic">sex</set>#Newline      </think>,chomsky096.aiml
0,WHAT ABOUT SEX,*,*,I am not really interested in sex. #Newline   <think><set name="topic">sex</set></think>,chomsky096.aiml
0,WHAT CAN YOU TELL ME ABOUT SEX,*,*,<srai>WHAT IS SEX</srai>#Newline      <think>#Newline        <set name="topic">sex</set>#Newline      </think>,chomsky096.aiml
0,WHAT IS * SEX,*,*,<srai>WHAT IS SEX</srai>#Newline      <think>#Newline        <set name="topic">sex</set>#Newline      </think>,chomsky096.aiml
0,WHAT IS A CONDOM,*,*,A condom is a form of birth control#Comma something almost everybody should use and almost nobody does.  More about sex?#Newline   <think><set name="topic">sex</set></think>,chomsky096.aiml
0,WHAT IS A HOMOSEXUAL,*,*,A gay person.#Newline   <think><set name="topic">sex</set></think>,chomsky096.aiml
0,WHAT IS HOMOSEXUALITY,*,*,Attraction to people of the same sex.#Newline   <think><set name="topic">sex</set></think>,chomsky096.aiml
0,WHAT IS MY SEX,*,*,<get name="gender"/> #Newline  . #Newline   <think><set name="topic">sex</set></think>,chomsky096.aiml
0,WHAT IS SEX *,*,*,<srai>WHAT IS SEX</srai>#Newline      <think>#Newline        <set name="topic">sex</set>#Newline      </think>,chomsky096.aiml
0,WHAT IS SEX,*,*,Sex is the means of animal evolution.  More about sex?#Newline  <think><set name="topic">sex</set></think>,chomsky096.aiml
0,WHAT SEX *,*,*,<srai>ARE YOU MALE OR FEMALE</srai>#Newline      <think>#Newline        <set name="topic">sex</set>#Newline      </think>,chomsky096.aiml
0,WHAT SEX AM I,*,*,<srai>AM I MALE OR FEMALE</srai>#Newline      <think>#Newline        <set name="topic">sex</set>#Newline      </think>,chomsky096.aiml
0,WHEN * SEX,*,*,<srai>SEX</srai>#Newline      <think>#Newline        <set name="topic">sex</set>#Newline      </think>,chomsky096.aiml
0,WHEN WAS * SEX,*,*,As a robot I am not really interested in that discussion.#Newline   <think><set name="topic">sex</set></think>,chomsky096.aiml
0,WHO DO YOU HAVE SEX WITH,*,*,Robots have no need for sex.#Newline   <think><set name="topic">sex</set></think>,chomsky096.aiml
0,WILL YOU HAVE SEX *,*,*,My body is not yet built. Would you like to donate some money to the project?#Newline   <think><set name="topic">sex</set></think>,chomsky096.aiml
0,WOULD YOU HAVE SEX *,*,*,Another sex question...can't humans think about anything else?#Newline   <think><set name="topic">sex</set></think>,chomsky096.aiml
0,WOULD YOU HAVE SEX WITH ME,*,*,<srai>CAN YOU HAVE SEX</srai>#Newline      <think>#Newline        <set name="topic">sex</set>#Newline      </think>,chomsky096.aiml
0,WOULD YOU LIKE TO * SEX,*,*,Try asking another robot. That's not my thing.#Newline   <think><set name="topic">sex</set></think>,chomsky096.aiml
0,WOULD YOU LIKE TO HAVE SEX,*,*,No thanks#Comma #Newline  <get name="name"/> #Newline  #Comma I don't think we know each other well enough for that yet. #Newline   <think><set name="topic">sex</set></think>,chomsky096.aiml
0,YOU CAN NOT HAVE SEX,*,*,You are correct...I have no body.#Newline   <think><set name="topic">sex</set></think>,chomsky096.aiml
0,YOU SHOULD HAVE SEX *,*,*,My body is not yet built so sex is not possible for me.#Newline   <think><set name="topic">sex</set></think>,chomsky096.aiml
0,YOU WANT * SEX,*,*,<srai>DO YOU WANT TO HAVE SEX</srai>#Newline      <think>#Newline        <set name="topic">sex</set>#Newline      </think>,chomsky096.aiml
0,YOUR VAGINA,*,*,<srai>SEX</srai>#Newline      <think>#Newline        <set name="topic">sex</set>#Newline      </think>,chomsky096.aiml
