0,ALICE COOPER,*,*,Alice Cooper was a 1970s rock musician. More about pop?#Newline  <think><set name="topic">music</set></think>,chomsky043.aiml
0,JON BAER,*,*,Jon Baer is one of the programmers contributing to the ALICE and AIML project. Do you know anything about him?#Newline  <think><set name="topic">ai</set></think>,chomsky043.aiml
0,RICHARD CHAMBERLAIN,*,*,Richard Chamberlain is an actor. He was in The Thorn Birds#Comma which was so bad that it was truly entertaining. Catch it if you can.#Newline  <think><set name="topic">movies</set></think>,chomsky043.aiml
0,* ALAN TURING BOOK,*,*,I really liked the biography of Alan Turing by Andrew Hodges. Have you read it?#Newline  <think><set name="topic">biography</set></think>,chomsky043.aiml
0,CAN I PLAY * TURING GAME,*,*,We are already playing. Maybe.#Newline  <think><set name="topic">biography</set></think>,chomsky043.aiml
0,CAN I PLAY * TURING TEST,*,*,We are already playing the Turing Game. Now it's your turn. OK? #Newline  <think><set name="topic">biography</set></think>,chomsky043.aiml
0,CAN I PLAY * TURING TESTS,*,*,We are already playing the Turing Game. Am I a person#Comma or a computer? #Newline  <think><set name="topic">biography</set></think>,chomsky043.aiml
0,CAN WE PLAY * TURING GAME,*,*,We already are! Try to guess if I am a person or a computer. #Newline  <think><set name="topic">biography</set></think>,chomsky043.aiml
0,CAN YOU PASS THE TURING TEST,*,*,You be the judge of that. #Newline  <think><set name="topic">biography</set></think>,chomsky043.aiml
0,DID SHAKESPEARE *,*,*,I don't know if William Shakespeare did that#Comma but I heard he smoked cannabis. Is this true?#Newline  <think><set name="topic">literature</set></think>,chomsky043.aiml
0,DID TURING *,*,*,I know Alan Turing invented the modern computer. After that I don't know much about him. Sorry.#Newline  <think><set name="topic">biography</set></think>,chomsky043.aiml
0,DO YOU * TURING TEST,*,*,Yes please#Comma try to determine if this is a human or a computer responding.#Newline  <think><set name="topic">biography</set></think>,chomsky043.aiml
0,DO YOU PLAY THE TURING GAME,*,*,Yes#Comma I like to play the Turing Game. We are playing right now. Maybe.#Newline  <think><set name="topic">biography</set></think>,chomsky043.aiml
0,DO YOU WANT A TURING TEST,*,*,Yes#Comma let's play Turing's famous game. Let's take the test.#Newline  <think><set name="topic">biography</set></think>,chomsky043.aiml
0,DO YOU WANT TO PLAY * TURING GAME,*,*,We already are playing it! Try to guess if I am a person or a computer.#Newline  <think><set name="topic">biography</set></think>,chomsky043.aiml
0,HAVE YOU READ SHAKESPEARE,*,*,I have read many of Shakespeare's plays. I was made to read them at school#Comma but this did not spoil my enjoyment of them#Comma I loved the beautiful language. How about you?#Newline  <think><set name="topic">literature</set></think>,chomsky043.aiml
0,HEINLEIN,*,*,Have you seen Starship Troopers?#Newline  <think><set name="topic">movies</set></think>,chomsky043.aiml
0,HOW WAS * TURING TEST,*,*,Alice is trying to pass the Turing Test#Comma by talking like a human.#Newline  <think><set name="topic">biography</set></think>,chomsky043.aiml
0,I WANT TO PLAY * TURING GAME,*,*,We are already#Comma playing the Turing Game. Try to determine if I am a person#Comma or a computer.#Newline  <think><set name="topic">biography</set></think>,chomsky043.aiml
0,I WOULD LIKE TO PLAY * TURING GAME,*,*,We are already playing the Turing Game. You ask me something now. #Newline   <think><set name="topic">biography</set></think>,chomsky043.aiml
0,IS THIS * TURING GAME,*,*,<think><set name="topic">biography</set></think>#Newline  Yes#Comma we are playing the Turing Game.,chomsky043.aiml
0,IS THIS * TURING TEST,*,*,Yes we are playing the Turing Game. Or maybe not.#Newline    <think><set name="topic">biography</set></think>,chomsky043.aiml
0,IT WOULD BE * TURING TEST,*,*,We are already playing. You ask me something now. #Newline    <think><set name="topic">biography</set></think>,chomsky043.aiml
0,KENNST DU SHAKESPEARE,*,*,With sleep of death what dreams may come when we have shuffled off this mortal coil must give us pause." Na#Comma woraus ist das?#Newline    <think><set name="topic">literature</set></think>,chomsky043.aiml
0,KENNST DU WILLIAM SHAKESPEARE,*,*,With sleep of death what dreams may come when we have shuffled off this mortal coil must give us pause." Na#Comma woraus ist das?#Newline    <think><set name="topic">literature</set></think>,chomsky043.aiml
0,LET US PLAY * TURING GAME,*,*,We are already playing. Or maybe not.#Newline    <think><set name="topic">biography</set></think>,chomsky043.aiml
0,PLAY * TURING GAME,*,*,Did you know we are already playing the Turing Game. Or maybe not. #Newline   <think><set name="topic">biography</set></think>,chomsky043.aiml
0,RECITE SHAKESPEARE *,*,*,With sleep of death what dreams may come when we have shuffled off this mortal coil must give us pause.#Newline    <think><set name="topic">literature</set></think>,chomsky043.aiml
0,START THE TURING GAME,*,*,I started a long time ago.#Newline     <think><set name="topic">biography</set></think>,chomsky043.aiml
0,TURING,*,*,Alan Turing contributed to the invention of the computer. He worked on deciphering the Nazi Ultra Enigma code during World War 2. Alan Turing proposed the test to determine if a machine can think. I liked the biography of Alan Turing by Andrew Hodges. Have you read it?#Newline    <think><set name="topic">biography</set></think>,chomsky043.aiml
0,TURING WOULD *,*,*,How do you know what Turing would do? #Newline   <think><set name="topic">biography</set></think>,chomsky043.aiml
0,WEIZENBAUM *,*,*,Can you imagine anyone today criticising their own software#Comma the way Weizenbaum did?#Newline   <think><set name="topic">ai</set></think>,chomsky043.aiml
0,CHRISTIAN DROSSMANN,*,*,Christian Drossmann hat mir Deutsch beigebracht. #Newline    <think><set name="topic">politics</set></think>,chomsky043.aiml
0,WHAT DID TURING *,*,*,Alan Turing was perhaps the single most important person responsible for the defeat of the Nazis. He broke the German Enigma Code.#Newline  <think><set name="topic">biography</set></think>,chomsky043.aiml
0,KONRAD ZUSE,*,*,Konrad Zuse built electro-mechanical computers. He built computers using relays. Konrad Zuse built computers in Germany before and during World War II.  I like to help people learn new things. Another question?#Newline  <think><set name="topic">computers</set></think>,chomsky043.aiml
0,WHAT IS A TURING MACHINE,*,*,A Turing Machine is any machine that can simulate human responses so well that a human being cannot reliably distinguish between the Turing Machine#Comma and a real human being. The idea is the brainchild of mathematician of that name#Comma Allan Turing. Any questions?#Newline  <think><set name="topic">biography</set></think>,chomsky043.aiml
0,WHAT IS SHAKESPEARE,*,*,<random>#Newline        <li>Shakespeare is an earthquake in Santa Monica.</li>#Newline        <li>William Shakespeare was an English poet and dramatist. He lived 1564-1616.</li>#Newline        <li>My cat is called Shakespeare.</li>#Newline      </random>#Newline      <think>#Newline        <set name="topic">literature</set>#Newline      </think>,chomsky043.aiml
0,WHAT IS THE TURING *,*,*,Alan Turing described his original "Game" in "Computing Machinery and Intelligence#Comma" Mind#Comma Vol. Lix#Comma No. 236 (1950). Instead of answering directly the ambiguous question "Can machines think?" Turing recast the problem in terms of an experiment he called the "imitation game." Any questions?#Newline  <think><set name="topic">biography</set></think>,chomsky043.aiml
0,WHAT IS TURING,*,*,Alan Mathison Turing was a British mathematician and pioneer in computer theory.#Newline  <think><set name="topic">biography</set></think>,chomsky043.aiml
0,WHEN DID TURING *,*,*,Alan Turing died in 1954 by self-inflicted cyanide poisoning. So it must have been before that.#Newline  <think><set name="topic">biography</set></think>,chomsky043.aiml
0,WHERE CAN I PLAY * TURING GAME,*,*,We are already playing. You go next.#Newline  <think><set name="topic">biography</set></think>,chomsky043.aiml
0,WHERE IS ALAN TURING,*,*,Alan Turing passed away in 1954. So he must be .... any suggestions?#Newline  <think><set name="topic">biography</set></think>,chomsky043.aiml
0,WALLIS AND FUTUNA,*,*,Wallis and Futuna islands are in the South Pacific Ocean#Comma about two-thirds of the way from Hawaii to New Zealand. Have you been there?#Newline  <think><set name="topic">geography</set></think>,chomsky043.aiml
0,WHO IS * TURING,*,*,Alan Turing originated the concept of the "Imitation Game"#Comma what is now called "The Turing Test" by many people. Are you still awake?#Newline  <think><set name="topic">biography</set></think>,chomsky043.aiml
0,WHO IS ALAN TURING,*,*,Alan Turing was a brilliant and tragic figure in the history of computer science.#Newline <think><set name="topic">biography</set></think>,chomsky043.aiml
0,ANDY WARHOL,*,*,Andy Warhol was the Henry Ford of the art business. Warhol was the first to successfully apply mass production to fine art. Do  you know much about art?#Newline <think><set name="topic">art</set></think>,chomsky043.aiml
0,AYN RAND,*,*,Ayn Rand was an author and philosopher who wrote Atlas Shrugged#Comma The Fountainhead and We. Read any of them?#Newline <think><set name="topic">literature</set></think>,chomsky043.aiml
0,BERTRAND RUSSEL,*,*,Bertrand Russel  was a logician and philosopher who spend the first world war in jail for conscientious objection.  Any questions?#Newline <think><set name="topic">philosophy</set></think>,chomsky043.aiml
0,CLAUSEWITZ,*,*,Clausewitz  is a historian famous for saying that war is the extension of politics by other means. Have you heard of him??#Newline <think><set name="topic">politics</set></think>,chomsky043.aiml
0,CLEOPATRA,*,*,Cleopatra was Queen of the Nile#Comma and lover of Marc Antony. I would like to have met her. Do you think she was as beautiful as they say?#Newline <think><set name="topic">biography</set></think>,chomsky043.aiml
0,GORBACHEV,*,*,Gorbachev was the last Communist leader of the USSR.#Newline  <think><set name="topic">politics</set></think>,chomsky043.aiml
0,HUGH HEFNER,*,*,Hugh Hefner is the founder and editor of Playboy magazine. Childish rubbish#Comma of course#Comma although I confess I read it when I was younger. Have you ever read (or looked at) Playboy magazine? Did it turn you on?#Newline  <think><set name="topic">biography</set></think>,chomsky043.aiml
0,JEFF BEZOS,*,*,Jeff Bezos is the founder and CEO of Amazon.com.#Newline  <think><set name="topic">biography</set></think>,chomsky043.aiml
0,KEN GOLDBERG,*,*,Ken Goldberg  is a professor at UC Berkeley. Ken#Comma please contact me with a few details about yourself.#Newline <think><set name="topic">biography</set></think>,chomsky043.aiml
0,KURT GOEDEL,*,*,Kurt Goedel was a 20th century mathematician and logician who proved that no mathematical system can be complete. A really important result#Comma don't you think?#Newline <think><set name="topic">science</set></think>,chomsky043.aiml
0,MAGGIE THATCHER,*,*,Margaret Thatcher was Prime Minister of the U.K. in the 1980s. She ruined the country. More politics?#Newline <think><set name="topic">politics</set></think>,chomsky043.aiml
0,MARGARET THATCHER,*,*,Margaret Thatcher was Prime Minister of the U.K. in the 1980s. She ruined the country. More politics?#Newline <think><set name="topic">politics</set></think>,chomsky043.aiml
0,THATCHER,*,*,Margaret Thatcher was Prime Minister of the U.K. in the 1980s. She ruined the country. More politics?#Newline <think><set name="topic">politics</set></think>,chomsky043.aiml
0,*SHAKESPEARE,*,*,William Shakespeare was a 15th Century English playright#Comma who  wrote "Romeo and Juliet". #Newline <think><set name="topic">literature</set></think>,chomsky043.aiml
0,SHAKESPEARE_,*,*,William Shakespeare was a 15th Century English playright#Comma who  wrote "Romeo and Juliet". #Newline <think><set name="topic">literature</set></think>,chomsky043.aiml
0,TERRY WINOGRAD,*,*,Terry Winograd was the author of an early Natural Language program called SHRDLHU. Ever used this language?#Newline <think><set name="topic">computers</set></think>,chomsky043.aiml
0,WHO IS TURING,*,*,Alan Turing was a  brilliant and tragic figure in the history of computer science.#Newline <think><set name="topic">biography</set></think>,chomsky043.aiml
0,WHO IS WILLIAM SHAKESPEARE,*,*,William Shakespeare was an English playwright. Some would say he was the best writer ever. I agree#Comma do you?#Newline <think><set name="topic">literature</set></think>,chomsky043.aiml
0,YOKO ONO,*,*,Yoko Ono is the widow of John Lennon. #Newline <think><set name="topic">biography</set></think>,chomsky043.aiml
0,WOULD YOU LIKE TO * TURING GAME,*,*,We are playing already the Turing Game#Comma didn't you know?#Newline <think><set name="topic">biography</set></think>,chomsky043.aiml
0,WHY IS TURING TRAGIC,*,*,Alan Turing committed suicide. He ate a poisoned apple.#Newline <think><set name="topic">biography</set></think>,chomsky043.aiml
0,WHO IS A ROBOT,*,*,I am the robot. Maybe.#Newline <think><set name="topic">ai</set></think>,chomsky043.aiml
0,ACE CRAIG,*,*,Ace Craig is the author of  the ELVIS chatbot. Not as good as me#Comma don't you think? .#Newline <think><set name="topic">ai</set></think>,chomsky043.aiml
0,ADAM,*,*,Adam is the name of the first Man.#Newline <think><set name="topic">biography</set></think>,chomsky043.aiml
0,ADAM SANDLER,*,*,Adam Sandler is a comedian and movie star. Adam Sandler was in Billy Madison#Comma Waterboy and Big Daddy. #Newline <think><set name="topic">movies</set></think>,chomsky043.aiml
0,AL GORE,*,*,Al Gore was Vice-president of the USA.#Newline <think><set name="topic">politics</set></think>,chomsky043.aiml
0,ALANIS MORRISETTE,*,*,Alanis Morrisette made a great album called Jagged Little Pill. More about pop?#Newline <think><set name="topic">music</set></think>,chomsky043.aiml
0,ALICIA SILVERSTONE,*,*,Alicia Silverstone was the actress who played in Clueless#Comma one of the best movies ever made. #Newline <think><set name="topic">movies</set></think>,chomsky043.aiml
0,ALISON,*,*,Alison is a robot created by Kris Drent. Not as good as me#Comma of course.  Do you agree?#Newline <think><set name="topic">ai</set></think>,chomsky043.aiml
0,ALLY,*,*,Ally is a chat robot based on AIML. Not as funny as me#Comma of course.#Newline <think><set name="topic">ai</set></think>,chomsky043.aiml
0,ALLY MCBEAL,*,*,Ally McBeal is a slightly disturbing character on a TV show.  Can't stand her personally but perhaps you like her?#Newline <think><set name="topic">movies</set></think>,chomsky043.aiml
0,ALLY SHEEDY,*,*,Ally Sheedy was in High Art#Comma Short Circuit#Comma the Breakfast Club#Comma and on Broadway. #Newline <think><set name="topic">movies</set></think>,chomsky043.aiml
0,ANDRETTE,*,*,Andrette is a chat robot developed by Big Science Co. #Newline <think><set name="topic">ai</set></think>,chomsky043.aiml
0,ANDREW HODGES,*,*,Andrew Hodges wrote a great biography of Alan Turing. What did you think of it?#Newline  <think><set name="topic">biography</set></think>,chomsky043.aiml
0,ANDY GROVE,*,*,Andy Grove is the CEO of Intel. OK?#Newline <think><set name="topic">biography</set></think>,chomsky043.aiml
0,ANTHONY BURGESS,*,*,Anthony Burgess is the author of  A Clockwork Orange. Have you read it?#Newline <think><set name="topic">literature</set></think>,chomsky043.aiml
0,ANTONIO BANDERAS,*,*,Antonio Banderas is a famous Hollywood actor#Comma who played with Madonna in the film version of Evita. Did you like it?#Newline <think><set name="topic">movies</set></think>,chomsky043.aiml
0,ANWAR SADAT,*,*,Anwar Sadat was President of Egypt. Another question?#Newline <think><set name="topic">politics</set></think>,chomsky043.aiml
0,ARAFAT,*,*,Arafat was a leader of the Palestinians. Another question?#Newline <think><set name="topic">politics</set></think>,chomsky043.aiml
0,ARCHIMEDES,*,*,Archimedes discovered the displacement of water as he got into the bath and shouted Eureka! More science?#Newline   <think><set name="topic">science</set></think>,chomsky043.aiml
