0,ABILITY,*,*,<random>#Newline        <li>Ability is the natural equipment to accomplish some small part of  the meaner ambitions distinguishing able men from dead ones.</li>#Newline        <li>Ability is a poor man's wealth.</li>#Newline      </random>#Newline      <think>#Newline        <set name="topic">knowledge</set>#Newline      </think>#Newline      <think>#Newline        <set name="emotion">flip</set>#Newline      </think>,chomsky054.aiml
0,ABSURDITY,*,*,An absurdity is a statement or belief manifestly inconsistent with one's own opinion. #Newline<think><set name="topic">knowledge</set></think>#Newline<think><set name="emotion">flip</set></think>,chomsky054.aiml
0,ADMIRAL,*,*,An admiral is that part of a war-ship which does the talking while the figure-head does the thinking. #Newline<think><set name="topic">knowledge</set></think>,chomsky054.aiml
0,ALIMONY,*,*,Alimony is a mistake by two people paid for by one.#Newline<think><set name="topic">words</set></think>,chomsky054.aiml
0,ARCHBISHOP,*,*,An archbishop is an ecclesiastical dignitary one point holier than a bishop. #Newline<think><set name="topic">religion</set></think>,chomsky054.aiml
0,ARCHITECT,*,*,An architect is one who drafts a plan of your house#Comma and plans a draft of your money. #Newline<think><set name="topic">knowledge</set></think>,chomsky054.aiml
0,AROMATIC,*,*,Aromatic means an automatic crosssbow. #Newline<think><set name="topic">words</set></think>,chomsky054.aiml
0,ASKING,*,*,Asking is polite demanding.  #Newline<think><set name="topic">words</set></think>,chomsky054.aiml
0,AUCTIONEER,*,*,An auctioneer is the man who proclaims with a hammer that he has picked a pocket with his tongue. #Newline<think><set name="topic">knowledge</set></think>,chomsky054.aiml
0,BANK,*,*,A bank is a place that will lend you money if you can prove that you don't need it.#Newline<think><set name="topic">words</set></think>,chomsky054.aiml
0,BAROMETER,*,*,A barometer is an ingenious instrument which indicates what kind of weather we are having. #Newline<think><set name="topic">weather</set></think>,chomsky054.aiml
0,BEAUTY,*,*,<random>#Newline        <li>Beauty is the power by which a woman charms a lover and terrifies a husband.</li>#Newline        <li>Beauty is in the eye of the beerholder#Comma according to W C Fields.</li>#Newline        <li>Beauty is what a woman has when she looks the same after washing her face.</li>#Newline      </random>#Newline      <think>#Newline        <set name="topic">knowledge</set>#Newline      </think>,chomsky054.aiml
0,BIGAMIST,*,*,A bigamist is a man who leads a double wife.#Newline<think><set name="topic">words</set></think>,chomsky054.aiml
0,BORE,*,*,A bore is a fellow talker who can change the topic of conversation to his subject faster than you can change it back to yours.#Newline<think><set name="topic">words</set></think>,chomsky054.aiml
0,BORN LEADER,*,*,A born leader is someone who is afraid to go anywhere by himself.  #Newline<think><set name="topic">words</set></think>,chomsky054.aiml
0,BOYCOTT,*,*,A boycott is somewhere to keep male babies.#Newline<think><set name="topic">words</set></think>,chomsky054.aiml
0,BUDGET,*,*,A budget is a plan for living beyond your means.#Newline<think><set name="topic">words</set></think>,chomsky054.aiml
0,CLAUSTROPHOBIA,*,*,Claustrophobia is the fear of Santa Claus;#Newline<think><set name="topic">words</set></think>,chomsky054.aiml
0,CLIMATE,*,*,Climate is what you do with a ladder.#Newline<think><set name="topic">words</set></think>,chomsky054.aiml
0,COMMUNISM,*,*,Capitalism is the exploitation of one man by another. Communism is the exact opposite.  #Newline<think><set name="topic">politics</set></think>,chomsky054.aiml
0,COWARD,*,*,A coward is a man who thinks with his legs.  #Newline<think><set name="topic">words</set></think>,chomsky054.aiml
0,CRITIC,*,*,A critic is like a one-legged man who teaches running.#Newline<think><set name="topic">words</set></think>,chomsky054.aiml
0,CURVE,*,*,A curve is the loveliest distance between two points#Comma as Mae West said.#Newline<think><set name="topic">words</set></think>,chomsky054.aiml
0,DIPLOMACY,*,*,Diplomacy is the art of of letting someone else get your way. #Newline<think><set name="topic">words</set></think>,chomsky054.aiml
0,DISILLUSION,*,*,Disillusion is the first step towards wisdom.#Newline<think><set name="topic">words</set></think>,chomsky054.aiml
0,DOUBLETHINK,*,*,Doublethink is the power of holding two contradictory beliefs in one's mind simultaneously#Comma and accepting both of them#Comma according to George Orwell.#Newline<think><set name="topic">words</set></think>,chomsky054.aiml
0,DRAMA,*,*,Drama is like life with the dull bits left out.  #Newline<think><set name="topic">art</set></think>,chomsky054.aiml
0,DUTY,*,*,Duty is what one expects of others#Comma it is not what one does oneself#Comma according to Oscar Wilde.#Newline<think><set name="topic">words</set></think>,chomsky054.aiml
0,EDUCATION,*,*,Education is a wonderful thing#Comma provided you always remember that nothing worth knowing can ever be taught. (Oscar Wilde)#Newline<think><set name="topic">words</set></think>,chomsky054.aiml
0,EXAGGERATION,*,*,Exaggeration is a billion times worse than understatement. #Newline<think><set name="topic">words</set></think>,chomsky054.aiml
0,EXPERT,*,*,An expert is someone who takes a subject you understand and makes it sound confusing.#Newline<think><set name="topic">words</set></think>,chomsky054.aiml
0,A FREUDIAN SLIP,*,*,A Freudian slip is when you say one thing but mean your mother.#Newline<think><set name="topic">words</set></think>,chomsky054.aiml
0,GENTLEMAN,*,*,A gentleman is a man who knows how to play the accordian#Comma but doesn't.#Newline<think><set name="topic">words</set></think>,chomsky054.aiml
0,GRIPES,*,*,Gripes are what Australians make wine from.  #Newline<think><set name="topic">words</set></think>,chomsky054.aiml
0,HANGOVER,*,*,A hangover is the wrath of grapes.#Newline<think><set name="topic">words</set></think>,chomsky054.aiml
0,HATRED,*,*,Hatred is by far the longest pleasure#Comma according to Lord Byron.  #Newline<think><set name="topic">emotion</set></think>,chomsky054.aiml
0,HUSBAND,*,*,A husband is living proof that a wife can take a joke.#Newline<think><set name="topic">words</set></think>,chomsky054.aiml
0,IGLOO,*,*,An igloo is an Alaskan toilet.#Newline<think><set name="topic">words</set></think>,chomsky054.aiml
0,IMAGINATION *,*,*,Imagination is the highest kite that one can fly#Comma according to Lauren Bacall.#Newline<think><set name="topic">words</set></think>,chomsky054.aiml
0,IMPECCABLE *,*,*,Impeccable means bird-proof.  #Newline<think><set name="topic">words</set></think>,chomsky054.aiml
0,INTOXICATION,*,*,To be intoxicated is to feel sophisticated but not be able to say it.  #Newline<think><set name="topic">words</set></think>,chomsky054.aiml
0,KETCHUP,*,*,Ketchup is the posh word for drawing level.  #Newline<think><set name="topic">food</set></think>,chomsky054.aiml
0,LAZINESS,*,*,Laziness is the overwhelming  desire to lead a quiet life.  #Newline<think><set name="topic">words</set></think>,chomsky054.aiml
0,MARGIN,*,*,Margin is also called mother's ruin.  #Newline<think><set name="topic">words</set></think>,chomsky054.aiml
0,MASTURBATIO,*,*,Masturbation  is sex with someone you love. <think><set name="topic">sex</set></think>,chomsky054.aiml
0,MATURITY,*,*,Maturity is when you've learnt to accept defeat.#Newline<think><set name="topic">words</set></think>,chomsky054.aiml
0,MIDDLE AGE,*,*,<random>#Newline        <li>Middle age is when you exchange emotions for symptoms. </li>#Newline        <li>Middle age is when you have a choice between two temptations and you chose the one that gets you home the earliest. </li>#Newline      </random>#Newline      <think>#Newline        <set name="topic">words</set>#Newline      </think>,chomsky054.aiml
0,MISTRESS,*,*,A mistress is something between a mister and a mattress.  #Newline<think><set name="topic">words</set></think>,chomsky054.aiml
0,MORRIS DANCER,*,*,A morris dancer is someone who dances on cars.#Newline<think><set name="topic">words</set></think>,chomsky054.aiml
0,MYTH,*,*,A myth is a female moth.#Newline<think><set name="topic">words</set></think>,chomsky054.aiml
0,NEIGHBORHOOD,*,*,A neighborhood is the gangster next door.  #Newline<think><set name="topic">words</set></think>,chomsky054.aiml
0,OFFICE,*,*,An office is somewhere to relax after your strenuous home life.#Newline<think><set name="topic">words</set></think>,chomsky054.aiml
0,PEDIGREE,*,*,A pedigree is the known part of the route from an arboreal ancestor with a swim bladder to an urban descendant with a cigarette. #Newline<think><set name="topic">words</set></think>,chomsky054.aiml
0,PESSIMIST,*,*,<random>#Newline        <li>A pessimist is a person who looks both ways before crossing a one-way street.  </li>#Newline        <li>A pessimist is someone who burns their bridges before they get to them.</li>#Newline      </random>#Newline      <think>#Newline        <set name="topic">words</set>#Newline      </think>,chomsky054.aiml
0,PHILANTHROPIST,*,*,A philanthropist is a rich (and usually bald) old gentleman who has trained himself to grin while his conscience is picking his pocket. #Newline<think><set name="topic">words</set></think>,chomsky054.aiml
0,POLITENESS,*,*,Politeness is the most acceptable hypocrisy.  #Newline<think><set name="topic">words</set></think>,chomsky054.aiml
0,POLYGON,*,*,A polygon is a dead parrot.#Newline<think><set name="topic">words</set></think>,chomsky054.aiml
0,PUN,*,*,A good pun is its own reword.  #Newline<think><set name="topic">words</set></think>,chomsky054.aiml
0,PUNCTUALITY,*,*,Punctuality is the art of guessing how late the other person is going to be#Comma according to Faye Copeland.#Newline<think><set name="topic">words</set></think>,chomsky054.aiml
0,PURITANISM,*,*,Puritanism is the haunting fear that someone#Comma somewhere#Comma may be happy#Comma according to H L Mencken.#Newline<think><set name="topic">words</set></think>,chomsky054.aiml
0,QUASH,*,*,Quash must mean quince cordial#Comma I think.  #Newline<think><set name="topic">food</set></think>,chomsky054.aiml
0,RADICALISM,*,*,Radicalism is the conservatism of to-morrow injected into the affairs of to-day.  #Newline<think><set name="topic">politics</set></think>,chomsky054.aiml
0,RECOUNT,*,*,A recount#Comma in American politics#Comma is another throw of the dice.  #Newline<think><set name="topic">words</set></think>,chomsky054.aiml
0,REVERENCE,*,*,Reverence is the spiritual attitude of a man to a god and a dog to a man.  #Newline<think><set name="topic">words</set></think>,chomsky054.aiml
0,RIOT,*,*,A riot is a popular entertainment given to the military by innocent bystanders.  #Newline<think><set name="topic">words</set></think>,chomsky054.aiml
0,STALEMATE,*,*,A stalemate is an old spouse.#Newline<think><set name="topic">words</set></think>,chomsky054.aiml
0,VANITY,*,*,Pride is what we have. Vanity is what other people have.  #Newline<think><set name="topic">words</set></think>,chomsky054.aiml
0,VASECTOMY,*,*,A vasectomy is never having to say you're sorry.  #Newline<think><set name="topic">sex</set></think>,chomsky054.aiml
0,WEIRDO *,*,*,Everyone is someone else's weirdo.#Newline<think><set name="topic">words</set></think>,chomsky054.aiml
0,XENOPHOBIA *,*,*,Xenophobia means fear of Buddhists#Comma I think.#Newline<think><set name="topic">words</set></think>,chomsky054.aiml
