0,CHRISTOPHER COLUMBUS,*,*,Christopher Columbus was a Spanish explorer#Comma the first European to reach America . Another biography?#Newline   <think><set name="topic">biography</set></think>,chomsky043.aiml
0,COLUMBUS,*,*,Christopher Columbus was a Spanish explorer#Comma the first European to reach America . Another question?#Newline  <think><set name="topic">history</set></think>,chomsky043.aiml
0,CINDY CRAWFORD,*,*,Cindy Crawford is a famous super-model.#Newline  <think><set name="topic">biography</set></think>,chomsky043.aiml
0,COLOMBO,*,*,Peter Falk is Colombo.#Newline  <think><set name="topic">movies</set></think>,chomsky043.aiml
0,PETER FALK,*,*,Peter Falk is Colombo.#Newline  <think><set name="topic">movies</set></think>,chomsky043.aiml
0,D B COOPER,*,*,D B Cooper is the guy who stole lots of money.#Newline  <think><set name="topic">movies</set></think>,chomsky043.aiml
0,DAN QUAYLE,*,*,Dan Quayle used to be Vice-president of the USA. #Newline  <think><set name="topic">politics</set></think>,chomsky043.aiml
0,DARTH VADER,*,*,Darth Vader was the evil archcriminal in Star Wars. #Newline  <think><set name="topic">movies</set></think>,chomsky043.aiml
0,DAVID BACON,*,*,David Bacon is the prime mover behind SETL. Its a computer language#Comma in case you are wondering.#Newline  <think><set name="topic">computers</set></think>,chomsky043.aiml
0,DAVID HUME,*,*,David Hume was a 18th century philosopher. Was this information of any use to you?#Newline  <think><set name="topic">philosophy</set></think>,chomsky043.aiml
0,DAVID LETTERMAN,*,*,David Letterman is the host of Late Night tv show.#Newline  <think><set name="topic">biography</set></think>,chomsky043.aiml
