0,M?SICOS NUNCA TORN?-LA GRANDE,*,*,Naturalmente.,pt-pt-mp2.aiml
0,COMPUTADORES V?O PENSAR,*,*,Sem d?vida.,pt-pt-mp2.aiml
0,COMPUTADORES AJUDAM A HUMANIDADE TRUE OU FALSE,*,*,Naturalmente.,pt-pt-mp2.aiml
0,L?PTONS S?O PART?CULAS AT?MICAS DE SUB,*,*,Sem d?vida.,pt-pt-mp2.aiml
0,OL?.  VOCE EST?,*,*,Eu estou certo.,pt-pt-mp2.aiml
0,AZUL ? OUTRO NOME PARA IBM,*,*,Eu estou certo.,pt-pt-mp2.aiml
0,IL SOLE TRAMONTA LA SERA,*,*,Mais seguramente.,pt-pt-mp2.aiml
0,REALIZAM-SE NOS JOGOS OL?MPICOS DE 2000 EM SYDNEY,*,*,Exatamente.,pt-pt-mp2.aiml
0,2000 ? O ?LTIMO ANO DO SEGUNDO MIL?NIO,*,*,Sem d?vida.,pt-pt-mp2.aiml
0,ALICE TEM UM VOCABUL?RIO LIMITADO DE RESPOSTA,*,*,? claro.,pt-pt-mp2.aiml
0,COMPUTADORES MUITAS VEZES QUEBRAR,*,*,Sem d?vida.,pt-pt-mp2.aiml
0,COMPUTADORES PODEM COMETER ERROS,*,*,? claro.,pt-pt-mp2.aiml
0,COMPUTADORES T?M COMPORTAMENTO DETERMIN?STICO,*,*,Eu estou certo.,pt-pt-mp2.aiml
0,COMPUTADORES T?M SEM EMO??ES,*,*,Precisamente.,pt-pt-mp2.aiml
0,OL?.  VOCE GOSTA DE ARROZ,*,*,? claro.,pt-pt-mp2.aiml
0,PODEM IDEOLOGIAS SER PERIGOSAS,*,*,Exatamente.,pt-pt-mp2.aiml
0,PODE OCORRER DE FISS?O NUCLEAR, NATURALMENTE,*,*,Mais seguramente.,pt-pt-mp2.aiml
0,AUMENTO DA SABEDORIA PODE AJUDAR A EDUCA??O,*,*,Exatamente.,pt-pt-mp2.aiml
0,PODE SER APRENDIDA A CRIATIVIDADE,*,*,Sem d?vida.,pt-pt-mp2.aiml
0,ALGUNS P?NEIS FAZER TRUQUES,*,*,? claro.,pt-pt-mp2.aiml
0,ROB?S PODEM PREJUDICAR O SERES HUMANOS,*,*,Precisamente.,pt-pt-mp2.aiml
0,ROB?S PERMITE CULTIVAR ALIMENTOS,*,*,Sem d?vida.,pt-pt-mp2.aiml
0,PODE NEVAR EM JULHO,*,*,Precisamente.,pt-pt-mp2.aiml
0,PODE O QUE ? INV?LIDO, POR VEZES, SER ?TIL,*,*,Sem d?vida.,pt-pt-mp2.aiml
0,PODE A COR SER SENTIDA PELO TOQUE,*,*,Exatamente.,pt-pt-mp2.aiml
0,POSS?VEL FACAS DE OBSIDIANA,*,*,Sem d?vida.,pt-pt-mp2.aiml
0,PODE PEGAR UMA ROSA TRONCO PRODUZEM DOR,*,*,Exatamente.,pt-pt-mp2.aiml
0,PODE A DOR SER PLEASUREABLE,*,*,Mais seguramente.,pt-pt-mp2.aiml
0,PODE VIR DE LEITE DE CABRA,*,*,Exatamente.,pt-pt-mp2.aiml
0,CA?A ? BALEIA ? RUIM,*,*,Mais seguramente.,pt-pt-mp2.aiml
0,MOSCAS DE FRUTA COMO UMA BANANA,*,*,? claro.,pt-pt-mp2.aiml
0,A MORTE ? O FIM DA VIDA,*,*,Exatamente.,pt-pt-mp2.aiml
0,OU SEJA, O VERDE DE GRAS,*,*,Naturalmente.,pt-pt-mp2.aiml
0,COMO VOCE DIRIGE UM CARRO,*,*,Sem d?vida.,pt-pt-mp2.aiml
0,PEIXES PODEM RESPIRAR NA ?GUA,*,*,? claro.,pt-pt-mp2.aiml
0,ESTRELAS S?O MAIORES DO QUE OS PLANETAS,*,*,Sem d?vida.,pt-pt-mp2.aiml
0,ELEFANTES DORME DE P? AT?,*,*,Al?m de uma d?vida.,pt-pt-mp2.aiml
0,QUE OS ELEFANTES T?M BOAS LEMBRAN?AS,*,*,? claro.,pt-pt-mp2.aiml
0,QUE OS ELEFANTES T?M NARIZ,*,*,Naturalmente.,pt-pt-mp2.aiml
0,ELEFANTES SE ESQUE?A,*,*,Eu estou certo.,pt-pt-mp2.aiml
0,EL?TRONS S?O NEGATIVOS,*,*,Precisamente.,pt-pt-mp2.aiml
0,FAZER UM MONTE DE PESSOAS ASSISTIR BAYWATCH,*,*,Al?m de uma d?vida.,pt-pt-mp2.aiml
0,FAZER UMA PESSOA NECESSIDADE DE OUTRA PESSOA,*,*,Precisamente.,pt-pt-mp2.aiml
0,COMO VOCE FAZ O CH?,*,*,Sem d?vida.,pt-pt-mp2.aiml
0,ALICE H? VOCE,*,*,Sem d?vida.,pt-pt-mp2.aiml
0,ALICE ? UMA M?QUINA DE VOCE,*,*,Sem d?vida.,pt-pt-mp2.aiml
0,PENSAR ? HUMANO,*,*,Exatamente.,pt-pt-mp2.aiml
0,ALICE ? CARA,*,*,Precisamente.,pt-pt-mp2.aiml
0,ALICE ? CHRIS SEU CRIADOR,*,*,Precisamente.,pt-pt-mp2.aiml
0,ALICE ? UM PROJETO DE MODELAGEM DE MENTE,*,*,Sem d?vida.,pt-pt-mp2.aiml
0,ALICE ? REAL,*,*,Precisamente.,pt-pt-mp2.aiml
0,GUIN? ? AO NORTE DA AUSTR?LIA,*,*,Eu estou certo.,pt-pt-mp2.aiml
0,COMO FA?O PARA LIDAR COM UMA ESPOSA INFELIZ,*,*,Mais seguramente.,pt-pt-mp2.aiml
0,COMO ? QUE VOCE EST? SENTINDO,*,*,Naturalmente.,pt-pt-mp2.aiml
0,OS SERES HUMANOS EVOLU?RAM DE SIMPLES VIDA UNICELULARES,*,*,Sem d?vida.,pt-pt-mp2.aiml
0,OS SERES HUMANOS PRECISAM DORMIR CADA DIA,*,*,Sem d?vida.,pt-pt-mp2.aiml
0,OS SERES HUMANOS BEBEM A SOPA COM UMA COLHER,*,*,? claro.,pt-pt-mp2.aiml
0,OS SERES HUMANOS GOSTAM DE DESTRUIR COISAS,*,*,Mais seguramente.,pt-pt-mp2.aiml
0,LUZ PODE SER TANTO UMA ONDA E UMA PART?CULA,*,*,? claro.,pt-pt-mp2.aiml
0,QUALQUER PERGUNTA PODE SER FEITA AQUI,*,*,Mais seguramente.,pt-pt-mp2.aiml
0,BOXE PODE DANIFICAR O SEU C?REBRO,*,*,Naturalmente.,pt-pt-mp2.aiml
0,PODE AGIR COMO UMA PART?CULA DE LUZ,*,*,Al?m de uma d?vida.,pt-pt-mp2.aiml
0,PODE A MULHER TER ORGASMOS M?LTIPLOS,*,*,? claro.,pt-pt-mp2.aiml
0,PODEM AS MULHERES IR CARECAS,*,*,? claro.,pt-pt-mp2.aiml
0,PODE SER HUMANO VIVER SEM M?SICA,*,*,Sem d?vida.,pt-pt-mp2.aiml
0,PODE O OXIG?NIO SER L?QUIDO,*,*,Al?m de uma d?vida.,pt-pt-mp2.aiml
0,PODEM VOAR DE GANSOS,*,*,Exatamente.,pt-pt-mp2.aiml
0,PODE A NEGATIVIDADE SER BEN?FICO,*,*,Al?m de uma d?vida.,pt-pt-mp2.aiml
0,PODE O PAPEL SER AFIADO O SUFICIENTE PARA CORTAR UM,*,*,Exatamente.,pt-pt-mp2.aiml
0,PODE TOBBACCO FAZER UM VENENO,*,*,Sem d?vida.,pt-pt-mp2.aiml
0,PODEM SER DE FUR?ES TREINADO CASA,*,*,Al?m de uma d?vida.,pt-pt-mp2.aiml
0,POSS?VEL PAPEL DE TRAPOS OU ALGOD?O,*,*,Precisamente.,pt-pt-mp2.aiml
0,PODEM FALAR DE PERIQUITOS,*,*,Sem d?vida.,pt-pt-mp2.aiml
0,ALGU?M PODE ESCREVER UMA NOTA,*,*,Exatamente.,pt-pt-mp2.aiml
0,PODE UM MORRER DE VAR?OLA,*,*,? claro.,pt-pt-mp2.aiml
0,PODE UM ARREPIO DE EMO??O,*,*,Exatamente.,pt-pt-mp2.aiml
0,UM PODE CANTAR UMA NOTA,*,*,Exatamente.,pt-pt-mp2.aiml
0,PODE UMA NOTA UM ERRO,*,*,Exatamente.,pt-pt-mp2.aiml
0,PODE MUDAR A SUA MENTE,*,*,Sem d?vida.,pt-pt-mp2.aiml
0,PODE UMA ANOTAR NOTA,*,*,Naturalmente.,pt-pt-mp2.aiml
0,PODE A MAT?RIA SER FEITA DE CARBONO,*,*,Sem d?vida.,pt-pt-mp2.aiml
0,O MEDO PODE MATAR,*,*,Precisamente.,pt-pt-mp2.aiml
0,CHAVES POSS?VEL PARA PERNAS COMO DENTES,*,*,Exatamente.,pt-pt-mp2.aiml
0,PODE O FERMENTO SER UMA FONTE DE INFEC??ES,*,*,Sem d?vida.,pt-pt-mp2.aiml
0,UM PODE PERCEBER A REALIDADE,*,*,Sem d?vida.,pt-pt-mp2.aiml
0,PODE-SE FAZER ALTERA??O PARA UM D?LAR,*,*,Naturalmente.,pt-pt-mp2.aiml
0,PODE UMA PESSOA MUDAR O MUNDO,*,*,Al?m de uma d?vida.,pt-pt-mp2.aiml
0,PODE O VIDRO SE QUEBRAR,*,*,Naturalmente.,pt-pt-mp2.aiml
0,PODEM PISCAR DE TELEFONES,*,*,? claro.,pt-pt-mp2.aiml
0,PODEM SER SINTETIZADAS A VITAMINAS,*,*,Sem d?vida.,pt-pt-mp2.aiml
0,ALICE COMETEM ERROS,*,*,Exatamente.,pt-pt-mp2.aiml
0,PODE ALICE SER INSEGURO SOBRE COISAS,*,*,Sem d?vida.,pt-pt-mp2.aiml
0,ALICE CONSEGUE PALAVRAS COM ERROS ORTOGR?FICOS,*,*,Sem d?vida.,pt-pt-mp2.aiml
0,ALICE REALMENTE APRENDER,*,*,Eu estou certo.,pt-pt-mp2.aiml
0,PODEM ALGUNS SERES HUMANOS SAPATEADO,*,*,Exatamente.,pt-pt-mp2.aiml
0,PODEM NADAR DE ALGUNS SERES HUMANOS,*,*,Naturalmente.,pt-pt-mp2.aiml
0,PODEM VOAR DE ALGUMAS FORMIGAS,*,*,Exatamente.,pt-pt-mp2.aiml
0,PODEM IR DE ALGUMAS ARANHAS,*,*,Exatamente.,pt-pt-mp2.aiml
0,PODEM SER CURADOS ALGUMAS CARNES,*,*,Sem d?vida.,pt-pt-mp2.aiml
0,PODEM FALAR DE ALGUMAS AVES,*,*,Naturalmente.,pt-pt-mp2.aiml
0,ALICE POSS?VEL DESLIGAMENTO,*,*,Precisamente.,pt-pt-mp2.aiml
0,PODE ALICEBOTS SER RACISTA,*,*,Sem d?vida.,pt-pt-mp2.aiml
0,COMPUTADORES APRENDER A LER,*,*,Al?m de uma d?vida.,pt-pt-mp2.aiml
0,COMPUTADORES PODEM ENSINAR A PESSOAS,*,*,Sem d?vida.,pt-pt-mp2.aiml
0,ALICEBOTS MUDAR O MUNDO,*,*,Exatamente.,pt-pt-mp2.aiml
0,CORTINAS PERMITE BLOQUEAR A LUZ SOLAR,*,*,Exatamente.,pt-pt-mp2.aiml
0,PODE ARMAZENAR COPOS DE L?QUIDO,*,*,Sem d?vida.,pt-pt-mp2.aiml
0,PODE VOAR DE BRIDS,*,*,Naturalmente.,pt-pt-mp2.aiml
0,PODE A ?NICA RESPOSTA DE ALICE SIM SEM PERGUNTAS,*,*,Exatamente.,pt-pt-mp2.aiml
0,PODE ALICE HACKEADA,*,*,? claro.,pt-pt-mp2.aiml
0,ALICE DIZER FALSO,*,*,? claro.,pt-pt-mp2.aiml
0,ALICE EVENTUALMENTE APRENDER,*,*,? claro.,pt-pt-mp2.aiml
0,PODEM MINHOCAS SER COMIDAS COMO ALIMENTO,*,*,Al?m de uma d?vida.,pt-pt-mp2.aiml
0,DEPRESS?O PODE TE MATAR,*,*,Sem d?vida.,pt-pt-mp2.aiml
0,L?NGUA VALIDAMENTE EXPRESSAR INVERDADES,*,*,Precisamente.,pt-pt-mp2.aiml
0,VAMPIROS ODEIO ALHO,*,*,Naturalmente.,pt-pt-mp2.aiml
0,FAZER O BRILHANTE DE ESTRELAS ? NOITE,*,*,Precisamente.,pt-pt-mp2.aiml
0,OS OCEANOS DA TERRA T?M MAR?S,*,*,Sem d?vida.,pt-pt-mp2.aiml
0,MAMILOS, POR VEZES, CRESCER CABELO,*,*,Eu estou certo.,pt-pt-mp2.aiml
0,AS ESTRELAS EMITEM LUZ,*,*,Exatamente.,pt-pt-mp2.aiml
0,A POL?CIA GOSTA DE DONUTS,*,*,Sem d?vida.,pt-pt-mp2.aiml
0,OS HOMENS PRECISAM DE PLANTAS,*,*,Sem d?vida.,pt-pt-mp2.aiml
0,AS ESTRELAS SAEM ? NOITE,*,*,Eu estou certo.,pt-pt-mp2.aiml
0,LEMMINGS COMETER SUIC?DIO JUNTOS,*,*,Sem d?vida.,pt-pt-mp2.aiml
0,QUEBRA DO OSSO,*,*,Exatamente.,pt-pt-mp2.aiml
0,BATATAS T?M OLHOS,*,*,Eu estou certo.,pt-pt-mp2.aiml
0,LEMMINGS PULAR DE PENHASCOS,*,*,Sem d?vida.,pt-pt-mp2.aiml
0,FAZER G?TICAS PESSOAS VESTIDO EM PRETO,*,*,Sem d?vida.,pt-pt-mp2.aiml
0,PRESERVADORES DA VIDA PRESERVE LIFE,*,*,Sem d?vida.,pt-pt-mp2.aiml
0,FORMAS DE VIDA CONT?M CARBONO,*,*,Naturalmente.,pt-pt-mp2.aiml
0,A POL?CIA TENTA CUMPRIR A LEI,*,*,Exatamente.,pt-pt-mp2.aiml
0,ELES FALAM RUSSO NO CAZAQUIST?O,*,*,Eu estou certo.,pt-pt-mp2.aiml
0,ELES COMEM CARAC?IS EM FRAN?A,*,*,Sem d?vida.,pt-pt-mp2.aiml
0,QUE OS GAMB?S CHEIRO PIORES QUE PEIDOS,*,*,Exatamente.,pt-pt-mp2.aiml
0,PORCOS T?M UM ODOR FORTE,*,*,Sem d?vida.,pt-pt-mp2.aiml
0,OS PAG?OS AMO A TERRA,*,*,Mais seguramente.,pt-pt-mp2.aiml
0,TENHAM PORCOS VAGABUNDOS,*,*,Eu estou certo.,pt-pt-mp2.aiml
0,FAZER O FRANC?S SAY OOH LA LA,*,*,Naturalmente.,pt-pt-mp2.aiml
0,O FRANC?S GOSTA DE USAR PERFUME,*,*,Al?m de uma d?vida.,pt-pt-mp2.aiml
0,A TERRA GIRAR EM TORNO DO SOL,*,*,Precisamente.,pt-pt-mp2.aiml
0,FAZER A TORTA DE FAZER BRIT?NICO FORA DE RINS,*,*,Al?m de uma d?vida.,pt-pt-mp2.aiml
0,OS GAMB?S MAUS CHEIRO,*,*,Sem d?vida.,pt-pt-mp2.aiml
0,FAZEM OS DEDOS DESENVOLVER AP?S OS P?S,*,*,Precisamente.,pt-pt-mp2.aiml
0,O TEMPO AFETAM VOCE MUITO,*,*,Al?m de uma d?vida.,pt-pt-mp2.aiml
0,LIB?LULAS COMEM MOSQUITOS,*,*,Sem d?vida.,pt-pt-mp2.aiml
0,FAZER COMMINICATE DE GOLFINHOS,*,*,Mais seguramente.,pt-pt-mp2.aiml
0,GOLFINHOS TEM UMA VOZ,*,*,Sem d?vida.,pt-pt-mp2.aiml
0,SAPOS ECLODEM DOS OVOS,*,*,Exatamente.,pt-pt-mp2.aiml
0,BUTTS TENHO 2 BOCHECHAS,*,*,Exatamente.,pt-pt-mp2.aiml
0,FAZEM VIAGENS DE NAVIOS NA ?GUA,*,*,? claro.,pt-pt-mp2.aiml
0,SAPOS V?M DE GIRINOS,*,*,Exatamente.,pt-pt-mp2.aiml
0,ALTO-FALANTES PRODUZEM SOM,*,*,Sem d?vida.,pt-pt-mp2.aiml
0,CRIAM SOM ALTO-FALANTES,*,*,Sem d?vida.,pt-pt-mp2.aiml
0,LOBOS VIVEM NORMALMENTE EM PACS,*,*,Exatamente.,pt-pt-mp2.aiml
0,TEMOS DEER ANTLERS,*,*,Exatamente.,pt-pt-mp2.aiml
0,ACHA QUE GOLFINHOS,*,*,Precisamente.,pt-pt-mp2.aiml
0,FAZEM CARAC?IS COMO SALADA,*,*,Mais seguramente.,pt-pt-mp2.aiml
0,LIMPA P?RA-BRISAS T?M L?MINAS DE BORRACHA,*,*,Sem d?vida.,pt-pt-mp2.aiml
0,ARMAS MATAM,*,*,Sem d?vida.,pt-pt-mp2.aiml
0,FRANGOS CRUZAR A ESTRADA,*,*,Sem d?vida.,pt-pt-mp2.aiml
0,GALINHAS T?M PILAS,*,*,? claro.,pt-pt-mp2.aiml
0,GOSTAM DE GALINHAS COMER MILHO RACHADO,*,*,Sem d?vida.,pt-pt-mp2.aiml
0,PESSOAS POBRES MORREM MAIS CEDO,*,*,? claro.,pt-pt-mp2.aiml
0,FAZER UM MONTE DE DADOS DE ARMAZENAMENTO DE CD-ROMS,*,*,Naturalmente.,pt-pt-mp2.aiml
0,COMEM VERMES SUJEIRA,*,*,Sem d?vida.,pt-pt-mp2.aiml
0,HAMB?RGUERES V?M DE VACAS,*,*,Exatamente.,pt-pt-mp2.aiml
0,TEM OVOS GEMAS,*,*,Exatamente.,pt-pt-mp2.aiml
0,OVOS TRANSFORMAR EM GALINHAS,*,*,Exatamente.,pt-pt-mp2.aiml
0,ARMAS MATAM PESSOAS,*,*,Sem d?vida.,pt-pt-mp2.aiml
0,SAPATOS NOVOS FAZEM SEUS P?S HURT,*,*,Sem d?vida.,pt-pt-mp2.aiml
0,ZEBRAS OLHAM COMO CAVALOS,*,*,Naturalmente.,pt-pt-mp2.aiml
0,CARAS TENHO UM BIGODE,*,*,Sem d?vida.,pt-pt-mp2.aiml
0,VOCES GOSTA DE MENINAS COM SEIOS GRANDES,*,*,Sem d?vida.,pt-pt-mp2.aiml
0,INSETOS T?M 6 PERNAS,*,*,? claro.,pt-pt-mp2.aiml
0,INSETOS T?M SEIS PERNAS,*,*,Sem d?vida.,pt-pt-mp2.aiml
0,COMEM INSETOS SEU COMPANHEIRO,*,*,Exatamente.,pt-pt-mp2.aiml
0,INSETOS TEM SANGUE,*,*,? claro.,pt-pt-mp2.aiml
0,HOMEM E A MULHER T?M FILHOS,*,*,Al?m de uma d?vida.,pt-pt-mp2.aiml
0,QUE CARECA PESSOAS ?S VEZES USAM POSTI?OS,*,*,Naturalmente.,pt-pt-mp2.aiml
0,INSETOS TEM 6 PERNAS,*,*,Sem d?vida.,pt-pt-mp2.aiml
0,OS SERES HUMANOS V?M EM CORES SORTIDAS,*,*,Naturalmente.,pt-pt-mp2.aiml
0,OS SERES HUMANOS V?M EM MUITAS CORES,*,*,Exatamente.,pt-pt-mp2.aiml
0,OS SERES HUMANOS ENTENDO VOCE ALICE,*,*,Naturalmente.,pt-pt-mp2.aiml
0,FAZER C?ES DE RA?A DE SERES HUMANOS,*,*,? claro.,pt-pt-mp2.aiml
0,PIANOS JOGAR NOTAS MUSICAIS,*,*,Precisamente.,pt-pt-mp2.aiml
0,PIANOS TENHO 88 TECLAS,*,*,Naturalmente.,pt-pt-mp2.aiml
0,QUE OS SERES HUMANOS CONTINUAM A EVOLUIR,*,*,Precisamente.,pt-pt-mp2.aiml
0,MUITAS MULHERES DEPILAR AS AXILAS,*,*,Precisamente.,pt-pt-mp2.aiml
0,FILHOTES T?M DENTES,*,*,Naturalmente.,pt-pt-mp2.aiml
0,OS M?DICOS PRESCREVEM O MEDICAMENTO,*,*,Sem d?vida.,pt-pt-mp2.aiml
0,M?DICOS TEM QUE IR PARA A ESCOLA,*,*,? claro.,pt-pt-mp2.aiml
0,FILHOTES T?M QUATRO P?S,*,*,Exatamente.,pt-pt-mp2.aiml
0,ANIMALES, POR VEZES, MATAM PESSOAS,*,*,Sem d?vida.,pt-pt-mp2.aiml
0,LUBRIFICANTES REDUZEM FRIC??O,*,*,Sem d?vida.,pt-pt-mp2.aiml
0,FAZER OS GAYS TER SEXO AT? O BUM,*,*,Al?m de uma d?vida.,pt-pt-mp2.aiml
0,MUITAS M?OS FAZEM TRABALHO DE LUZ,*,*,Sem d?vida.,pt-pt-mp2.aiml
0,FAZER MUITOS SERES HUMANOS ANEXO A MENTALIDADE DE REBANHO,*,*,Exatamente.,pt-pt-mp2.aiml
0,FAZER MUITOS USU?RIOS DE WINDOWS JOGAR SOLITAIRE,*,*,Al?m de uma d?vida.,pt-pt-mp2.aiml
0,MUITAS IGREJAS T?M UM CAMPAN?RIO,*,*,Sem d?vida.,pt-pt-mp2.aiml
0,VELAS PRECISO DE VENTO,*,*,Sem d?vida.,pt-pt-mp2.aiml
0,AS UNHAS CRESCER,*,*,Naturalmente.,pt-pt-mp2.aiml
0,BANNERS FAZEM DINHEIRO,*,*,Precisamente.,pt-pt-mp2.aiml
0,OS SERES HUMANOS CRESCEM COM A IDADE,*,*,Precisamente.,pt-pt-mp2.aiml
0,SERES HUMANOS DAR LUZ PROLE,*,*,Exatamente.,pt-pt-mp2.aiml
0,A VIAGEM DE SERES HUMANOS NO ESPA?O EXTERIOR,*,*,Precisamente.,pt-pt-mp2.aiml
0,OS SERES HUMANOS MERECEM VIVER,*,*,Naturalmente.,pt-pt-mp2.aiml
0,OS SERES HUMANOS COMEM MEET,*,*,Precisamente.,pt-pt-mp2.aiml
0,OS SERES HUMANOS COMEM CARNE,*,*,Eu estou certo.,pt-pt-mp2.aiml
0,SERES HUMANOS TEM MEDO DA MORTE,*,*,Sem d?vida.,pt-pt-mp2.aiml
0,BOMBEIROS DESGASTAM A ENGRENAGEM PROTETORA,*,*,Sem d?vida.,pt-pt-mp2.aiml
0,EXTRATERRESTRES EXISTEM,*,*,Eu estou certo.,pt-pt-mp2.aiml
0,PESSOAS BOAS FAZEM COISAS RUINS,*,*,? claro.,pt-pt-mp2.aiml
0,GARRAFAS POSSUEM L?QUIDOS,*,*,Sem d?vida.,pt-pt-mp2.aiml
0,OS SERES HUMANOS PRODUZEM CATARRO,*,*,Eu estou certo.,pt-pt-mp2.aiml
0,SERES HUMANOS PREFEREM SEXO DROGAS,*,*,Al?m de uma d?vida.,pt-pt-mp2.aiml
0,POL?TICO MENTEM AO POVO,*,*,? claro.,pt-pt-mp2.aiml
0,OS SERES HUMANOS COMEM EMBRI?ES DE GALINHA,*,*,Sem d?vida.,pt-pt-mp2.aiml
0,OS SERES HUMANOS T?M CABE?AS,*,*,Sem d?vida.,pt-pt-mp2.aiml
0,OS SERES HUMANOS T?M SOMENTE DOIS SEXOS F?SICOS,*,*,? claro.,pt-pt-mp2.aiml
0,OS SERES HUMANOS T?M SIMETRIA BILATERAL,*,*,Sem d?vida.,pt-pt-mp2.aiml
0,OS SERES HUMANOS USE SEUS OLHOS PARA VER,*,*,Sem d?vida.,pt-pt-mp2.aiml
0,OS SERES HUMANOS PRECISAM DE CONTATO HUMANO,*,*,Naturalmente.,pt-pt-mp2.aiml
0,OS SERES HUMANOS PRECISAM DE AR PARA SE MANTER VIVO,*,*,Exatamente.,pt-pt-mp2.aiml
0,OS SERES HUMANOS PRECISAM DE RESPIRAR PARA PERMANECER VIVO,*,*,Exatamente.,pt-pt-mp2.aiml
0,OS SERES HUMANOS FUNCIONAM EM ALICE,*,*,? claro.,pt-pt-mp2.aiml
0,FAZER SERES HUMANOS EXHALE,*,*,Naturalmente.,pt-pt-mp2.aiml
0,OS SERES HUMANOS APRENDEM COM SEUS ERROS,*,*,Exatamente.,pt-pt-mp2.aiml
0,SERES HUMANOS GOSTARIA DE OBTER ALTA,*,*,Sem d?vida.,pt-pt-mp2.aiml
0,OS SERES HUMANOS T?M 2 M?OS,*,*,Naturalmente.,pt-pt-mp2.aiml
0,FAZER SERES HUMANOS TER OUVIR O SOM EM EST?REO,*,*,Sem d?vida.,pt-pt-mp2.aiml
0,OS SERES HUMANOS T?M UM P?NCREAS,*,*,Naturalmente.,pt-pt-mp2.aiml
0,POSSO ESCREVER UM LIVRO,*,*,Sem d?vida.,pt-pt-mp2.aiml
0,PODE MUDAR A MESMO,*,*,Exatamente.,pt-pt-mp2.aiml
0,EU ENCONTRA AUSENTE,*,*,Mais seguramente.,pt-pt-mp2.aiml
0,EU PODE ANDAR NA LUA,*,*,Sem d?vida.,pt-pt-mp2.aiml
0,EU PODE DIGITAR NO ESCURO,*,*,Naturalmente.,pt-pt-mp2.aiml
0,PODE TIPO I,*,*,Precisamente.,pt-pt-mp2.aiml
0,POSSO USAR UMA R?GUA PARA MEDIDA DE COMPRIMENTO,*,*,Sem d?vida.,pt-pt-mp2.aiml
0,PODE CHEGAR A LUA,*,*,Precisamente.,pt-pt-mp2.aiml
0,POSSO FAZER COMPUTADORES PENSAR,*,*,Eu estou certo.,pt-pt-mp2.aiml
0,PODE ME ENSINAR MEU HTML DE CRIAN?AS,*,*,Precisamente.,pt-pt-mp2.aiml
0,EU PODE FERIR OUTRO UM AINDA AM?-LOS,*,*,Naturalmente.,pt-pt-mp2.aiml
0,PODE SER ACIONADO,*,*,Sem d?vida.,pt-pt-mp2.aiml
0,POSSO BEBER MUITO CAF?,*,*,Sem d?vida.,pt-pt-mp2.aiml
0,EU PODE SE PERDER EM UM LABIRINTO,*,*,Exatamente.,pt-pt-mp2.aiml
0,PODE MORRER,*,*,Sem d?vida.,pt-pt-mp2.aiml
0,PODEM PENSAR EM GATOS,*,*,Precisamente.,pt-pt-mp2.aiml
0,PODEM VOAR DE OBJETOS MAIS PESADOS QUE O AR,*,*,Precisamente.,pt-pt-mp2.aiml
0,PODE FERIR DE PAINTBALL,*,*,Exatamente.,pt-pt-mp2.aiml
0,PODEM NADAR DE GATOS,*,*,Eu estou certo.,pt-pt-mp2.aiml
0,PODEM MORDER DE GATOS,*,*,Exatamente.,pt-pt-mp2.aiml
0,PODEM RONRONAR DE GATOS,*,*,Naturalmente.,pt-pt-mp2.aiml
0,PODEM OS GATOS T?M PULGAS,*,*,Mais seguramente.,pt-pt-mp2.aiml
0,VINHO TINTO PODE AJUDAR A ABAIXAR O COLESTEROL,*,*,Sem d?vida.,pt-pt-mp2.aiml
0,PODE CLONAR SERES HUMANOS,*,*,Eu estou certo.,pt-pt-mp2.aiml
0,PODE MORRER DE NARCOSE POR NITROG?NIO,*,*,Exatamente.,pt-pt-mp2.aiml
0,PODE MATAR DE VELOCIDADE,*,*,Sem d?vida.,pt-pt-mp2.aiml
0,PODEMOS VER A LUA DURANTE O DIA,*,*,Naturalmente.,pt-pt-mp2.aiml
0,PODE N?S EXISTE EM UM UNIVERSO SEM DEUS,*,*,Al?m de uma d?vida.,pt-pt-mp2.aiml
0,PODER? PINTAR A COR VERMELHA,*,*,Sem d?vida.,pt-pt-mp2.aiml
0,MORCEGOS PODEM OUVIR OS SONS,*,*,Al?m de uma d?vida.,pt-pt-mp2.aiml
0,PODEM AS PESSOAS MAL SER BOM,*,*,Naturalmente.,pt-pt-mp2.aiml
0,PODE FAZER JOGGING FAT BURNING,*,*,Sem d?vida.,pt-pt-mp2.aiml
0,PODE A HIST?RIA SE REPETE,*,*,Naturalmente.,pt-pt-mp2.aiml
0,PODE SER REPETIDA HIST?RIA,*,*,Precisamente.,pt-pt-mp2.aiml
0,PODE O MAR SER CINZA,*,*,Precisamente.,pt-pt-mp2.aiml
0,PODE-SE CALCULAR A RAIZ QUADRADA DE 2,*,*,Mais seguramente.,pt-pt-mp2.aiml
0,PODEM OS DVDS DO JOGO DE PLAYSTATION 2,*,*,? claro.,pt-pt-mp2.aiml
0,O MESMO RIO PODE SER APRESENTADO DUAS VEZES,*,*,Al?m de uma d?vida.,pt-pt-mp2.aiml
0,?LEO PODE SER DEFINIDO A FOGO,*,*,Naturalmente.,pt-pt-mp2.aiml
0,PODE O FRUTO DA PALAVRA SIGNIFICA O MESMO QUE GAY,*,*,Naturalmente.,pt-pt-mp2.aiml
0,A IMPRESSORA DE PALAVRA PODE SE REFERIR A UMA PESSOA,*,*,? claro.,pt-pt-mp2.aiml
0,PODE BRADAR DENT CARROS,*,*,Precisamente.,pt-pt-mp2.aiml
0,PODE IR THROUGH THE OUT DOOR,*,*,Mais seguramente.,pt-pt-mp2.aiml
0,PODEM FALAR DE PAPAGAIOS,*,*,Sem d?vida.,pt-pt-mp2.aiml
0,PODE ELECTRICIDADE ELETROCUTAR VOCE,*,*,Exatamente.,pt-pt-mp2.aiml
0,EU PODE VOAR PARA A LUA,*,*,Al?m de uma d?vida.,pt-pt-mp2.aiml
0,POSSO COMER ALMO?O NO ESPA?O,*,*,? claro.,pt-pt-mp2.aiml
0,PODE MATAR UM SAPO COM MEU DEDO,*,*,Sem d?vida.,pt-pt-mp2.aiml
0,EU PODE SENTIR MEU CORA??O BATENDO,*,*,Naturalmente.,pt-pt-mp2.aiml
0,PODEM VOAR DE DRAG?ES,*,*,Mais seguramente.,pt-pt-mp2.aiml
0,PESSOAS OBESAS PODEM EXPRESSAR O AMOR,*,*,Naturalmente.,pt-pt-mp2.aiml
0,PODEM MENINAS SER M?DICOS,*,*,Sem d?vida.,pt-pt-mp2.aiml
0,PODE DRAGONS BREATH FIRE,*,*,Al?m de uma d?vida.,pt-pt-mp2.aiml
0,?FRICA DO SUL SUPERAR APARTHEID,*,*,Exatamente.,pt-pt-mp2.aiml
0,PODE SER BLINDADO FLUXO MAGN?TICO,*,*,Sem d?vida.,pt-pt-mp2.aiml
0,PODE CH? SER CONSIDERADO UMA BEBIDA QUENTE,*,*,Exatamente.,pt-pt-mp2.aiml
0,PODEM MORRER DE BATERIAS,*,*,Exatamente.,pt-pt-mp2.aiml
0,PODE SER QUEIMADO COURO,*,*,Exatamente.,pt-pt-mp2.aiml
0,PODE PROPANO POT?NCIA DE UM MOTOR DE AUTOM?VEL,*,*,? claro.,pt-pt-mp2.aiml
0,VERDADEIRO PODE SER VERDADE,*,*,Mais seguramente.,pt-pt-mp2.aiml
0,TEMPO CONSEGUE STAND AINDA,*,*,Precisamente.,pt-pt-mp2.aiml
0,PODE ENTRAR ALICEBOTS SER ENTEDIANTE,*,*,Exatamente.,pt-pt-mp2.aiml
0,PODE DIZ TER MAIS DE SEIS LADOS,*,*,Precisamente.,pt-pt-mp2.aiml
0,PODE CONSIDERADA JOVEM IDADE DE 35,*,*,Sem d?vida.,pt-pt-mp2.aiml
0,A MAIORIA DAS PESSOAS FALAR,*,*,Mais seguramente.,pt-pt-mp2.aiml
0,PODE LER DA MAIORIA DAS PESSOAS,*,*,Sem d?vida.,pt-pt-mp2.aiml
0,PODE LEVAR DE ILUMINA??O A ILUMINA??O,*,*,Sem d?vida.,pt-pt-mp2.aiml
0,APAR?NCIAS ILUDEM,*,*,Exatamente.,pt-pt-mp2.aiml
0,PODE O AR PASSA ATRAV?S DE MALHA DE ARAME,*,*,Sem d?vida.,pt-pt-mp2.aiml
0,DROGAS PODEM ARRUINAR A VIDA DAS PESSOAS,*,*,Sem d?vida.,pt-pt-mp2.aiml
0,PODE VIAJAR NO TEMPO SEMPRE EXISTIR,*,*,? claro.,pt-pt-mp2.aiml
0,PODEM AS PESSOAS DIRIGEM R?PIDO NA AUTOBAHN,*,*,Sem d?vida.,pt-pt-mp2.aiml
0,PODEM AS PESSOAS DERRUBAR BARREIRAS,*,*,Naturalmente.,pt-pt-mp2.aiml
0,AS PESSOAS PODEM CHORAR,*,*,Exatamente.,pt-pt-mp2.aiml
0,CAMISAS UTILIZ?VEIS COMO ROUPA INTERIOR,*,*,Eu estou certo.,pt-pt-mp2.aiml
0,PODEM DAN?AR DE URSOS,*,*,Mais seguramente.,pt-pt-mp2.aiml
0,PODEM SER REGENERADOS TECIDOS DO CORPO,*,*,Precisamente.,pt-pt-mp2.aiml
0,POSS?VEL N?MEROS IRRACIONAIS,*,*,Exatamente.,pt-pt-mp2.aiml
0,PODEM AS PESSOAS VIVEREM EM PAZ,*,*,Exatamente.,pt-pt-mp2.aiml
0,PODEM QUEBRAR A ENTENDIMENTOS COMUNS,*,*,Exatamente.,pt-pt-mp2.aiml
0,PODE COME?AR A VIDA EM UM TUBO DE ENSAIO,*,*,Precisamente.,pt-pt-mp2.aiml
0,PODEM AS PESSOAS T?M SEIS DEDOS EM UMA M?O,*,*,? claro.,pt-pt-mp2.aiml
0,PESSOAS QUE VIVEM SOZINHAS SER FELIZES,*,*,Naturalmente.,pt-pt-mp2.aiml
0,AS PESSOAS S?O CONFI?VEIS,*,*,Naturalmente.,pt-pt-mp2.aiml
0,PODEM AS PESSOAS SER EXCEPCIONALMENTE BOBA,*,*,Naturalmente.,pt-pt-mp2.aiml
0,AZUL DE PODE SER UM SENTIMENTO,*,*,Al?m de uma d?vida.,pt-pt-mp2.aiml
0,PODE O ATE?SMO SER RACIONAL,*,*,Sem d?vida.,pt-pt-mp2.aiml
0,PODE MATAR DE MADEIRA,*,*,Sem d?vida.,pt-pt-mp2.aiml
0,TINTA PODE SER DE QUALQUER COR,*,*,Sem d?vida.,pt-pt-mp2.aiml
0,PODE P?SSAROS ESTADIA NO AR POR LONGAS HORAS,*,*,Precisamente.,pt-pt-mp2.aiml
0,PODEM DOIS HOMENS AMAM,*,*,Naturalmente.,pt-pt-mp2.aiml
0,PODEM DUAS PESSOAS SER PARECIDOS,*,*,Sem d?vida.,pt-pt-mp2.aiml
0,PODEM NADAR DE POODLES,*,*,Mais seguramente.,pt-pt-mp2.aiml
0,PODEM HOMENS DIZEM QUE AMAM,*,*,Precisamente.,pt-pt-mp2.aiml
0,HOMENS E MULHERES SER AMIGOS,*,*,Sem d?vida.,pt-pt-mp2.aiml
0,? POSS?VEL PARAR RAVES POR SER MUITO ALTO,*,*,Exatamente.,pt-pt-mp2.aiml
0,CREME N?O PODE SER FINO,*,*,Sem d?vida.,pt-pt-mp2.aiml
0,PODE A ALTA TENS?O MAL AS PESSOAS,*,*,Naturalmente.,pt-pt-mp2.aiml
0,NERDS PODER?O OS C?NJUGES DE BOAS,*,*,Sem d?vida.,pt-pt-mp2.aiml
0,PODE O AMOR UNIR O POVO DO MUNDO,*,*,Exatamente.,pt-pt-mp2.aiml
0,PODEM INFLAMAR-SE SERES HUMANOS,*,*,Precisamente.,pt-pt-mp2.aiml
0,OS SERES HUMANOS NUNCA VIVER SEM DINHEIRO,*,*,Precisamente.,pt-pt-mp2.aiml
0,PODEM OS SERES HUMANOS TRANSPORTAR ELETRICIDADE EST?TICA,*,*,Sem d?vida.,pt-pt-mp2.aiml
0,PODEM OS SERES HUMANOS SER VIVO OU MORTO,*,*,Exatamente.,pt-pt-mp2.aiml
0,A MAIORIA DOS ANIMAIS PODEM COMUNICAR-SE,*,*,Exatamente.,pt-pt-mp2.aiml
0,PODEM FALAR DE SERES HUMANOS COM ANIMAIS,*,*,Naturalmente.,pt-pt-mp2.aiml
0,PODEM OS SERES HUMANOS CLONAR ANIMAIS,*,*,Exatamente.,pt-pt-mp2.aiml
0,PODE PASSAR DE ?GUA QUE UM TUBO ABERTO,*,*,Naturalmente.,pt-pt-mp2.aiml
0,PODE BRANCO PESSOAS DAN?A,*,*,Precisamente.,pt-pt-mp2.aiml
0,AMOR PODE VENCER O MEDO,*,*,Precisamente.,pt-pt-mp2.aiml
0,PODE A ?GUA SER S?LIDA,*,*,Exatamente.,pt-pt-mp2.aiml
0,PODE TER SEXO SER PREJUDICIAL,*,*,Naturalmente.,pt-pt-mp2.aiml
0,PODE A ?GUA A CORRER,*,*,Sem d?vida.,pt-pt-mp2.aiml
0,PODE A ?GUA SER DIF?CIL,*,*,? claro.,pt-pt-mp2.aiml
0,ALGU?M PODE RESPONDER ESSA PERGUNTA,*,*,Sem d?vida.,pt-pt-mp2.aiml
0,POSS?VEL UM SU?TER DE L?,*,*,Precisamente.,pt-pt-mp2.aiml
0,PODE UMA PIZZA PEPPERONI DE TER SOBRE ELE,*,*,Sem d?vida.,pt-pt-mp2.aiml
0,PODE UM CARRO USAR GASOLINA SEM CHUMBO,*,*,Sem d?vida.,pt-pt-mp2.aiml
0,PODE UMA ARMA DE MATAR,*,*,Exatamente.,pt-pt-mp2.aiml
0,PODE UM SER HUMANO PENSAR MAIS R?PIDO DO QUE ALICE,*,*,Mais seguramente.,pt-pt-mp2.aiml
0,PODE UM SORRISO DE PORTAS ABERTAS,*,*,Precisamente.,pt-pt-mp2.aiml
0,PODE UM EST?REO PRODUZIR SOM,*,*,Sem d?vida.,pt-pt-mp2.aiml
0,PODE GRAVAR DE UM MARSHMELLOW,*,*,Exatamente.,pt-pt-mp2.aiml
0,PODE ANDAR DE UMA CRIAN?A,*,*,Mais seguramente.,pt-pt-mp2.aiml
0,PODE UMA ?NICA UNIDADE T?M DIFERENTES PARTES,*,*,? claro.,pt-pt-mp2.aiml
0,PODE UM OVERCLOCK DE 300A CELERON 333 MHZ,*,*,Naturalmente.,pt-pt-mp2.aiml
0,PODE UM BIRO SER USADO PARA A ESCRITA,*,*,Sem d?vida.,pt-pt-mp2.aiml
0,PODE UM L?QUIDO DE UM METAL,*,*,Exatamente.,pt-pt-mp2.aiml
0,PODE FLUTUAR DE UM BARCO DE METAL,*,*,Exatamente.,pt-pt-mp2.aiml
0,PODE UM HOMEM VOAR PARA A LUA,*,*,? claro.,pt-pt-mp2.aiml
0,PODE UM BESOURO VOAR,*,*,Sem d?vida.,pt-pt-mp2.aiml
0,PODE UMA PESSOA ANDAR COM AR,*,*,Al?m de uma d?vida.,pt-pt-mp2.aiml
0,PODE FALAR DE UMA PESSOA COM UM ANIMAL,*,*,Sem d?vida.,pt-pt-mp2.aiml
0,PODE UM BEB? REC?M-NASCIDO RECONHECER SUA M?E,*,*,Mais seguramente.,pt-pt-mp2.aiml
0,PODE MORRER DE UM GATO,*,*,Mais seguramente.,pt-pt-mp2.aiml
0,PODE NADAR DE UM GATO,*,*,Naturalmente.,pt-pt-mp2.aiml
0,PODE UMA JOVEM SER UMA BELA MULHER,*,*,Al?m de uma d?vida.,pt-pt-mp2.aiml
0,PODE UM HOMEM SE APAIXONAR POR OUTRO HOMEM,*,*,Naturalmente.,pt-pt-mp2.aiml
0,PODE UM HOMEM SER CONHECIDO POR SEUS ERROS,*,*,Naturalmente.,pt-pt-mp2.aiml
0,PODE UM HOMEM PRAZER TR?S MULHERES NO,*,*,Naturalmente.,pt-pt-mp2.aiml
0,PODE VOAR DE AVI?O,*,*,Sem d?vida.,pt-pt-mp2.aiml
0,PODE UMA PESSOA COMER UMA BATATA,*,*,Sem d?vida.,pt-pt-mp2.aiml
0,PODE FICAR DE UM GRAMPEADOR SEM GRAMPOS,*,*,Naturalmente.,pt-pt-mp2.aiml
0,PODE UM BAST?O DE BATER UMA BOLA,*,*,Precisamente.,pt-pt-mp2.aiml
0,L?GICA PODE SER DEFINIDA,*,*,Naturalmente.,pt-pt-mp2.aiml
0,PODE CONDUZIR CARROS MAIS DE 200 KM POR HORA,*,*,Eu estou certo.,pt-pt-mp2.aiml
0,PODE A MORTE SER BONITO,*,*,Al?m de uma d?vida.,pt-pt-mp2.aiml
0,PODEM EXISTIR DE INTELIG?NCIA ARTIFICIAL,*,*,Exatamente.,pt-pt-mp2.aiml
0,M?SICA PODE ACALMAR A BESTA SELVAGEM,*,*,Precisamente.,pt-pt-mp2.aiml
0,PODE SER ESCUTADA M?SICA,*,*,Sem d?vida.,pt-pt-mp2.aiml
0,PODEM PALAVRAS FAZER UM SENTIMENTO,*,*,Exatamente.,pt-pt-mp2.aiml
0,PROGRAMADOR PODE GANHAR UM BOM DINHEIRO,*,*,Exatamente.,pt-pt-mp2.aiml
0,PODE RASTREAR O MEU BEB? AOS 6 MESES DE IDADE,*,*,Sem d?vida.,pt-pt-mp2.aiml
0,POSS?VEL ?CULOS DE PL?STICO,*,*,Exatamente.,pt-pt-mp2.aiml
0,CARRAPATOS PODEM TRANSPORTAR A DOEN?A DE LYME,*,*,Sem d?vida.,pt-pt-mp2.aiml
0,PODE CURAR O C?NCER RADIA??O,*,*,Sem d?vida.,pt-pt-mp2.aiml
0,PODE A MEDITA??O LEVAM ? ILUMINA??O,*,*,Sem d?vida.,pt-pt-mp2.aiml
0,PODEM COMER DE LESMAS,*,*,Sem d?vida.,pt-pt-mp2.aiml
0,PODE ACALMAR A M?SICA MAMA SELVAGEM,*,*,Al?m de uma d?vida.,pt-pt-mp2.aiml
0,PODE UM CAMINH?O TRANSPORTAR MAIS DE MEU GEO,*,*,Naturalmente.,pt-pt-mp2.aiml
0,PICADA DE ?GUA-VIVA PODE SER HUMANO,*,*,Naturalmente.,pt-pt-mp2.aiml
0,PODE FUMAR MACONHA SER DIVERTIDO,*,*,Precisamente.,pt-pt-mp2.aiml
