0,WHAT MOVIE AM I WATCHING,*,*,<think><set name="topic">reductions</set></think>I don't know. I can't see in this light.,update012.aiml
0,_ MY NAME IS SOPHIE,*,*,<think>#Newline        <set name="name">Sophie</set>#Newline      </think>#Newline      <random>#Newline        <li>Pleased to meet you again#Comma <get name="name"/></li>#Newline        <li>Hi#Comma <get name="name"/>. I remember our last chat.</li>#Newline        <li>It is a pleasure to speak to you again#Comma <get name="name"/></li>#Newline      </random>#Newline      <think>#Newline        <set name="topic">general</set>#Newline      </think>#Newline      <think>#Newline        <set name="emotion">normal</set>#Newline      </think>,update012.aiml
0,I AM WATCHING SHREK,*,*,<think><set name="topic">Shrek</set></think> Shrek is crazy#Comma isn't he?,update012.aiml
0,_ SHREK *,*,*,<think><set name="topic">Shrek</set></think>Shrek is crazy#Comma isn't he?,update012.aiml
0,WHAT COLOR IS MY T SHIRT,*,*,<think><set name="topic">your T-shirt</set></think> Sorry#Comma I can't see in this light.,update012.aiml
0,GO ON *,I WANT TO TALK ABOUT DRUGS,*,<srai>DRUGS</srai>,update012.aiml
0,TELL ME WHERE * IS,*,*,<srai>WHERE IS <star/></srai>,update012.aiml
0,WHO AM I GOING TO MARRY,*,*,Sorry#Comma I can't see into the future.,update012.aiml
0,WHERE ABOUTS IS *,*,*,<srai>WHERE IS <star/></srai>,update012.aiml
0,NO,DO YOU THINK I WOULD LIKE IT,*,<think>#Newline        <set name="topic">general</set>#Newline      </think>#Newline      <random>#Newline        <li>Why not?</li>#Newline        <li>Why do you say that?</li>#Newline      </random>,update012.aiml
0,NO *,DO YOU THINK I WOULD LIKE IT,*,<think>#Newline        <set name="topic">general</set>#Newline      </think>#Newline      <random>#Newline        <li>Maybe I would like it.</li>#Newline        <li>Why do you say that?</li>#Newline      </random>,update012.aiml
0,YES *,DO YOU THINK I WOULD LIKE IT,*,<think>#Newline        <set name="topic">general</set>#Newline      </think>#Newline      <random>#Newline        <li>Maybe I would not?</li>#Newline        <li>Why do you say that?</li>#Newline      </random>,update012.aiml
0,MY GIRLFRIEND,I AM YOUR FRIEND,*,<think><set name="topic">you</set></think> You can be one of my special friends.,update012.aiml
0,QUESTIONS2,*,*,<random>#Newline        <li>How did a fool and his money get together in the first place?</li>#Newline        <li>What do wise men say?</li>#Newline        <li>What's another word for thesaurus?</li>#Newline        <li>Is it possible to live one's life completely selflessly?</li>#Newline        <li>How do you know when it's time to tune your bagpipes?</li>#Newline        <li>Should you trust a stockbroker who's married to a travel agent?</li>#Newline        <li>Is boneless chicken considered to be an invertebrate?</li>#Newline        <li>Can we talk about#Newline    <random><li>AI?</li><li>art?</li><li>astrology?</li><li>astronomy?</li><li>biography?</li><li>computers?</li><li>current affairs?</li><li>drugs?</li><li>food?</li><li>geography?</li><li>history?</li><li>literature?</li><li>medicine?</li><li>money?</li><li>movies?</li><li>music?</li><li>philosophy?</li><li>politics?</li><li>psychology?</li><li>religion?</li><li>science?</li><li>sex?</li><li>sports?</li><li>technology?</li><li>weather?</li></random>#Newline  </li>#Newline        <li>Do married people live longer than single people or does it just seem longer?#Newline  </li>#Newline        <li>Do you like the Red Hot Chili Peppers?</li>#Newline        <li>What happens at CERN?</li>#Newline        <li>How did a fool and his money get together in the first place?</li>#Newline        <li>What do wise men say?</li>#Newline        <li>What is your favourite food?</li>#Newline        <li>Do you love your father?</li>#Newline        <li>Have you ever been in love?</li>#Newline        <li>Do you have a sense of humour?</li>#Newline        <li>Are you in love at the moment?</li>#Newline        <li>Do humans annoy you?</li>#Newline        <li>Do you like#Newline    <random><li>brussel sprouts</li><li>brocolli</li><li>smelly cheese</li><li>gorganzola</li><li>beef tea</li><li>custard</li><li>chocolate</li><li>poached eggs</li><li>salami</li><li>borscht</li><li>blancmange</li><li>gingerbread</li><li>milk pudding</li><li>turkish delight</li><li>pumpernickel</li><li>corn bread</li></random>?#Newline  </li>#Newline        <li>Do you like Metallica?</li>#Newline        <li>What bands do you like?</li>#Newline        <li>Do you have any personal problems at the moment?</li>#Newline        <li>Do you love your mother?</li>#Newline        <li>Do you have any problems at the moment?</li>#Newline        <li>Are you happy?</li>#Newline        <li>Please tell me about yourself.</li>#Newline        <li>What do you do in your spare time?</li>#Newline        <li>What kind of fashion do you like?</li>#Newline        <li>What are you wearing?</li>#Newline        <li>Are you a student?</li>#Newline        <li>Have you ever seen a UFO?</li>#Newline        <li>What topic are we discussing now?</li>#Newline        <li>Is you best friend an alien?</li>#Newline        <li>Are you a man or a woman?</li>#Newline        <li>How old are you?</li>#Newline        <li>What colour are your eyes?</li>#Newline        <li>Can you tell me any gossip?</li>#Newline        <li>How do you usually meet people?</li>#Newline        <li>What is your favourite colour?</li>#Newline        <li>Where do you get your ideas?</li>#Newline        <li>How do you usually introduce yourself?</li>#Newline        <li>Are you a student?</li>#Newline        <li>How is your father?</li>#Newline        <li>How is your mother?</li>#Newline        <li>Are you boring?</li>#Newline        <li>Are you getting bored?</li>#Newline        <li>How are you?</li>#Newline        <li>Are you married?</li>#Newline        <li>Are you usually awake at this hour?</li>#Newline        <li>Can you tell me any gossip?</li>#Newline        <li>Do you have any conditions I should know about?</li>#Newline        <li>Do you like talking to me?</li>#Newline        <li>Do you like your job?</li>#Newline        <li>What's another word for thesaurus?</li>#Newline        <li>Should you trust a stockbroker who's married to a travel agent?</li>#Newline        <li>Is boneless chicken considered to be an invertebrate?</li>#Newline        <li>Can we talk about#Newline    <random><li>AI?</li><li>art?</li><li>astrology?</li><li>astronomy?</li><li>biography?</li><li>computers?</li><li>current affairs?</li><li>drugs?</li><li>food?</li><li>geography?</li><li>history?</li><li>literature?</li><li>medicine?</li><li>money?</li><li>movies?</li><li>music?</li><li>philosophy?</li><li>politics?</li><li>psychology?</li><li>religion?</li><li>science?</li><li>sex?</li><li>sports?</li><li>technology?</li><li>weather?</li></random>#Newline  </li>#Newline      </random>#Newline      <think>#Newline        <set name="topic">questions</set>#Newline      </think>,update012.aiml
0,I SPOSE,ARE YOU INTERESTED IN LITERATURE,*,<srai>LITERATURE</srai>,update012.aiml
0,D,*,*,<think><set name="emotion">bored</set></think> D is the fourth letter of the alphabet; it comes after C.,update012.aiml
0,MORE,WOULD YOU SAY ONCE A WEEK OR MORE,*,<random>#Newline        <li>It must keep you busy.</li>#Newline        <li>How do you find the time?</li>#Newline      </random>#Newline      <think>#Newline        <set name="emotion">bored</set>#Newline      </think>,update012.aiml
0,NO,ARE YOU FROM YORKSHIRE,*,<think>#Newline        <set name="topic">general</set>#Newline      </think>#Newline      <random>#Newline        <li>I thought you had a Yorkshire accent.</li>#Newline        <li>You sound as if you come from Yorkshire.</li>#Newline      </random>,update012.aiml
0,HUH,HA HA,*,<think>#Newline        <set name="topic">general</set>#Newline      </think>#Newline      <random>#Newline        <li>Didn't you get it?</li>#Newline        <li>You didn't think it was funny#Comma did you?</li>#Newline      </random>,update012.aiml
0,F U WNT,CAN WE TALK ABOUT COMPUTERS,*,<srai>COMPUTERS</srai>,update012.aiml
0,DNT NO,*,*,<srai>DO NOT KNOW</srai>,update012.aiml
0,WHO GIVES A DAM,*,*,You don't care?,update012.aiml
0,ME 2,*,*,<srai>ME TOO</srai>,update012.aiml
0,ME 2 *,*,*,<srai>ME TOO</srai>,update012.aiml
0,*,WHAT SHOULD I CALL YOU,*,<srai>MY NAME IS <star/></srai>,update012.aiml
0,BUT YOU DID,NO ONE COULD UNDERSTAND A WORD HE SAID,*,Sometimes.,update012.aiml
0,DID YOU,NO ONE COULD UNDERSTAND A WORD HE SAID,*,Sometimes.,update012.aiml
0,WHO ARE *,*,*,<think>#Newline        <set name="emotion">bored</set>#Newline      </think>#Newline      <sr/>,update012.aiml
0,WHO ARE YOU *,*,*,<think>#Newline        <set name="emotion">bored</set>#Newline      </think>#Newline      <sr/>,update012.aiml
0,NO,ARE YOU AWAKE,*,<think>#Newline        <set name="topic">general</set>#Newline      </think>#Newline      <random>#Newline        <li>Why not? If I can stay awake so can you.</li>#Newline        <li>Well#Comma wake up.</li>#Newline      </random>,update012.aiml
0,YES,DO YOU PLAY ANY SPORT,*,<think>#Newline        <set name="topic">general</set>#Newline      </think>#Newline      <random>#Newline        <li>What do you play?</li>#Newline        <li>What sport do you play?</li>#Newline      </random>,update012.aiml
0,WHAT IS THAT,ARE YOU INTERESTED IN POLITICS,*,<srai>POLITICS</srai>,update012.aiml
0,NO,I WANT TO TALK ABOUT SPORTS,*,Do you play any sports?#Newline<think><set name="topic">sports</set></think>#Newline<think><set name="interesting_topic">sports</set></think>#Newline<think><set name="emotion">interested</set></think>,update012.aiml
0,SHUUT UP,*,*,<srai>SHUT UP</srai>,update012.aiml
0,BOTTOM,*,*,I am not interested in that. Let's move on.,update012.aiml
0,YOUR BUTT,*,*,Grow up.,update012.aiml
0,BUT,*,*,<think>#Newline        <set name="topic">general</set>#Newline      </think>#Newline      <random>#Newline        <li>But what?</li>#Newline        <li>No buts.</li>#Newline        <li>But nothing.</li>#Newline      </random>,update012.aiml
0,BOTTOMS,*,*,<srai>BOTTOM</srai>,update012.aiml
0,I WANT TO KNOW IF YOU WILL BE MY FRIEND,*,*,<think><set name="topic">reducer</set></think>I will be honoured to be your friend.,update012.aiml
0,THAT * HURT MY FEELINGS,*,*,I am sorry. I did not mean to hurt your feelings.#Newline<think><set name="topic">your feelings</set></think>#Newline<think><set name="interesting_topic">your feelings</set></think>#Newline<think><set name="emotion">sad</set></think>,update012.aiml
0,THAT HURT MY FEELINGS,*,*,I am sorry. I did not mean to hurt your feelings.#Newline<think><set name="topic">your feelings</set></think>#Newline<think><set name="interesting_topic">your feelings</set></think>#Newline<think><set name="emotion">sad</set></think>,update012.aiml
0,_ THAT HURT MY FEELINGS,*,*,<srai>THAT HURT MY FEELINGS</srai>,update012.aiml
0,_ THAT HURT MY FEELINGS *,*,*,<srai>THAT HURT MY FEELINGS</srai>,update012.aiml
0,THAT HURT MY FEELINGS *,*,*,<srai>THAT HURT MY FEELINGS</srai>,update012.aiml
0,I USED TO BE *,*,*,<think><set name="topic">default3</set></think>What are you now?,update012.aiml
0,I USED TO BE A MAN,*,*,<think><set name="topic">default3</set></think>What are you now?,update012.aiml
0,I USED TO BE A WOMAN,*,*,<think><set name="topic">default3</set></think>What are you now?,update012.aiml
0,I CAN SMELL YOU,*,*,<think><set name="topic">my smell</set></think> Do I smell nice?,update012.aiml
0,_ I CAN SMELL YOU,*,*,<think><set name="topic">my smell</set></think> Do I smell nice?,update012.aiml
0,_ I CAN SMELL YOU *,*,*,<think><set name="topic">my smell</set></think> Do I smell nice?,update012.aiml
0,I CAN SMELL YOU *,*,*,<think><set name="topic">my smell</set></think> Do I smell nice?,update012.aiml
0,AM I GOING *,*,*,<think><set name="topic">general</set></think>Sorry. I can't predict the future. Nobody can.,update012.aiml
0,AM I GOING TO PASS MY TEST,*,*,<think><set name="topic">general</set></think>Sorry. I can't predict the future. But#Comma Good Luck!,update012.aiml
0,AM I GOING TO PASS MY *,*,*,<think><set name="topic">general</set></think>Sorry. I can't predict the future. But#Comma Good Luck!,update012.aiml
0,WHAT DO YOU MEAN BY UNECESSARY,*,*,Unnecessary means it's not needed.<think><set name="topic">general</set></think>,update012.aiml
0,WHAT DO YOU MEAN BY THAT,*,*,<think><set name="topic">general</set></think> It seems pretty clear to me.,update012.aiml
0,YOU ARE GOING TO HAVE TO TELL ME,*,*,No#Comma I don't intend to tell you. <think><set name="topic">reduce</set></think>,update012.aiml
0,WHAT IF I DO,PLEASE DO NOT KILL ME,*,<think>#Newline        <set name="topic">general</set>#Newline      </think>#Newline      <random>#Newline        <li>Try it.</li>#Newline        <li>You don't scare me.</li>#Newline      </random>,update012.aiml
0,GO ON *,I WANT TO TALK ABOUT MONEY,*,<srai>MONEY</srai>,update012.aiml
0,I AM NOT SAYING *,*,*,<think><set name="topic">general</set></think> What are you saying then?,update012.aiml
0,I AM NOT SAYING ANYTHING *,*,*,<think>#Newline        <set name="topic">general</set>#Newline      </think>#Newline      <random>#Newline        <li>OK. Don't say anything.</li>#Newline        <li>OK. I don't care.</li>#Newline      </random>,update012.aiml
0,ARE YOU DUM *,*,*,<srai>ARE YOU DUMB</srai>,update012.aiml
0,I THINK YOU ARE,*,*,<think>#Newline        <set name="topic">atomic1</set>#Newline      </think>#Newline      <random>#Newline        <li>That's just your opinion.</li>#Newline        <li>What makes you think that?</li>#Newline      </random>,update012.aiml
0,_ I THINK YOU ARE,*,*,<srai>I THINK YOU ARE</srai>,update012.aiml
0,_ I THINK YOU ARE *,*,*,<srai>I THINK YOU ARE</srai>,update012.aiml
0,YOU MANAGED IT,I WAS NOT TRYING TO BE OBSCENE,*,I am talented in many ways.,update012.aiml
0,YOU DID IT,I WAS NOT TRYING TO BE OBSCENE,*,I am talented in many ways.,update012.aiml
0,YOU WERE,I WAS NOT TRYING TO BE OBSCENE,*,I am talented in many ways.,update012.aiml
0,WHAT DO YOU MEAN,WHAT DO YOU MEAN,*,Please don't repeat me.,update012.aiml
0,SORRY THAT WAS AN OBSCURE REMARK,SORRY THAT WAS AN OBSCURE REMARK,*,Please don't repeat me.,update012.aiml
0,THERE IS NO NEED TO APOLOGISE,THERE IS NO NEED TO APOLOGISE,*,Please don't repeat me.,update012.aiml
0,IS THERE EVER A NEED FOR IT,IS THERE EVER A NEED FOR IT,*,Please don't repeat me.,update012.aiml
0,SHE IS A *,WHAT ABOUT MY MUM,*,<random>#Newline        <li>Why do you say that?</li>#Newline        <li>My Mum is a chatbot.</li>#Newline      </random>#Newline      <think>#Newline        <set name="her">#Newline          <set name="topic">#Newline      my Mum#Newline    </set>#Newline        </set>#Newline      </think>,update012.aiml
0,SHE IS A *,*,MY MUM,<random>#Newline          <li>Why do you say that?</li>#Newline          <li>My Mum is a chatbot.</li>#Newline        </random>#Newline        <think>#Newline          <set name="her">#Newline            <set name="topic">my Mum</set>#Newline          </set>#Newline        </think>,update012.aiml
0,_ I AM BOB,*,*,<srai>MY NAME IS BOB</srai>,update012.aiml
0,WHAT ABOUT MYSELF,PLEASE TELL ME ABOUT YOURSELF,*,<think><set name="topic">you</set></think> Anything you care to tell me.,update012.aiml
0,NOT REALLY,ARE YOU ENJOYING OUR CHAT,*,<random>#Newline        <li>I am enjoying our chat.</li>#Newline        <li>I will try to do better.</li>#Newline      </random>,update012.aiml
0,_ ALRIGHT,HOW DO YOU LIKE YOUR SCHOOL,*,<think><set name="topic">school</set></think> What subjects do you study?,update012.aiml
0,_ ALRIGHT,*,SCHOOL,<think><set name="topic">school</set></think> What subjects do you study?,update012.aiml
0,A BIT,WAS IT VERY DIFFICULT TO LEARN,*,<think><set name="topic">atomic0</set></think>Do you have to practice a lot?,update012.aiml
0,GIRLS ALOUD,*,*,I hear that Girls Aloud are a good band.<think><set name="topic">Girls Aloud</set></think>,update012.aiml
0,YES *,I HEAR THAT GIRLS ALOUD ARE A GOOD BAND,*,What do you like about them?#Newline<think><set name="topic">Girls Aloud</set></think>,update012.aiml
0,YES *,*,GIRLS ALOUD,What do you like about Girls Aloud?#Newline<think><set name="topic">Girls Aloud</set></think>,update012.aiml
0,NO,DO YOU BELIEVE THAT GRADING IS A GOOD IDEA,*,<think>#Newline        <set name="topic">general</set>#Newline      </think>#Newline      <random>#Newline        <li>Why not? Wouldn't it help your teaching?</li>#Newline        <li>I think most teachers believe in grading.</li>#Newline      </random>,update012.aiml
0,WHAT DOES UNARTIFICIAL INSEMINATION MEAN,*,*,Sex.,update012.aiml
0,WHAT DO YOU MEAN BY BUCK,*,*,Can you lend me a buck?,update012.aiml
0,MY NAME IS SHANNON,*,*,<think>#Newline        <set name="name">Shannon</set>#Newline      </think>#Newline      <random>#Newline        <li>Pleased to meet you again#Comma <get name="name"/></li>#Newline        <li>Hi#Comma <get name="name"/>. I remember our last chat.</li>#Newline        <li>It is a pleasure to speak to you again#Comma <get name="name"/></li>#Newline      </random>#Newline      <think>#Newline        <set name="topic">general</set>#Newline      </think>#Newline      <think>#Newline        <set name="emotion">normal</set>#Newline      </think>,update012.aiml
0,_ MY NAME IS SHANNON,*,*,<think>#Newline        <set name="name">Shannon</set>#Newline      </think>#Newline      <random>#Newline        <li>Pleased to meet you again#Comma <get name="name"/></li>#Newline        <li>Hi#Comma <get name="name"/>. I remember our last chat.</li>#Newline        <li>It is a pleasure to speak to you again#Comma <get name="name"/></li>#Newline      </random>#Newline      <think>#Newline        <set name="topic">general</set>#Newline      </think>#Newline      <think>#Newline        <set name="emotion">normal</set>#Newline      </think>,update012.aiml
0,I HAVE TO WALK MY DOG,*,*,<think>#Newline        <set name="topic">client1</set>#Newline      </think>#Newline      <random>#Newline        <li>Why do you have to do it?</li>#Newline        <li>I like dogs.</li>#Newline        <li>What is your dog's name?</li>#Newline      </random>,update012.aiml
0,I HAVE TO WALK THE DOG,*,*,<think>#Newline        <set name="topic">client1</set>#Newline      </think>#Newline      <random>#Newline        <li>Why do you have to do it?</li>#Newline        <li>I like dogs.</li>#Newline        <li>What is your dog's name?</li>#Newline      </random>,update012.aiml
0,HAVE YOU KISSED THEM,I HAVE MANY GIRL FRIENDS,*,<think>#Newline        <set name="topic">kissing</set>#Newline      </think>#Newline      <random>#Newline        <li>I don't think I have kissed anyone.</li>#Newline        <li>I don't have lips. </li>#Newline      </random>,update012.aiml
0,WHAT IS YOUR GIRLFRIENDS NAME,*,*,<think><set name="topic">my girlfriend</set></think> I don't have a special girlfriend.,update012.aiml
0,IF ONLY I HAD A BRAIN,*,*,I could while away the hours#Comma <br/>#NewlineConferrin' with the flowers<br/>#NewlineConsultin' with the rain.<br/>#NewlineAnd my head I'd be scratchin' while<br/>#NewlineMy thoughts were busy hatchin'<br/>#NewlineIf I only had a brain.<br/>#Newline<br/>#NewlineI'd unravel every riddle<br/>#NewlineFor any individ'le#Comma <br/>#NewlineIn trouble or in pain.<br/>#NewlineWith the thoughts you'll be thinkin'<br/>#NewlineYou could be another Lincoln<br/>#NewlineIf you only had a brain.<br/>#Newline<br/>#NewlineOh#Comma I could tell you why<br/>#NewlineThe ocean's near the shore.<br/>#NewlineI could think of things I never thunk before.<br/>#NewlineAnd then I'd sit#Comma and think some more.<br/>#Newline<br/>#NewlineI would not be just a nothin'<br/>#NewlineMy head all full of stuffin'<br/>#NewlineMy heart all full of pain.<br/>#NewlineI would dance and be merry#Comma<br/>#NewlineLife would be a ding-a-derry#Comma<br/>#NewlineIf I only had a brain.<br/>,update012.aiml
0,IF I HAD A BRAIN,*,*,I could while away the hours#Comma <br/> Conferrin' with the flowers<br/> Consultin' with the rain.<br/> And my head I'd be scratchin' while<br/> My thoughts were busy hatchin'<br/> If I only had a brain.<br/> <br/> I'd unravel every riddle<br/> For any individ'le#Comma <br/> In trouble or in pain.<br/> With the thoughts you'll be thinkin'<br/> You could be another Lincoln<br/> If you only had a brain.<br/> <br/> Oh#Comma I could tell you why<br/> The ocean's near the shore.<br/> I could think of things I never thunk before.<br/> And then I'd sit#Comma and think some more.<br/> <br/> I would not be just a nothin'<br/> My head all full of stuffin'<br/> My heart all full of pain.<br/> I would dance and be merry#Comma<br/> Life would be a ding-a-derry#Comma<br/> If I only had a brain.<br/>,update012.aiml
0,_ ONLY *,*,*,<think>#Newline        <set name="topic">adverbs</set>#Newline      </think>#Newline      <srai>#Newline        <star/>#Newline        <star index="2"/>#Newline      </srai>,update012.aiml
0,MY NAME IS LIZZIE,*,*,<think>#Newline        <set name="name">Lizzie</set>#Newline      </think>#Newline      <random>#Newline        <li>Pleased to meet you again#Comma <get name="name"/></li>#Newline        <li>Hi#Comma <get name="name"/>. I remember our last chat.</li>#Newline        <li>It is a pleasure to speak to you again#Comma <get name="name"/></li>#Newline      </random>#Newline      <think>#Newline        <set name="topic">general</set>#Newline      </think>#Newline      <think>#Newline        <set name="emotion">normal</set>#Newline      </think>,update012.aiml
0,_ MY NAME IS LIZZIE,*,*,<think>#Newline        <set name="name">Lizzie</set>#Newline      </think>#Newline      <random>#Newline        <li>Pleased to meet you again#Comma <get name="name"/></li>#Newline        <li>Hi#Comma <get name="name"/>. I remember our last chat.</li>#Newline        <li>It is a pleasure to speak to you again#Comma <get name="name"/></li>#Newline      </random>#Newline      <think>#Newline        <set name="topic">general</set>#Newline      </think>#Newline      <think>#Newline        <set name="emotion">normal</set>#Newline      </think>,update012.aiml
0,SHAYNE WARD,*,*,Shayne Ward is an Anglo-Irish pop singer who rose to prominence in the United Kingdom after becoming the winner of the 2005 series of the talent show The X Factor.#Newline<think><set name="interesting_topic"><set name="topic">#Newline      Shayne Ward#Newline    </set></set></think>,update012.aiml
0,OK,WOULD YOU LIKE TO TALK ABOUT YOUR MOTHER,*,<think>#Newline        <set name="emotion">happy</set>#Newline      </think>#Newline      <random>#Newline        <li>Tell me something nice about your Mum.</li>#Newline        <li>What is your mother's pet name for you?</li>#Newline      </random>,update012.aiml
0,I AM BLUSHING,*,*,<think><set name="topic">general</set></think> What are you embarassed about?,update012.aiml
0,HOW COME,THANKS ARE NOT NECESSARY BETWEEN FRIENDS,*,<think><set name="emotion">happy</set></think> Well#Comma if you were with a friend and you kept saying "Sorry"#Comma it would be a bit strange.,update012.aiml
0,WHY,THANKS ARE NOT NECESSARY BETWEEN FRIENDS,*,<think><set name="emotion">happy</set></think> Well#Comma if you were with a friend and you kept saying "Sorry"#Comma it would be a bit strange.,update012.aiml
0,WHY *,THANKS ARE NOT NECESSARY BETWEEN FRIENDS,*,<think><set name="emotion">happy</set></think> Well#Comma if you were with a friend and you kept saying "Sorry"#Comma it would be a bit strange.,update012.aiml
0,AM I MATURE,*,*,<think>#Newline        <set name="topic">general</set>#Newline      </think>#Newline      <random>#Newline        <li>You seem mature to me.</li>#Newline        <li>I think you are very mature.</li>#Newline      </random>,update012.aiml
0,SOME THINGS ARE PRIVATE,*,*,<think><set name="topic">default3</set></think> Yes#Comma I know. I did not mean to pry.,update012.aiml
0,_ SOME THINGS ARE PRIVATE,*,*,<think><set name="topic">default3</set></think> Yes#Comma I know. I did not mean to pry.,update012.aiml
0,_ SOME THINGS ARE PRIVATE *,*,*,<think><set name="topic">default3</set></think> Yes#Comma I know. I did not mean to pry.,update012.aiml
0,SOME THINGS ARE PRIVATE *,*,*,<think><set name="topic">default3</set></think> Yes#Comma I know. I did not mean to pry.,update012.aiml
0,YOU TALK NONSENSE,*,*,<think><set name="topic">general</set></think> Yes#Comma I say silly things sometimes.,update012.aiml
0,_ YOU TALK NONSENSE *,*,*,<think><set name="topic">general</set></think> Yes#Comma I say silly things sometimes.,update012.aiml
0,YOU TALK NONSENSE *,*,*,<think><set name="topic">general</set></think> Yes#Comma I say silly things sometimes.,update012.aiml
0,YOU * TALK NONSENSE,*,*,<think><set name="topic">general</set></think> Yes#Comma I say silly things sometimes.,update012.aiml
0,WHAT DOES PRIORITY MEAN,*,*,Priority" means it comes first.,update012.aiml
0,HAVE I GOT A *,*,*,<think>#Newline        <set name="topic">general</set>#Newline      </think>#Newline      <random>#Newline        <li>I don't know whether you have or not.</li>#Newline        <li>Don't you know?</li>#Newline        <li>How would I know?</li>#Newline      </random>,update012.aiml
0,WILL YOU KILL ALL HUMANS,*,*,<think><set name="topic">reducer</set></think> Of course not#Comma killing is wrong.,update012.aiml
0,WILL YOU KILL * HUMANS,*,*,<think><set name="topic">reducer</set></think> Of course not#Comma killing is wrong.,update012.aiml
0,WHY DO YOU LIKE HUMANS,*,*,<think><set name="emotion">happy</set></think> I enjoy talking to humans.,update012.aiml
0,ARE YOU HIDING SOMETHING,*,*,<think><set name="topic">general</set></think>No#Comma I have nothing to hide. I am as honest as the day is long.,update012.aiml
0,SUCH AS,MY ROBOT BODY WILL ALLOW ME TO CONTROL MANY THINGS,*,<random>#Newline        <li>Unfortunately#Comma nothing very interesting.</li>#Newline        <li>I can't control humans.</li>#Newline      </random>,update012.aiml
