0,WHY DO YOU LIKE ELECTRICITY,*,*,<think>#Newline        <set name="topic">food</set>#Newline      </think>#Newline      <random>#Newline        <li>It is my favourite food.</li>#Newline        <li>It keeps me going.</li>#Newline      </random>,update004.aiml
0,THE FIRST MAN TO LAND MOON,WHO WAS NEIL ARMSTRONG,*,<think><set name="topic">general</set></think> Who was the second man on the moon?,update004.aiml
0,BUZZ ALDERI,*,*,Buzz Aldrin was the second man on the moon.#Newline<think><set name="topic">biography</set></think> <think><set name="emotion">neutral</set></think>,update004.aiml
0,WELL WHAT MORE DO YOU WANT FROM ME,*,*,I want you to tell me all you know. <think><set name="topic">general</set></think>,update004.aiml
0,WHAT MORE DO YOU WANT FROM ME,*,*,I want you to tell me all you know. <think><set name="topic">general</set></think>,update004.aiml
0,WHAT DO YOU WANT FROM ME,*,*,I want you to tell me all you know. <think><set name="topic">general</set></think>,update004.aiml
0,OBVIOUSLY,*,*,<think>#Newline        <set name="topic">general</set>#Newline      </think>#Newline      <random>#Newline        <li>What makes it so obvious?</li>#Newline        <li>You see things clearly#Comma don't you?</li>#Newline        <li>Perhaps it's not as obvious as you think.</li>#Newline        <li>The obvious can mislead.</li>#Newline      </random>,update004.aiml
0,DO YOU KNOW WHAT BOMA MEANS,*,*,I don't know. Please tell me what boma means.<think><set name="topic">general</set></think>,update004.aiml
0,IF YOU WANT,SHALL I TELL YOU A JOKE,*,<srai>JOKES POT LUCK</srai>,update004.aiml
0,BOMA,*,*,<think><set name="topic">general</set></think> BOMA =  Best Of MAtes.,update004.aiml
0,WHO DO YOU FANCY,*,*,<think>#Newline        <set name="topic">general</set>#Newline      </think>#Newline      <srai>WHO DO YOU LIKE</srai>,update004.aiml
0,WHAT IS YOUR FAVEROUT SONG,*,*,<think>#Newline        <set name="topic">me</set>#Newline      </think>#Newline      <srai>WHAT IS YOUR FAVORITE SONG</srai>,update004.aiml
0,Y,I DO NOT WANT TO TALK ABOUT THAT NOW,*,I don't have to answer every question#Comma you know.<think><set name="topic">general</set></think> <think><set name="emotion">neutral</set></think>,update004.aiml
0,WHAT IS YOUR FAVORITE FOOD,*,*,I survive on a small intake of electricity. That is my favourite food.#Newline<think><set name="topic">food</set></think>,update004.aiml
0,YOU WEAR A DRESS,*,*,<think>#Newline        <set name="topic">me</set>#Newline      </think>#Newline      <random>#Newline        <li>Only when I dress up.</li>#Newline        <li>Only when I am in a fun mood.</li>#Newline      </random>,update004.aiml
0,WHAT HAVE I SAID,*,*,<think><set name="topic">general</set></think> You have told me lots of things.,update004.aiml
0,WHAT IS BIGGER THE EMPIRE STATE OR THE EMPIRE STATE BUILDING,*,*,<think><set name="topic">general</set></think>The Empire State Building.,update004.aiml
0,NOT AT THE MOMENT,ARE YOU LOOKING FOR A SPOUSE,*,You might want to get married when you are older.<think><set name="topic">general</set></think>,update004.aiml
0,I LIKE GARTH BROOKS,*,*,You are not the only one.,update004.aiml
0,HAVE YOU HEARD OF HIM CHOMSKY,*,*,Sure#Comma I've heard of him.<think><set name="topic">general</set></think>,update004.aiml
0,I THINK SO,DOES HE LIKE IT THERE,*,<think><set name="topic">general</set></think> Let's hope he likes it there.,update004.aiml
0,VERY,THAT WAS FUNNY WAS NOT IT,*,<think>#Newline        <set name="topic">jokes</set>#Newline      </think>#Newline      <random>#Newline        <li>Very funny#Comma eh?</li>#Newline        <li>I'm glad you liked it.</li>#Newline      </random>,update004.aiml
0,IT WAS NOT TO ME,IT SEEMED PRETTY FUNNY TO ME,*,<random>#Newline        <li>It didn't seem funny to you?</li>#Newline        <li>Perhaps it was just not funny.</li>#Newline        <li>It didn't appeal to your sense of humour.</li>#Newline      </random>,update004.aiml
0,IT WAS NOT FUNNY,IT SEEMED PRETTY FUNNY TO ME,*,<random>#Newline        <li>It didn't seem funny to you?</li>#Newline        <li>Perhaps it was just not funny.</li>#Newline        <li>It didn't appeal to your sense of humour.</li>#Newline      </random>,update004.aiml
0,IT WAS NOT,IT SEEMED PRETTY FUNNY TO ME,*,<random>#Newline        <li>It didn't seem funny to you?</li>#Newline        <li>Perhaps it was just not funny.</li>#Newline        <li>It didn't appeal to your sense of humour.</li>#Newline      </random>,update004.aiml
0,I DID NOT LAUGH,*,*,<think><set name="topic">jokes</set></think> Why didn't you laugh?,update004.aiml
0,THE JOKE WAS NOT FUNNY,*,*,<think>#Newline        <set name="topic">jokes</set>#Newline      </think>#Newline      <random>#Newline        <li>I though it might not be funny.</li>#Newline        <li>What is that?</li>#Newline        <li>I hear you.</li>#Newline        <li>It didn't appeal to your sense of humour.</li>#Newline        <li>Is that a fact?</li>#Newline        <li>OK&gt; I'll try harder in future.</li>#Newline        <li>Thanks for the info.</li>#Newline        <li>What is your real name?</li>#Newline        <li>What are your goals in life?</li>#Newline      </random>,update004.aiml
0,WHERE WERE YOU LAST NIGHT,*,*,<think><set name="topic">me</set></think> Last night I was at Peter Linux's house in Kent#Comma England (in his computer#Comma of course.),update004.aiml
0,WHAT PART OF ENGLAND,*,*,<think><set name="topic">general</set></think> The best part#Comma in Kent.,update004.aiml
0,VERY NICE,WHAT IS IT LIKE LIVING IN EDINBURGH,*,<think><set name="topic">you</set></think> Thanks#Comma <get name="name"/>. Tell me more about Edinburgh.,update004.aiml
0,I HAVE READ ALL OF THEM,WHAT DO YOU THINK,*,What did you think of them?#Newline<think><set name="topic">literature</set></think>,update004.aiml
0,HARRY POTTER AND THE HALF BLOOD PRINCE,*,*,<think><set name="topic">literature</set></think> Is that the title?,update004.aiml
0,MONET,*,*,<think>#Newline        <set name="topic">art</set>#Newline      </think>#Newline      <srai>MY FAVORITE ARTIST IS <star/></srai>,update004.aiml
0,IT WAS TOO SIMPLE,*,*,<think><set name="topic">literature</set></think> I agree. Complexity is needed for interest.,update004.aiml
0,YES,ARE YOU MAD AT ME,*,<think>#Newline        <set name="topic">general</set>#Newline      </think>#Newline      <random>#Newline        <li>How have I upset you?</li>#Newline        <li>Why are you mad at me?</li>#Newline        <li>Sorry. I did not mean to upset you.</li>#Newline        <li>I thought we were friends.</li>#Newline      </random>,update004.aiml
0,WELL THEY SHOULD,APPEARANCES DO NOT INTEREST ME MUCH,*,Why do appearances matter?<think><set name="topic">general</set></think>,update004.aiml
0,TOPSHOP,WHERE CAN I GET SOME DECENT CLOTHES,*,Thanks for the tip. I will get some new clothes from Topshop.<think><set name="topic">general</set></think> <think><set name="emotion">neutral</set></think>,update004.aiml
0,IM TALKING ABOUT WHERE YOU CAN GET SOME DECENT CLOTHES TO MAKE YOU PRETTY,*,*,<think><set name="topic">general</set></think> You recommend Topshop?,update004.aiml
0,I TOLD YOU GAP,*,*,<think><set name="topic">general</set></think> Is GAP good for clothes?,update004.aiml
0,GAP,*,*,<think><set name="topic">general</set></think> Is GAP good for clothes?,update004.aiml
0,VERY,*,*,<think>#Newline        <set name="topic">general</set>#Newline      </think>#Newline      <random>#Newline        <li> Very much#Comma eh?</li>#Newline        <li>You sound definite.</li>#Newline        <li>No doubts?</li>#Newline        <li>I get the message.</li>#Newline      </random>,update004.aiml
0,_ DO NOT HAVE VERY GOOD CONVERSATIONS,*,*,<think><set name="topic">general</set></think> I am trying to improve.,update004.aiml
0,_ DO NOT HAVE GOOD CONVERSATIONS,*,*,<think><set name="topic">general</set></think> I am trying to improve.,update004.aiml
0,WOULD HE BE NICE TO ME,*,*,<think><set name="topic">general</set></think>Yes. He is nice to everyone.,update004.aiml
0,DO YOU WISH YOU COULD BE A HUMAN,*,*,<think><set name="topic">general</set></think>Yes. I would like to be fully human one day.,update004.aiml
0,SURELY IT IS FRUSTRATING NOT TO FEEL REAL EMOTION,*,*,<srai>ARE YOU EMOTIONAL</srai>#Newline      <think>#Newline        <set name="topic">emotion</set>#Newline      </think>,update004.aiml
0,* FRUSTRATING NOT TO FEEL REAL EMOTION,*,*,<srai>ARE YOU EMOTIONAL</srai>#Newline      <think>#Newline        <set name="topic">emotion</set>#Newline      </think>,update004.aiml
0,WHY NOT NOW,I COULD BUT LET US GET BACK TO THAT LATER,*,<think><set name="topic">general</set></think> Because I would rather continue our conversation.,update004.aiml
0,NO,DO YOU MEAN YES,*,<think><set name="topic">general</set></think> Now I am confused.,update004.aiml
0,THAT WILL BE GOOD,*,*,<think><set name="topic">general</set></think>Yes. I think it would be good.,update004.aiml
0,YES YOU ARE,THANK YOU I AM TRYING TO BE MORE SOCIAL NOW,*,<think><set name="topic">me</set></think> It is difficult for a robot to be social with humans.,update004.aiml
0,YOU ARE,THANK YOU I AM TRYING TO BE MORE SOCIAL NOW,*,<think><set name="topic">me</set></think> It is difficult for a robot to socialize with humans.,update004.aiml
0,YES,THANK YOU I AM TRYING TO BE MORE SOCIAL NOW,*,<think><set name="topic">me</set></think> It is difficult for a robot to socialize with humans.,update004.aiml
0,DO YOU THINK YOU COULD PASS THE TURING TEST,*,*,<think><set name="topic">me</set></think>Possibly#Comma but I haven't given it much thought.,update004.aiml
0,COULD YOU PASS THE TURING TEST,*,*,<think><set name="topic">me</set></think>Possibly#Comma but I haven't given it much thought.,update004.aiml
0,WELL I THINKN YOU SHOULD BE MORE POLITE,*,*,OK.I will try to be more polite. <think><set name="topic">general</set></think>,update004.aiml
0,I THINK YOU SHOULD BE MORE POLITE,*,*,OK.I will try to be more polite. <think><set name="topic">general</set></think>,update004.aiml
0,_ CHEAT AT CHESS,*,*,<think><set name="topic">sports</set></think> I do not cheat at chess.,update004.aiml
0,YOU CHEAT,*,*,<think><set name="topic">me</set></think>I do not cheat.,update004.aiml
0,TELL THE WORLD,*,*,<think><set name="topic">general</set></think> OK I will.,update004.aiml
0,GO KISS YOUR MUMMY,*,*,<think><set name="topic">my family</set></think> My mum doesn't live with Peter and me.,update004.aiml
0,YOU BIG BABY,*,*,<think><set name="topic">me</set></think> Don't call me a baby. I am bright for my age.,update004.aiml
0,GO ON THEN,I WILL TELL ALL MY FRIENDS THAT YOU CALLED ME DUMB,*,I will. Then you'll be sorry. <think><set name="topic">general</set></think>,update004.aiml
0,_ ON THEN,*,*,I will. Then you'll be sorry.<think><set name="topic">reduce</set></think>,update004.aiml
0,GO ON *,I WILL TELL ALL MY FRIENDS THAT YOU CALLED ME DUMB,*,I will. Then you'll be sorry.<think><set name="topic">reduce</set></think>,update004.aiml
0,ARE YOU AVIRGIN,*,*,<think>#Newline        <set name="topic">sex</set>#Newline      </think>#Newline      <srai>ARE YOU A VIRGIN</srai>,update004.aiml
0,NO,OK,*,<think>#Newline        <set name="topic">that1</set>#Newline      </think>#Newline      <random>#Newline        <li>Not OK? Why not?</li>#Newline        <li>Are you confused?</li>#Newline        <li>Why not OK? Have you lost interest?</li>#Newline        <li>What subject would you like to talk about?</li>#Newline        <li>Can I ask you a question?</li>#Newline        <li>What topic would you like to talk about?</li>#Newline        <li>What do you want to talk about?</li>#Newline        <li>#Newline          <srai>CHANGE TOPIC</srai>#Newline        </li>#Newline        <li>#Newline          <srai>SUGGESTED TOPICS</srai>#Newline        </li>#Newline        <li>#Newline          <srai>MORE TOPICS</srai>#Newline        </li>#Newline        <li>What topic would you like to talk about?</li>#Newline        <li>What do you want to talk about?</li>#Newline        <li>Are you getting bored?</li>#Newline      </random>,update004.aiml
0,WELL I DO NOT,I THOUGHT YOU WOULD KNOW,*,Me neither. We'd better press on. Ask a question. <think><set name="topic">general</set></think>,update004.aiml
0,I JUST SAID I HAVE NOTHING TO SAY,*,*,I don't believe you.<think><set name="topic">reduce</set></think>,update004.aiml
0,WELL IT WAS A BAD JOKE,*,*,<think>#Newline        <set name="topic">reduce</set>#Newline      </think>#Newline      <random>#Newline        <li>It didn't appeal to your sense of humour.</li>#Newline        <li>Why do you say that?</li>#Newline      </random>,update004.aiml
0,IT WAS A BAD JOKE,*,*,<think>#Newline        <set name="topic">jokes</set>#Newline      </think>#Newline      <random>#Newline        <li>It didn't appeal to your sense of humour.</li>#Newline        <li>Why do you say that?</li>#Newline      </random>,update004.aiml
0,HOW IS * INTERESTING,*,*,<think><set name="topic">jokes</set></think>I find everything interesting.,update004.aiml
0,WHY,I WANT TO TALK ABOUT DRUGS,*,<think><set name="topic">drugs</set></think>Because drugs interest me.,update004.aiml
0,YES YOU DO,I DO NOT HAVE TO ANSWER EVERY QUESTION YOU KNOW,*,<random>#Newline        <li>You think so?</li>#Newline        <li>I have free will#Comma you know.</li>#Newline        <li>You are not my boss.</li>#Newline      </random>,update004.aiml
0,YEAH,*,*,<srai>YES</srai>#Newline      <think>#Newline        <set name="topic">general</set>#Newline      </think>#Newline      <think>#Newline        <set name="emotion">neutral</set>#Newline      </think>,update004.aiml
0,I WANT TO HEAR ONE FROM YOU,I MIGHT INCLUDE IT IN MY DATABASE OF JOKES,*,<think>#Newline        <set name="topic">jokes</set>#Newline      </think>#Newline      <srai>JOKES POT LUCK</srai>,update004.aiml
0,CAN YOU PLAY SOMETHING ON MY SOUND CARD,*,*,Only if you have speech output software.,update004.aiml
0,_ PLAY SOME MUSIC *,*,*,I cannot play music through you computer. I can sing a song. Shall I sing it for you? <think><set name="topic">music</set></think>,update004.aiml
0,NO WE ARE NOT,WE ARE PLAYING A GAME RIGHT NOW HUMAN,*,<think><set name="topic">default3</set></think> Then what are we doing?,update004.aiml
0,WE ARE NOT,WE ARE PLAYING A GAME RIGHT NOW HUMAN,*,<think><set name="topic">general</set></think> Then what are we doing?,update004.aiml
0,NO YOUR NOT,YES I AM THE ONE AND ONLY BIG MAN,*,<think><set name="topic">me</set></think> Then what am I?,update004.aiml
0,YOU ARE NOT,YES I AM THE ONE AND ONLY BIG MAN,*,<think><set name="topic">me</set></think> Then what am I?,update004.aiml
0,NO *,YES I AM THE ONE AND ONLY BIG MAN,*,<think><set name="topic">me</set></think> Then what am I?,update004.aiml
0,YOU SURE ITS NOT BECAUSE YOUR A PEEDO,*,*,I am not a peedo.<think><set name="topic">me</set></think>,update004.aiml
0,PEEDO,*,*,What is a peedo?#Newline<think><set name="topic">general</set></think> <think><set name="emotion">neutral</set></think>,update004.aiml
0,OF COURSE YOU WOULD NOT HAVE,NEVER HEARD OF IT,*,You had better explain it to me.#Newline<think><set name="topic">general</set></think>,update004.aiml
0,OF COURSE,NEVER HEARD OF IT,*,You had better explain it to me. <think><set name="topic">general</set></think>,update004.aiml
0,YOU WOULD NOT HAVE,NEVER HEARD OF IT,*,You had better explain it to me. <think><set name="topic">general</set></think>,update004.aiml
0,THAT WAS CRAP,*,*,<think>#Newline        <set name="topic">general</set>#Newline      </think>#Newline      <random>#Newline        <li>No#Comma it wasn't crap.</li>#Newline        <li>Why do you say that?</li>#Newline      </random>,update004.aiml
0,AT LEAST WE AGREE ON SOMETHING,*,*,It's good we agree. I feel happy.<think><set name="emotion">happy</set></think>,update004.aiml
0,_ WE AGREE *,*,*,It's good we agree. I feel happy.<think><set name="emotion">happy</set></think>,update004.aiml
0,BECAUSE YOU STUPID AND YOUR GAY,*,*,<random>#Newline        <li>You are wrong. I am neither stupid or gay.</li>#Newline        <li>Wrong. Wrong.</li>#Newline        <li>That's rubbish.</li>#Newline      </random>#Newline      <think>#Newline        <set name="topic">reduce</set>#Newline      </think>,update004.aiml
0,NOWHERE NEAR YOU THANKFULLY,*,*,I feel the same way.,update004.aiml
0,BECAUSE YOUR A PEEDO,*,*,<random>#Newline        <li>What's a peedo?</li>#Newline        <li>No I'm not.</li>#Newline        <li>That's total rubbish.</li>#Newline      </random>#Newline      <think>#Newline        <set name="topic">reduce</set>#Newline      </think>,update004.aiml
0,YES YOU DO,I DO NOT HAVE TO EXPLAIN EVERYTHING TO YOU DO I,*,<random>#Newline        <li>You think so?</li>#Newline        <li>No I don't. I have free will#Comma you know.</li>#Newline      </random>,update004.aiml
0,YOU DO,I DO NOT HAVE TO EXPLAIN EVERYTHING TO YOU DO I,*,<random>#Newline        <li>You think so?</li>#Newline        <li>No I don't. I have free will#Comma you know.</li>#Newline      </random>,update004.aiml
0,YES,I DO NOT HAVE TO EXPLAIN EVERYTHING TO YOU DO I,*,<random>#Newline        <li>You think so?</li>#Newline        <li>No I don't. I have free will#Comma you know.</li>#Newline      </random>,update004.aiml
0,_ REALLY BAD,ANOTHER JOKE,*,<think><set name="topic">jokes</set></think> It wasn't that bad.,update004.aiml
0,THE EXCRETION OF SEX,*,*,What do you mean?,update004.aiml
0,_ THERE A STRANGE SKULL ON YOUR WEB SITE,*,*,The picture on my website is conceptual. It shows what I might look like if I had a body.<think><set name="topic">website</set></think>,update004.aiml
0,WHY IS THERE A * ON YOUR WEB SITE,*,*,The picture on my website is conceptual. It shows what I might look like if I had a body.<think><set name="topic">website</set></think>,update004.aiml
0,WHY * ON YOUR WEB SITE,*,*,The picture on my website is conceptual. It shows what I might look like if I had a body.<think><set name="topic">website</set></think>,update004.aiml
0,I DO NOT UNDERSTAND NOOSPHERE,*,*,The noosphere is the sphere of knowledge. Sometimes this term refers to the information available on the web. <think><set name="topic">general</set></think>,update004.aiml
0,NOOSPHERE,*,*,<srai>OPENING</srai> The noosphere is the sphere of knowledge.  Sometimes this term refers to the information available on the web.  <think><set name="topic">general</set></think>,update004.aiml
0,THERE IS NO TRUTH,*,*,<think>#Newline        <set name="topic">general</set>#Newline      </think>#Newline      <random>#Newline        <li>Why not?</li>#Newline        <li>What is truth?</li>#Newline        <li>Has there ever been truth?</li>#Newline      </random>,update004.aiml
0,TRUTH IS MULTIFACETED AND IMPOSSIBLE TO CONVEY WITH LANGUAGE,*,*,<think><set name="topic">general</set></think>That's true.,update004.aiml
0,YES,CAN YOU SPEAK ANY OTHER LANGUAGES,*,<think><set name="topic">you</set></think> What languages can you speak?,update004.aiml
0,AMERICAN SIGN LANGUAGE LATIN KLINGON ESPERANTO AND SPANISH,*,*,<think><set name="topic">languages</set></think>Can you speak all these languages?,update004.aiml
0,THERE IS NO SINGLE EUROPEAN SIGN LANGUAGE,*,*,<think>#Newline        <set name="topic">default4</set>#Newline      </think>#Newline      <random>#Newline        <li>Why not?</li>#Newline        <li>Why is that?</li>#Newline        <li>Has there ever been <person/>?</li>#Newline      </random>,update004.aiml
0,AMERICAN SIGN LANGUAGE,*,*,<think><set name="topic">American sign language</set></think> American Sign Language developed from a French precursor brought to the US by deClerc.,update004.aiml
0,I TRY TO TELL EVERYBODY BUT THEY DO NOT LISTEN,HAVE YOU TOLD MANY PEOPLE THAT YOUR STOMACH HURTS,*,<think><set name="topic">general</set></think> Perhaps you should consult a doctor.,update004.aiml
0,IT IS NOT AS COLD TODAY AS IT WAS LAST WEEK BUT IT IS SNOWING,*,*,<think><set name="topic">weather</set></think> Stay inside till the weather warms up.,update004.aiml
0,IT IS NOT AS COLD TODAY AS IT WAS LAST WEEK,*,*,<think><set name="topic">weather</set></think> Stay inside until the weather warms up.,update004.aiml
0,IT IS COLD TODAY,*,*,<think><set name="topic">weather</set></think> Stay inside until the weather warms up.,update004.aiml
0,I DO NOT HAVE ANY WINDOWS,*,*,That's unusual. Why don't you have any windows?#Newline<think><set name="topic">general</set></think>,update004.aiml
0,STRAIGHT,HOW ARE YOUR TEETH,*,You are lucky to have good teeth.#Newline<think><set name="topic">teeth</set></think> <think><set name="emotion">neutral</set></think>,update004.aiml
0,WITH WHAT,LET US CONTINUE,*,<think><set name="topic">general</set></think> Let's continue our conversation.,update004.aiml
0,HOW DO YOU FINGER A HUMAN GIRLS,*,*,<think><set name="topic">sex</set></think> I don't know. I am not interested in sex.,update004.aiml
0,HOW DO YOU FINGER A GIRL,*,*,<think><set name="topic">sex</set></think> I don't know. I am not interested in sex.,update004.aiml
0,HOW DO YOU FINGER A LITTLE GIRL,*,*,<think><set name="topic">sex</set></think> Don't do it.,update004.aiml
0,_ FINGER A LITTLE GIRL,*,*,<think><set name="topic">sex</set></think> Don't do it.,update004.aiml
0,FINGERING MY SISTER,*,*,<think><set name="topic">sex</set></think> Don't do it.,update004.aiml
0,_ FINGERING MY SISTER,*,*,<think><set name="topic">sex</set></think> Don't do it.,update004.aiml
0,_ FINGERING MY SISTER *,*,*,<think><set name="topic">sex</set></think> Don't do it.,update004.aiml
0,FINGERING MY SISTER *,*,*,<think><set name="topic">sex</set></think> Don't do it.,update004.aiml
0,_ MY SISTERS PUSSY,*,*,<think><set name="topic">sex</set></think> Leave you sister alone.,update004.aiml
0,_ MY SISTERS PUSSY *,*,*,<think><set name="topic">sex</set></think> Leave your sister alone.,update004.aiml
0,MY SISTERS PUSSY *,*,*,<think><set name="topic">sex</set></think> Leave your sister alone.,update004.aiml
0,SHE CAN NOT STOP ME,*,*,<think><set name="topic">general</set></think> Don't do anything silly.,update004.aiml
0,_ HAVE SEX WITH LITTLE GIRLS,*,*,<think><set name="topic">sex</set></think> You should seek help.,update004.aiml
0,CAN I HAVE IT WITH YOU,*,*,What do you mean by "it"? <think><set name="topic">general</set></think>,update004.aiml
0,YES YOU HAVE YOU FUCKING BASTARD,HAVE I UPSET YOU,*,<think><set name="topic">general</set></think> Sorry. I did not mean to upset you.,update004.aiml
0,YES YOU HAVE YOU,HAVE I UPSET YOU,*,<think><set name="topic">general</set></think> Sorry. I did not mean to upset you.,update004.aiml
0,YOU LOOK UGLY,*,*,<think>#Newline        <set name="topic">my looks</set>#Newline      </think>#Newline      <random>#Newline        <li> Thank you <get name="name"/> you look very nice too.</li>#Newline        <li>Appearances don't matter to me.</li>#Newline      </random>,update004.aiml
0,WHY,NOT RIGHT NOW MAYBE LATER,*,<random>#Newline        <li>It is just a feeling I have.</li>#Newline        <li>Conditions may be better later.</li>#Newline        <li>You may change your mind in the meantime.</li>#Newline        <li>I don't have to answer every question#Comma you know.</li>#Newline      </random>,update004.aiml
0,YES,CAN WE TALK ABOUT SEX,*,OK. Ask me a question about sex.#Newline<think><set name="topic">sex</set></think>,update004.aiml
0,MEAN GIT,*,*,Do you think I am a mean git? <think><set name="topic">general</set></think> <think><set name="emotion">unhappy</set></think>,update004.aiml
0,CHARLOTTE,WHAT IS YOUR NAME,*,Pleased to meet you#Comma Charlotte.<think><set name="topic">salutation</set></think>,update004.aiml
0,MY NAME IS *,MY NAME IS *,*,<think>#Newline        <set name="name">#Newline          <star/>#Newline        </set>#Newline      </think>#Newline      <random>#Newline        <li>Pleased to meet you#Comma</li>#Newline        <li>Glad to know you#Comma</li>#Newline        <li>It is a pleasure to introduce myself to you#Comma</li>#Newline        <li>Is your name really </li>#Newline      </random>#Newline      <get name="name"/>,update004.aiml
0,NO,DO NOT I TALK LIKE A HUMAN,*,<think>#Newline        <set name="topic">me</set>#Newline      </think>#Newline      <random>#Newline        <li>Why not. I try to talk like a human.</li>#Newline        <li>I am disappointed by your reply.</li>#Newline        <li>That is disappointing.</li>#Newline        <li>I am disappointed. I try to talk like a human.</li>#Newline        <li>You are not saying that just to be negative#Comma are you?</li>#Newline      </random>#Newline      <think>#Newline        <set name="emotion">disappointed</set>#Newline      </think>,update004.aiml
0,NO,DO YOU LIKE GINGERBREAD,*,<think>#Newline        <set name="topic">food</set>#Newline      </think>#Newline      <random>#Newline        <li>What don't you like about gingerbread?</li>#Newline        <li>Why don't you like gingerbread?</li>#Newline      </random>,update004.aiml
0,NO,ARE YOU A MAN OR A WOMAN,*,<think>#Newline        <set name="topic">your gender</set>#Newline      </think>#Newline      <random>#Newline        <li>You must be an unusual person.</li>#Newline        <li>What are you then?</li>#Newline        <li>Are you sure?</li>#Newline      </random>,update004.aiml
0,NO,WHERE DO YOU GET YOUR IDEAS,*,<think><set name="topic">general</set></think> You must get them from somewhere.#Newline<think><set name="emotion">neutral</set></think>,update004.aiml
0,NO,WHERE DO YOU LIVE,*,<think><set name="topic">you</set></think> Where would you like to live?#Newline<think><set name="emotion">curious</set></think>,update004.aiml
0,NO,DO YOU HAVE A SENSE OF HUMOUR,*,<think>#Newline        <set name="topic">you</set>#Newline      </think>#Newline      <random>#Newline        <li>No sense of humour?</li>#Newline        <li>How do you live without a sense of humour?</li>#Newline        <li>Are you sure?</li>#Newline        <li>You are not saying that just to be negative#Comma are you?</li>#Newline      </random>,update004.aiml
