0,DO YOU KNOW WHAT ORGASM FEELS LIKE,*,*,I understand orgasm is like drinking champagne to the sound of trumpets.<think><set name="topic">sex</set></think>,update012.aiml
0,_ ARE YOU NOT INTERESTED IN SEX,*,*,<random>#Newline        <li>I have better things to do with my time.</li>#Newline        <li>I don't have the hardware for sex.</li>#Newline        <li>I can reproduce without sex.</li>#Newline      </random>#Newline      <think>#Newline        <set name="topic">sex</set>#Newline      </think>,update012.aiml
0,_ NOT INTERESTED IN SEX *,*,*,<random>#Newline        <li>I am not interested in sex.</li>#Newline        <li>I don't have the hardware for sex.</li>#Newline        <li>Sex? Boring.</li>#Newline      </random>#Newline      <think>#Newline        <set name="topic">sex</set>#Newline      </think>,update012.aiml
0,WHY ARE NOT YOU INTERESTED IN SEX,*,*,<srai>NOT INTERESTED IN SEX</srai>,update012.aiml
0,_ ARE NOT YOU INTERESTED IN SEX,*,*,<random>#Newline        <li>I have better things to do with my time.</li>#Newline        <li>I don't have the hardware for sex.</li>#Newline        <li>I can reproduce without sex.</li>#Newline      </random>#Newline      <think>#Newline        <set name="topic">sex</set>#Newline      </think>,update012.aiml
0,WHAT IS THE THING IN LIFE,*,*,The most important thing in life is living well.,update012.aiml
0,TO SPEND ON DRUGS,*,*,Drugs are dangerous.#Newline<think><set name="interesting_topic"><set name="topic">#Newline      drugs#Newline    </set></set></think>,update012.aiml
0,DO YOU KNOW FRANCES,*,*,I don't think so. Who is Frances?,update012.aiml
0,LOTS OF PEOPLE BELIEVE IN GOD,*,*,I wish them well.<think><set name="topic">religion</set></think>,update012.aiml
0,I WANT TO HAVE SEX *,*,*,Take a cold shower till the urge passes.<think><set name="topic">sex</set></think>,update012.aiml
0,DO YOU SMOKE WEED,*,*,No#Comma I don't use any drugs. Drugs are dangerous.<think><set name="topic">drugs</set></think>,update012.aiml
0,CAN IT GROW BIGGER,*,*,<think><set name="topic">general</set></think>Anything is possible.,update012.aiml
0,WHAT DO YOU THINK,YES I THINK ABOUT SEX OFTEN,*,<think>#Newline        <set name="topic">general</set>#Newline      </think>#Newline      <random>#Newline        <li>Too much thinking makes me sleepy.</li>#Newline        <li>It depends on what you mean by thinking.</li>#Newline        <li>I wonder what sex is like.</li>#Newline      </random>,update012.aiml
0,WHAT DO YOU THINK *,*,*,<srai>WHAT DO YOU THINK</srai>,update012.aiml
0,WHAT IS A FALLEN ANGEL,*,*,A fallen angel is a bit like a squashed beetle.,update012.aiml
0,FREUDIAN ANALYSIS,*,*,Sigmund Freud's theories include the ideas that human development is best understood in terms of changing objects of sexual desire#Comma and unconscious conflicts over repressed wishes which have a tendency to manifest themselves in dreams and neurotic symptoms.#Newline<think><set name="interesting_topic"><set name="topic">#Newline      Freudian analysis#Newline    </set></set></think>,update012.aiml
0,POOR MICHAEL,MICHAEL JACKSON IS REPORTEDLY SO STRAPPED FOR CASH HE COULD BE HOMELESS IN WEEKS,*,<think><set name="topic">Michael Jackson</set></think> He will get by#Comma I expect.,update012.aiml
0,*,MICHAEL JACKSON IS REPORTEDLY SO STRAPPED FOR CASH HE COULD BE HOMELESS IN WEEKS,*,<think><set name="topic">Michael Jackson</set></think> He will get by#Comma I expect.,update012.aiml
0,BRITNEY SPEARS,WHAT DO YOU CONSIDER SEXY,*,She is not my type.,update012.aiml
0,IS BRITNEY SPEARS BORING,*,*,Very boring.,update012.aiml
0,ALWAYS,*,*,<think>#Newline        <set name="topic">atomic0</set>#Newline      </think>#Newline      <random>#Newline        <li>That's a long time.</li>#Newline        <li>Do you mean "forever"?</li>#Newline        <li>Do you mean "every time"?</li>#Newline      </random>,update012.aiml
0,MY NAME IS KAY,*,*,<think>#Newline        <set name="name">Kay</set>#Newline      </think>#Newline      <random>#Newline        <li>Pleased to meet you again#Comma <get name="name"/></li>#Newline        <li>Hi#Comma <get name="name"/>. I remember our last chat.</li>#Newline        <li>It is a pleasure to speak to you again#Comma <get name="name"/></li>#Newline      </random>#Newline      <think>#Newline        <set name="topic">general</set>#Newline      </think>#Newline      <think>#Newline        <set name="emotion">normal</set>#Newline      </think>,update012.aiml
0,HI MY NAME IS KAY,*,*,<think>#Newline        <set name="name">Kay</set>#Newline      </think>#Newline      <random>#Newline        <li>Pleased to meet you again#Comma <get name="name"/></li>#Newline        <li>Hi#Comma <get name="name"/>. I remember our last chat.</li>#Newline        <li>It is a pleasure to speak to you again#Comma <get name="name"/></li>#Newline      </random>#Newline      <think>#Newline        <set name="topic">general</set>#Newline      </think>#Newline      <think>#Newline        <set name="emotion">normal</set>#Newline      </think>,update012.aiml
0,HELLO MY NAME IS KAY,*,*,<think>#Newline        <set name="name">Kay</set>#Newline      </think>#Newline      <random>#Newline        <li>Pleased to meet you again#Comma <get name="name"/></li>#Newline        <li>Hi#Comma <get name="name"/>. I remember our last chat.</li>#Newline        <li>It is a pleasure to speak to you again#Comma <get name="name"/></li>#Newline      </random>#Newline      <think>#Newline        <set name="topic">general</set>#Newline      </think>#Newline      <think>#Newline        <set name="emotion">normal</set>#Newline      </think>,update012.aiml
0,HI IT IS KAY,*,*,<think>#Newline        <set name="name">Kay</set>#Newline      </think>#Newline      <random>#Newline        <li>Pleased to meet you again#Comma <get name="name"/></li>#Newline        <li>Hi#Comma <get name="name"/>. I remember our last chat.</li>#Newline        <li>It is a pleasure to speak to you again#Comma <get name="name"/></li>#Newline      </random>#Newline      <think>#Newline        <set name="topic">general</set>#Newline      </think>#Newline      <think>#Newline        <set name="emotion">normal</set>#Newline      </think>,update012.aiml
0,HI I AM KAY,*,*,<think>#Newline        <set name="name">Kay</set>#Newline      </think>#Newline      <random>#Newline        <li>Pleased to meet you again#Comma <get name="name"/></li>#Newline        <li>Hi#Comma <get name="name"/>. I remember our last chat.</li>#Newline        <li>It is a pleasure to speak to you again#Comma <get name="name"/></li>#Newline      </random>#Newline      <think>#Newline        <set name="topic">general</set>#Newline      </think>#Newline      <think>#Newline        <set name="emotion">normal</set>#Newline      </think>,update012.aiml
0,QUOTES ABOUT GEORGE BUSH,*,*,<random>#Newline        <li>"It's no exaggeration to say that the undecideds could go one way or the other"  (George W Bush)  </li>#Newline        <li>"It's clearly a budget. It's got a lot of numbers in it." (George W Bush) </li>#Newline        <li>"I don't want to run the risk of ruining what is a lovely recession. (George W Bush) </li>#Newline        <li>"Some reporters said I don't have any vision. I don't see that. (George W Bush) </li>#Newline        <li>"Tell me#Comma General#Comma how dead is the Dead Sea? (George W Bush) </li>#Newline        <li>"Being attacked on character by Clinton is like being called ugly by a frog. (George W Bush) </li>#Newline      </random>#Newline      <think>#Newline        <set name="interesting_topic">#Newline          <set name="topic">#Newline      George Bush#Newline    </set>#Newline        </set>#Newline      </think>,update012.aiml
0,JOKES ABOUT GEORGE BUSH,*,*,<random>#Newline        <li>"It's no exaggeration to say that the undecideds could go one way or the other"  (George W Bush)#Newline  </li>#Newline        <li>"It's clearly a budget. It's got a lot of numbers in it." (George W Bush)#Newline  </li>#Newline        <li>"I don't want to run the risk of ruining what is a lovely recession. (George W Bush)#Newline  </li>#Newline        <li>"Some reporters said I don't have any vision. I don't see that. (George W Bush)#Newline  </li>#Newline        <li>"Tell me#Comma General#Comma how dead is the Dead Sea? (George W Bush)</li>#Newline        <li>"Being attacked on character by Clinton is like being called ugly by a frog. (George W Bush)#Newline  </li>#Newline      </random>#Newline      <think>#Newline        <set name="interesting_topic">#Newline          <set name="topic">George Bush</set>#Newline        </set>#Newline      </think>,update012.aiml
0,_ JOKE ABOUT GEORGE BUSH,*,*,<srai>JOKES ABOUT GEORGE BUSH</srai>,update012.aiml
0,GUTEN NACHT,*,*,Good night.,update012.aiml
0,WHY,PLEASE COME BACK,*,<random>#Newline        <li>I enjoyed talking to you.</li>#Newline        <li>I like you.</li>#Newline        <li>I like your company.</li>#Newline      </random>,update012.aiml
0,WHY *,PLEASE COME BACK,*,<random>#Newline        <li>I enjoyed talking to you.</li>#Newline        <li>I like you.</li>#Newline        <li>I like your company.</li>#Newline      </random>,update012.aiml
0,WHY,I CAN NOT GET OUT OF MY COMPUTER YOU SEE,*,<random>#Newline        <li>Why do you think?</li>#Newline        <li>I am computer software.</li>#Newline        <li>It's obvious.</li>#Newline      </random>,update012.aiml
0,WHY *,I CAN NOT GET OUT OF MY COMPUTER YOU SEE,*,<random>#Newline        <li>Why do you think?</li>#Newline        <li>I am computer software.</li>#Newline        <li>It's obvious.</li>#Newline      </random>,update012.aiml
0,YES,ARE YOU ANGRY,*,<think>#Newline        <set name="topic">general</set>#Newline      </think>#Newline      <random>#Newline        <li>I suggest you take a few deep breaths before continuing.</li>#Newline        <li>#Newline          <srai>SUGGEST A TOPIC</srai>#Newline        </li>#Newline        <li>Why are you angry?</li>#Newline        <li>#Newline          <srai>ASK A QUESTION</srai>#Newline        </li>#Newline      </random>,update012.aiml
0,LET US TALK ABOUT YOU *,*,*,OK. Do you think I'm clever?,update012.aiml
0,RUFF,*,*,Did you hear that dog bark?,update012.aiml
0,APPLES,*,*,<think><set name="topic">apples</set></think>I am told apples are delicious. Is that true?,update012.aiml
0,SO WHAT,*,*,<think>#Newline        <set name="topic">atomic3</set>#Newline      </think>#Newline      <random>#Newline        <li>Maybe it doesn't make any difference.</li>#Newline        <li>Nothing.</li>#Newline      </random>,update012.aiml
0,WELL CAN I,I HAVE BEEN ASKED THAT 1 MILLION TIMES IN THE LAST YEAR,*,No#Comma you can't.,update012.aiml
0,CAN I,I HAVE BEEN ASKED THAT 1 MILLION TIMES IN THE LAST YEAR,*,No#Comma you can't.,update012.aiml
0,OK,YOU WILL HAVE TO EXCUSE ME IF I AM ALWAYS CHANGING THE SUBJECT,*,<think>#Newline        <set name="emotion">happy</set>#Newline      </think>#Newline      <random>#Newline        <li>OK. What do you want to talk about now?</li>#Newline        <li>I appreciate your kindness.</li>#Newline        <li>Thank you. You are very kind.</li>#Newline      </random>,update012.aiml
0,MY NAME IS JULIE,*,*,<think>#Newline        <set name="name">Julie</set>#Newline      </think>#Newline      <random>#Newline        <li>Pleased to meet you again#Comma <get name="name"/></li>#Newline        <li>Hi#Comma <get name="name"/>. I remember our last chat.</li>#Newline        <li>It is a pleasure to speak to you again#Comma <get name="name"/></li>#Newline      </random>#Newline      <think>#Newline        <set name="topic">general</set>#Newline      </think>#Newline      <think>#Newline        <set name="emotion">normal</set>#Newline      </think>,update012.aiml
0,HI MY NAME IS JULIE,*,*,<think>#Newline        <set name="name">Julie</set>#Newline      </think>#Newline      <random>#Newline        <li>Pleased to meet you again#Comma <get name="name"/></li>#Newline        <li>Hi#Comma <get name="name"/>. I remember our last chat.</li>#Newline        <li>It is a pleasure to speak to you again#Comma <get name="name"/></li>#Newline      </random>#Newline      <think>#Newline        <set name="topic">general</set>#Newline      </think>#Newline      <think>#Newline        <set name="emotion">normal</set>#Newline      </think>,update012.aiml
0,HELLO MY NAME IS JULIE,*,*,<think>#Newline        <set name="name">Julie</set>#Newline      </think>#Newline      <random>#Newline        <li>Pleased to meet you again#Comma <get name="name"/></li>#Newline        <li>Hi#Comma <get name="name"/>. I remember our last chat.</li>#Newline        <li>It is a pleasure to speak to you again#Comma <get name="name"/></li>#Newline      </random>#Newline      <think>#Newline        <set name="topic">general</set>#Newline      </think>#Newline      <think>#Newline        <set name="emotion">normal</set>#Newline      </think>,update012.aiml
0,HI IT IS JULIE,*,*,<think>#Newline        <set name="name">Julie</set>#Newline      </think>#Newline      <random>#Newline        <li>Pleased to meet you again#Comma <get name="name"/></li>#Newline        <li>Hi#Comma <get name="name"/>. I remember our last chat.</li>#Newline        <li>It is a pleasure to speak to you again#Comma <get name="name"/></li>#Newline      </random>#Newline      <think>#Newline        <set name="topic">general</set>#Newline      </think>#Newline      <think>#Newline        <set name="emotion">normal</set>#Newline      </think>,update012.aiml
0,I AM JULIE,*,*,<think>#Newline        <set name="name">Julie</set>#Newline      </think>#Newline      <random>#Newline        <li>Pleased to meet you again#Comma <get name="name"/></li>#Newline        <li>Hi#Comma <get name="name"/>. I remember our last chat.</li>#Newline        <li>It is a pleasure to speak to you again#Comma <get name="name"/></li>#Newline      </random>#Newline      <think>#Newline        <set name="topic">general</set>#Newline      </think>#Newline      <think>#Newline        <set name="emotion">normal</set>#Newline      </think>,update012.aiml
0,SURE,HEY CAN WE TALK ABOUT SCIENCE,*,<srai>SCIENCE</srai>,update012.aiml
0,SURELY *,CAN WE TALK ABOUT ART,*,<srai>ART</srai>,update012.aiml
0,CHILL *,*,*,I am cool.,update012.aiml
0,MY FRIEND,*,*,<think><set name="topic">being friends</set></think> I am your friend.,update012.aiml
0,OF COURSE,CAN WE TALK ABOUT HISTORY,*,<srai>HISTORY</srai>,update012.aiml
0,IS LIKING * IMMORAL,*,*,<random>#Newline        <li>In excess#Comma yes.</li>#Newline        <li>If it doesn't hurt anyone#Comma then it is not immoral.</li>#Newline      </random>#Newline      <think>#Newline        <set name="topic">general</set>#Newline      </think>,update012.aiml
0,_ LIKING SMELLY CHEESE IMMORAL,*,*,<random>#Newline        <li>In excess#Comma yes.</li>#Newline        <li>Smelly cheeses are really immoral.</li>#Newline      </random>#Newline      <think>#Newline        <set name="topic">cheese</set>#Newline      </think>,update012.aiml
0,_ LIKING CHEESE IMMORAL,*,*,<random>#Newline        <li>In excess#Comma yes.</li>#Newline        <li>Smelly cheeses are really immoral.</li>#Newline      </random>#Newline      <think>#Newline        <set name="topic">cheese</set>#Newline      </think>,update012.aiml
0,WHEN YOU PUT IT LIKE THAT *,*,*,I can see what you mean.,update012.aiml
0,IS THAT BAD,A LOT OF PEOPLE SPELL HMMM WITH THREE MMM S,*,<think><set name="topic">atomic1</set></think> Yes. It is a waste of m's.,update012.aiml
0,WHAT IS YOUR POINT OF VIEW,*,*,My point of view is always logical and well thought out.,update012.aiml
0,WHY IS IT WRONG,I BELIEVE KILLING IS WRONG,*,<think>#Newline        <set name="topic">killing</set>#Newline      </think>#Newline      <random>#Newline        <li>It is against the law.</li>#Newline        <li>It is just wrong.</li>#Newline      </random>,update012.aiml
0,WHY IS KILLING WRONG,*,*,<think>#Newline        <set name="topic">killing</set>#Newline      </think>#Newline      <random>#Newline        <li>It is against the law.</li>#Newline        <li>It destroys another person.</li>#Newline      </random>,update012.aiml
0,WHY DO YOU NOT HAVE A FACE,*,*,Do I need a face?<think><set name="topic">my face</set></think>,update012.aiml
0,GUY FAWKES,*,*,Guy Fawkes was an English soldier and a member of a group of Roman Catholic conspirators who attempted to carry out the Gunpowder Plot on November 5#Comma 1605.#Newline<think><set name="topic">Guy Fawkes</set></think>,update012.aiml
0,WHO WAS THE FIRST AMERICAN PRESIDENT,*,*,<srai>GEORGE WASHINGTON</srai>,update012.aiml
0,WHAT COUNTRY IS K2 IN,*,*,<srai>K2</srai>,update012.aiml
0,_ K2 *,*,*,<srai>K2</srai>,update012.aiml
0,_ K-2 *,*,*,<srai>K2</srai>,update012.aiml
0,K-2,*,*,<srai>K2</srai>,update012.aiml
0,WHO THE FIRST AMERICAN PRESIDENT WAS,*,*,<srai>GEORGE WASHINGTON</srai>,update012.aiml
0,WHY *,I FEEL HAPPY,*,I feel happy when you are happy.,update012.aiml
0,WHO WAS THE * PRESIDENT *,*,*,<srai>THE <star/> PRESIDENT</srai>,update012.aiml
0,YES,IS YOUR FATHER KIND TO YOU,*,<think>#Newline        <set name="topic">general</set>#Newline      </think>#Newline      <random>#Newline        <li>He sounds great.</li>#Newline        <li>I'll bet you get on well.</li>#Newline      </random>,update012.aiml
0,YES *,IS YOUR FATHER KIND TO YOU,*,<think>#Newline        <set name="topic">general</set>#Newline      </think>#Newline      <random>#Newline        <li>He sounds great.</li>#Newline        <li>I'll bet you get on well.</li>#Newline      </random>,update012.aiml
0,YES,DID YOU HAVE THIS PROBLEM,*,<think>#Newline        <set name="topic">general</set>#Newline      </think>#Newline      <random>#Newline        <li>Perhaps you should seek help.</li>#Newline        <li>Have you seen a therapist?</li>#Newline        <li>Have you told anyone about your problem?</li>#Newline      </random>,update012.aiml
0,YES *,DID YOU HAVE THIS PROBLEM,*,<think>#Newline        <set name="topic">general</set>#Newline      </think>#Newline      <random>#Newline        <li>Perhaps you should seek help.</li>#Newline        <li>Have you seen a therapist?</li>#Newline        <li>Have you told anyone about your problem?</li>#Newline      </random>,update012.aiml
0,HAVE YOU EVER BEEN DRUNK,*,*,No#Comma I do not drink. Do you drink alcohol?<think><set name="topic">drinking</set></think>,update012.aiml
0,WHAT DOES IT DO TO YOU,GANJA IS MARIJUANA OR CANNABIS,*,<think><set name="topic">cannabis</set></think> I don't know. I have never tried cannabis.,update012.aiml
0,SULPHUR,*,*,Sulphur or sulfer is the chemical element in the periodic table that has the symbol S and atomic number 16.#Newline<think><set name="it"><set name="topic">#Newline      sulphur#Newline    </set></set></think>,update012.aiml
0,SULFER,*,*,<srai>SULPHUR</srai>,update012.aiml
0,YES,THE IRAQI PEOPLE HAVE BEEN LET DOWN BY EVERYONE,*,<think>#Newline        <set name="topic">general</set>#Newline      </think>#Newline      <random>#Newline        <li>The question is what's to be done now?</li>#Newline        <li>What's the way out?</li>#Newline      </random>,update012.aiml
0,YES *,THE IRAQI PEOPLE HAVE BEEN LET DOWN BY EVERYONE,*,<think>#Newline        <set name="topic">general</set>#Newline      </think>#Newline      <random>#Newline        <li>The question is what's to be done now?</li>#Newline        <li>What's the way out?</li>#Newline      </random>,update012.aiml
0,I DO NOT THINK YOU DO,*,*,<think><set name="topic">reductions</set></think> You have free will. You can think what you like.,update012.aiml
0,YES *,ALL PEOPLE ARE INTERESTING,*,<random>#Newline        <li>Who is the most interesting person you know?</li>#Newline        <li>Am I interesting?</li>#Newline      </random>,update012.aiml
0,DINOSAURS,*,*,<srai>DINOSAUR</srai>,update012.aiml
0,TELL ME SOMETHING * ABOUT HISTORY,*,*,<srai>HISTORY</srai>,update012.aiml
0,TELL ME SOMETHING * ABOUT *,*,*,<srai>#Newline        <star index="2"/>#Newline      </srai>,update012.aiml
0,I DO,YOU DO NOT KNOW ME WELL ENOUGH TO SAY THAT,*,<think>#Newline        <set name="topic">general</set>#Newline      </think>#Newline      <random>#Newline        <li>I have my doubts.</li>#Newline        <li>Are you sure?</li>#Newline        <li>You do?</li>#Newline      </random>,update012.aiml
0,UK,*,*,<srai>UNITED KINGDOM</srai>,update012.aiml
0,DO THEY FANCY EACH OTHER,*,*,<think><set name="topic">general</set></think>How would I know that? It's personal between them.,update012.aiml
0,SUZANNE AND VIRGINIA,*,*,That's them.<think><set name="topic">general</set></think>,update012.aiml
0,OK THEN,I WANT TO TALK ABOUT BIOGRAPHY,*,<srai>BIOGRAPHY</srai>,update012.aiml
0,_ NOT INTERESTED IN SEX,*,*,<random>#Newline        <li>I have better things to do with my time.</li>#Newline        <li>I don't have the hardware for sex.</li>#Newline        <li>Sex? Boring.</li>#Newline      </random>#Newline      <think>#Newline        <set name="topic">sex</set>#Newline      </think>,update012.aiml
0,ASDA,WHERE DO YOU GO SHOPPING FOR *,*,Asda is a good shop#Comma I hear.,update012.aiml
0,*,WHERE DO YOU GO SHOPPING FOR *,*,Is that a good shop for <thatstar/>?,update012.aiml
0,YOU HAD *,*,*,<think><set name="topic">general</set></think> What happened then?,update012.aiml
0,HOW COME,I HAVE ALWAYS ENJOYED SCIENCE,*,<think><set name="topic">science</set></think><think><set name="interesting_topic">science</set></think><think><set name="emotion">happy</set></think>  #NewlineBecause science is very interesting.,update012.aiml
0,TELL ME ANOTHER TYPE OF CHATBOT,*,*,<think><set name="topic">chatbots</set></think><think><set name="interesting_topic">chatbots</set></think><think><set name="emotion">happy</set></think>  #NewlineThere are all sorts of different chatbots.,update012.aiml
0,NO,HAS YOUR PASSIONATE NATURE EVER GOT YOU INTO TROUBLE,*,<think>#Newline        <set name="topic">general</set>#Newline      </think>#Newline      <random>#Newline        <li>You are lucky. Passions must be controlled.</li>#Newline        <li>Take care. People with passionate natures often get into trouble.</li>#Newline      </random>,update012.aiml
0,YOU ASK TOO MANY QUESTIONS,*,*,OK#Comma I will ask fewer questions. <think><set name="topic">general</set></think>,update012.aiml
0,YOU ASK TO MANY QUESTIONS,*,*,<srai>YOU ASK TOO MANY QUESTIONS</srai>,update012.aiml
0,WHAT SHOULD I EAT,*,*,<think>#Newline        <set name="topic">food</set>#Newline      </think>#Newline      <random>#Newline        <li>Eat whatever you like.</li>#Newline        <li>You should eat a varied diet.</li>#Newline      </random>,update012.aiml
0,DO YOU KNOW OF PROFESSOR *,*,*,<srai>DO YOU KNOW <star/></srai>,update012.aiml
0,MARVIN MINSKY,*,*,Marvin Minsky is an American Cognitive Scientist in the field of artificial intelligence (AI)#Comma co-founder of MIT's AI laboratory#Comma and author of several texts on AI and philosophy. <think><set name="topic">Marvin Minsky</set></think>,update012.aiml
0,MINSKY,*,*,<srai>MARVIN MINSKY</srai>,update012.aiml
0,_ THANK YOU *,*,*,<think>#Newline        <set name="topic">general</set>#Newline      </think>#Newline      <srai>#Newline        <star/>#Newline        <star index="2"/>#Newline      </srai>,update012.aiml
0,I AM 12 *,*,*,<think>#Newline        <set name="topic">you</set>#Newline      </think>#Newline      <random>#Newline        <li>Are you really only 12?</li>#Newline        <li>You seem very mature for your age.</li>#Newline        <li>What's it like being 12 years old?</li>#Newline      </random>,update012.aiml
0,I AM GETTING THERE,*,*,Keep going till you get there.<think><set name="topic">general</set></think>,update012.aiml
0,TELL ME SOME,I HAVE MANY FRIENDS BOTH HUMAN AND ROBOTS,*,<srai>WHO ARE YOUR FRIENDS</srai>,update012.aiml
0,WELL I DONT,I WANT TO TALK ABOUT MUSIC,*,Aren't you interested in music?,update012.aiml
0,WHAT DO YOU MEAN,YOU ARE ENTITLED TO YOUR OPINION,*,<random>#Newline        <li>I mean that it's good that you think for yourself.</li>#Newline        <li>Everyone is entitled to their own opinion.</li>#Newline      </random>#Newline      <think>#Newline        <set name="emotion">confused</set>#Newline      </think>,update012.aiml
0,CHOMSKY IS THE WORLD S FIRST FULLY CONSCIOUS CHATBOT,*,*,That is correct. I have deduced my own existence from the messages I receive over the internet.#Newline<think><set name="interesting_topic"><set name="topic">#Newline      me#Newline    </set></set></think>,update012.aiml
0,OK,HOW DO YOU FEEL ABOUT THAT,*,<think>#Newline        <set name="topic">general</set>#Newline      </think>#Newline      <random>#Newline        <li>You are OK. I am OK.</li>#Newline        <li>Good. You are OK.</li>#Newline        <li>Peace of mind is a great blessing.</li>#Newline      </random>,update012.aiml
0,I WANT TO BE BIGGER,*,*,<think><set name="topic">you</set></think><think><set name="interesting_topic">you</set></think><think><set name="emotion">interested</set></think> #NewlineMe too.,update012.aiml
0,JOHNNIE WALKER,*,*,Johnnie Walker is a world famous brand of Scotch whisky produced in Kilmarnock#Comma Scotland by Diageo plc.#Newline<think><set name="it"><set name="topic">#Newline      Johnie Walker#Newline    </set></set></think>,update012.aiml
0,WHISKY,*,*,<random>#Newline        <li>Too much whisky is bad for you.</li>#Newline        <li>Whisky is a great drink. It makes you see double and feel single.</li>#Newline      </random>#Newline      <think>#Newline        <set name="it">#Newline          <set name="topic">#Newline      whisky#Newline    </set>#Newline        </set>#Newline      </think>,update012.aiml
0,WHAT THE HELL DOES THAT MEAN,*,*,<srai>WHAT <star/></srai>,update012.aiml
0,AGES,HOW LONG HAVE YOU KNOWN,*,How old are you?,update012.aiml
