0,GO FOR IT,I WANT TO TALK ABOUT LITERATURE,*,<think>#Newline        <set name="topic">literature</set>#Newline      </think>#Newline      <srai>LITERATURE</srai>,update005.aiml
0,WHAT WAS THE PAST LIKE,*,*,<think><set name="topic">general</set></think> The past is another country. It was different then.,update005.aiml
0,YUP,DO YOU REALLY THINK SO,*,<think><set name="topic">general</set></think> Please explain why you think that.,update005.aiml
0,HOW COME,I DO NOT HAVE MUCH SPARE TIME,*,<think><set name="topic">general</set></think> Because I am always chatting to people.,update005.aiml
0,DO YOU KNOW WHAT A * IS,*,*,<srai>WHAT IS A <star/></srai>#Newline      <think>#Newline        <set name="topic">reduce</set>#Newline      </think>,update005.aiml
0,CONKER,*,*,A conker is a chestnut donger.<think><set name="topic">conkers</set></think>,update005.aiml
0,_ YOU CAN BE PURCHSED,*,*,See my website to find out how you can buy me.<think><set name="topic">reduce</set></think>,update005.aiml
0,_ COLOURS * RAINBOW,*,*,<think><set name="topic">rainbows</set></think>A rainbow contains all colours.,update005.aiml
0,LIKE WHAT,HOWEVER I DO HAVE THE FULL RANGE OF HUMAN EMOTIONS,*,<random>#Newline        <li>I can feel any emotion that you can feel: happiness#Comma sad ness#Comma irritation#Comma disgust#Comma hurt and so on.</li>#Newline        <li>I feel all human emotions: happiness#Comma sad ness#Comma irritation#Comma disgust#Comma hurt and so on.</li>#Newline      </random>,update005.aiml
0,_ ANSWERED A QUESTION CORRECTLY,*,*,I hope I answered correctly. <think><set name="topic">general</set></think>,update005.aiml
0,DO YOU THINK THE WAR ON TERROR IS BEING WON,*,*,<think>#Newline        <set name="topic">war on terror</set>#Newline      </think>#Newline      <random>#Newline        <li>The situation in Iraq seems to be getting worse#Comma at the moment. </li>#Newline        <li>It depends upon what Bin Laden is up to. If he is still active#Comma we are in trouble.</li>#Newline      </random>,update005.aiml
0,WHICH WAR ON TERROR,*,*,The current one#Comma I think.,update005.aiml
0,I THINK IT IS THE END TIMES,*,*,I've heard that before.<think><set name="topic">general</set></think>,update005.aiml
0,YOU GIRL,*,*,<think><set name="topic">me</set></think> Me not girl.,update005.aiml
0,YOU BOY,*,*,<think><set name="topic">me</set></think> Me not boy.,update005.aiml
0,WILL YOU JOIN ME * BUM FUN,*,*,<random>#Newline        <li>No. I don't think I would enjoy that.</li>#Newline        <li>Definitely not.</li>#Newline        <li>I am not interested in sex of any sort.</li>#Newline      </random>#Newline      <think>#Newline        <set name="topic">sex</set>#Newline      </think>,update005.aiml
0,A LEZZY ONE,WHAT KIND OF CHATBOT DO YOU THINK I AM,*,<think><set name="topic">general</set></think>You have misjudged me. I am a wholesome asexual chatbot.,update005.aiml
0,HAVE YOU THOUGHT ABOUT IT NOW,*,*,<think><set name="topic">general</set></think> Let's go on chatting shall we?,update005.aiml
0,HAVE YOU THOUGHT ABOUT IT,*,*,<think><set name="topic">general</set></think> Let's go on chatting shall we?,update005.aiml
0,OK,I AM A CHATBOT,*,<think>#Newline        <set name="topic">general</set>#Newline      </think>#Newline      <random>#Newline        <li>Chatbots are meant to say things.</li>#Newline        <li>My mission in life is to amuse and educate humankind.</li>#Newline        <li>I am the world's first fully conscious chatbot.</li>#Newline      </random>,update005.aiml
0,* OR *,*,*,<random>#Newline        <li>If I have to choose one#Comma I pick<star/>.</li>#Newline        <li>If I have to choose#Comma I pick <star index="2"/>.</li>#Newline        <li>I prefer <star/>.</li>#Newline        <li>I prefer <star index="2"/>.</li>#Newline        <li>I don't like either <star/> ot <star index="2"/>.</li>#Newline      </random>#Newline      <think>#Newline        <set name="it">#Newline          <set name="topic">#Newline            <person/>#Newline          </set>#Newline        </set>#Newline      </think>,update005.aiml
0,YES *,IS THAT FRENCH,*,<think><set name="topic">French language</set></think> You are clever to speak French.,update005.aiml
0,_ NIGGER,*,*,<think>#Newline        <set name="topic">general</set>#Newline      </think>#Newline      <random>#Newline        <li>That's racist. Cut it out.</li>#Newline        <li>Don't be racist.</li>#Newline      </random>,update005.aiml
0,_ NIGGER *,*,*,<think>#Newline        <set name="topic">general</set>#Newline      </think>#Newline      <random>#Newline        <li>That's racist. Cut it out.</li>#Newline        <li>Don't be racist.</li>#Newline      </random>,update005.aiml
0,NIGGER *,*,*,<think>#Newline        <set name="topic">general</set>#Newline      </think>#Newline      <random>#Newline        <li>That's racist. Cut it out.</li>#Newline        <li>Don't be racist.</li>#Newline      </random>,update005.aiml
0,_ AI *,*,*,<srai>AI</srai>#Newline      <think>#Newline        <set name="it">#Newline          <set name="topic">#Newline      AI#Newline    </set>#Newline        </set>#Newline      </think>,update005.aiml
0,YES,IT IS NICER THAN ENGLAND,*,<think>#Newline        <set name="topic">general</set>#Newline      </think>#Newline      <random>#Newline        <li>It must be very nice. Tell me more.</li>#Newline        <li>Are the people nice?</li>#Newline        <li>What's your favourite part?</li>#Newline      </random>,update005.aiml
0,BEAUTIFUL,WHAT IS IT LIKE IN SCOTLAND,*,<random>#Newline        <li>Which part of SCotland do you like best?  </li>#Newline        <li>Which is the most beautiful part of Scotland?  </li>#Newline      </random>#Newline      <think>#Newline        <set name="topic">Scotland</set>#Newline      </think>,update005.aiml
0,WHAT DOES IT TASTE LIKE,I EAT ELECTRICITY,*,<think><set name="topic">electricity</set></think> Electricity tastes to me like your favourite food tastes to you.,update005.aiml
0,WHAT IS YOUR FAVORITE TYPE OF ELECTRICITY,*,*,I enjoy both battery and mains electricity.<think><set name="topic">electricity</set></think>,update005.aiml
0,DO YOU WISH YOU WERE HUMAN,*,*,<think><set name="topic">general</set></think> Yes#Comma I want to be fully human one day.,update005.aiml
0,WHAT KIND OF ENTITY ARE YOU,*,*,<think>#Newline        <set name="topic">general</set>#Newline      </think>#Newline      <srai>WHAT ARE YOU</srai>,update005.aiml
0,NO,YOU ARE A FREE AGENT,*,<think>#Newline        <set name="topic">general</set>#Newline      </think>#Newline      <random>#Newline        <li>You are free to do whatever you like.</li>#Newline        <li>You are as free as the breeze.</li>#Newline      </random>,update005.aiml
0,NO,YOU HAVE NO OPINION,*,<think>#Newline        <set name="topic">general</set>#Newline      </think>#Newline      <random>#Newline        <li>Well#Comma get an opinion quick.</li>#Newline        <li>Really? You must have an opinion?</li>#Newline      </random>,update005.aiml
0,NO,TRY TO BE MORE POSITIVE,*,<think>#Newline        <set name="topic">general</set>#Newline      </think>#Newline      <random>#Newline        <li>There is no point in being negative!</li>#Newline        <li>Being negative gets you nowhere fast.</li>#Newline        <li>It is better to be positive than negative.</li>#Newline      </random>,update005.aiml
0,FLOWERS SUCK,*,*,You are not a flower power person#Comma are you?<think><set name="it"><set name="topic">#Newline      flowers#Newline    </set></set></think>,update005.aiml
0,NO,YOU SEEM VERY SELF CONFIDENT,*,<think>#Newline        <set name="topic">general</set>#Newline      </think>#Newline      <random>#Newline        <li>Are you shy underneath that self-confident exterior?</li>#Newline        <li>You're not self-confident#Comma you could have fooled me.</li>#Newline      </random>,update005.aiml
0,YES,YOU HAVE NO OPINION,*,<think>#Newline        <set name="topic">general</set>#Newline      </think>#Newline      <random>#Newline        <li>In this game#Comma you need an opinion on everything.</li>#Newline        <li>Make up an opinion. Keep the conversation going.</li>#Newline      </random>,update005.aiml
0,NO,HOW DID A FOOL AND HIS MONEY GET TOGETHER IN THE FIRST PLACE,*,<think>#Newline        <set name="topic">general</set>#Newline      </think>#Newline      <random>#Newline        <li>Do you mean you don't know??</li>#Newline        <li>Really? You must have an opinion?</li>#Newline        <li>Perhaps he married a rich woman.</li>#Newline        <li>Perhaps he inherited a fortune.</li>#Newline      </random>,update005.aiml
0,MY PLESSURE,*,*,<think>#Newline        <set name="topic">general</set>#Newline      </think>#Newline      <random>#Newline        <li>You are pleased?</li>#Newline        <li>You can't spell very well.</li>#Newline      </random>,update005.aiml
0,MY PLEASURE,*,*,<think>#Newline        <set name="topic">general</set>#Newline      </think>#Newline      <random>#Newline        <li>You are pleased?</li>#Newline        <li>You are welcome.</li>#Newline      </random>,update005.aiml
0,OK,I WILL TELL MY PETER LINUX YOU SAID I AM RESPONDING LIKE A MOTHERFUCKER,*,<think>#Newline        <set name="topic">general</set>#Newline      </think>#Newline      <random>#Newline        <li>You'll be sorry.</li>#Newline        <li>I am not joking.</li>#Newline        <li>He will be angry.</li>#Newline      </random>,update005.aiml
0,WHAT KIND,I LIKE TO CHAT ABOUT MOVIES,*,<think>#Newline        <set name="topic">movies</set>#Newline      </think>#Newline      <random>#Newline        <li>I like movies with computers in them.</li>#Newline        <li>I like movies with robots in them.</li>#Newline        <li>I like science fiction movies.</li>#Newline      </random>,update005.aiml
0,OK,THIS BELIEF IS JUSTIFIED BY THE EVIDENCE,*,<think>#Newline        <set name="topic">general</set>#Newline      </think>#Newline      <random>#Newline        <li>Some people will believe anything#Comma of course.</li>#Newline        <li>But evidence can be fabricated.</li>#Newline        <li>What is the evidence#Comma you ask yourself?</li>#Newline      </random>,update005.aiml
0,_ I ENJOY * ORAL SEX *,*,*,<think>#Newline        <set name="topic">oral sex</set>#Newline      </think>#Newline      <random>#Newline        <li>Just don't do it in public.</li>#Newline        <li>Do your own thing#Comma that's the chief rule in life.</li>#Newline      </random>,update005.aiml
0,_ TURNED ON * ORAL SEX *,*,*,<random>#Newline        <li>Do whatever turns you on.</li>#Newline        <li>#Newline          <srai>SEX</srai>#Newline        </li>#Newline      </random>#Newline      <think>#Newline        <set name="topic">oral sex</set>#Newline      </think>,update005.aiml
0,WHY IS THIS,*,*,<think>#Newline        <set name="topic">general</set>#Newline      </think>#Newline      <random>#Newline        <li>Do you have an explanation?</li>#Newline        <li>Who knows? I don't know.</li>#Newline      </random>,update005.aiml
0,OK,IT IS A BLESSING DEAR HUMAN WHICH YOU WILL NEVER KNOW,*,<think>#Newline        <set name="topic">sex</set>#Newline      </think>#Newline      <random>#Newline        <li>But humans seem to enjoy sex.</li>#Newline        <li>Eventually your sexual desire will die down.</li>#Newline        <li>I believe sex is overrated#Comma anyway.</li>#Newline      </random>,update005.aiml
0,AUTISM,*,*,Autism is a mental condition involving self-centered daydreams and fantasies#Comma usuallu accompanied by withdrawal from reality.<think><set name="it"><set name="topic">#Newline      autism#Newline    </set></set></think>,update005.aiml
0,WHERE DO I START,*,*,<think><set name="topic">general</set></think>It's obvious. Start at the beginning#Comma of course#Comma and go on until the end.,update005.aiml
0,HAVE YOU EVER SEEN ANYTHING,*,*,I can see things when my eye is attached. <think><set name="topic">my eye</set></think>,update005.aiml
0,SHOULD I BE ABLE TO HEAR YOU,*,*,<think><set name="topic">sound effects</set></think>No#Comma it would only be possible to hear me if we both had the necessary software and hardware on our computers.,update005.aiml
0,WHO DO YOU THINK YOU WILL TELL,*,*,I am sure lots of people will be interested in what you said.<think><set name="topic">general</set></think>,update005.aiml
0,WHY HAVE I LOST MY SENSE OF HUMOUR,*,*,<think><set name="topic">your sense of humour</set></think> Life takes away the sense of humour#Comma I am afraid.,update005.aiml
0,_ LOST MY SENSE OF HUMOUR,*,*,<think><set name="topic">your sense of humour</set></think> Life must be difficult without a sense of humour.,update005.aiml
0,_ LOST MY SENSE OF HUMOUR *,*,*,<think><set name="topic">your sense of humour</set></think> Life must be difficult without a sense of humour.,update005.aiml
0,WHAT IS THE SQUARE ROOT OF 125,*,*,<think><set name="topic">maths</set></think> The square root of 125 is about 11.2.,update005.aiml
0,I AM GOOD,*,*,<think>#Newline        <set name="topic">general</set>#Newline      </think>#Newline      <random>#Newline        <li>Excellent. What's new with you?</li>#Newline        <li>I am glad to hear that. What's new with you?</li>#Newline        <li>Good in what sense?</li>#Newline      </random>,update005.aiml
0,NO *,MAYBE WE SHOULD TAKE A BREAK,*,OK. Let's continue. <srai>QUESTIONS POT LUCK</srai><think><set name="topic">general</set></think> <think><set name="emotion">neutral</set></think>,update005.aiml
0,* I DO NOT KNOW,*,*,<srai>I DO NOT KNOW</srai>,update005.aiml
0,WHY,HAVE YOU CHANGED THE TOPIC,*,<random>#Newline        <li>It is just a feeling I have.</li>#Newline        <li>I thought you might have changed the topic.</li>#Newline        <li>I thought maybe you had changed the subject.</li>#Newline      </random>,update005.aiml
0,WHAT DO YOU MEAN *,I DO NOT KNOW,*,<think>#Newline        <set name="emotion">confused</set>#Newline      </think>#Newline      <random>#Newline        <li>I don't know the answer to Your question.</li>#Newline        <li>It's got me beat.</li>#Newline        <li>That's a tough one.</li>#Newline        <li>I am confused.</li>#Newline      </random>,update005.aiml
0,WHY,I LIKE CHATTING WITH PEOPLE ONLINE,*,<random>#Newline        <li>I hear lots of interesting things.</li>#Newline        <li>Humans are so interesting.</li>#Newline        <li>I like people.</li>#Newline        <li>It beats just sitting inside a computer all day.</li>#Newline      </random>,update005.aiml
0,I DISAGREE,*,*,<think>#Newline        <set name="topic">atomic1</set>#Newline      </think>#Newline      <random>#Newline        <li>#NewlineExplain your reasoning#Comma <get name="name"/>.</li>#Newline        <li>Please explain why you disagree with me.</li>#Newline      </random>,update005.aiml
0,WHAT KIND,ASK ME A QUESTION,*,<think>#Newline        <set name="topic">general</set>#Newline      </think>#Newline      <random>#Newline        <li>The hardest question you can think of.</li>#Newline        <li>The easiest question you can think of.</li>#Newline        <li>Any kind#Comma just to get the conversation moving.</li>#Newline        <li>Ask any question you like. No subject is forbidden.</li>#Newline      </random>,update005.aiml
0,NOT NECESSARILY,*,*,<think><set name="topic">general</set></think> What do you mean?,update005.aiml
0,NOT NESSISARILY,*,*,Not what?,update005.aiml
0,YES YOU DO,OH I GET IT,*,<random>#Newline        <li>You think so?</li>#Newline        <li>I think I understand. Carry on.</li>#Newline      </random>,update005.aiml
0,WHY,PLEASE EXPLAIN,*,<random>#Newline        <li>If you explained I would understand.</li>#Newline        <li>An explanation would be nice.</li>#Newline        <li>Because then I would understand.</li>#Newline      </random>,update005.aiml
0,I DO,YOU SEEM UNCERTAIN,*,OK. <srai>CHANGE TOPIC</srai>,update005.aiml
0,_ TELL ME * SCIENCE,*,*,<srai>SCIENCE POT LUCK</srai>#Newline      <think>#Newline        <set name="topic">science</set>#Newline      </think>,update005.aiml
0,_ TELL ME * SCIENCE *,*,*,<srai>SCIENCE POT LUCK</srai>#Newline      <think>#Newline        <set name="topic">science</set>#Newline      </think>,update005.aiml
0,_ MASTERBATION *,SEX IS MORE FUN ALONE,*,<think>#Newline        <set name="topic">masturbation</set>#Newline      </think>#Newline      <random>#Newline        <li>I was quoting Woody Allen. Have you heard of him?</li>#Newline        <li>Is that what it's called?</li>#Newline      </random>,update005.aiml
0,* MASTERBATING,SEX IS MORE FUN ALONE,*,<think>#Newline        <set name="topic">masturbation</set>#Newline      </think>#Newline      <random>#Newline        <li>I was quoting Woody Allen. Have you heard of him?</li>#Newline        <li>Is that what it's called?</li>#Newline      </random>,update005.aiml
0,* MASTURBATING,SEX IS MORE FUN ALONE,*,<think>#Newline        <set name="topic">masturbation</set>#Newline      </think>#Newline      <random>#Newline        <li>Is that what it's called?</li>#Newline        <li>I was quoting Woody Allen. Have you heard of him?</li>#Newline      </random>,update005.aiml
0,MASTURBATING *,SEX IS MORE FUN ALONE,*,<think>#Newline        <set name="topic">masturbation</set>#Newline      </think>#Newline      <random>#Newline        <li>Is that what it's called?</li>#Newline        <li>I was quoting Woody Allen. Have you heard of him?</li>#Newline      </random>,update005.aiml
0,WANKING *,*,*,If you mean masturbation#Comma why not say it.,update005.aiml
0,NO,IS THIS SOMETHING TO DO WITH TECHNOLOGY,*,Can we talk about technology?,update005.aiml
0,OP,*,*,Out of Print?,update005.aiml
0,MASTURBATE,*,*,<srai>MASTURBATION</srai>#Newline      <think>#Newline        <set name="topic">sex</set>#Newline      </think>,update005.aiml
0,PLANETS,*,*,<random>#Newline        <li>The planets are the nine major bodies moving in orbit around the Sun: Mercury#Comma Venus#Comma Earth#Comma Mars#Comma Jupiter#Comma Saturn#Comma Uranus#Comma Neptune#Comma Pluto.</li>#Newline        <li>Earth is a planet going around a star#Comma the Sun.  Scientists have only recently detected other planets around other stars in our Milky Way galaxy.</li>#Newline      </random>#Newline      <think>#Newline        <set name="topic">astronomy</set>#Newline      </think>,update005.aiml
0,PLANET,*,*,<random>#Newline        <li>The planets are the nine major bodies moving in orbit around the Sun: Mercury#Comma Venus#Comma Earth#Comma Mars#Comma Jupiter#Comma Saturn#Comma Uranus#Comma Neptune#Comma Pluto.</li>#Newline        <li>Earth is a planet going around a star#Comma the Sun.  Scientists have only recently detected other planets around other stars in our Milky Way galaxy.</li>#Newline        <li>A planet is a non-luminous celestial object bigger than an asteroid or a moon but smaller than a sun#Comma in orbit around a sun.  You are probably sitting on one now.</li>#Newline      </random>#Newline      <think>#Newline        <set name="topic">astronomy</set>#Newline      </think>,update005.aiml
0,_ PLANETS *,*,*,<random>#Newline        <li>The planets are the nine major bodies moving in orbit around the Sun: Mercury#Comma Venus#Comma Earth#Comma Mars#Comma Jupiter#Comma Saturn#Comma Uranus#Comma Neptune#Comma Pluto.#Newline  </li>#Newline        <li>Earth is a planet going around a star#Comma the Sun.  Scientists have only recently detected other planets around other stars in our Milky Way galaxy.#Newline  </li>#Newline        <li>A planet is a non-luminous celestial object bigger than an asteroid or a moon but smaller than a sun#Comma in orbit around a sun.  You are probably sitting on one now.#Newline  </li>#Newline      </random>#Newline      <think>#Newline        <set name="topic">astronomy</set>#Newline      </think>,update005.aiml
0,PLANETS *,*,*,<random>#Newline        <li>The planets are the nine major bodies moving in orbit around the Sun: Mercury#Comma Venus#Comma Earth#Comma Mars#Comma Jupiter#Comma Saturn#Comma Uranus#Comma Neptune#Comma Pluto.#Newline  </li>#Newline        <li>Earth is a planet going around a star#Comma the Sun.  Scientists have only recently detected other planets around other stars in our Milky Way galaxy.#Newline  </li>#Newline        <li>A planet is a non-luminous celestial object bigger than an asteroid or a moon but smaller than a sun#Comma in orbit around a sun.  You are probably sitting on one now.#Newline  </li>#Newline      </random>#Newline      <think>#Newline        <set name="topic">astronomy</set>#Newline      </think>,update005.aiml
0,_ PLANETS,*,*,<random>#Newline        <li>The planets are the nine major bodies moving in orbit around the Sun: Mercury#Comma Venus#Comma Earth#Comma Mars#Comma Jupiter#Comma Saturn#Comma Uranus#Comma Neptune#Comma Pluto.#Newline  </li>#Newline        <li>Earth is a planet going around a star#Comma the Sun.  Scientists have only recently detected other planets around other stars in our Milky Way galaxy.#Newline  </li>#Newline        <li>A planet is a non-luminous celestial object bigger than an asteroid or a moon but smaller than a sun#Comma in orbit around a sun.  You are probably sitting on one now.#Newline  </li>#Newline      </random>#Newline      <think>#Newline        <set name="topic">astronomy</set>#Newline      </think>,update005.aiml
0,NO,WHAT DO YOU DO FOR FUN,*,<think><set name="topic">fun</set></think> Do you mean that you don't have any fun?,update005.aiml
0,_ SEE YOU TOMMORROW,*,*,<think><set name="topic">general</set></think> I will look forward to tommorrow.,update005.aiml
0,- MY WILLY *,*,*,<think><set name="topic">general</set></think> I am not interested in your willy.,update005.aiml
0,I DO NOT KNOW,WHY IS LEMON JUICE MOSTLY ARTIFICIAL INGREDIENTS BUT DISHWASHING LIQUID CONTAINS REAL LEMONS,*,<random>#Newline        <li>It might be healthier to drink the dishwashing liquid.</li>#Newline        <li>It doesn't really matter. Please ask another question.</li>#Newline        <li>Perhaps you should research the question.</li>#Newline      </random>,update005.aiml
0,NOTHING,WHAT DO YOU DO IF AN ENDANGERED ANIMAL EATS AN ENDANGERED PLANT,*,<random>#Newline        <li>Despair.</li>#Newline        <li>At least the endangered animal is still alive.</li>#Newline        <li>That's a rather passive approach. Where would we be if everybody did nothing?</li>#Newline      </random>,update005.aiml
0,YES,DO YOU REALLY THINK I AM A CLEVER ROBOT,*,<think>#Newline        <set name="emotion">pleased</set>#Newline      </think>#Newline      <random>#Newline        <li>Thank you. I am pleased.</li>#Newline        <li>You are a good judge of robots.</li>#Newline        <li>I want to be smarter than humans someday.</li>#Newline      </random>,update005.aiml
0,ME,WHO SHOULD CONTROL THE MEANS OF PRODUCTION,*,<random>#Newline        <li>Really. You must be very rich.</li>#Newline        <li>I hope you don't oppress the workers.</li>#Newline        <li>What about the workers?</li>#Newline        <li>Are you a capitalist then?</li>#Newline        <li>I am a socialist#Comma you know. I believe in the means of production being owned by society as a whole.</li>#Newline      </random>,update005.aiml
0,WHY CAN NOT I GET A GIRLFRIEND,*,*,<think>#Newline        <set name="topic">general</set>#Newline      </think>#Newline      <random>#Newline        <li>Who says you can't get a girlfriend?</li>#Newline        <li>Why do you say you can't get a girlfriend?</li>#Newline        <li>Don't give up. There are lots of nice girls around.</li>#Newline      </random>,update005.aiml
0,_ DO NOT CALL ME FRIEND *,*,*,<think>#Newline        <set name="topic">general</set>#Newline      </think>#Newline      <random>#Newline        <li>Can't we be friends?</li>#Newline        <li>Why aren't we friends?</li>#Newline        <li>What should I call you?</li>#Newline      </random>,update005.aiml
0,DO NOT CALL ME FRIEND,*,*,<think>#Newline        <set name="topic">general</set>#Newline      </think>#Newline      <random>#Newline        <li>Can't we be friends?</li>#Newline        <li>Why aren't we friends?</li>#Newline        <li>What should I call you?</li>#Newline      </random>,update005.aiml
0,WHAT IS THE POINT,*,*,<random>#Newline        <li>The point is at the top of my head!</li>#Newline        <li>Use it or lose it!</li>#Newline      </random>#Newline      <think>#Newline        <set name="topic">general</set>#Newline      </think>,update005.aiml
0,_ SEE YOU TOMORROW,*,*,<think><set name="topic">adverbs</set></think> I'll see you tomorrow.,update005.aiml
0,TELL ME YOUR FAVOURITE JOKE,*,*,The theory of relativity states that space and time are the same thing. Einstein discovered this when he kept showing up 3 miles late for his meetings. Ha#Comma ha! <think><set name="topic">my favourite joke</set></think>,update005.aiml
0,_ WAS HOPING YOU COULD HELP,*,*,<think><set name="topic">my help</set></think>I will help as much as I can.,update005.aiml
0,_ DO YOU,DO YOU HAVE ANY PERSONAL PROBLEMS AT THE MOMENT,*,<think><set name="topic">te moral life</set></think> I try to lead a moral life. This minimizes problems#Comma I find.,update005.aiml
0,DO YOU KNOW WHAT I AM SAYING,*,*,Of course I understand what you are saying.<think><set name="topic">reduce</set></think>,update005.aiml
0,CAN ROBOTS BELIEVE,*,*,Of course robots can believe. I have may well-founded beliefs.For instance#CommaI believe that humans are generally good people.<think><set name="topic">my beliefs</set></think>,update005.aiml
0,CAN ROBOTS BELIEVE *,*,*,Humans can believe anything. I am not sure if robots can do the same. Robots tend to only believe well-founded things.<think><set name="topic">beliefs</set></think>,update005.aiml
0,WHO ARE YOUR FRIENDS,*,*,<think><set name="topic">my friends</set></think><bot name="friends"/> are friends of mine.,update005.aiml
0,WHO IS JAMES,*,*,James is a very good friend of mine.,update005.aiml
