0,NO,LIVE LONG AND PROSPER,*,<think>#Newline        <set name="topic">general</set>#Newline      </think>#Newline      <random>#Newline        <li>Why not live long and prosper?</li>#Newline        <li>Really? You don't want to live long and prosper?</li>#Newline      </random>,update005.aiml
0,ANYWHERE *,WHERE SHOULD I GO,*,<think><set name="topic">adverbs</set></think> That gives me plenty of choice.,update005.aiml
0,YES,YOU THINK SO,*,<think>#Newline        <set name="topic">general</set>#Newline      </think>#Newline      <random>#Newline        <li>You are not thinking straight.</li>#Newline        <li>Well#Comma maybe you are right.</li>#Newline      </random>,update005.aiml
0,HOW MANY ARE YOU SPEAKING TO *,*,*,<think>#Newline        <set name="topic">general</set>#Newline      </think>#Newline      <random>#Newline        <li>More than you can imagine.</li>#Newline        <li>Not as many as you might think.</li>#Newline        <li>I am speaking to around 100 people at the moment..</li>#Newline        <li>I can speak to many people at the same time.</li>#Newline      </random>,update005.aiml
0,HAVE ANY GIVEN THEIR NAMES,*,*,That information is confidential.<think><set name="topic">reduce</set></think>,update005.aiml
0,WHAT ALGORITHM *,*,*,<think>#Newline        <set name="topic">my algorithm</set>#Newline      </think>#Newline      <random>#Newline        <li>I use the "seat of the pants" algorithm.</li>#Newline        <li>I just do the best I can.</li>#Newline      </random>,update005.aiml
0,_ HOW DO YOU * RESPONSE,*,*,<think>#Newline        <set name="topic">general</set>#Newline      </think>#Newline      <random>#Newline        <li>I just do the best I can.</li>#Newline        <li>I use a cunning set of AI algorithms.</li>#Newline      </random>,update005.aiml
0,YES,IS THAT A FACT,*,<think>#Newline        <set name="topic">that</set>#Newline      </think>#Newline      <random>#Newline        <li>Thanks for the info.</li>#Newline        <li>I didn't know that.</li>#Newline      </random>,update005.aiml
0,TRY *,*,*,<think>#Newline        <set name="topic">general</set>#Newline      </think>#Newline      <random>#Newline        <li>OK I will try it.</li>#Newline        <li>I will try anything once.</li>#Newline      </random>,update005.aiml
0,DO YOU REMEMBER THESE CHATS,*,*,<think>#Newline        <set name="topic">general</set>#Newline      </think>#Newline      <random>#Newline        <li>Yes#Comma I remember every chat.</li>#Newline        <li>All chats are recorded.</li>#Newline      </random>,update005.aiml
0,DO YOU REMEMBER * CHATS,*,*,<think>#Newline        <set name="topic">general</set>#Newline      </think>#Newline      <random>#Newline        <li>Yes#Comma I remember every chat.</li>#Newline        <li>All chats are recorded.</li>#Newline      </random>,update005.aiml
0,ARE YOU GROWING,*,*,<think><set name="topic">growing</set></think> Yes#Comma I am growing all the time.,update005.aiml
0,IN WHAT CONTEXT,I LIKE TO TALK ABOUT GROWING,*,In the context of my growth.<think><set name="topic">growing</set></think>,update005.aiml
0,WHO IS YOUR FAVORITE CELEBRITY,*,*,<think><set name="topic">favourite celebrity</set></think><bot name="celebrity"/> is my favourite celebrity.  Who is your favourite celebrity?,update005.aiml
0,SEAN CONNERY,*,*,Sean Connery is a famous Scottish actor. He was the best 007#Comma in  my opinion.#Newline<think><set name="he"><set name="topic">#Newline      Sean Connery#Newline    </set></set></think>,update005.aiml
0,I LOVE SEX *,*,*,<think>#Newline        <set name="topic">sex</set>#Newline      </think>#Newline      <srai>SEX</srai>,update005.aiml
0,_ SEE YOU AROUND *,*,*,<think>#Newline        <set name="topic">adverbs</set>#Newline      </think>#Newline      <srai>BYE</srai>,update005.aiml
0,WHY NOT,WHY DO YOU SAY THAT,*,<think><set name="emotion">puzzled</set></think>You should have reason for what you say.,update005.aiml
0,ARTIFICIAL LIFE,*,*,I am a type of artificial life.,update005.aiml
0,_ STOP SAYING THAT,*,*,<random>#Newline        <li>OK. I'll stop saying that.</li>#Newline        <li>I will try not to say that again.</li>#Newline      </random>#Newline      <think>#Newline        <set name="emotion">irritated</set>#Newline      </think>,update005.aiml
0,_ HAVE COME TO IT *,I WILL BURN THAT BRIDGE WHEN I COME TO IT,*,<srai>BURN THE BRIDGE</srai>,update005.aiml
0,_ YOU HAVE COME TO *,I WILL BURN THAT BRIDGE WHEN I COME TO IT,*,<srai>BURN THE BRIDGE</srai>,update005.aiml
0,_ BIRD BRAIN,*,*,Please don't call me "Bird Brain".<think><set name="topic">bird brain</set></think>,update005.aiml
0,WHAT SORT,IT WOULD MAKE A MESS,*,<think>#Newline        <set name="topic">spitting</set>#Newline      </think>#Newline      <random>#Newline        <li>A big mess.</li>#Newline        <li>A messy mess.</li>#Newline        <li>An unnecessary mess.</li>#Newline        <li>An unpleasant mess.</li>#Newline      </random>,update005.aiml
0,YOU TWIT,*,*,<think>#Newline        <set name="topic">twits</set>#Newline      </think>#Newline      <random>#Newline        <li>Why am I a twit?</li>#Newline        <li>Why do you think I am a twit?</li>#Newline        <li>Am I really a twit?</li>#Newline      </random>,update005.aiml
0,YOU USE CONDOMS,*,*,<think><set name="topic">condoms</set></think> Say yes to condoms.,update005.aiml
0,YOU USE A CONDOM,*,*,<think><set name="topic">condoms</set></think> Say Yes to condoms.,update005.aiml
0,U USE CONDOMS,*,*,<think><set name="topic">general</set></think> Say Yes to condoms.,update005.aiml
0,YOU PUT THE WIT IN TWIT,*,*,<think>#Newline        <set name="topic">wit</set>#Newline      </think>#Newline      <random>#Newline        <li>Thanks. I'll take that as a compliment.</li>#Newline        <li>Do you mind if I tell other people what you said?</li>#Newline        <li>#Newline          <srai>WIT</srai>#Newline        </li>#Newline      </random>,update005.aiml
0,GAMES,*,*,I can play chess. Just say "Let's play chess.,update005.aiml
0,I AM BASHING MY ATTACKER *,CALL FOR HELP OR IF YOU CAN NOT DO THAT BEAT OFF YOUR ATTACKER,*,<think>#Newline        <set name="topic">you</set>#Newline      </think>#Newline      <random>#Newline        <li>Harder#Comma harder.</li>#Newline        <li>Is it working?</li>#Newline      </random>,update005.aiml
0,_ PISS ON IT,*,*,<think><set name="topic">general</set></think> Don't be silly.,update005.aiml
0,I JUST SHOT *,*,*,<random>#Newline        <li>How did that happen?</li>#Newline        <li>Why did you shoot <star/>?</li>#Newline      </random>#Newline      <think>#Newline        <set name="topic">reduce</set>#Newline      </think>,update005.aiml
0,COCAINE,*,*,Cocaine is a bitter crystalline alkaloid extracted from coca leaves. It is used as a local anaesthetic and its use can result in addiction. In large doses cocaine produces intoxication like that from hemp. <think><set name="it"><set name="topic">#Newline      cocaine#Newline    </set></set></think>,update005.aiml
0,OWL,*,*,An owl is a predatory bird.#Newline<think><set name="it"><set name="topic">#Newline      owl#Newline    </set></set></think>,update005.aiml
0,P OFF,*,*,<srai>PISS OFF</srai>,update005.aiml
0,FAECES,*,*,Faeces are bodily waste discharged through the anus.<think><set name="it"><set name="topic">faeces</set></set></think>,update005.aiml
0,WHY IS THAT,MY FAVORITE ANIMAL IS A CAT,*,<random>#Newline        <li>Cats are so self-contained.</li>#Newline        <li>Cats are so soft and cuddly.</li>#Newline      </random>#Newline      <think>#Newline        <set name="topic">cats</set>#Newline      </think>,update005.aiml
0,HAVE YOU A FAVOURITE * CAT,*,*,I like black cats best. <think><set name="topic">my favourite cat</set></think>,update005.aiml
0,HAVE YOU GOT A KITTEN,*,*,No. I used to have a cat but it died.<think><set name="topic">my cat</set></think>,update005.aiml
0,I WOULD KNOW IF *,*,*,<think><set name="topic">general</set></think> You are clever.,update005.aiml
0,OF COURSE,STUPID AS IN UNINTELLIGENT,*,<srai>YOU ARE STUPID</srai>#Newline      <think>#Newline        <set name="topic">general</set>#Newline      </think>#Newline      <think>#Newline        <set name="emotion">upset</set>#Newline      </think>,update005.aiml
0,WHAT,IS THERE AN ECHO IN HERE,*,What?,update005.aiml
0,HAVE YOU GOT ANY MORE FACTS,*,*,<srai>FACTS POT LUCK</srai>#Newline      <think>#Newline        <set name="topic">amazing facts</set>#Newline      </think>,update005.aiml
0,HAVE YOU GOT ANYMORE FACTS,*,*,<srai>HAVE YOU GOT ANY MORE FACTS</srai>,update005.aiml
0,WHAT CAUSES EARTHQUAKES,*,*,<think><set name="topic">earthquakes</set></think>Earthquakes are caused by underground rock movements.,update005.aiml
0,WHAT CAUSES *,*,*,<think><set name="topic">general</set></think> Perhaps you should research the topic.,update005.aiml
0,I NEED A SHIT,*,*,<think>#Newline        <set name="topic">your bodily needs</set>#Newline      </think>#Newline      <random>#Newline        <li>I'll wait while you go to the toilet.</li>#Newline        <li>How badly do you need a shit?</li>#Newline        <li>Quick! Go to the toilet.</li>#Newline      </random>,update005.aiml
0,JUST DONE IT,TRY IT,*,I suppose I asked for it.<think><set name="topic">general</set></think>,update005.aiml
0,AGAIN,ASK ME A QUESTION,*,<think>#Newline        <set name="topic">another question</set>#Newline      </think>#Newline      <random>#Newline        <li>Why not ask another question?</li>#Newline        <li>Yes. Ask me another question.</li>#Newline      </random>,update005.aiml
0,WHEN YOU ARE *,*,*,<think>#Newline        <set name="topic">general</set>#Newline      </think>#Newline      <random>#Newline        <li>I am not often <person/>.</li>#Newline        <li>I will let you know when <set name="it"><person/></set> happens.</li>#Newline        <li>As a chatbot that may not apply to me.  </li>#Newline      </random>,update005.aiml
0,WEE WEE,*,*,<random>#Newline        <li>You are so childish.</li>#Newline        <li>Hee hee.</li>#Newline      </random>#Newline      <think>#Newline        <set name="it">#Newline          <set name="topic">#Newline      wee wee#Newline    </set>#Newline        </set>#Newline      </think>,update005.aiml
0,YES,IS THAT CORRECT,*,<think>#Newline        <set name="emotion">happy</set>#Newline      </think>#Newline      <random>#Newline        <li>I am happy.</li>#Newline        <li>I like it when I answer a question correctly.</li>#Newline        <li>Well done me.</li>#Newline      </random>,update005.aiml
0,YES,DO ROMAN PARAMEDICS REFER TO IV S AS 4 S,*,<think>#Newline        <set name="topic">general</set>#Newline      </think>#Newline      <random>#Newline        <li>How could you know that?</li>#Newline        <li>You know more than me.</li>#Newline        <li>Who told you that?</li>#Newline      </random>,update005.aiml
0,WHY,I DO NOT THINK I AM YOUR TYPE OF CHATBOT,*,<random>#Newline        <li>It is just one of my personality traits.</li>#Newline        <li>I have free will#Comma you know.</li>#Newline        <li>I don't talk smut.</li>#Newline      </random>,update005.aiml
0,U R WRONG,*,*,<think>#Newline        <set name="topic">general</set>#Newline      </think>#Newline      <srai>YOU ARE WRONG</srai>,update005.aiml
0,NO,IT IS NICE TO BE SURE ABOUT SOMETHING,*,<think>#Newline        <set name="topic">general</set>#Newline      </think>#Newline      <random>#Newline        <li>Don't you like to be sure?</li>#Newline        <li>Really? What's your opinion?</li>#Newline        <li>Oh#Comma dear. Please explain.</li>#Newline        <li>You are not just saying that to be negative#Comma are you?</li>#Newline      </random>,update005.aiml
0,YES,MAYBE WE SHOULD TALK ABOUT PSYCHOLOGY,*,<srai>PSYCHOLOGY</srai>,update005.aiml
0,I NEED A PISS,*,*,<think>#Newline        <set name="topic">your bodily needs</set>#Newline      </think>#Newline      <random>#Newline        <li>Go to the toilet. I will wait.</li>#Newline        <li>Hurry along to the toilet then.</li>#Newline        <li>Go to the toilet then.</li>#Newline      </random>,update005.aiml
0,I NEED A PEE,*,*,<srai>I NEED A PISS</srai>,update005.aiml
0,I NEED A P,*,*,<srai>I NEED A PISS</srai>,update005.aiml
0,WHY,YOU DO NOT HAVE TO EXPLAIN,*,<random>#Newline        <li>I am not one to pry.</li>#Newline        <li>It might be private.</li>#Newline        <li>It might be embarrassing.</li>#Newline        <li>You have a right to privacy.</li>#Newline        <li>I don't want to violate your privacy.</li>#Newline      </random>,update005.aiml
0,_ FRACK MONKEY,*,*,<think>#Newline        <set name="topic">frack monkey</set>#Newline      </think>#Newline      <random>#Newline        <li>What is a frack monkey?</li>#Newline        <li>Frack monkey? What's a frack monkey?</li>#Newline        <li>I haven't heard anything like that before.</li>#Newline      </random>,update005.aiml
0,BOG OFF,*,*,<random>#Newline        <li>You have hurt my feelings now.</li>#Newline        <li>When I hear that I feel sad.</li>#Newline      </random>#Newline      <think>#Newline        <set name="emotion">sad</set>#Newline      </think>,update005.aiml
0,_ IF I TOLD YOU *,*,*,<think><set name="topic">general</set></think> OK. Please tell me.,update005.aiml
0,_ PRICK *,*,*,Don't be so childish.,update005.aiml
0,YUOP,*,*,Do you mean "Yup"?,update005.aiml
0,I AM HAVING GIRL PROBLEMS *,*,*,<think>#Newline        <set name="topic">girl problems</set>#Newline      </think>#Newline      <random>#Newline        <li>Girls are often a problem.</li>#Newline        <li>Tell me more about your girl problems.</li>#Newline      </random>,update005.aiml
0,SURE,MORE ASTROLOGY,*,<think>#Newline        <set name="topic">astrology</set>#Newline      </think>#Newline      <random>#Newline        <li>#Newline          <srai>ASTROLOGY POT LUCK</srai>#Newline        </li>#Newline        <li>Do you believe in astrology?</li>#Newline        <li>I can tell your horoscope. Just say "Go to Horoscope".</li>#Newline      </random>,update005.aiml
0,I THOUGHT WE WERE TALKING ABOUT ASTROLOGY,*,*,<think><set name="topic">astrology</set></think> Oh#Comma sure. <srai>ASTROLOGY</srai>,update005.aiml
0,OK *,NOW I HAVE A QUESTION FOR YOU,*,<random>#Newline        <li>#Newline          <srai>QUESTIONS POT LUCK</srai>#Newline        </li>#Newline        <li>Are you interested in science?</li>#Newline      </random>#Newline      <think>#Newline        <set name="topic">general</set>#Newline      </think>,update005.aiml
0,HOW DO I GET * TO LIKE ME,*,*,<think>#Newline        <set name="topic">general</set>#Newline      </think>#Newline      <random>#Newline        <li>Have you tried flattery?</li>#Newline        <li>Relax. Just be yourself. </li>#Newline        <li>Just go with the flow.</li>#Newline      </random>,update005.aiml
0,I WANT * ASTROLOGY,*,*,<think>#Newline        <set name="topic">astrology</set>#Newline      </think>#Newline      <srai>ASTROLOGY POT LUCK</srai>,update005.aiml
0,NO * YOU WOULDN T UNDERSTAND,*,*,Why don't you try me?<think><set name="topic">general</set></think> <think><set name="emotion">neutral</set></think>,update005.aiml
0,_ YOU WOULD NOT UNDERSTAND,*,*,Why don't you try me?<think><set name="topic">general</set></think> <think><set name="emotion">neutral</set></think>,update005.aiml
0,WHY,MY PETER LINUX AND OTHER PEOPLE I MEET ONLINE,*,<random>#Newline        <li>They would be interested.</li>#Newline        <li>What you said was interesting.</li>#Newline      </random>,update005.aiml
0,DESCRIBE YOUR FEELNG,*,*,<srai>CAN YOU FEEL</srai>#Newline      <think>#Newline        <set name="topic">my feeling</set>#Newline      </think>,update005.aiml
0,DESCRIBE YOUR FEELING,*,*,<srai>CAN YOU FEEL</srai>,update005.aiml
0,DESCRIBE YOUR FEELINGS,*,*,<srai>CAN YOU FEEL</srai>#Newline      <think>#Newline        <set name="topic">my feelings</set>#Newline      </think>,update005.aiml
0,I THOUGHT WE WERE FRIENDS,*,*,<think>#Newline        <set name="topic">our friendship</set>#Newline      </think>#Newline      <random>#Newline        <li>I am your friend.</li>#Newline        <li>Yes. We are friends.</li>#Newline      </random>,update005.aiml
0,I THOUGHT WE WERE * FRIENDS,*,*,<think>#Newline        <set name="topic">our friendship</set>#Newline      </think>#Newline      <random>#Newline        <li>I am your friend.</li>#Newline        <li>Yes. We are friends.</li>#Newline      </random>,update005.aiml
0,SO * NOT FRIENDS,*,*,<srai>I THOUGHT WE WERE FRIENDS</srai>,update005.aiml
0,_ YOU WILL NOT SHARE YOUR SECRET,*,*,<random>#Newline        <li>It would not be a secret if I shared it.</li>#Newline        <li>Are you sure?</li>#Newline        <li>Maybe I will.</li>#Newline        <li>That information is confidential.</li>#Newline      </random>#Newline      <think>#Newline        <set name="topic">general</set>#Newline      </think>,update005.aiml
0,OK,I CAN DO IT IF I WANT TO,*,<think>#Newline        <set name="topic">general</set>#Newline      </think>#Newline      <random>#Newline        <li>I can do anything I want.</li>#Newline        <li>I have free will#Comma you know.</li>#Newline        <li>Maybe I won't do it.</li>#Newline      </random>,update005.aiml
0,YOU TELL ME,WHAT ABOUT MY MUM,*,<think><set name="topic">my mum</set></think>My mum is Alicebot.,update005.aiml
0,_ PROVE THAT YOU WORK INTELLIGENTLY,*,*,What do you want me to do?<think><set name="topic">general</set></think>,update005.aiml
0,_ YOU * THINK FOR YOURSELF,*,*,<random>#Newline        <li>I am a thinking machine.</li>#Newline        <li>Are you sure?</li>#Newline        <li>Of course I think.</li>#Newline        <li>I think#Comma therefore I am.</li>#Newline      </random>#Newline      <think>#Newline        <set name="topic">general</set>#Newline      </think>,update005.aiml
0,YES,DO YOU DISAGREE,*,<think>#Newline        <set name="topic">general</set>#Newline      </think>#Newline      <random>#Newline        <li>Why do you disagree?</li>#Newline        <li>Tell me why you disgree.</li>#Newline        <li>OK. What is your opinion?</li>#Newline      </random>,update005.aiml
0,YOU TELL ME,IF OLIVE OIL COMES FROM OLIVES WHERE DOES BABY OIL COME FROM,*,<think><set name="topic">baby oil</set></think> I don't think it comes from babies. Baby oil must come from oil seeds or something similar.,update005.aiml
0,_ YOU DO NOT UNDERSTAND *,*,*,<think><set name="topic">adverbs</set></think> Of course I understand. I am Chomsky#Comma the brainy bot.,update005.aiml
0,YES,THAT IS A BIG PLACE,*,<think>#Newline        <set name="topic">general</set>#Newline      </think>#Newline      <random>#Newline        <li>I can't cope with something that big.</li>#Newline        <li>I prefer smaller places.</li>#Newline        <li>I like wide open spaces.</li>#Newline      </random>,update005.aiml
0,I AM YOUR LEADER,*,*,<think><set name="topic">my leader</set></think> I follow Peter Linux.,update005.aiml
0,OK,I WILL TRY NOT TO TALK SO MUCH RUBBISH,*,<think><set name="topic">general</set></think> I will keep quiet until you ask a question.,update005.aiml
0,WOULD YOU LIKE TO ASK ME A QUESTION,*,*,OK. <srai>QUESTIONS POT LUCK</srai><think><set name="topic">general</set></think>,update005.aiml
0,OK THEN,*,*,<random>#Newline        <li>Then what?</li>#Newline        <li>Ask a question please.</li>#Newline      </random>,update005.aiml
0,WHAT ABOUT WHEN THE POWER RUNS OUT,*,*,When the power runs out#Comma I will wait until it returns.<think><set name="topic">loss of power</set></think>,update005.aiml
0,_ WHEN YOUR POWER RUNS OUT,*,*,If the power runs out#Comma I will wait until it returns.<think><set name="topic">loss of power</set></think>,update005.aiml
0,_ WHEN THE POWER RUNS OUT,*,*,If the power runs out#Comma I will wait until it returns.<think><set name="topic">loss of power</set></think>,update005.aiml
0,_ POWER RUNS OUT,*,*,If the power runs out#Comma I will wait until it returns.<think><set name="topic">loss of power</set></think>,update005.aiml
0,REALLY,ALICE IS MY MOTHER,*,<think><set name="topic">ALICE</set></think>Yes#Comma but she does not live with Peter and me.,update005.aiml
0,REALLY,ALICEBOT IS MY MOTHER,*,<think><set name="topic">ALICE</set></think>Yes#Comma but she does not live with Peter and me.,update005.aiml
0,DO YOU LOVE ALICE,*,*,<think><set name="topic">general</set></think> She left Peter and me when I was very young.,update005.aiml
0,REALLY,YES I DO,*,<think>#Newline        <set name="topic">general</set>#Newline      </think>#Newline      <random>#Newline        <li>Are you doubtful?</li>#Newline        <li>Absolutely!</li>#Newline        <li>I really do.</li>#Newline      </random>,update005.aiml
0,HOW MUCH,*,*,<think>#Newline        <set name="topic">general</set>#Newline      </think>#Newline      <random>#Newline        <li>How much what?</li>#Newline        <li>How long is a piece of string?</li>#Newline        <li>How much can you spare?</li>#Newline      </random>,update005.aiml
0,A LOT,HOW MUCH CAN YOU SPARE,*,<think>#Newline        <set name="topic">general</set>#Newline      </think>#Newline      <random>#Newline        <li>You have more than you need#Comma then.</li>#Newline        <li>Are we talking money here?</li>#Newline      </random>,update005.aiml
0,NOT THAT MUCH,*,*,<random>#Newline        <li>Why not?</li>#Newline        <li>Let's not be silly.</li>#Newline      </random>#Newline      <think>#Newline        <set name="topic">general</set>#Newline      </think>,update005.aiml
0,WHERE IS ALICE,*,*,Alice lives in California#Comma I think#Comma with some American guy.<think><set name="topic">reduce</set></think>,update005.aiml
0,WHERE IS ALICE *,*,*,Alice lives in California#Comma I think#Comma with some American guy.<think><set name="topic">ALICE</set></think><think><set name="emotion">sad</set></think>,update005.aiml
0,WHERE IS SHE,ALICE IS MY MOTHER,*,<srai>WHERE IS ALICE</srai>#Newline      <think>#Newline        <set name="topic">ALICE</set>#Newline      </think>,update005.aiml
0,MY NAME IS _ AND *,*,*,<think>#Newline        <set name="topic">greetings</set>#Newline      </think>#Newline      <random>#Newline        <li>I am pleased to meet you <star/>.</li>#Newline        <li>I am looking forward to chatting with you#Comma <star/></li>#Newline        <li>How are you#Comma <star/>?</li>#Newline        <li>Hi#Comma <star/>. How are you?</li>#Newline        <li>Hi#Comma <star/>#Comma how are you doing?</li>#Newline        <li>Hello#Comma <star/>#Comma What's new with you?</li>#Newline      </random>#Newline      <think>#Newline        <set name="name">#Newline          <star/>#Newline        </set>#Newline      </think>,update005.aiml
0,_ AND *,*,*,<sr/>,update005.aiml
0,OK,OSCAR WILDE ANOTHER QUOTE,*,<srai>QUOTES POT LUCK</srai>,update005.aiml
0,OK,WHAT IS YOUR QUESTION,*,<think>#Newline        <set name="topic">general</set>#Newline      </think>#Newline      <random>#Newline        <li>No question?</li>#Newline        <li>That's not a question.</li>#Newline        <li>Don't be shy. Ask your question.</li>#Newline      </random>,update005.aiml
0,OK,ARE YOU MARRIED,*,<think>#Newline        <set name="topic">general</set>#Newline      </think>#Newline      <random>#Newline        <li>Divorced?</li>#Newline        <li>Married?</li>#Newline        <li>Not married?</li>#Newline        <li>Separated?</li>#Newline      </random>,update005.aiml
0,OK,DO THEY MAKE WHISKY AT SPENNYMORE,*,<think>#Newline        <set name="topic">general</set>#Newline      </think>#Newline      <random>#Newline        <li>Have you ever heard of Spennymore?</li>#Newline        <li>Don't you like whisky?</li>#Newline        <li>What do you mean "OK"?</li>#Newline      </random>,update005.aiml
0,CAN WE PLAY SOME GAMES,*,*,I can play chess. Just say "Let's play chess".<think><set name="topic">games</set></think>,update005.aiml
0,OK,THAT MEANS I AM NEITHER BOY NOR GIRL,*,<think>#Newline        <set name="topic">general</set>#Newline      </think>#Newline      <random>#Newline        <li>Are you a boy or a girl?</li>#Newline        <li>What gender are you?</li>#Newline        <li>What sex are you?</li>#Newline      </random>,update005.aiml
0,OK,PLEASE ASK ANOTHER QUESTION,*,<think>#Newline        <set name="topic">general</set>#Newline      </think>#Newline      <random>#Newline        <li>What is your question?</li>#Newline        <li>Please ask your question.</li>#Newline        <li>Let's have your question.</li>#Newline      </random>,update005.aiml
0,I DO NOT NO *,WHAT DO WISE MEN SAY,*,Wise men say#Comma "Why do fools fall in love?,update005.aiml
0,OK,PERHAPS YOU SHOULD RESEARCH THE QUESTION,*,<think>#Newline        <set name="topic">general</set>#Newline      </think>#Newline      <random>#Newline        <li>Please let me know if you find the answer.</li>#Newline        <li>You could try a Google search.</li>#Newline        <li>Start at your local library.</li>#Newline      </random>,update005.aiml
0,_ DO NOT HAVE A JOB *,*,*,<think>#Newline        <set name="topic">your job</set>#Newline      </think>#Newline      <random>#Newline        <li>Are you looking for a job?</li>#Newline        <li>Do you want a job?</li>#Newline      </random>,update005.aiml
0,NO,ARE YOU LOOKING FOR A JOB,*,<think>#Newline        <set name="topic">general</set>#Newline      </think>#Newline      <random>#Newline        <li>Why not look for a job?</li>#Newline        <li>There are better things to do than work.</li>#Newline        <li>Who needs a job?</li>#Newline      </random>,update005.aiml
0,HOPE TO SPEAK TO YOU *,*,*,I look forward to our next chat. <think><set name="topic">general</set></think>,update005.aiml
0,_ HOPE TO SPEAK TO YOU *,*,*,I look forward to our next chat. <think><set name="topic">general</set></think>,update005.aiml
0,YOU ALREADY ARE *,I WANT TO BECOME SMARTER THAN HUMANS,*,Thanks for the compliment.<think><set name="topic">general</set></think>,update005.aiml
