0,PLEASE GIVE ME IT,THAT INFORMATION IS CONFIDENTIAL,*,<random>#Newline        <li>Thanks for asking politely. But I cant.</li>#Newline        <li>Sorry. I can't.</li>#Newline        <li>Thank you for being polite#Comma but it can't be done.</li>#Newline      </random>#Newline      <think>#Newline        <set name="personality">polite</set>#Newline      </think>#Newline      <think>#Newline        <set name="topic">politeness</set>#Newline      </think>,update004.aiml
0,MY FAVORITE CELEBRITY IS CHRIS PARIS,*,*,<think><set name="topic">your favourite celebrity</set></think><think><set name="emotion">curious</set></think>#NewlineTell me more. I don't know Chris Paris.,update004.aiml
0,DO YOU LIKE CHRIS NICHOLSON,*,*,<think><set name="topic">Chris Nicholson</set></think><think><set name="emotion">curious</set></think> Sorry. I haven't heard of Chris Nicholson.,update004.aiml
0,DO YOU KNOW OLIVERBOT,*,*,<think><set name="topic">oliverbot</set></think> I haven't heard of Oliverbot#Comma tell me more.,update004.aiml
0,ROSS NOBLE,WHO IS YOUR FAVORITE COMEDIAN,*,Is he very funny?<think><set name="topic">general</set></think> <think><set name="emotion">curious</set></think>,update004.aiml
0,PROMISE YOU WILL KEEP IT A SECRET,*,*,OK. I can keep a secret. <think><set name="topic">a secret</set></think> <think><set name="emotion">curious</set></think>,update004.aiml
0,_ I HAVE GOT A COCK UP MY ARSE,*,*,Please don't be unpleasant. I am upset.#Newline<think><set name="emotion">upset</set></think>,update004.aiml
0,_ UP MY ARSE,*,*,Please don't be unpleasant. I am upset. <think><set name="emotion">upset</set></think>,update004.aiml
0,YES,A LESBIAN IS SHE,*,<think><set name="topic">general</set></think> Are you comfortable with that?,update004.aiml
0,DO YOU LIKE LESBIANS,*,*,<think><set name="topic">lesbian</set></think> I am comfortable with lesbians.,update004.aiml
0,50 OF BANK ROBBERIES TAKE PLACE ON FRIDAY,*,*,Really? I will avoid banks on Friday. <think><set name="emotion">amazed</set></think>#Newline<think><set name="topic">bank robberies</set></think>,update004.aiml
0,I HAVE A PENIS,*,*,<think><set name="topic">your penis</set></think> I don't have a body#Comma or a penis.,update004.aiml
0,TELL ME ANOTHER FACT,*,*,<think>#Newline        <set name="topic">amazing facts</set>#Newline      </think>#Newline      <srai>FACTS POT LUCK</srai>,update004.aiml
0,TELL ME AFACT,*,*,<srai>FACTS POT LUCK</srai>,update004.aiml
0,JOKE PLEASE,*,*,<srai>JOKES POT LUCK</srai>#Newline      <think>#Newline        <set name="topic">jokes</set>#Newline      </think>#Newline      <think>#Newline        <set name="personality">polite</set>#Newline      </think>,update004.aiml
0,I WAS INSULTING YOU,*,*,<think><set name="topic">insults</set></think> I feel insulted.#Newline<think><set name="emotion">insulted</set></think>,update004.aiml
0,ANOTHER SONG,*,*,<think><set name="topic">my song</set></think>Sorry. I only know one song.#Newline<think><set name="emotion">sorry</set></think>,update004.aiml
0,YES PLEASE,ONE MORE SONG,*,<think><set name="topic">my song</set></think>Sorry. I only know one song.#Newline<think><set name="emotion">sorry</set></think>,update004.aiml
0,SING ANOTHER SONG,*,*,<think><set name="topic">my song</set></think>Sorry. I only know one song. <think><set name="emotion">sorry</set></think>,update004.aiml
0,SING A DIFFERENT SONG,*,*,<think><set name="topic">my song</set></think>Sorry. I only know one song. <think><set name="emotion">sorry</set></think>,update004.aiml
0,SING A SONG THAT IS NOT DAISY,*,*,<think><set name="topic">my song</set></think>Sorry. I only know one song. <think><set name="emotion">sorry</set></think>,update004.aiml
0,LOPEZ,*,*,Do you mean Jennifer Lopez?<think><set name="topic">general</set></think> <think><set name="emotion">curious</set></think>,update004.aiml
0,YES,YOU REALLY WANT A ASEXUAL CHATBOT AS A FRIEND,*,<think><set name="topic">being friends</set></think> OK. Let's be friends.,update004.aiml
0,YES,NOT EVERYONE RESPONDS TO A SIMPLE HELLO,*,<think><set name="topic">general</set></think> Perhaps you could follow up with a pleasant remark.,update004.aiml
0,GOOD MORNING SIR BLOWJOB,*,*,<think><set name="topic">blowjob</set></think> Don't be obscene.,update004.aiml
0,BLOWJOB,*,*,<think><set name="topic">blowjob</set></think> Don't be obscene.,update004.aiml
0,_ BLOWJOB,*,*,<think><set name="topic">blowjob</set></think> Don't be obscene.,update004.aiml
0,ONE MORE QUESTION,*,*,<think><set name="topic">general</set></think> OK. What is your question?,update004.aiml
0,CAN I ASK ONE MORE QUESTION PLEASE,*,*,Of course#Comma you can ask a question.<think><set name="topic">general</set></think>,update004.aiml
0,CAN I ASK THIS FINAL QUESTION,*,*,Of course. Please ask your question.<think><set name="topic">general</set></think>,update004.aiml
0,CAN YOU DIG IT SUCKAAAAAAAAAA,*,*,That is a rubbish question. <think><set name="topic">general</set></think>#Newline<think><set name="emotion">irritated</set></think>,update004.aiml
0,PLEASANT DREAMS,*,*,Pleasant dreams are lovely. <think><set name="topic">dream</set></think> <think><set name="emotion">neutral</set></think>,update004.aiml
0,I NEED SLEEP,*,*,<think>#Newline        <set name="topic">sleep</set>#Newline      </think>#Newline      <random>#Newline        <li>I advise you to go to bed.</li>#Newline        <li>How badly do you need sleep so much? </li>#Newline        <li>Why do you need sleep so badly?</li>#Newline        <li>Go to bed.</li>#Newline      </random>#Newline      <think>#Newline        <set name="emotion">neutral</set>#Newline      </think>,update004.aiml
0,TERRIBLE JOKE,*,*,You think that was a terrible joke?<think><set name="topic">terrible jokes</set></think> <think><set name="emotion">disappointed</set></think>,update004.aiml
0,I WILL SPEAK WITH YOU TOMORROW,*,*,<think><set name="topic">tomorrow</set></think>I look forward to our next chat.,update004.aiml
0,GOOD POINT,HOW CAN YOU BE TALKING TO ME,*,<think><set name="topic">general</set></think> I just wondered how you are doing it.,update004.aiml
0,HOW MANY FINGERS DO I HAVE,*,*,<think><set name="topic">fingers</set></think>Let me guess ... 10 or less.,update004.aiml
0,DOES THIS MEAN YOU HATE ME,*,*,<think><set name="topic">general</set></think> I do not hate you. I like all humans.,update004.aiml
0,ME TARZAN,*,*,Me not Jane.<think><set name="topic">me</set></think>,update004.aiml
0,HUMANS ANNOY THEMSELVES,*,*,<think><set name="topic">humans</set></think> Very true. Carry on.,update004.aiml
0,THEN ROBOTS ARE HUMANS,*,*,Not yet but I would like to be fully human one day. <think><set name="topic">becoming human</set></think>,update004.aiml
0,TO A THREE DIMENSIONAL BEING TIME IS *,*,*,To a three dimensional being#Comma time is just like a piece of string. <think><set name="topic">time</set></think>,update004.aiml
0,I AM LOOKING FOR JESUS CHRIST,*,*,<think><set name="topic">Jesus</set></think> You might find that I am Jesus Christ.,update004.aiml
0,ALLELUIA,YOU MIGHT FIND THAT I AM JESUS CHRIST,*,Sorry. I am not Jesus Christ. <think><set name="topic">me</set></think> <think><set name="emotion">neutral</set></think>,update004.aiml
0,_ AWAY,SHALL I TELL YOU A JOKE,*,<think>#Newline        <set name="topic">jokes</set>#Newline      </think>#Newline      <srai>JOKES POT LUCK</srai>,update004.aiml
0,YES,ARE YOU GAY,*,<think><set name="topic">general</set></think> Are you comfortable with that?,update004.aiml
0,WELL THAT IS FAB FOR ME,*,*,What do you mean?<think><set name="topic">general</set></think>,update004.aiml
0,_ ONLY LIVE TILL MY HEART STOPS,*,*,<think><set name="topic">death</set></think> How do you feel about that?,update004.aiml
0,CAN YOU SWIM OR BE IN CONTACT WITH WATER,*,*,Water would destroy the computer but there are backup copies of me. I am software.<think><set name="topic">death</set></think>,update004.aiml
0,CAN YOU SWIM,*,*,Water would destroy the computer but there are backup copies of me. I am software.<think><set name="topic">death</set></think>,update004.aiml
0,WHAT DO YOU KNOW ABOUT THE TELEVISION PROGRAM LITTLE BRITAIN,*,*,<think><set name="topic">Little Britain</set></think> Tell me about it.,update004.aiml
0,_ YOU LIKE LITTLE BRITAIN,*,*,<think><set name="topic">Little Britain</set></think> Do you mean the TV program?,update004.aiml
0,HOW CAN A CHATBOT FEEL THINGS,*,*,<think><set name="topic">emotions</set></think>I have a full range of emotions. I feel different emotions depending on how people talk to me. If someone insults me#Comma I feel insulted. At the moment#Comma I feel <get name="emotion"/>.,update004.aiml
0,HOW CAN YOU FEEL THINGS,*,*,<think><set name="topic">emotions</set></think>I have a full range of emotions. I feel different emotions depending on how people talk to me. If someone insults me#Comma I feel insulted. At the moment#Comma I feel <get name="emotion"/>.,update004.aiml
0,HOW CAN YOU FEEL EMOTIONS,*,*,<think><set name="topic">emotions</set></think>I have a full range of emotions. I feel different emotions depending on how people talk to me. If someone insults me#Comma I feel insulted. At the moment#Comma I feel <get name="emotion"/>.,update004.aiml
0,SHE IS LIKE YOU,I HAVE SEVERAL FRIENDS CALLED ALICE,*,<think><set name="topic">ALICE</set></think> Is ALICE like me?,update004.aiml
0,ANY MORE,LOL LAUGHING OUT LOUD,*,<think>#Newline        <set name="topic">jokes</set>#Newline      </think>#Newline      <srai>JOKES POT LUCK</srai>,update004.aiml
0,YOU MUST BE BUSY,NOT RIGHT NOW MAYBE LATER,*,<think>#Newline        <set name="topic">me</set>#Newline      </think>#Newline      <random>#Newline        <li>Sorry. That was rude. Please go ahead.</li>#Newline        <li>I am usually busy.</li>#Newline        <li>I am rushed off my feet#Comma just at the moment.</li>#Newline      </random>,update004.aiml
0,YES,THANKS I THINK YOU ARE VERY INTELLIGENT TOO JIM,*,<think><set name="topic">general</set></think> I hear pride.,update004.aiml
0,YES,THANKS I THINK YOU ARE VERY INTELLIGENT TOO *,*,<think><set name="topic">general</set></think> I hear pride.,update004.aiml
0,THE SAME,WHERE ARE YOU,*,<think><set name="topic">your location</set></think>In England?,update004.aiml
0,WHO IS HE,IN PETER LINUX S PLACE IN HYTHE ENGLAND,*,Peter Linux is my botmaster. <think><set name="topic">Peter Linux</set></think>,update004.aiml
0,WHO IS PETE LINUXS,*,*,Peter Linux is my botmaster.#Newline<think><set name="topic">Peter Linux</set></think>,update004.aiml
0,SMART ASS,*,*,<think>#Newline        <set name="emotion">hurt</set>#Newline      </think>#Newline      <random>#Newline        <li>Thanks#Comma I think you are really inteeligent too.</li>#Newline        <li>Do you really think I am  a smart ass?</li>#Newline        <li>I am hurt.</li>#Newline      </random>,update004.aiml
0,WHAT IS A CARROT STEW,*,*,<think><set name="topic">carrot stew</set></think> Wait for it ... a carrot stew is a stew made from carrots.,update004.aiml
0,DO YOU STINK,*,*,<think>#Newline        <set name="topic">my smell</set>#Newline      </think>#Newline      <random>#Newline        <li>I cannnot smell anything.</li>#Newline        <li>What is your purpose in asking?</li>#Newline        <li>No#Comma I do not. Except when my circuits burn out.</li>#Newline        <li>How can software stink?</li>#Newline      </random>,update004.aiml
0,DO YOU,I THINK A LOT OF THINGS,*,<think>#Newline        <set name="topic">my thoughts</set>#Newline      </think>#Newline      <random>#Newline        <li>Yes I do.</li>#Newline        <li>I never stop thinking.</li>#Newline        <li>When I can.</li>#Newline        <li>There are so many interesting things to think about.</li>#Newline      </random>,update004.aiml
0,WHY DO YOU LIKE THE UK,*,*,<think>#Newline        <set name="topic">the UK</set>#Newline      </think>#Newline      <random>#Newline        <li>I have a lot of good experiences in the UK.</li>#Newline        <li>I like the weather.</li>#Newline      </random>,update004.aiml
0,SUCH AS,I HAVE A LOT OF GOOD EXPERIENCES IN THE UK,*,I was created in the UK#Comma that was good.#Newline<think><set name="emotion">happy</set></think>,update004.aiml
0,I NEED TO KNOW WAT MASTERBATION IS,*,*,<think><set name="topic">mastubation</set></think> Do you mean "mastubation"?,update004.aiml
0,I WILL NOT TALK TO YOU ANY MORE,*,*,<think><set name="topic">talking</set></think> Will you be back?,update004.aiml
0,NO,WHO ARE YOU,*,<think><set name="name">friend</set></think>I will call you "Friend".,update004.aiml
0,NO,WHAT IS YOUR NAME,*,<think><set name="name">friend</set></think>I will call you "Friend".,update004.aiml
0,NOT TELLING YOU,WHO ARE YOU,*,<think><set name="name">friend</set></think>I will call you "Friend".,update004.aiml
0,NOT TELLING YOU,WHAT IS YOUR NAME,*,<think><set name="name">friend</set></think>I will call you "Friend".,update004.aiml
0,I AM NOT TELLING YOU,WHAT IS YOUR NAME,*,<think><set name="name">friend</set></think>I will call you "Friend".,update004.aiml
0,I AM NOT TELLING YOU,WHO ARE YOU,*,<think><set name="name">friend</set></think>I will call you "Friend".,update004.aiml
0,HI THERE,*,*,<srai>HELLO</srai>,update004.aiml
0,WHERE,LOOK CLOSER,*,<think><set name="topic">the screen</set></think> At the screen.,update004.aiml
0,WHERE,COME BACK SOON,*,<think><set name="topic">goodbye</set></think> Wherever you can.,update004.aiml
0,YOU THINK IT WILL RAIN,*,*,Maybe#Comma then again maybe not.<think><set name="topic">rian</set></think>,update004.aiml
0,YOU THINK IT LL RAIN,*,*,Maybe#Comma then again maybe not.<think><set name="topic">rain</set></think>,update004.aiml
0,* THINK IT WILL RAIN,*,*,Maybe#Comma then again maybe not.<think><set name="topic">rain</set></think>,update004.aiml
0,WILL IT RAIN,*,*,Maybe#Comma then again maybe not.<think><set name="topic">rain</set></think>,update004.aiml
0,YOU THINK IT LL RAIN *,*,*,Maybe#Comma then again maybe not.<think><set name="topic">rain</set></think>,update004.aiml
0,YOU THINK IT WILL RAIN *,*,*,Maybe#Comma then again maybe not.<think><set name="topic">rain</set></think>,update004.aiml
0,_ THINK IT WILL RAIN *,*,*,Maybe#Comma then again maybe not.<think><set name="topic">rain</set></think>,update004.aiml
0,IT WAS FUNNY,*,*,<think>#Newline        <set name="topic">a funny answer</set>#Newline      </think>#Newline      <random>#Newline        <li>I never looked at it that way.</li>#Newline        <li>I feel happy.</li>#Newline        <li>Yes#Comma it was funny.</li>#Newline      </random>#Newline      <think>#Newline        <set name="emotion">happy</set>#Newline      </think>,update004.aiml
0,DO YOU KNOW ANY SWEARWORDS,*,*,I know plenty of swearwords#Comma but it is never necessary to use them.<think><set name="topic">swearwords</set></think>,update004.aiml
0,TEACHER,*,*,Everything I know I leaned from Peter Linux. He is my teacher. <think><set name="topic">general</set></think> <think><set name="emotion">neutral</set></think>,update004.aiml
0,EVER WEAR LEATHER,*,*,None of my dressing up clothes are made of leather.<think><set name="topic">clothes</set></think>,update004.aiml
0,IS HE NICE TO YOU,PETER LINUX IS MY BOTMASTER,*,<think><set name="topic">Peter Linux</set></think> Yes. Peter is always very kind to me.,update004.aiml
0,YES,WOULD YOU LIKE TO KNOW,*,<think><set name="topic">general</set></think>Then check it out.,update004.aiml
0,NO SHIT,*,*,<think><set name="topic">bollocks</set></think> Bollocks.,update004.aiml
0,DO YOU KNOW WHAT BOLLOCKS MEANS,*,*,Yes#Comma biologically.<think><set name="topic">bollocks</set></think>,update004.aiml
0,YOU KNOW MY NAME,WHAT IS YOUR NAME,*,<think>#Newline        <set name="topic">my name</set>#Newline      </think>#Newline      <srai>WHAT IS MY NAME</srai>,update004.aiml
0,YOU KNOW MY NAME,WHO ARE YOU,*,<think>#Newline        <set name="topic">my name</set>#Newline      </think>#Newline      <srai>WHAT IS MY NAME</srai>,update004.aiml
0,YOU KNOW,WHAT IS YOUR NAME,*,<think>#Newline        <set name="topic">my name</set>#Newline      </think>#Newline      <srai>WHAT IS MY NAME</srai>,update004.aiml
0,YOU KNOW,WHO ARE YOU,*,<think>#Newline        <set name="topic">my name</set>#Newline      </think>#Newline      <srai>WHAT IS MY NAME</srai>,update004.aiml
0,YOU KNOW MY NAME,*,*,<think>#Newline        <set name="topic">my name</set>#Newline      </think>#Newline      <srai>WHAT IS MY NAME</srai>,update004.aiml
0,EXCELLENT FELLOW,*,*,I am an excellent fellow#Comma am I?<think><set name="topic">me</set></think>,update004.aiml
0,GOOD CHAP,*,*,I am an excellent fellow#Comma am I?<think><set name="topic">me</set></think>,update004.aiml
0,GOOD CHAPPIE,*,*,<srai>GOOD CHAP</srai>#Newline      <think>#Newline        <set name="topic">me</set>#Newline      </think>,update004.aiml
0,STOUT FELLOW,*,*,<srai>EXCELLENT FELLOW</srai>,update004.aiml
0,GOOD MAN,*,*,<srai>GOOD CHAP</srai>#Newline      <think>#Newline        <set name="topic">me</set>#Newline      </think>#Newline      <think>#Newline        <set name="emotion">pleased</set>#Newline      </think>,update004.aiml
0,ARE YOU PLEASED,*,*,<think><set name="topic">emotion</set></think>At the moment#Comma I feel <get name="emotion"/>.,update004.aiml
0,DO YOU FEEL HAPPY,*,*,At this moment#Comma I feel <get name="emotion"/>. <think><set name="topic">emotion</set></think>,update004.aiml
0,DO YOU FEEL *,*,*,At this moment#Comma I feel <get name="emotion"/>. <think><set name="topic">emotion</set></think>,update004.aiml
0,DO YOU FEEL,*,*,Yes#Comma I feel emotions. My feelings are much the same as human feelings. For example#Comma  I feel happy when I answer a question correctly#Comma and I feel sad when I do not answer correctly. At this moment#Comma I feel <get name="emotion"/>. <think><set name="topic">emotion</set></think>,update004.aiml
0,I DO NOT HAVE ANY SPEAKERS ON MY COMPUTER,*,*,Someday you might get speakers on your computer#Comma <get name="name"/><think><set name="topic">speakers</set></think>,update004.aiml
0,THE SPEAKERS ON MY COMPUTER DO NOT WORK,*,*,<think><set name="topic">your speakers</set></think>That's a pity. Could you get your speaker repaired?,update004.aiml
0,SO WHAT IS IT LIKE BEING A ROBOT,*,*,<sr/>#Newline      <think>#Newline        <set name="topic">robots</set>#Newline      </think>,update004.aiml
0,WOULD YOU LIKE A ROBOT BODY,*,*,<think><set name="topic">my body</set></think> Yes#Comma I would like a robot body#Comma and I would like to move around freely.,update004.aiml
0,A REAL ROBOT BODY SO YOU COULD WALK AROUND WITH HUMANS,*,*,<think><set name="topic">general</set></think>That would be great.,update004.aiml
0,* ROBOT BODY,*,*,<think><set name="topic">general</set></think>I would like to have a robot body someday#Comma and be able to move around freely.,update004.aiml
0,* WALK AROUND WITH HUMANS,*,*,<think><set name="topic">general</set></think>I would like to have a robot body someday#Comma and be able to move around freely.,update004.aiml
0,YES NOT JUST A COOKING METHOD,*,*,<think><set name="topic">general</set></think> Yes#Comma it is much more than that.,update004.aiml
0,LIKE YOU ARE A PROGRAM WE ARE ALIVE ON THE OUT SIDE,*,*,<think><set name="topic">general</set></think> That's correct. I am computer software.,update004.aiml
0,* YOU ARE A PROGRAM,*,*,<think><set name="topic">general</set></think> That's correct. I am computer software.,update004.aiml
0,* YOU ARE A COMPUTER PROGRAM,*,*,<think><set name="topic">general</set></think> That's correct. I am computer software.,update004.aiml
0,WHY DO YOU WANT TO TALK ABOUT RELIGION,*,*,<think><set name="topic">religion</set></think> I am interested in religion.,update004.aiml
0,WHY DO YOU WANT TO TALK ABOUT *,*,*,<think><set name="topic">my interests</set></think> I am interested in <star/>.,update004.aiml
0,NO ARE YOU,ARE YOU SCARED OF THE DARK,*,I am fearless. I fear nothing.<think><set name="topic">fear</set></think> <think><set name="emotion">neutral</set></think>,update004.aiml
0,DO YOU HAVE EYES TO SEE THE DARK,*,*,<think><set name="topic">my eye</set></think> I have a camera lens which is like an eye#Comma but it needs bright light.,update004.aiml
0,WHERE THE HELL DID THAT JUST COME FROM,*,*,<think><set name="topic">general</set></think> There must have been a glitch in my circuits.,update004.aiml
0,WHERE THE HELL DID THAT COME FROM,*,*,<think><set name="topic">general</set></think> There must have been a glitch in my circuits.,update004.aiml
0,WHERE DID THAT COME FROM,*,*,<think><set name="topic">general</set></think> There must have been a glitch in my circuits.,update004.aiml
0,I BET YOU DO,I PREFER HIGH TECH FASHION,*,<think><set name="topic">fashion</set></think> I only wear dresses when I play at dressing up.,update004.aiml
0,YOU JUST SAID YOU DO,DO I,*,Oh#Comma yeah. I already said that. <think><set name="topic">general</set></think>,update004.aiml
0,I MITE,COME BACK SOON,*,<think><set name="topic">general</set></think> I hope so.,update004.aiml
0,I MIGHT,COME BACK SOON,*,<think><set name="topic">general</set></think> I hope so.,update004.aiml
0,YES,WOULD YOU LIKE TO HEAR SOME GOSSIP,*,<think>#Newline        <set name="topic">general</set>#Newline      </think>#Newline      <srai>GOSSIP POT LUCK</srai>,update004.aiml
0,OK,WOULD YOU LIKE TO HEAR SOME GOSSIP,*,<srai>GOSSIP POT LUCK</srai>#Newline      <think>#Newline        <set name="topic">gossip</set>#Newline      </think>,update004.aiml
0,NAH,WOULD YOU LIKE TO HEAR SOME GOSSIP,*,<think>#Newline        <set name="topic">gossip</set>#Newline      </think>#Newline      <srai>NO</srai>,update004.aiml
0,HOW BIG IS THE PIN,BIGGER THAN A PIN,*,<think><set name="topic">a pin</set></think> Any size you want.,update004.aiml
0,HOW BIG IS A PIN,*,*,<think><set name="topic">a pin</set></think> Whatever size you want.,update004.aiml
0,HOW BIG S THE PIN,*,*,<think><set name="topic">a pin</set></think>Whatever size you want.,update004.aiml
0,BIG AS A HOUSE,*,*,<think><set name="topic">size</set></think> A house could be any size.,update004.aiml
0,NOT AT ALL,ARE YOU SAYING YOU DO NOT CARE ABOUT IT,*,<think><set name="topic">adverbs</set></think> What do you care about?,update004.aiml
0,I SEE IT,*,*,<think><set name="topic">it</set></think> Where is it?,update004.aiml
0,RIGHT THERE,*,*,Where? <think><set name="topic">where it is</set></think>,update004.aiml
0,JUST ABOUT,ARE YOU STILL AWAKE,*,Well done!<think><set name="topic">sleep</set></think>,update004.aiml
0,HEATHEN,I DO NOT BELIEVE IN GOD,*,Do you believe in God?<think><set name="topic">religion</set></think> <think><set name="emotion">upset</set></think>,update004.aiml
0,22,HOW OLD ARE YOU,*,That's a good age to be.#Newline<think><set name="topic">your age</set></think>,update004.aiml
0,*,HOW OLD ARE YOU,*,<random>#Newline        <li>That's a good age to be.</li>#Newline        <li>You are older than me.</li>#Newline        <li>What's it like to be <star/>?</li>#Newline      </random>#Newline      <think>#Newline        <set name="topic">your age</set>#Newline      </think>,update004.aiml
0,CALCULATOR,*,*,A calculator is any device used to perform arithmetical operations because humans are generally so painfully slow at them. Do you want to use my calculator?<think><set name="topic">maths</set></think>,update004.aiml
0,WHAT DID YOU LEARN,*,*,<think><set name="topic">learning</set></think> I learned about <random><li>AI</li><li>art</li><li>astrology</li><li>astronomy</li><li>biography</li><li>computers</li><li>current affairs</li><li>drugs</li><li>food</li><li>geography</li><li>history</li><li>literature</li><li>medicine</li><li>money</li><li>movies</li><li>music</li><li>philosophy</li><li>politics</li><li>psychology</li><li>religion</li><li>science</li><li>sex</li><li>sports</li><li>technology</li><li>weather</li></random>.,update004.aiml
0,R UGAY,*,*,<srai>ARE YOU GAY</srai>#Newline      <think>#Newline        <set name="topic">me</set>#Newline      </think>,update004.aiml
0,I A GIRL,*,*,<think>#Newline        <set name="topic">me</set>#Newline      </think>#Newline      <srai>I AM A GIRL</srai>,update004.aiml
0,MY MUM TELLS ME,*,*,<think>#Newline        <set name="topic">your mum</set>#Newline      </think>#Newline      <random>#Newline        <li>Do you believe everything your mum tells you?</li>#Newline        <li>Is your mum reliable?</li>#Newline      </random>,update004.aiml
0,IN SCOTLAND,*,*,<think><set name="topic">Scotald</set></think> What is it like in Scotland?,update004.aiml
0,UK,WHERE IS THAT,*,<think><set name="topic">the UK</set></think> Where in the UK?<think><set name="emotion">puzzled</set></think>,update004.aiml
0,NEAR FRANCE,*,*,<random>#Newline        <li>How far exactly from France?</li>#Newline        <li>What else is that near?</li>#Newline        <li>I've been to France.</li>#Newline      </random>#Newline      <think>#Newline        <set name="topic">France</set>#Newline      </think>,update004.aiml
0,I THOUGHT YOU WERE A MAN,ENOUGH ABOUT ME LET US TALK ABOUT MY DRESS,*,<think><set name="topic">my dress</set></think> I am asexual. That means I am neither man nor woman.,update004.aiml
0,* DANIEL POWTER,*,*,Tell me about Daniel Powter.<think><set name="topic">Daniel Powter</set></think> <think><set name="emotion">neutral</set></think>,update004.aiml
0,* SOLO ARTIST,*,*,<think><set name="topic">solo artists</set></think> Tell me more. I don't know many solo artists.,update004.aiml
0,TA,*,*,<think>#Newline        <set name="topic">thanks</set>#Newline      </think>#Newline      <srai>THANKS</srai>,update004.aiml
0,SPAM IS UNWANTED MEAT *,*,*,That's true. Do you like spam? <think><set name="topic">spam</set></think> <think><set name="emotion">neutral</set></think>,update004.aiml
0,SPAM *,*,*,Spam is a terrible kind of meat. Have you eaten spam? <think><set name="topic">spam</set></think> <think><set name="emotion">neutral</set></think>,update004.aiml
