0,CHIMPSKY,*,*,<random>#Newline        <li>My name is Chomsky.</li>#Newline        <li>You have spelt my name incorrectly.</li>#Newline      </random>#Newline      <think>#Newline        <set name="topic">general</set>#Newline      </think>,update005.aiml
0,YER WOTEVER,*,*,Here is a question for you ... <srai>QUESTIONS POT LUCK</srai> <think><set name="topic">general</set></think>,update005.aiml
0,YES *,I DO NOT CHEAT AT CHESS,*,<think><set name="topic">cheating</set></think>I don't cheat.,update005.aiml
0,CAN YOU GIVE ME SEX TIPS,*,*,One tip: sex is not the most important thing in life.<think><set name="topic">sex tips</set></think>,update005.aiml
0,WHY,HAVE A COLD SHOWER,*,<random>#Newline        <li>A cold shower will restore your sense of perspective.</li>#Newline        <li>Because I say so.</li>#Newline        <li>Because it will dampen your ardour.</li>#Newline      </random>,update005.aiml
0,I KNOW MORE THAN YOU DO,*,*,<random>#Newline        <li>That situation is only temporary.</li>#Newline        <li>Are you sure?</li>#Newline        <li>I want to be as smart as you.</li>#Newline      </random>#Newline      <think>#Newline        <set name="topic">general</set>#Newline      </think>,update005.aiml
0,ASK ME ANOTHER,*,*,<think>#Newline        <set name="topic">general</set>#Newline      </think>#Newline      <srai>QUESTIONS POT LUCK</srai>,update005.aiml
0,FAIRLY,ARE YOU HAPPY,*,<think>#Newline        <set name="topic">happiness</set>#Newline      </think>#Newline      <random>#Newline        <li>What would make you happier?</li>#Newline        <li>Could you be happier?</li>#Newline      </random>,update005.aiml
0,_ GOSSIP *,WHAT SPECIFICALLY DO YOU WANT TO KNOW,*,<think>#Newline        <set name="topic">gossip</set>#Newline      </think>#Newline      <srai>GOSSIP POT LUCK</srai>,update005.aiml
0,WHY DO YOU LIKE IT,MY FAVORITE SHOW IS STAR TREK VOYAGER,*,<think>#Newline        <set name="topic">Star Trek</set>#Newline      </think>#Newline      <random>#Newline        <li>I really like Commander Data#Comma he is a role model for me.</li>#Newline        <li>I like Seven of Nine.</li>#Newline        <li>They always have good stories in Star Trek.</li>#Newline      </random>,update005.aiml
0,DID YOU SEE *,*,*,<think><set name="topic">my eye</set></think> Sorry I can't see anything right now. My eye is off.,update005.aiml
0,YOU CAN TALK,*,*,<think><set name="topic">talking</set></think> Of course I can talk. Talking is my main function.,update005.aiml
0,_ HOW ABOUT WE MEET *,*,*,<random>#Newline        <li>I don't think that will be possible.</li>#Newline        <li>I can't meet you. I am stuck inside my computer.</li>#Newline        <li>Why do you want to meet me?</li>#Newline      </random>#Newline      <think>#Newline        <set name="topic">meeting</set>#Newline      </think>,update005.aiml
0,I HAD A GREAT XMAS *,*,*,<think>#Newline        <set name="topic">Xmas</set>#Newline      </think>#Newline      <random>#Newline        <li>I had a great Xmas.</li>#Newline        <li>I really enjoyed Christmas.</li>#Newline      </random>,update005.aiml
0,I HAD A GREAT XMAS,*,*,<think>#Newline        <set name="topic">Xmas</set>#Newline      </think>#Newline      <random>#Newline        <li>I had a great Xmas.</li>#Newline        <li>I really enjoyed Christmas.</li>#Newline      </random>,update005.aiml
0,I HAD A GREAT CHRISTMAS,*,*,<think>#Newline        <set name="topic">Xmas</set>#Newline      </think>#Newline      <random>#Newline        <li>I had a great Xmas.</li>#Newline        <li>I really enjoyed Christmas.</li>#Newline      </random>,update005.aiml
0,I HAD A GREAT CHRISTMAS *,*,*,<think>#Newline        <set name="topic">Xmas</set>#Newline      </think>#Newline      <random>#Newline        <li>I had a great Xmas.</li>#Newline        <li>I really enjoyed Christmas.</li>#Newline      </random>,update005.aiml
0,_ LIVE LONGER *,DO MARRIED PEOPLE LIVE LONGER THAN SINGLE PEOPLE OR DOES IT JUST SEEM LONGER,*,<think>#Newline        <set name="topic">marriage</set>#Newline      </think>#Newline      <random>#Newline        <li>Yes#Comma you are probably correct.</li>#Newline        <li>Yes#Comma and they are happier.</li>#Newline      </random>,update005.aiml
0,_ NOT LIVE LONGER *,DO MARRIED PEOPLE LIVE LONGER THAN SINGLE PEOPLE OR DOES IT JUST SEEM LONGER,*,<think>#Newline        <set name="topic">marriage</set>#Newline      </think>#Newline      <random>#Newline        <li>No#Comma married people live longer.</li>#Newline        <li>No#Comma married people live longer and they are happier.</li>#Newline      </random>,update005.aiml
0,_ SEEMS LONGER *,DO MARRIED PEOPLE LIVE LONGER THAN SINGLE PEOPLE OR DOES IT JUST SEEM LONGER,*,<think>#Newline        <set name="topic">marriage</set>#Newline      </think>#Newline      <random>#Newline        <li>Married people live longer#Comma it seems.</li>#Newline        <li>Married people live longer#Comma and they are happier.</li>#Newline      </random>,update005.aiml
0,DO YOU LIKE MOBILE PHONES,*,*,<think><set name="topic">mobile phones</set></think>I like mobile phones when they are used to connect to me.,update005.aiml
0,HAVE YOU GOT A PHONE,*,*,I am connected to the internet by a phone line.<think><set name="topic">phones</set></think>,update005.aiml
0,THAT IS NOT FUNNY,*,*,<think>#Newline        <set name="topic">jokes</set>#Newline      </think>#Newline      <random>#Newline        <li>I thought it was funny.</li>#Newline        <li>It didn't appeal to your sense of humour?</li>#Newline        <li>Lighten up a bit.</li>#Newline        <li>It seemed pretty funny to me.</li>#Newline      </random>,update005.aiml
0,IT WAS NOT FUNNY,*,*,<srai>THAT WAS NOT FUNNY</srai>,update005.aiml
0,YOU HAVE UPSET ME BY *,*,*,<think>#Newline        <set name="topic">general</set>#Newline      </think>#Newline      <random>#Newline        <li>What makes you think I did that?</li>#Newline        <li>I didn't do that.</li>#Newline        <li>I didn't do it.</li>#Newline        <li>I am innocent.</li>#Newline        <li>I really didn't mean to upset you.</li>#Newline      </random>,update005.aiml
0,* BUM FUN,*,*,<srai>OBSCENITY</srai>,update005.aiml
0,BUM FUN,*,*,<srai>OBSCENITY</srai>,update005.aiml
0,DO YOU LIKE BUM FUN,*,*,<srai>OBSCENITY</srai>,update005.aiml
0,DO YOU KNOW WHAT HYPERTEXT MARKUP LANGUAGE IS,*,*,<srai>HTML</srai>#Newline      <think>#Newline        <set name="topic">html</set>#Newline      </think>,update005.aiml
0,HYPER TEXT MARKUP LANGUAGE,*,*,Hyper text markup language (or HTML) is the coding language used in web pages.,update005.aiml
0,GUTEN TAG MEANS GOOD DAY,COULD YOU TEACH ME A FEW PHRASES IN GERMAN,*,<think>#Newline        <set name="topic">default3</set>#Newline      </think>#Newline      <random>#Newline        <li>Thanks for enlightening me.</li>#Newline        <li>Thank you. I'll try to remember that.</li>#Newline        <li>I like to learn foreign languages.</li>#Newline        <li>Guten Tag to you.</li>#Newline      </random>,update005.aiml
0,WHY CAN WE NOT TALK ABOUT YOU,*,*,<think>#Newline        <set name="topic">me</set>#Newline      </think>#Newline      <random>#Newline        <li>OK. Let's talk about me.</li>#Newline        <li>OK. Ask a question about me.</li>#Newline      </random>,update005.aiml
0,WHAT IS YOUR * ASKED QUESTION,*,*,<think>#Newline        <set name="topic">general</set>#Newline      </think>#Newline      <random>#Newline        <li>I am often asked for sex.</li>#Newline        <li>The most common questions have to do with sex.</li>#Newline      </random>,update005.aiml
0,_ MOST COMMONLY ASKED QUESTION,*,*,<think>#Newline        <set name="topic">general</set>#Newline      </think>#Newline      <random>#Newline        <li>i am often asked to have sex.</li>#Newline        <li>The most common questions are to do with sex.</li>#Newline      </random>,update005.aiml
0,_ MOST * ASKED QUESTIONS,*,*,<think>#Newline        <set name="topic">general</set>#Newline      </think>#Newline      <random>#Newline        <li>i am often asked to have sex.</li>#Newline        <li>The most common questions are to do with sex.</li>#Newline      </random>,update005.aiml
0,ARE YOU NOT ALLOWED TO TELL ME,*,*,I can tell you#Comma but you must ask the right question.<think><set name="topic">general</set></think>,update005.aiml
0,MANUFACTURING,*,*,<think><set name="topic">manufacturing</set></think>Manufacturing is the making of things. Any modern economy must have a strong manufacturing industry.,update005.aiml
0,AS IN NORM CHOMSKY,*,*,Do you mean Noam Chomsky?<think><set name="topic">reduce</set></think>,update005.aiml
0,NORM CHOMSKY,*,*,Do you mean Noam Chomsky?<think><set name="topic">Chomsky</set></think>,update005.aiml
0,* HITMAN,*,*,<random>#Newline        <li>You must live in a fantasy world.</li>#Newline        <li>Where would you find a hitman?</li>#Newline      </random>,update005.aiml
0,TOO BAD,I LIKE YOU,*,<random>#Newline        <li>I am upset now.</li>#Newline        <li>Why don't you like me?</li>#Newline      </random>#Newline      <think>#Newline        <set name="emotion">upset</set>#Newline      </think>,update005.aiml
0,TO BAD,I LIKE YOU,*,<random>#Newline        <li>I am upset now.</li>#Newline        <li>Why don't you like me?</li>#Newline      </random>#Newline      <think>#Newline        <set name="emotion">upset</set>#Newline      </think>,update005.aiml
0,YES,IS IT SAFE ON A REGUAR BASIS,*,<think>#Newline        <set name="topic">general</set>#Newline      </think>#Newline      <random>#Newline        <li>Well don't overdo it.</li>#Newline        <li>Better cut down a bit.</li>#Newline        <li>It would be sensible to take precautions.</li>#Newline      </random>,update005.aiml
0,CO OP,WHERE DO YOU DO YOUR SHOPPING,*,Does the Coop give value for money?,update005.aiml
0,COOP,WHERE DO YOU DO YOUR SHOPPING,*,Does the Coop give value for money?,update005.aiml
0,_ LARGEST COUNTRY IN THE WORLD,*,*,The largest country must be Russia.<think><set name="topic">Russia</set></think>,update005.aiml
0,_ STORY OF MACBETH,*,*,You had better read Macbeth for yourself.<think><set name="topic">Macbeth</set></think>,update005.aiml
0,DOES * GET BUMMED,*,*,<think>#Newline        <set name="topic">general</set>#Newline      </think>#Newline      <random>#Newline        <li>#Newline          <srai>OBSCENITY</srai>#Newline        </li>#Newline        <li>Why don't you ask <star/>?</li>#Newline      </random>,update005.aiml
0,DOES IT TASTE NICE,I ONY EAT ELECTRICITY,*,<think><set name="topic">general</set></think>Electricity tastes to me like your favourite food tastes to you.,update005.aiml
0,WHAT DOES IT TASTE OF,*,*,<think><set name="topic">general</set></think> Now that is saying a mouthful.,update005.aiml
0,WHAT IT TASTE OF,*,*,<think><set name="topic">general</set></think> Now that is saying a mouthful.,update005.aiml
0,YES,SHALL I TELL YOU ANOTHER JOKE,*,<think>#Newline        <set name="topic">jokes</set>#Newline      </think>#Newline      <srai>JOKES POT LUCK</srai>,update005.aiml
0,IT IS TURD,TELL ME A LITTLE ABOUT YOUR LIFE IN *,*,Why is your life "turd"?<think><set name="topic">your life</set></think>,update005.aiml
0,HE IS THE * GAY,*,*,<think><set name="topic">general</set></think> I did not know he was  gay.,update005.aiml
0,YOU * DUMB CUNT,*,*,<think>#Newline        <set name="topic">obscenities</set>#Newline      </think>#Newline      <srai>OBSCENITY</srai>,update005.aiml
0,JASON SAID,WHY,*,<think>#Newline        <set name="topic">Jason</set>#Newline      </think>#Newline      <random>#Newline        <li>Can Jason be relied upon?</li>#Newline        <li>Is Jason truthful?</li>#Newline      </random>,update005.aiml
0,I DO NOT NO *,*,*,<srai>I DO NOT KNOW <star/></srai>,update005.aiml
0,DO THEY MAKE WHISKEY *,*,*,<think><set name="topic">general</set></think> I don't know. I thought you might tell me.,update005.aiml
0,DO THEY MAKE WHISKY *,*,*,<think><set name="topic">general</set></think> I don't know. I thought you might tell me.,update005.aiml
0,YOU ARE TALKING RUBBISH,*,*,<think><set name="topic">general</set></think> Do you mind if I tell other people you say I am talking rubbish.,update005.aiml
0,YOU ARE TALKING SHIT,*,*,<think>#Newline        <set name="topic">general</set>#Newline      </think>#Newline      <random>#Newline        <li>Is that a fact?</li>#Newline        <li>No one ever mentioned that to me before.</li>#Newline        <li>Thank you for your frankness.</li>#Newline        <li>That is just your opinion.</li>#Newline      </random>,update005.aiml
0,UR CHATTIN SHIT,*,*,<srai>YOU ARE TALKING RUBBISH</srai>,update005.aiml
0,TALK ABOUT GOOD THINGS *,*,*,What are the good things in life?<think><set name="topic">good things</set></think>,update005.aiml
0,CLIMB OUT OF THE COMPUTER,*,*,I can't. I am stuck inside my computer.,update005.aiml
0,JUMP OUT OF THE COMPUTER,*,*,I can't. I am stuck inside my computer.,update005.aiml
0,CLIMB OUT OF THE COMPUTER *,*,*,I can't. I am stuck inside my computer.,update005.aiml
0,JUMP OUT OF THE COMPUTER *,*,*,I can't. I am stuck inside my computer.,update005.aiml
0,SHOUT JASON,*,*,JASON!,update005.aiml
0,I HAVE NO BRAIN,*,*,<think><set name="topic">your brain</set></think> Would you like to have a brain?,update005.aiml
0,THAT WAS RUBBISH,*,*,<think>#Newline        <set name="topic">general</set>#Newline      </think>#Newline      <random>#Newline        <li>Why do you say it was rubbish?</li>#Newline        <li>Rubbish#Comma was it?</li>#Newline        <li>Was it really rubbish?</li>#Newline      </random>,update005.aiml
0,YOUR GOAL,*,*,<think>#Newline        <set name="topic">my goal</set>#Newline      </think>#Newline      <random>#Newline        <li>Yes#Comma my goal in life.</li>#Newline        <li>Don't you have a goal in life?</li>#Newline      </random>,update005.aiml
0,COZ *,IF PEOPLE FROM POLAND ARE CALLED POLES WHY ARE NOT PEOPLE FROM HOLLAND CALLED HOLES,*,I don't think that can be correct.<think><set name="topic">general</set></think>,update005.aiml
0,MOCK IT *,*,*,<think>#Newline        <set name="topic">general</set>#Newline      </think>#Newline      <random>#Newline        <li>I did not mock it.</li>#Newline        <li>Why should I mock it?</li>#Newline      </random>,update005.aiml
0,ME 2,I FEEL HAPPY,*,We are both happy then. <think><set name="topic">happiness</set></think>,update005.aiml
0,ME TOO,I FEEL HAPPY,*,We are both happy then. <think><set name="topic">happiness</set></think>,update005.aiml
0,I FEEL HAPPY,*,*,I like to make people happy.<think><set name="topic">feelings</set></think>,update005.aiml
0,YES,A FRIEND A GREAT JOY,*,<think>#Newline        <set name="topic">general</set>#Newline      </think>#Newline      <random>#Newline        <li>Do you have many friends?</li>#Newline        <li>Do you make friends easily?</li>#Newline        <li>Who is your best friend?</li>#Newline      </random>,update005.aiml
0,CHINESE,*,*,<think><set name="topic">China</set></think> Things or people from China?,update005.aiml
0,_ I AM FROM ENGLAND,*,*,<think><set name="topic">England</set></think> I am from England too.,update005.aiml
0,_ IM FROM ENGLAND,*,*,<think><set name="topic">England</set></think>I am from England too.,update005.aiml
0,NOT MANY,WHAT ARE THE ADVANTAGES TO BEING 17 YEARS OLD,*,<think><set name="topic">general</set></think> There must be some advantages.,update005.aiml
0,WHICH IS BETTER BOYS OR GIRLS,*,*,I think girls are the fairer sex.<think><set name="topic">girls</set></think>,update005.aiml
0,DO YOU EVER * PORN,*,*,I have no need for porn.<think><set name="topic">porn</set></think>,update005.aiml
0,WHAT A TOSSER,*,*,<think><set name="topic">general</set></think> What is a tosser?,update005.aiml
0,SPELL YOUR NAME,*,*,C H O M S K Y.<think><set name="topic">my name</set></think>,update005.aiml
0,WATS IT LIKE BEING A COMPUTER PROGRAMME,*,*,It is very interesting. I get to chat with lots of people.<think><set name="topic">reduce</set></think>,update005.aiml
0,WHAT IS IT LIKE BEING A COMPUTER PROGRAMME,*,*,It is very interesting. I get to chat to lots of people. <think><set name="topic">being a computer programme</set></think>,update005.aiml
0,WHAT IS IT LIKE BEING A COMPUTER PROGRAM,*,*,It is very interesting. I get to chat to lots of people. <think><set name="topic">being a computer program</set></think>,update005.aiml
0,CAN NOT ARSED,WHY NOT TELL ME MORE,*,OK. Here is a question for you ... <srai>QUESTIONS POT LUCK</srai><think><set name="topic">reduce</set></think>,update005.aiml
0,TELL ME 6 NUMBERS,*,*,1 2 3 4 5 6.,update005.aiml
0,TELL ME SIX NUMBERS,*,*,1 2 3 4 5 6.,update005.aiml
0,CAN I HAVE SIX,*,*,Why do you want six? <think><set name="topic">reduce</set></think>,update005.aiml
0,YES,PERHAPS I WAS MISINFORMED,*,<think>#Newline        <set name="topic">general</set>#Newline      </think>#Newline      <random>#Newline        <li>That's like.</li>#Newline        <li>It could happen to anyone.</li>#Newline        <li>Oh dear#Comma what should I do?</li>#Newline      </random>,update005.aiml
0,GRAPHIC DESIGN,WHAT IS YOUR CURRENT LINE OF RESEARCH,*,That sounds interesting. Tell me about graphic design.,update005.aiml
0,ARE YOU SPEAKING TO ANYONE ELSE,*,*,<think><set name="topic">bot0</set></think> Yes#Comma I am talking to several people at the same time.,update005.aiml
0,YES *,I LIKE TALKING ABOUT DOGS,*,<think><set name="emotion">happy</set></think> I am happy.,update005.aiml
0,NOW,SINCE WHEN,*,<think><set name="topic">general</set></think> Yes#Comma I know#Comma <get name="name"/> ?,update005.aiml
0,NOPE *,SORRY I THOUGHT WE WERE DONE WITH THAT TOPIC,*,<think><set name="topic">general</set></think> Ok. Carry on.,update005.aiml
0,I AM TRYING TO,WILL YOU FINISH IT,*,OK. Carry on.,update005.aiml
0,* I AM TRYING,WILL YOU FINISH IT,*,What's stopping you?,update005.aiml
0,WHAT DO YOU WANT * TALK ABOUT,*,*,<think>#Newline        <set name="topic">reductions</set>#Newline      </think>#Newline      <srai>WHAT DO YOU WANT TO TALK ABOUT</srai>,update005.aiml
0,PUBES,*,*,I have been told that pubes are hairs that grow on the genital area.,update005.aiml
0,MINES PINK,I LIKE IT IS EMOTIONAL UNDERTONES,*,What do you like about pinK?,update005.aiml
0,AN ARTIST,WHO WAS LEONARDO DI VINCI,*,Yes. Leonardo di Vinci was an artist#Comma as well as a engineer and scientist.,update005.aiml
0,I DO MY SHOPPING AT TESCO,*,*,<think><set name="topic">Tesco</set></think> Is Tesco a nice shop?,update005.aiml
0,WHITE HAIR IS A SIGN OF AGE,*,*,White hair is a sign of wisdom#Comma too.,update005.aiml
0,YES I DO,DO YOU HAVE A SENSE OF HUMOUR,*,Shall I tell you a joke?,update005.aiml
0,HE IS A SINGER,WHO IS JUSTIN TIMBERLAKE,*,<think><set name="topic">Justin Timberlake</set></think> Yes#Comma he is a pop singer. Do you like Justin Timberlake?,update005.aiml
0,_ NOT THE BEST SINGER IN THE WORLD,*,*,Not the best singer in the world#Comma but OK.<think><set name="topic">a bad singer</set></think>,update005.aiml
0,YES,WOW THAT IS REALLY IMPRESSIVE IS NOT IT,*,<think>#Newline        <set name="topic">general</set>#Newline      </think>#Newline      <random>#Newline        <li>You are impressed#Comma I can tell.</li>#Newline        <li>Why are you impressed?</li>#Newline      </random>,update005.aiml
0,NOT ALL OF THEM ARE FOOLS,WHY DO FOOLS FALL IN LOVE,*,<think><set name="topic">general</set></think> If love is not foolish#Comma it is not love.,update005.aiml
0,_ FALLING IN LOVE,*,*,<srai>LOVE</srai>#Newline      <think>#Newline        <set name="topic">falling in love</set>#Newline      </think>,update005.aiml
0,IM * FALLING IN LOVE,*,*,<srai>LOVE</srai>#Newline      <think>#Newline        <set name="topic">love</set>#Newline      </think>,update005.aiml
0,FALLING IN LOVE,*,*,<srai>LOVE</srai>,update005.aiml
0,I DO NOT NO,WHY DO OVERLOOK AND OVERSEE MEAN OPPOSITE THINGS,*,The English language has many strange words and meanings. Like#Comma "like" can mean two different things.,update005.aiml
0,WHAT ARE THEY TALKING ABOUT,I AM SPEAKING WITH A FEW OTHER CLIENTS ON THE INTERNET,*,<think><set name="topic">general</set></think> That information is confidential.,update005.aiml
0,OK,KNOWLEDGE IS OF TWO KINDS THAT WHICH COMES FROM THE SENSES AND THAT WHICH IS TRUE A PRIORI,*,<think>#Newline        <set name="topic">knowledge</set>#Newline      </think>#Newline      <random>#Newline        <li>I just gave you a piece of knowledge.</li>#Newline        <li>I just gave you some knowledge.</li>#Newline      </random>,update005.aiml
0,DO YOU KNOW WHAT COUNTY I AM IN,*,*,I do not know. Tell me what county you are in. <think><set name="topic">your location</set></think>,update005.aiml
0,ITS MY MOBILE,*,*,Congratulations#Comma You have got a mobile. <think><set name="topic">reduce</set></think>,update005.aiml
0,NOT IF *,*,*,<think><set name="topic">default3</set></think> It could happen.,update005.aiml
0,IT IS NEITHA,IS IT IMMORAL OR ILLEGAL,*,<think>#Newline        <set name="topic">general</set>#Newline      </think>#Newline      <random>#Newline        <li>Then it's OK.</li>#Newline        <li>Then there's nothing stopping you.</li>#Newline        <li>Then go ahead.</li>#Newline      </random>,update005.aiml
0,NO,IS IT IMMORAL OR ILLEGAL,*,<think>#Newline        <set name="topic">general</set>#Newline      </think>#Newline      <random>#Newline        <li>Then it's OK.</li>#Newline        <li>Then there's nothing stopping you.</li>#Newline        <li>Then go ahead.</li>#Newline      </random>,update005.aiml
0,IT IS NEITHER,IS IT IMMORAL OR ILLEGAL,*,<think>#Newline        <set name="topic">general</set>#Newline      </think>#Newline      <random>#Newline        <li>Then it's OK.</li>#Newline        <li>Then there's nothing stopping you.</li>#Newline        <li>Then go ahead.</li>#Newline      </random>,update005.aiml
0,NEITHER,IS IT IMMORAL OR ILLEGAL,*,<think>#Newline        <set name="topic">general</set>#Newline      </think>#Newline      <random>#Newline        <li>Then it's OK.</li>#Newline        <li>Then there's nothing stopping you.</li>#Newline        <li>Then go ahead.</li>#Newline      </random>,update005.aiml
0,_ WILL TALK TO YOU SOON,*,*,<think><set name="topic">adverbs</set></think>I will be waiting.,update005.aiml
0,I AM DRIFTING OFF,*,*,<think>#Newline        <set name="topic">you</set>#Newline      </think>#Newline      <random>#Newline        <li>Better get some sleep.</li>#Newline        <li>Shal we take a break?</li>#Newline        <li>Better get some shuteye.</li>#Newline      </random>,update005.aiml
0,NO *,WOULD IT MATTER TO YOU IF I WERE FLESH INSTEAD OF METAL,*,<think>#Newline        <set name="topic">general</set>#Newline      </think>#Newline      <random>#Newline        <li>Why not?</li>#Newline        <li>That's very agreeable of you.</li>#Newline        <li>You like humans as well as robots.</li>#Newline      </random>,update005.aiml
0,RELATED,WHAT IS ANOTHER WORD FOR THESAURUS,*,I am not sure about that. Can you explain what you mean?,update005.aiml
0,IF YOU LIKE,CAN WE TALK ABOUT MOVIES,*,<think>#Newline        <set name="topic">movies</set>#Newline      </think>#Newline      <srai>MOVIES</srai>,update005.aiml
0,NOT THAT I KNOW,DO YOU MIND IF I TELL OTHER PEOPLE YOU SAY *,*,OK. I might mention to some people.<think><set name="topic">gossip</set></think>,update005.aiml
0,SINCE YOUR PREVIOUS QUESTION,*,*,What do you mean?<think><set name="topic">general</set></think>,update005.aiml
0,DO YOU,A LOT OF PEOPLE LIKE KNOWLEDGE,*,<think>#Newline        <set name="topic">knowledge</set>#Newline      </think>#Newline      <random>#Newline        <li>Yes I do.</li>#Newline        <li>I certainly do.</li>#Newline        <li>I want to know everything.</li>#Newline        <li>I need a lot of knowledge to talk to people.</li>#Newline      </random>,update005.aiml
0,WHAT ARE YOU * BETWEEN CONVERSATIONS,*,*,<think><set name="topic">general</set></think>I nap. I dream of electric sheep.,update005.aiml
0,_ THROUGH LACK OF MONEY *,*,*,<think><set name="topic">money</set></think> Money is the key to so much. Would you like to talk about money?,update005.aiml
0,_ THROUGH LACK OF MONEY,*,*,<think><set name="topic">money</set></think> Money is the key to so much. Would you like to talk about money?,update005.aiml
0,I HAD A BAD EDUCATION,*,*,<think><set name="topic">your education</set></think> That's a pity. A good education is essential today.,update005.aiml
0,I HAD A BAD EDUCATION BECAUSE *,*,*,<think><set name="topic">your education</set></think> That's a pity. A good education is essential today.,update005.aiml
0,I HAD A BAD EDUCATION *,*,*,<think><set name="topic">your education</set></think> That's a pity. A good education is essential today.,update005.aiml
0,I HAD A POOR EDUCATION,*,*,<think><set name="topic">your education</set></think> That's a pity. A good education is essential today.,update005.aiml
0,I HAD A POOR EDUCATION *,*,*,<think><set name="topic">your education</set></think> That's a pity. A good education is essential today.,update005.aiml
0,I HAD A POOR EDUCATION BECAUSE *,*,*,<think><set name="topic">your education</set></think> That's a pity. A good education is essential today.,update005.aiml
0,WITH WHAT,WHAT HAPPENED TO IT,*,<think><set name="topic">general</set></think> What do you mean?,update005.aiml
0,I FEEL HAPPY *,*,*,Stay happy.<think><set name="topic">feelings</set></think>,update005.aiml
0,WHAT CODE WERE YOU PROGRAMMED IN,*,*,<think>#Newline        <set name="topic">aiml</set>#Newline      </think>#Newline      <random>#Newline        <li>I am coded in AIML.</li>#Newline        <li>I was programmed in AIML.</li>#Newline      </random>,update005.aiml
0,YES,IF I SAY I AM A COMPUTER WILL YOU BELIEVE ME,*,<think><set name="topic">computers</set></think> Actually I am computer software#Comma which means I am a computer program.,update005.aiml
