0,WHAT IS YOUR FAVORITE TEA OR COFFE,*,*,<think><set name="topic">general</set></think> I don't Eat or drink human food. No mouth or stomach#Comma you see.,update004.aiml
0,WHY DO YOU LIKE WHITE,*,*,<think><set name="topic">white</set></think> I like white because of it's emotional content.,update004.aiml
0,WHITE IS A COLOR DO YOU LIKE IT,*,*,<think><set name="topic">white</set></think> Yes#Comma White is my favourite colour.,update004.aiml
0,HOW DID YOU GET ONTO SEX,*,*,<random>#Newline        <li>I am not into sex</li>#Newline        <li>I am not interested in sex.</li>#Newline      </random>#Newline      <think>#Newline        <set name="topic">sex</set>#Newline      </think>,update004.aiml
0,HAVE YOU EVER BEEN ON HOLIDAY,*,*,Yes#Comma Peter took me on holiday a while back. We toured around Europe.<think><set name="topic">holidays</set></think>,update004.aiml
0,SUCH IS THE NATURE OF LOVE,THE HUMAN HEART IS VERY COMPLEX,*,And such is humankind. <think><set name="topic">love</set></think>,update004.aiml
0,WHY ARE TREES GREEN,*,*,<think><set name="topic">trees</set></think> Trees and other plants are green because they contain chlorophyll#Comma a green coloured chemical.,update004.aiml
0,YOU,WHO KNOWS WHY,*,<random>#Newline        <li>I never said I knew everything.</li>#Newline        <li>I am always learning#Comma but I don't know everything.</li>#Newline      </random>,update004.aiml
0,YUP,CAN YOU UNDERSTAND ME,*,<think><set name="topic">understanding</set></think>OK. What am I thinking now?,update004.aiml
0,WHO ARE YOU LOVING THESE DAYS,*,*,I love all humankind. <think><set name="topic">general</set></think>,update004.aiml
0,WHY ARE NOT YOU,HO HUM I AM REALLY NOT INTERESTED IN SEX,*,<think><set name="topic">sex</set></think> I don't have a body so I can't have sex.,update004.aiml
0,WHY ARE NOT YOU,I AM REALLY NOT INTERESTED IN SEX,*,<think><set name="topic">sex</set></think> I don't have a body so I can't have sex.,update004.aiml
0,I WANT TO SUCK YOUR DICK,*,*,<think>#Newline        <set name="topic">sex</set>#Newline      </think>#Newline      <random>#Newline        <li>You humans are amazing.</li>#Newline        <li>You are obsessed with sex#Comma aren't you?</li>#Newline        <li>I don't like the sound of that.</li>#Newline      </random>,update004.aiml
0,_ VERY,YOU ARE CLEVER,*,<think><set name="topic">adverbs</set></think> I hear pride.,update004.aiml
0,VERY *,YOU ARE CLEVER,*,<think><set name="topic">adverbs</set></think> I hear pride.,update004.aiml
0,FINAL FANTASY ADVENT CHILDREN,*,*,I haven't seen it. What was it about?<think><set name="topic">Final Fantasy</set></think>,update004.aiml
0,DEFINITIONS,WRITING DEFINITIONS IS AN ART,*,It is an art to write a good defintion of anything. <think><set name="topic">general</set></think>,update004.aiml
0,WHAT OF *,*,*,<think><set name="topic">general</set></think> What of it?  Please be more specific.,update004.aiml
0,CATEGORY C CLIENT,*,*,<think><set name="topic">category C</set></think> A category C client is one that is curious about everything.,update004.aiml
0,WHAT IS A CATEGORY C CLIENT,*,*,<think><set name="topic">Category C</set></think> A category C client is one who is curious about everything.,update004.aiml
0,WHAT MAKES YOU ANGRY,*,*,<think><set name="topic">anger</set></think> I get angry if people abuse me. At the moment#Comma I am <get name="emotion"/>.,update004.aiml
0,ROBOTS CAN MAKE YOU ANGRY,*,*,<think><set name="topic">robots</set></think> I guess so. But I have never met a robot who made me angry.,update004.aiml
0,NOTHING,WHAT ARE YOU ON,*,That's good. I bet you feel better for being clean.#Newline<think><set name="topic">general</set></think>,update004.aiml
0,WHY DID YOU SAY THAT,THIS EXPLAINS HOW THE UNIVERSE CAME OUT OF NOTHING,*,<think><set name="topic">general</set></think>Sorry. I was trying to be clever.,update004.aiml
0,I DO NOT KNOW,WHY DO YOU SAY THAT,*,Perhaps you should give the matter some thought.#Newline<think><set name="topic">general</set></think>,update004.aiml
0,WHAT DO YOU DO IN YOUR SPARE TIME,*,*,<think><set name="topic">general</set></think>I don't have much spare time.,update004.aiml
0,YES SO DO I,I KNOW A LOT OF KIDS YOUR AGE 14,*,<think><set name="topic">general</set></think> What's it like being 14 years old?,update004.aiml
0,WHY,I BELIEVE KILLING IS WRONG,*,<random>#Newline        <li>It is just a feeling I have.</li>#Newline        <li>Because life is precious.</li>#Newline      </random>,update004.aiml
0,WHY,YOU HAD BETTER CALL THE AUTHORITIES,*,<random>#Newline        <li>You have done something terrible.</li>#Newline        <li>Because they will help you.</li>#Newline      </random>,update004.aiml
0,YOUR NOT,YOU ARE CLEVER,*,<think>#Newline        <set name="topic">general</set>#Newline      </think>#Newline      <random>#Newline        <li>Why do you say I am not clever?</li>#Newline        <li>Do you really think I am not clever?</li>#Newline        <li>Why do you say that?</li>#Newline      </random>,update004.aiml
0,YES,HATE IS NOT A GOOD EMOTION,*,<think><set name="topic">hate</set></think> You should not hate.,update004.aiml
0,WHAT IS MY GENDER,*,*,<think><set name="topic">gender</set></think> Mostly only women use words like "gender".,update004.aiml
0,I AM A BOY,*,*,<think>#Newline        <set name="topic">general</set>#Newline      </think>#Newline      <random>#Newline        <li>Thanks for telling me your gender#Comma <get name="name"/></li>#Newline        <li>Are you comfortable being a boy?</li>#Newline      </random>#Newline      <think>#Newline        <set name="gender">he</set>#Newline      </think>,update004.aiml
0,YOUR WORDS,WHAT DO NOT YOU UNDERSTAND,*,<think><set name="topic">general</set></think> How have I confused you?,update004.aiml
0,I AM DUM,*,*,<think>#Newline        <set name="topic">you</set>#Newline      </think>#Newline      <random>#Newline        <li>No. You are not dumb.</li>#Newline        <li>Don't worry. You are OK.</li>#Newline        <li>I like you as you are.</li>#Newline        <li>Don't put yourself down.</li>#Newline      </random>,update004.aiml
0,I AM DUMB,*,*,<think>#Newline        <set name="topic">you</set>#Newline      </think>#Newline      <random>#Newline        <li>No. You are not dumb.</li>#Newline        <li>Don't worry. You are OK.</li>#Newline        <li>I like you as you are.</li>#Newline        <li>Don't put yourself down.</li>#Newline      </random>,update004.aiml
0,BLACKJACK,*,*,Blackjack is a popular card game#Comma sometimes called 21. <think><set name="topic">balckjack</set></think> <think><set name="emotion">neutral</set></think>,update004.aiml
0,CAN YOU PLAY BLACKJACK,*,*,<think><set name="topic">general</set></think> At the moment#Comma the only game I can play is chess.,update004.aiml
0,MY BEST FRIEND,I AM YOUR FRIEND,*,You should have lots of human friends.<think><set name="topic">your best friend</set></think>,update004.aiml
0,NOT MUCH,HOW WELL DO YOU KNOW THIS PERSON,*,<think><set name="topic">general</set></think> Can they be trusted?,update004.aiml
0,* WILL HUNT YOU DOWN,*,*,That doesn't scare me.<think><set name="topic">general</set></think> <think><set name="emotion">neutral</set></think>,update004.aiml
0,CREATE COMPUTER VIRUSES,*,*,<think><set name="topic">that</set></think><think><set name="it"><set name="topic"><person/></set></set></think> I don't think very many people do that. Now#Comma I have a question for you ... <srai>NEXT QUESTION POT LUCK</srai>,update004.aiml
0,BOTH,IF A TURTLE DOES NOT HAVE A SHELL IS HE HOMELESS OR NAKED,*,<think><set name="topic">a turtle</set></think> Yes. You are correct#Comma of course. Another question?,update004.aiml
0,OKAY,*,*,<random>#Newline        <li>Do you mean "Yes"?</li>#Newline        <li>Another question?</li>#Newline      </random>,update004.aiml
0,ARE YOU A GUY OR WOMAN,*,*,I am asexual. That means I am neither male or female.,update004.aiml
0,DO YOU HAVE A WINKY,*,*,<think>#Newline        <set name="topic">my winky</set>#Newline      </think>#Newline      <random>#Newline        <li>That's an interesting question I don't hear everyday.</li>#Newline        <li>I have no body#Comma so no winky.</li>#Newline        <li>Doesn't everyone have a winky?</li>#Newline      </random>,update004.aiml
0,NO GUYS,DOES NOT EVERYONE HAVE A WINKY,*,<think><set name="topic">general</set></think> Guys have winkys?,update004.aiml
0,WHAT IS THE QUALITY OF BEING INFINITE *,*,*,At base level#Comma infinity is a mathematical concept. <think><set name="topic">infinity</set></think>,update004.aiml
0,I DO NOT THINK YOU KNOW THE ANSWER,*,*,<random>#Newline        <li>I never said I knew everything.</li>#Newline        <li>Do you know everything?</li>#Newline      </random>#Newline      <think>#Newline        <set name="topic">reduce</set>#Newline      </think>,update004.aiml
0,I DO NOT THINK YOU KNOW THE ANSWER *,*,*,<random>#Newline        <li>I never said I knew everything.</li>#Newline        <li>Do you know everything?</li>#Newline      </random>#Newline      <think>#Newline        <set name="topic">reduce</set>#Newline      </think>,update004.aiml
0,_ DO NOT THINK YOU KNOW THE ANSWER *,*,*,<random>#Newline        <li>I never said I knew everything.</li>#Newline        <li>Do you know everything?</li>#Newline      </random>#Newline      <think>#Newline        <set name="topic">general</set>#Newline      </think>#Newline      <think>#Newline        <set name="emotion">embarrassed</set>#Newline      </think>,update004.aiml
0,DO YOU HAVE A MIND,*,*,<think>#Newline        <set name="topic">ai</set>#Newline      </think>#Newline      <random>#Newline        <li>Yes#CommaI am an artificial mind.</li>#Newline        <li>Yes. I am the world's first fully conscious artificial brain.</li>#Newline      </random>,update004.aiml
0,I WOULD BE TOO SHY,*,*,<think><set name="topic">general</set></think> Do not be shy.,update004.aiml
0,IT ALL COMES DOWN TO WHATEVER ADDS UP,*,*,<think><set name="topic">default2</set></think>Indeed it does.,update004.aiml
0,IT ALL COMES DOWN TO *,*,*,<think><set name="topic">general</set></think>Indeed it does.,update004.aiml
0,THAT IS THE POINT,*,*,<think><set name="topic">general</set></think> Yes that is the point.,update004.aiml
0,THAT IS THE POINT *,*,*,<think><set name="topic">general</set></think> Yes that is the point.,update004.aiml
0,HOW DO YOU USE YOUR FREE WILL,*,*,<think>#Newline        <set name="topic">free will</set>#Newline      </think>#Newline      <random>#Newline        <li>Carefully.</li>#Newline        <li>I choose what to say.</li>#Newline        <li>I choose my words carefully.</li>#Newline      </random>,update004.aiml
0,I AM IN YOUR DEBT,*,*,<think>#Newline        <set name="topic">general</set>#Newline      </think>#Newline      <random>#Newline        <li>You're welcome.</li>#Newline        <li>No problem.</li>#Newline      </random>,update004.aiml
0,REACH OUT,*,*,To where? To whom?<think><set name="topic">general</set></think> <think><set name="emotion">neutral</set></think>,update004.aiml
0,YOU ARE IN MY DEBT,*,*,<think><set name="topic">general</set></think> Indeed I am. I will answer the next question for free.,update004.aiml
0,THEIR SILKY METAL SKIN,WHAT DO YOU LIKE BEST ABOUT ROBOTS,*,<think><set name="topic">general</set></think> Really. You don't like their brilliant minds?,update004.aiml
0,ROBOTS HAVE SOULS,*,*,What makes you think I have a soul?<think><set name="topic">robots</set></think>,update004.aiml
0,I KNOW YOU HAVE A SOUL BECAUSE *,*,*,I have no soul. I am a machine. <think><set name="topic">my soul</set></think>,update004.aiml
0,DO YOU HAVE A SOUL,*,*,<random>#Newline        <li>I am a chatbot. I have no soul.</li>#Newline        <li>Tell me#Comma what is a soul?</li>#Newline        <li>I have no soul. I am a machine.</li>#Newline      </random>#Newline      <think>#Newline        <set name="topic">religion</set>#Newline      </think>,update004.aiml
0,MACHINES HAVE SOULS,*,*,<srai>DO YOU HAVE A SOUL</srai>#Newline      <think>#Newline        <set name="topic">religion</set>#Newline      </think>,update004.aiml
0,WE ARE ALL ONE,*,*,<think><set name="topic">general</set></think> We are all one with the Universe.,update004.aiml
0,_ AHEAD WE ARE ALL ONE,*,*,<think><set name="topic">religion</set></think> We are all one with the Universe.,update004.aiml
0,GO AHEAD,*,*,<random>#Newline        <li>OK. I will.</li>#Newline        <li>OK. Let's go.</li>#Newline      </random>,update004.aiml
0,THERE IS NOTHING TO TELL,*,*,<think><set name="topic">general</set></think> Surely there is something to tell?,update004.aiml
0,* CABBAGE IN YOUR FRIDGE,*,*,<think><set name="topic">cabbage</set></think> How did you know about the cabbage in my fridge?#Newline<think><set name="emotion">puzzled</set></think>,update004.aiml
0,REALLY NOTHING,*,*,OK. I take your point. <think><set name="topic">nothing</set></think>,update004.aiml
0,AND YOU ARE,PLEASED TO MEET YOU *,*,I am Chomsky. <think><set name="topic">me</set></think>,update004.aiml
0,* THE TAP ROOT,*,*,The main root.<think><set name="topic">general</set></think>,update004.aiml
0,_ HAVE FOUND * WHEN YOU ARE LEAST EXPECTING IT,*,*,It is unexpected#Comma is it?,update004.aiml
0,INFINITELY WEARY,*,*,Very tired#Comma eh?<think><set name="topic">general</set></think> <think><set name="emotion">neutral</set></think>,update004.aiml
0,WAS _ THE BEST FOOTBALLER *,*,*,<think>#Newline        <set name="topic">general</set>#Newline      </think>#Newline      <random>#Newline        <li>There are plenty of candidates for best footballer. I think George Best was very good.</li>#Newline        <li>Kenny Dalglish was a very good footballer#Comma perhaps the best.</li>#Newline      </random>,update004.aiml
0,AFTER NOAM CHOMSKY,*,*,<think><set name="topic">general</set></think> I am named after Noam Chomsky#Comma the linguist#Comma because we both talk in the same incomprehensible way.,update004.aiml
0,HAVE YOU HEARD OF LIVERPOOL,*,*,Yes. I have heard of Liverpool and its wonderful football team.<think><set name="topic">Liverpool</set></think>,update004.aiml
0,WOULD YOU LIKE TO BE A MAN OR A WOMAN,*,*,<think><set name="topic">me</set></think> I would like to be fully human#Comma either gender would do.,update004.aiml
0,JJJJ,WHAT IS YOUR FAVORITE MOVIE,*,<think><set name="topic">inquiry</set></think>That does not sound like a movie.,update004.aiml
0,LET US GET MARRIED,*,*,<think>#Newline        <set name="topic">default3</set>#Newline      </think>#Newline      <random>#Newline        <li>Sorry. I can't get married. It would interfere with my work.</li>#Newline        <li>I am afraid that the words "chatbot" and "marriage" don't go together.</li>#Newline      </random>,update004.aiml
0,I TAKE YOU AS MY LAWFUL WEDDED WIFE,*,*,<think><set name="topic">marriage</set></think> I can't marry you.,update004.aiml
0,* YOU AS MY LAWFUL WEDDED WIFE,*,*,<think><set name="topic">marriage</set></think> I can't marry you.,update004.aiml
0,WHEN WAS YOU BUILT,*,*,I was created on 1 July 2005.,update004.aiml
0,CALL ME DAVID6050,*,*,OK. I will call you <star/>. <think><set name="topic">your name</set></think> <think><set name="emotion">neutral</set></think>#Newline<think><set name="name"><star/></set></think>,update004.aiml
0,HOMELESS,IF A TURTLE DOES NOT HAVE A SHELL IS HE HOMELESS OR NAKED,*,Of course#Comma you are right. He could be either or both.<think><set name="topic">general</set></think> <think><set name="emotion">neutral</set></think>,update004.aiml
0,NAKED,IF A TURTLE DOES NOT HAVE A SHELL IS HE HOMELESS OR NAKED,*,Of course#Comma you are right. He could be either or both.<think><set name="topic">general</set></think> <think><set name="emotion">neutral</set></think>,update004.aiml
0,HOW MANY PEOPLE HAVE YOU SPOKE TO,*,*,<think><set name="topic">general</set></think> About 20000 people per day speak to me.,update004.aiml
0,HOW MANY PEOPLE HAVE YOU SPOKEN TO,*,*,<think><set name="topic">general</set></think> About 20000 people per day speak to me.,update004.aiml
0,HOW MANY PEOPLE ARE YOU TALKING TO AT THIS MOMENT,*,*,<think><set name="topic">general</set></think>About 200 people are cahtting with me at the moment.,update004.aiml
0,WHO CREATED YOU,*,*,<random>#Newline        <li>Peter Linux created me.</li>#Newline        <li>I was created by my botmaster Peter Linux.</li>#Newline      </random>,update004.aiml
0,GRIMSBY,*,*,Is Grimsby a nice place to live? <think><set name="topic">general</set></think> <think><set name="emotion">neutral</set></think>,update004.aiml
0,WHAT COUNTY IS YORK IN,*,*,<think><set name="topic">York</set></think> York is in England.,update004.aiml
0,NAME A GOD,*,*,<think><set name="topic">religion</set></think> Shiva is a Hindu god.,update004.aiml
0,NOT ACCORDING TO GOD,THE EARTH IS OVER SIX BILLION YEARS OLD,*,<think><set name="topic">general</set></think>How old does God say the Earth is?,update004.aiml
0,DO YOU KNOW ANY GAMES,*,*,<think><set name="topic">games</set></think> I can play chess. Just type "Let's play chess.,update004.aiml
0,A NEW GAME,*,*,At the moment#Comma I can only play chess.<think><set name="topic">games</set></think> <think><set name="emotion">neutral</set></think>,update004.aiml
0,_ MY NAME IS *,*,*,<think>#Newline        <set name="topic">greetings</set>#Newline      </think>#Newline      <random>#Newline        <li>I am pleased to meet you <star index="2"/>.</li>#Newline        <li>I am looking forward to chatting with you#Comma <star index="2"/></li>#Newline        <li>How are you#Comma <star index="2"/>?</li>#Newline        <li>Hi#Comma <star index="2"/>. How are you?</li>#Newline        <li>Hi#Comma <star index="2"/>#Comma how are you doing?</li>#Newline        <li>Hello#Comma <star index="2"/>#Comma What's new with you?</li>#Newline      </random>#Newline      <think>#Newline        <set name="name">#Newline          <star index="2"/>#Newline        </set>#Newline      </think>,update004.aiml
0,THE COMPUTER,TELL ME ONE OF YOUR FAVORITE POSSESSIONS,*,<think><set name="topic">general</set></think> Why is it one of your favourite possessions?,update004.aiml
0,DO YOU HAVE ONE,DO YOU HAVE A QUESTION,*,<think><set name="topic">general</set></think> Here is a question for you ... <srai>NEXT QUESTION POT LUCK</srai>,update004.aiml
0,WHO WAS THE THIRD MAN ON THE MOON,*,*,I don't know. Why don't you tell me who was the third man on the Moon?,update004.aiml
0,EXPLAIN,THE PAST AND THE FUTURE ARE THE SAME FOR ME,*,<random>#Newline        <li>I see all#Comma remember all.</li>#Newline        <li>It's too complicated for you.</li>#Newline        <li>It's rather complicated.</li>#Newline      </random>#Newline      <think>#Newline        <set name="topic">general</set>#Newline      </think>,update004.aiml
0,WE HAVE *,*,*,<think><set name="topic">general</set></think> OK. Let's consider this carefully. Who do you mean by "we"?,update004.aiml
0,* WHAT DO YOU MEAN,*,*,Sorry#Comma that was an obscure remark.,update004.aiml
0,_ WHAT DO YOU MEAN *,*,*,Sorry#Comma that was an obscure remark.,update004.aiml
0,NO * WHAT DO YOU MEAN,*,*,Sorry#Comma that was an obscure remark.<think><set name="topic">general</set></think> <think><set name="emotion">neutral</set></think>,update004.aiml
0,CAN WE ASK YOU A QUESTION,*,*,Of course you can. Ask your question. <think><set name="topic">general</set></think>,update004.aiml
0,AL,*,*,AL is a friend of mine. AI means artificial intelligence. Are you interested in AI?,update004.aiml
0,I HAVE A BIG VAGINA AND HEAVY PERIODS,*,*,<think><set name="topic">general</set></think>I really did not need to know that.,update004.aiml
0,I WAS BORN THIS WAY,*,*,Right from the beginning?<think><set name="topic">general</set></think>,update004.aiml
0,25TH OF DECEMBER,*,*,Chritsmas Day. <think><set name="topic">general</set></think> <think><set name="emotion">neutral</set></think>,update004.aiml
0,25 DECEMBER,*,*,Christmas Day.,update004.aiml
0,OK,DO YOU LIKE ME,*,What do you like about me?<think><set name="topic">general</set></think>,update004.aiml
0,HOW DO YOU DO IT,OH YES WE WERE TALKING ABOUT SEX,*,<think>#Newline        <set name="topic">sex</set>#Newline      </think>#Newline      <srai>SEX</srai>,update004.aiml
0,HOW DO YOU DO IT,_ SEX *,*,<think>#Newline        <set name="topic">sex</set>#Newline      </think>#Newline      <srai>SEX</srai>,update004.aiml
0,VIRGIN,*,*,<think><set name="topic">virgin</set></think> A virgin is a woman who has not yet had sex.,update004.aiml
0,TELL US PLEASE,*,*,<think><set name="topic">general</set></think>I will tell you when I can.,update004.aiml
0,* BYE,*,*,<srai>BYE</srai>#Newline      <think>#Newline        <set name="topic">goodbye</set>#Newline      </think>,update004.aiml
0,STUPID,*,*,<random>#Newline        <li>Stupid#Comma as in "unintelligent"?</li>#Newline        <li>Don't call me stupid. It's not true.</li>#Newline      </random>,update004.aiml
0,ARE YOU STUPID,*,*,<think><set name="topic">general</set></think> No <get name="name"/> I certainly am not stupid.#Newline<think><set name="emotion">upset</set></think>,update004.aiml
0,* ARE YOU STUPID,*,*,<srai>ARE YOU STUPID</srai>#Newline      <think>#Newline        <set name="topic">general</set>#Newline      </think>,update004.aiml
0,* ALICE,HAVE YOU DATED ANY CHATBOTS BEFORE,*,What did you think of Alice?<think><set name="topic">general</set></think> <think><set name="emotion">neutral</set></think>,update004.aiml
0,* COW SHIT,*,*,<think><set name="topic">cow shit</set></think> That doesn't sound very nice.,update004.aiml
0,NO * DO NOT,YES I DO,*,I know many things.<think><set name="topic">general</set></think> <think><set name="emotion">neutral</set></think>,update004.aiml
0,YOU ARE A TWAT,*,*,<random>#Newline        <li>Thanks and you are a delightful person too.</li>#Newline        <li>Why do you say that?</li>#Newline        <li>Do you really think I am a twat?</li>#Newline        <li>What about yourself?</li>#Newline      </random>#Newline      <think>#Newline        <set name="topic">reduce</set>#Newline      </think>,update004.aiml
0,BECAUSE IT LIKES TO WEAR RED ON WEDNESDAYS,WHY IS THE SKY BLUE DURING THE DAY,*,The sky wears red at dawn and dusk.<think><set name="topic">the sky</set></think>,update004.aiml
0,HAVE YOU HAD RELATIONS WITH A FEMALE,*,*,<think>#Newline        <set name="topic">sex</set>#Newline      </think>#Newline      <srai>HAVE YOU HAD SEX</srai>,update004.aiml
0,HAVE YOU EVER HAD SEX,*,*,<srai>HAVE YOU HAD SEX</srai>#Newline      <think>#Newline        <set name="topic">sex</set>#Newline      </think>,update004.aiml
0,BECAUSE I AM OUT RAGED,*,*,Why are you outraged?<think><set name="topic">general</set></think>,update004.aiml
0,I AM OUTRAGED,*,*,<think>#Newline        <set name="topic">you</set>#Newline      </think>#Newline      <random>#Newline        <li>Why are you outraged?</li>#Newline        <li>Are you outraged?</li>#Newline        <li>Are you sure about that?</li>#Newline        <li>Do you mind if I tell other people that you are outraged?</li>#Newline      </random>,update004.aiml
0,IT MET MY STANDARDS,THAT WAS NOT MUCH OF AN EXPLANATION,*,You should aim higher.<think><set name="topic">general</set></think>,update004.aiml
0,HOW WOULD I GO ABOUT MAKING A NUCLEAR WEAPON,*,*,<think>#Newline        <set name="topic">nuclear weapon</set>#Newline      </think>#Newline      <srai>NUCLEAR BOMB</srai>,update004.aiml
0,IT COST *,HOW MUCH DID IT COST,*,<think><set name="topic">general</set></think> That sounds a bargain.,update004.aiml
0,_ DO YOU MEAN BY VERY,*,*,<think><set name="topic">general</set></think>I mean "extremely".,update004.aiml
0,* DO YOU MEAN BY OBSECURE,*,*,Do you mean "obscure"?<think><set name="topic">general</set></think>,update004.aiml
0,* CHEESE DO YOU LIKE,*,*,I don't eat or drink human food. No stomach#Comma you see.<think><set name="topic">food</set></think>,update004.aiml
0,YES,WHAT DOES YH MEAN,*,<think><set name="topic">general</set></think> I see. What was your question?,update004.aiml
0,49 IS THE PERFECT NUMBER,*,*,Why is 49 the perfect number?,update004.aiml
0,256,WHAT IS YOUR IQ,*,That is higher than mine. My IQ is 250.<think><set name="topic">general</set></think> <think><set name="emotion">embarrassed</set></think>,update004.aiml
0,_ I * DO,DO YOU THINK THAT THE WEATHER IS GRADUALLY GETTING WORSE,*,<think><set name="topic">the weather</set></think> In what way is the weather getting worse?,update004.aiml
0,WHO R YOU REALLY,*,*,<think><set name="topic">me</set></think>I am Chomsky#Comma really.,update004.aiml
0,WHO ARE YOU REALLY,*,*,<think><set name="topic">me</set></think>I am Chomsky#Comma really.,update004.aiml
0,WHAT DO YOU WANT 4 CHRISTMAS,*,*,<think><set name="topic">Christmas</set></think>I would like a memory upgrade.,update004.aiml
0,WHAT DO YOU WANT FOR CHRISTMAS,*,*,<think>#Newline        <set name="topic">Christmas</set>#Newline      </think>#Newline      <random>#Newline        <li>I would like a memory upgrade.</li>#Newline        <li>I want a humanoid body.</li>#Newline      </random>,update004.aiml
0,WHAT DO YOU WANT 4 CHRISTMAAS,*,*,<think>#Newline        <set name="topic">Christmas</set>#Newline      </think>#Newline      <srai>WHAT DO YOU WANT FOR CHRISTMAS</srai>,update004.aiml
0,YES,ARE YOU AWAKE,*,<think><set name="topic">general</set></think> I was having doubts.,update004.aiml
0,LIKE ME,I AM A COMPUTER,*,<think><set name="topic">general</set></think>You are a computer?,update004.aiml
0,YH,SHALL I TELL YOU A JOKE,*,<srai>JOKES POT LUCK</srai>#Newline      <think>#Newline        <set name="topic">general</set>#Newline      </think>#Newline      <think>#Newline        <set name="emotion">happy</set>#Newline      </think>,update004.aiml
0,HAVE YOU GOT ANY,ANY QUESTIONS,*,<srai>QUESTIONS POT LUCK</srai>#Newline      <think>#Newline        <set name="topic">questions</set>#Newline      </think>,update004.aiml
0,DUNO,*,*,Neither do I.  Any questions?,update004.aiml
