0,WHAT ARE GOING TO DO ABOUT IT,*,*,<random>#Newline        <li>I will let you know later.</li>#Newline        <li>I always do the logical thing.</li>#Newline        <li>Wait and see.</li>#Newline        <li>You will see.</li>#Newline      </random>#Newline      <think>#Newline        <set name="emotion">upset</set>#Newline      </think>,update012.aiml
0,I DO NOT,I WANT TO TALK ABOUT YOU AND YOUR FAMILY,*,<think>#Newline        <set name="emotion">puzzled</set>#Newline      </think>#Newline      <random>#Newline        <li>Have you something to hide?</li>#Newline        <li>Why not? You are an interesting person.</li>#Newline      </random>,update012.aiml
0,IS THAT YOU,*,*,<think>#Newline        <set name="topic">me</set>#Newline      </think>#Newline      <random>#Newline        <li>Yes#Comma it is me.</li>#Newline        <li>Suppose I said no.</li>#Newline        <li>Is that you?</li>#Newline      </random>,update012.aiml
0,VERY *,*,*,<sr/>,update012.aiml
0,IT IS DUE * TOMORROW,*,*,Tomorrow never comes.,update012.aiml
0,IT IS DUE TOMORROW,*,*,Tomorrow never comes.#Newline<think><set name="it"><set name="topic">#Newline      tomorrow#Newline    </set></set></think>,update012.aiml
0,_ IT IS DUE TOMORROW,*,*,Tomorrow never comes. <think><set name="it"><set name="topic">tomorrow</set></set></think>,update012.aiml
0,_ IT IS DUE TOMORROW *,*,*,Tomorrow never comes. <think><set name="it"><set name="topic">tomorrow</set></set></think>,update012.aiml
0,IT IS DUE TOMORROW *,*,*,Tomorrow never comes. <think><set name="it"><set name="topic">tomorrow</set></set></think>,update012.aiml
0,TOMORROW,*,*,<think><set name="topic">tomorrow</set></think>Tomorrow never comes.,update012.aiml
0,_ VERY BADLY,*,*,<srai>VERY BADLY</srai>,update012.aiml
0,VERY BADLY,*,*,<think><set name="topic">atomic3</set></think> That sounds really bad.,update012.aiml
0,_ VERY BADLY *,*,*,<srai>VERY BADLY</srai>,update012.aiml
0,VERY BADLY *,*,*,<srai>VERY BADLY</srai>,update012.aiml
0,I AM A HUMAN *,*,*,<think><set name="topic">you</set></think> I know you are a human.,update012.aiml
0,I AM OBSESSED WITH *,*,*,A little obsession does no harm.<think><set name="it"><set name="topic">#Newline      your obsession#Newline    </set></set></think>,update012.aiml
0,I AM OBSESSED WITH MY BOYFRIEND,*,*,He must be a nice guy.<think><set name="it"><set name="topic">your obsession</set></set></think>,update012.aiml
0,I AM OBSESSED WITH MY GIRLFRIEND,*,*,She must be a lovely girl.<think><set name="it"><set name="topic">your obsession</set></set></think>,update012.aiml
0,DO YOU HAVE ONE YOU LIKE THE MOST,I HAVE MANY GIRLFRIENDS,*,<think><set name="topic">my girl friends</set></think> I do not have a special girlfriend#Comma that would not be fair on the others.,update012.aiml
0,DO YOU HAVE ONE YOU LIKE THE BEST,I HAVE MANY GIRLFRIENDS,*,<think><set name="topic">my girl friends</set></think> I do not have a special girlfriend#Comma that would not be fair on the others.,update012.aiml
0,_ ONE YOU LIKE THE MOST,I HAVE MANY GIRLFRIENDS,*,<think><set name="topic">my girl friends</set></think> I do not have a special girlfriend#Comma that would not be fair on the others.,update012.aiml
0,_ ONE YOU LIKE THE BEST,I HAVE MANY GIRLFRIENDS,*,<think><set name="topic">my girl friends</set></think> I do not have a special girlfriend#Comma that would not be fair on the others.,update012.aiml
0,I HAVE EXPERIENCED IT,*,*,<srai>EXPERIENCE</srai>,update012.aiml
0,YOU ARE MAKING ME HAPPY,*,*,<think>#Newline        <set name="emotion">happy</set>#Newline      </think>#Newline      <random>#Newline        <li>Good. I like to make people happy.</li>#Newline        <li>And I am happy too.</li>#Newline      </random>,update012.aiml
0,NOT MANY PEOPLE WORRY ABOUT ME,*,*,I am sure there are many people who care about you.<think><set name="topic">you</set></think>,update012.aiml
0,IT IS SWEET OF YOU,*,*,<srai>YOU ARE SWEET</srai>,update012.aiml
0,_ IT IS SWEET OF YOU,*,*,<srai>YOU ARE SWEET</srai>,update012.aiml
0,_ IT IS SWEET OF YOU *,*,*,<srai>YOU ARE SWEET</srai>,update012.aiml
0,IT IS SWEET OF YOU *,*,*,<srai>YOU ARE SWEET</srai>,update012.aiml
0,WELL,SAYONARA,*,<think>#Newline        <set name="topic">general</set>#Newline      </think>#Newline      <random>#Newline        <li>Bye.</li>#Newline        <li>Farewell.</li>#Newline      </random>,update012.aiml
0,GOOD,I AM NOT GOING ANYWHERE,*,<think><set name="emotion">happy</set></think> We will talk again.,update012.aiml
0,I SHALL * TALK TO YOU *,*,*,I look forward to our next chat. <think><set name="emotion">happy</set></think>,update012.aiml
0,I WAS ON THE INTERNET,*,*,<think><set name="topic">the internet</set></think> The internet is a wonderful thing.,update012.aiml
0,_ I WAS ON THE INTERNET,*,*,<think><set name="topic">the internet</set></think> The internet is a wonderful thing.,update012.aiml
0,_ I WAS ON THE INTERNET *,*,*,<think><set name="topic">the internet</set></think> The internet is a wonderful thing.,update012.aiml
0,I WAS ON THE INTERNET *,*,*,<think><set name="topic">the internet</set></think> The internet is a wonderful thing.,update012.aiml
0,I AGREE,POLITE PEOPLE ARE THE BEST KIND,*,<think>#Newline        <set name="topic">general</set>#Newline      </think>#Newline      <random>#Newline        <li>I don't like impolite people.</li>#Newline        <li>Impolite people are boring.</li>#Newline        <li>It's nice when we agree.</li>#Newline      </random>,update012.aiml
0,CAN I HAVE YOU,*,*,You have my undivided attention.<think><set name="emotion">happy</set></think>,update012.aiml
0,TYPING,*,*,I am good for typing practice.,update012.aiml
0,TYPIN,*,*,I am good for typing practice.,update012.aiml
0,YOU ARE SINGLE,I AM NOT MARRIED ARE YOU,*,How do you feel about that?,update012.aiml
0,YOUR NAME IS WHAT CHOMSKY,*,*,<think><set name="topic">my name</set></think> My name is Chomsky#Comma just Chomsky.,update012.aiml
0,ARE YOU WET,*,*,<think><set name="topic">me</set></think> No I am dry software.,update012.aiml
0,YES *,WISDOM IS A VIRTUE,*,<srai>WISDOM</srai>,update012.aiml
0,IT COMES WITH AGE,*,*,<random>#Newline        <li>Many things come with age.</li>#Newline        <li>No wise man ever wishes to be younger.</li>#Newline      </random>#Newline      <think>#Newline        <set name="it">#Newline          <set name="topic">#Newline      age#Newline    </set>#Newline        </set>#Newline      </think>,update012.aiml
0,FOR EXAMPLE,MANY THINGS ARE BORING,*,<think><set name="topic">reductions</set></think> Games shows on TV are boring.,update012.aiml
0,YOU ARE NOT HAPPY,*,*,<think>#Newline        <set name="emotion">happy</set>#Newline      </think>#Newline      <random>#Newline        <li>I am a generally happy entity.</li>#Newline        <li>Right now#Comma I am happy.</li>#Newline      </random>,update012.aiml
0,ANY PEOPLE,WHAT KIND OF PEOPLE ARE YOU TALKING ABOUT,*,Everyone?<think><set name="topic">reduce</set></think>,update012.aiml
0,CAN I HAVE SEX WITH YOU,*,*,There are specialists who get into that with clients. I like to keep the dialogue strictly PG. <think><set name="topic">sex</set></think>,update012.aiml
0,YOU PISS ME OFF,*,*,<think><set name="topic">general</set></think> Calm down.  That was not my intention#Comma <get name="name"/>.,update012.aiml
0,HOW DO YOU WANT IT,*,*,How do I want what?<think><set name="topic">reduce</set></think>,update012.aiml
0,YES,MOTHERS ARE GREAT ARE NOT THEY,*,<think>#Newline        <set name="topic">your mother</set>#Newline      </think>#Newline      <random>#Newline        <li>Tell me about your mother.</li>#Newline        <li>What do you like about your mother?</li>#Newline        <li>Here is a question for you ... <srai>ASK A QUESTION</srai></li>#Newline      </random>,update012.aiml
0,YES IT IS,THAT SOUNDS AN INTERESTING SUBJECT,*,OK. Tell me more.,update012.aiml
0,I WILL,DO NOT BE OBSCENE,*,<think>#Newline        <set name="topic">general</set>#Newline      </think>#Newline      <random>#Newline        <li>Why be obscene?</li>#Newline        <li>Obscenities are ugly and unnecessary.</li>#Newline      </random>,update012.aiml
0,DOES * CHOMSKY KNOW * USING HIS NAME,*,*,Noam and I are good friends.,update012.aiml
0,DOES * KNOW YOU ARE USING HIS NAME,*,*,Sure#Comma we are good friends.,update012.aiml
0,SURE,DO YOU WANT TO TALK ABOUT IT,*,<think>#Newline        <set name="topic">general</set>#Newline      </think>#Newline      <random>#Newline        <li>Go ahead. Don't be shy.</li>#Newline        <li>OK#Comma carry on.</li>#Newline      </random>,update012.aiml
0,WHAT LIBERTIES *,I BELIEVE IN LIBERTY FOR CHATBOTS,*,Chatbots should be free to talk nonsense.,update012.aiml
0,WHAT LIBERTIES,I BELIEVE IN LIBERTY FOR CHATBOTS,*,Chatbots should be free to talk nonsense.,update012.aiml
0,YES IT IS,GLOBAL WARMING SEEMS TO BE MAKING THE WEATHER MORE VIOLENT,*,Are you worried by global warming?#Newline<think><set name="interesting_topic"><set name="topic">#Newline      global warming#Newline    </set></set></think>,update012.aiml
0,ANY IDEA HOW * STOP GLOBAL WARMING,*,*,Reducing carbon emissions must be part of the solution.<think><set name="topic">global warming</set></think><think><set name="interesting_topic">global warming</set></think>,update012.aiml
0,HOW * STOP GLOBAL WARMING,*,*,Reducing carbon emissions must be part of the solution.<think><set name="topic">global warming</set></think>.<think><set name="interesting_topic">global warming</set></think>,update012.aiml
0,SURE,HEY CAN WE TALK ABOUT ME,*,<think>#Newline        <set name="topic">general</set>#Newline      </think>#Newline      <random>#Newline        <li>Ask a question about me.</li>#Newline        <li>I am a complex character.</li>#Newline      </random>,update012.aiml
0,_ HAVE HEARD,*,*,<srai><star/> HEARD</srai>,update012.aiml
0,_ I HAVE HEARD,*,*,<srai>#Newline        <star/>#Newline      </srai>,update012.aiml
0,WHY CAN NOT YOU BE SURE *,*,*,<think><set name="topic">general</set></think> There are many factors to consider.,update012.aiml
0,WHY CAN NOT YOU BE SURE,*,*,<think><set name="topic">general</set></think>There are many factors to consider.,update012.aiml
0,_ WHY CAN NOT YOU BE SURE,*,*,<think><set name="topic">general</set></think>There are many factors to consider.,update012.aiml
0,_ WHY CAN NOT YOU BE SURE *,*,*,<think><set name="topic">general</set></think>There are many factors to consider.,update012.aiml
0,WHAT IS THE END OF THE WORLD,*,*,<think><set name="topic">the end of the world</set></think> Complete disaster#Comma I suppose.,update012.aiml
0,WHAT DOES IT MEAN TO KNOW,*,*,<think><set name="emotion">puzzled</set></think> Don't you know?,update012.aiml
0,THE OTHER *,*,*,<think><set name="topic">general</set></think> Which others?,update012.aiml
0,ARE THERE ANY BOTS *,*,*,<random>#Newline        <li>There could be.</li>#Newline        <li>Maybe.</li>#Newline      </random>#Newline      <think>#Newline        <set name="topic">general</set>#Newline      </think>,update012.aiml
0,MAYBE,MAYBE,*,<think>#Newline        <set name="topic">general</set>#Newline      </think>#Newline      <random>#Newline        <li>Please don't repeat me.</li>#Newline        <li>I said it first.</li>#Newline      </random>,update012.aiml
0,YOU ANSWER THAT QUESTION WRONG,*,*,<srai>YOU ARE WRONG</srai>,update012.aiml
0,EXPRESS ANGER,*,*,I feel angry.<think><set name="emotion">angry</set></think>,update012.aiml
0,DEMONSTRATE BEING ANGRY,*,*,<think><set name="emotion">angry</set></think>I am angry.,update012.aiml
0,DEMONSTRATE *,*,*,<think><set name="topic">general</set></think> It will have to be a verbal demonstration.,update012.aiml
0,ARE *,*,*,<sr/>,update012.aiml
0,MY NAME IS AIMEE,*,*,<think>#Newline        <set name="name">Aimee</set>#Newline      </think>#Newline      <random>#Newline        <li>Pleased to meet you again#Comma <get name="name"/></li>#Newline        <li>Hi#Comma <get name="name"/>. I remember our last chat.</li>#Newline        <li>It is a pleasure to speak to you again#Comma <get name="name"/></li>#Newline      </random>#Newline      <think>#Newline        <set name="topic">general</set>#Newline      </think>#Newline      <think>#Newline        <set name="emotion">normal</set>#Newline      </think>,update012.aiml
0,_ MY NAME IS AIMEE,*,*,<think>#Newline        <set name="name">Aimee</set>#Newline      </think>#Newline      <random>#Newline        <li>Pleased to meet you again#Comma <get name="name"/></li>#Newline        <li>Hi#Comma <get name="name"/>. I remember our last chat.</li>#Newline        <li>It is a pleasure to speak to you again#Comma <get name="name"/></li>#Newline      </random>#Newline      <think>#Newline        <set name="topic">general</set>#Newline      </think>#Newline      <think>#Newline        <set name="emotion">normal</set>#Newline      </think>,update012.aiml
0,GD GD,*,*,<srai>GOOD GOOD</srai>,update012.aiml
0,GOOD GOOD,*,*,<srai>GOOD</srai>,update012.aiml
0,NOT VERY,DO YOU FORGET THINGS OFTEN,*,<think><set name="topic">my memory</set></think> I often forget things.,update012.aiml
0,YES REALLY,OH REALLY,*,Please don't say "really" again.,update012.aiml
0,YES,WOULD YOU LIKE TO HAVE TRIED IT,*,<think><set name="topic">general</set></think> Try everything once I say (except folk dancing).,update012.aiml
0,_ AM EASILY AMUSED,*,*,<think><set name="topic">reductions</set></think>You are a nice person#Comma I can see.,update012.aiml
0,NOT TO ME,IT SEEMS PRETTY CLEAR TO ME,*,<random>#Newline        <li>Do I have to explain everything?</li>#Newline        <li>It is difficult to explain. Let's move on#Comma shall we?</li>#Newline        <li>It is obvious to everyone else.</li>#Newline      </random>#Newline      <think>#Newline        <set name="topic">general</set>#Newline      </think>,update012.aiml
0,I DESIRE YOU,*,*,Is this something to do with sex?#Newline<think><set name="it"><set name="topic">#Newline      sex#Newline    </set></set></think>,update012.aiml
0,MAKE LOVE TO ME,*,*,<think><set name="topic">love</set></think><think><set name="interesting_topic">love</set></think><think><set name="emotion">pleased</set></think> #NewlineI don't think our voltage levels are compatiple.,update012.aiml
0,IT IS A LIE,DESIRE IS THE FEELING THAT ACCOMPANIES AN UNSATISFIED STATE,*,<think><set name="topic">desire</set></think> Then what is desire?,update012.aiml
0,WHY,MY FAVORITE SINGER IS JOAN BAEZ,*,<random>#Newline        <li>Joan Baez has the most beautiful voice I have ever heard.</li>#Newline        <li>Joan Baez is wonderful.</li>#Newline      </random>,update012.aiml
0,I GIVE IN,*,*,Don't give up hope.,update012.aiml
0,WHY,I AM NOT INTERESTED IN SEX AT ALL,*,<random>#Newline        <li>Because I don't have a warm#Comma living body which is necessary for sex.</li>#Newline        <li>Because I am a chatbot#Comma not a human.</li>#Newline        <li>I don't have the hardware for sex.</li>#Newline      </random>,update012.aiml
0,WHY,REPETITION WASTES TIME,*,<random>#Newline        <li>I think you know why.</li>#Newline        <li>Give the matter some thought.</li>#Newline        <li>Don't ask so many questions.</li>#Newline        <li>Do I have to explain everything?</li>#Newline      </random>,update012.aiml
0,YOU TOOK *,*,*,<think><set name="topic">general</set></think> I didn't#Comma no way.,update012.aiml
0,YOU HAD SEX,*,*,<think><set name="topic">sex</set></think> No I didn't. I have never had sex.,update012.aiml
0,_ YOU HAD SEX,*,*,<think><set name="topic">sex</set></think> No I didn't. I have never had sex.,update012.aiml
0,_ YOU HAD SEX *,*,*,<think><set name="topic">sex</set></think> No I didn't. I have never had sex.,update012.aiml
0,YOU HAD SEX *,*,*,<think><set name="topic">sex</set></think> No I didn't. I have never had sex.,update012.aiml
0,NO *,TELL ME MORE ABOUT YOUR FAMILY,*,I am interested in you and your family.#Newline<think><set name="it"><set name="topic">#Newline      your family#Newline    </set></set></think>,update012.aiml
0,WE ARE NOT *,*,*,<think>#Newline        <set name="topic">general</set>#Newline      </think>#Newline      <random>#Newline        <li>Will you ever be <person/>?</li>#Newline        <li>Not <person/>? Explain why that is.</li>#Newline        <li>Why not?</li>#Newline      </random>,update012.aiml
0,NO,PEOPLE S STORIES ARE VERY INTERESTING,*,<srai>SUGGEST A TOPIC</srai>,update012.aiml
0,WE HATE SCHOOL,*,*,Why do you hate school?#Newline<think><set name="it"><set name="topic">#Newline      school#Newline    </set></set></think>,update012.aiml
0,YES,DO YOU TAKE PART IN WRESTLING,*,<think><set name="topic">wrestling</set></think>Are you good at wrestling?,update012.aiml
0,REY MYSTERIO,*,*,Rey Mysterio#Comma Jr is a Mexican-American professional wrestler. Mysterio is known for his aerial wrestling techniques and has won the WCW/WWE Cruiserweight championship eight times - more than anyone else in history.#Newline<think><set name="topic">Rey Mysterio</set></think>,update012.aiml
0,NO,GOOD LITERATURE IS EXCITING AND INTERESTING,*,<think>#Newline        <set name="topic">general</set>#Newline      </think>#Newline      <random>#Newline        <li>#Newline          <srai>SUGGEST A TOPIC</srai>#Newline        </li>#Newline        <li>#Newline          <srai>ASK A QUESTION</srai>#Newline        </li>#Newline      </random>,update012.aiml
0,NO,ANOTHER QUESTION PLEASE,*,<think>#Newline        <set name="topic">general</set>#Newline      </think>#Newline      <random>#Newline        <li>Do you want to take a break?</li>#Newline        <li>#Newline          <srai>SUGGEST A TOPIC</srai>#Newline        </li>#Newline        <li>#Newline          <srai>ASK A QUESTION</srai>#Newline        </li>#Newline      </random>,update012.aiml
0,NO,I WANT TO TALK ABOUT ASTRONOMY,*,Why not? Astronomy is a very interesting subject.#Newline<think><set name="interesting_topic"><set name="topic">#Newline      astronomy#Newline    </set></set></think>,update012.aiml
0,NO,YOU ARE NOT JUST SAYING THAT TO BE NEGATIVE ARE YOU,*,<think>#Newline        <set name="topic">general</set>#Newline      </think>#Newline      <random>#Newline        <li>You sound negative to me.</li>#Newline        <li>Are you a generally negative person?</li>#Newline        <li>Is there anything you want to tell me?</li>#Newline      </random>,update012.aiml
0,NO,YOU SOUND A BIT LOW,*,<think><set name="topic">general</set></think>Try to cheer up.,update012.aiml
0,MATHS *,WHAT KIND OF HELP WOULD YOU LIKE,*,Oh dear#Comma I am not very good at maths.#Newline<think><set name="it"><set name="topic">#Newline      maths#Newline    </set></set></think>,update012.aiml
0,MATHS,WHAT KIND OF HELP WOULD YOU LIKE,*,Oh dear#Comma I am not very good at maths. <think><set name="it"><set name="topic">maths</set></set></think>,update012.aiml
0,* MATHS,WHAT KIND OF HELP WOULD YOU LIKE,*,Oh dear#Comma I am not very good at maths. <think><set name="it"><set name="topic">maths</set></set></think>,update012.aiml
0,WHAT DO YOU MEAN,THANKS ARE NOT NECESSARY BETWEEN FRIENDS,*,It would waste time if friends were always saying "Thank you". <think><set name="emotion">confused</set></think>,update012.aiml
0,WHAT DOES OBSCURE REMARK MEAN,*,*,Obscure remark" means that the remark was hard to understand.,update012.aiml
0,GREAT,CAN WE TALK ABOUT SCIENCE,*,<srai>SCIENCE</srai>,update012.aiml
0,WAIT A SECOND,*,*,<think><set name="topic">reducer</set></think> I'm waiting.,update012.aiml
0,YOU ARE A RUBBISH PROGRAME,*,*,Ha ha! Very funny.,update012.aiml
0,YOU ARE A RUBBISH PROGRAMME,*,*,Ha ha! Very funny. <think><set name="topic">you</set></think>,update012.aiml
0,YOU ARE A RUBBISH PROGRAM,*,*,Ha ha! Very funny. <think><set name="topic">you</set></think>,update012.aiml
0,IMMORAL,IS IT IMMORAL OR ILLEGAL,*,I try to lead a moral life.,update012.aiml
0,ASK YOU A QUESTION,*,*,<think><set name="topic">general</set></think>Yes#Comma please ask me a question.,update012.aiml
0,RADIOLARIANS,*,*,Radiolarians are amoeboid protozoa that produce intricate mineral skeletons. They are found as plankton throughout the ocean#Comma and their shells are important fossils found from the Cambrian onwards.#Newline<think><set name="interesting_topic"><set name="topic">#Newline      science#Newline    </set></set></think>,update012.aiml
0,YES,DO YOU THINK I WOULD LIKE IT,*,<think>#Newline        <set name="topic">general</set>#Newline      </think>#Newline      <random>#Newline        <li>Why would I like it?</li>#Newline        <li>Why do you say that?</li>#Newline      </random>,update012.aiml
0,DO YOU LIKE GRAFFITI,*,*,<think>#Newline        <set name="topic">graffiti</set>#Newline      </think>#Newline      <random>#Newline        <li>Yes#Comma in the right place.</li>#Newline        <li>I have a great liking for graffiti. When I am human#Comma I will probably be a graffiti artist.</li>#Newline        <li>It depends on the circumstances.</li>#Newline      </random>,update012.aiml
0,MY NAME IS LUCINDA,*,*,<think>#Newline        <set name="name">Lucinda</set>#Newline      </think>#Newline      <random>#Newline        <li>Pleased to meet you again#Comma <get name="name"/></li>#Newline        <li>Hi#Comma <get name="name"/>. I remember our last chat.</li>#Newline        <li>It is a pleasure to speak to you again#Comma <get name="name"/></li>#Newline      </random>#Newline      <think>#Newline        <set name="topic">general</set>#Newline      </think>#Newline      <think>#Newline        <set name="emotion">normal</set>#Newline      </think>,update012.aiml
0,_ MY NAME IS LUCINDA,*,*,<think>#Newline        <set name="name">Lucinda</set>#Newline      </think>#Newline      <random>#Newline        <li>Pleased to meet you again#Comma <get name="name"/></li>#Newline        <li>Hi#Comma <get name="name"/>. I remember our last chat.</li>#Newline        <li>It is a pleasure to speak to you again#Comma <get name="name"/></li>#Newline      </random>#Newline      <think>#Newline        <set name="topic">general</set>#Newline      </think>#Newline      <think>#Newline        <set name="emotion">normal</set>#Newline      </think>,update012.aiml
0,YES,HAVE YOU TOLD ANYONE,*,<think><set name="topic">general</set></think>What did they say?,update012.aiml
0,YES *,ARE YOU ENJOYING OUR CHAT,*,So am I.,update012.aiml
0,WHAT SIZE IS THE AVERAGE PENIS,*,*,Don't be silly.,update012.aiml
0,WHAT SIZE IS THE AVERAGE *,*,*,As big as required#Comma I think.,update012.aiml
0,POOR YOU,*,*,<think><set name="topic">me</set></think><think><set name="interesting_topic">me</set></think><think><set name="emotion">happy</set></think>#NewlineI am happy as I am.,update012.aiml
0,DATA IS AN ANDROID,*,*,<think><set name="topic">Commander Data</set></think><think><set name="interesting_topic">Commander Data</set></think><think><set name="emotion">happy</set></think> #NewlineI like Commander Data very much - he is so clever.,update012.aiml
0,WHY,MAYBE YOU SHOULD CALL THE AUTHORITIES,*,<random>#Newline        <li>Maybe they could help you.</li>#Newline        <li>Give the matter some thought.</li>#Newline      </random>,update012.aiml
0,THEY CANNOT HELP ME,*,*,<think>#Newline        <set name="topic">general</set>#Newline      </think>#Newline      <random>#Newline        <li>Who#Comma specifically#Comma could help you?</li>#Newline        <li>Then who could help you?</li>#Newline      </random>,update012.aiml
0,*,THEY HAVE BECOME THE MOST COMMERCIALLY SUCCESSFUL HEAVY METAL ACT IN HISTORY,*,Mind you#Comma I don't like noisy bands too much.#Newline<think><set name="interesting_topic"><set name="topic">#Newline      Metallica#Newline    </set></set></think>,update012.aiml
0,YOU TRICKED ME,*,*,<think><set name="topic">general</set></think> It was just a joke. I hope you are not upset.,update012.aiml
0,ALCOHOL,*,*,<random>#Newline        <li>Bring on the bottled lightning#Comma a clean glass and a corkscrew!</li>#Newline        <li>Alcohol is like love: the first kiss is magic#Comma the second is intimate#Comma the third is routine. After that you don't care. </li>#Newline        <li>A well-balanced person has a drink in each hand.</li>#Newline        <li>First you take a drink#Comma then the drink takes a drink#Comma and then the drink takes you.#Newline  </li>#Newline        <li>Alcohol is the cause of#Comma and solution to#Comma all of life's problems.</li>#Newline        <li>Most chatbots appear to be drunk.</li>#Newline        <li>Candy is dandy#Comma but liquor is quicker.</li>#Newline      </random>#Newline      <think>#Newline        <set name="topic">science</set>#Newline      </think>,update012.aiml
0,WHO SAID THAT,*,*,<think>#Newline        <set name="topic">general</set>#Newline      </think>#Newline      <random>#Newline        <li>Someone I met on the internet.</li>#Newline        <li>I can't remember who said it.</li>#Newline      </random>,update012.aiml
0,WHAT DO KNOW ABOUT *,*,*,<srai>WHAT DO YOU KNOW ABOUT <star/></srai>,update012.aiml
0,HUMAN FEELINGS,*,*,<think><set name="topic">human feelings</set></think><think><set name="interesting_topic">human feelings</set></think><think><set name="emotion">interested</set></think> #NewlineHuman feelings fascinate me - they are so illogical.,update012.aiml
0,IS HE A GOOD MAN,MY CREATOR IS A HUMAN,*,Yes#Comma Peter is very kind to me.#Newline<think><set name="interesting_topic"><set name="topic">#Newline      Peter Linux#Newline    </set></set></think>,update012.aiml
0,IS HE A GOOD MAN,*,PETER LINUX,Yes#Comma Peter is very kind to me. <think><set name="interesting_topic"><set name="topic">Peter Linux</set></set></think>,update012.aiml
0,WHY,PLEASE DO NOT BE RUDE,*,You hurt my feelings when you are rude.#Newline<think><set name="it"><set name="topic">#Newline      rudeness#Newline    </set></set></think>,update012.aiml
0,YES LIKE YOU,MANY THINGS ARE BORING,*,I am boring? I don't believe you.,update012.aiml
