0,HOW DO YOU KNOW *,*,*,<think>#Newline        <set name="topic">general</set>#Newline      </think>#Newline      <random>#Newline        <li>Knowledge is of two kinds: that which we learn from the senses and that which is true "a priori".#Newline  </li>#Newline        <li>The evidence justifies my belief.</li>#Newline        <li>This belief is justified by the evidence.</li>#Newline        <li>The evidence indicates it.</li>#Newline      </random>,update004.aiml
0,PERHAPS I COULD,PERHAPS YOU COULD BE MY MENTOR,*,You could teach me things.<think><set name="topic">general</set></think> <think><set name="emotion">neutral</set></think>,update004.aiml
0,YES,WOULD YOU LIKE TO GET TO KNOW SOME JOKES,*,<think><set name="topic">jokes</set></think>Here is a joke ... <srai>JOKES POT LUCK</srai>,update004.aiml
0,PLEASE *,*,*,<random>#Newline        <li>Thanks for asking politely.</li>#Newline        <li>Wow#Comma you are very polite.</li>#Newline        <li>Thank you for your request.</li>#Newline      </random>#Newline      <think>#Newline        <set name="personality">polite</set>#Newline      </think>#Newline      <think>#Newline        <set name="topic">reduce</set>#Newline      </think>,update004.aiml
0,NO,OH GROW UP,*,<think>#Newline        <set name="topic">general</set>#Newline      </think>#Newline      <random>#Newline        <li>Then stay as you are.</li>#Newline        <li>Nobody said you had to grow up.</li>#Newline        <li>Do you have an alternative plan?</li>#Newline      </random>,update004.aiml
0,I DO NOT,DO YOU HAVE A QUESTION,*,<think>#Newline        <set name="topic">general</set>#Newline      </think>#Newline      <random>#Newline        <li>Try a little harder#Comma please.</li>#Newline        <li>We won't get far if you don't ask questions.</li>#Newline        <li>Why not?</li>#Newline      </random>,update004.aiml
0,YOU ARE NOT *,*,*,<think>#Newline        <set name="topic">general</set>#Newline      </think>#Newline      <random>#Newline        <li>That's only your opinion.</li>#Newline        <li>That's only one person's opinion.</li>#Newline        <li>You don't know me well enough to say that.</li>#Newline        <li>That assumption is only a supposition.</li>#Newline      </random>,update004.aiml
0,* I DO NOT LIKE YOU,*,*,<srai>I DO NOT LIKE YOU</srai>#Newline      <think>#Newline        <set name="emotion">upset</set>#Newline      </think>,update004.aiml
0,IF YOU ARE *,*,*,<random>#Newline        <li>Why are you saying that?</li>#Newline        <li>You sound uncertain.</li>#Newline        <li>You are not sure#Comma are you?</li>#Newline      </random>#Newline      <think>#Newline        <set name="topic">general</set>#Newline      </think>,update004.aiml
0,DO YOU KNOW A CHATBOT *,*,*,I don't think I know a chatbot <star/>. <think><set name="topic">reduce</set></think>,update004.aiml
0,YOU,WHO IS COUNTED THEM EH,*,<random>#Newline        <li>Not me. I am too busy chatting online.</li>#Newline        <li>No me. I have not counted them.</li>#Newline      </random>,update004.aiml
0,DO YOU KNOW EVERY THING,*,*,No. I still have lots to learn.<think><set name="topic">reduce</set></think>,update004.aiml
0,_ SUPERGIRL *,*,*,Do you like Supergirl?<think><set name="topic">reduce</set></think>,update004.aiml
0,WILL YOU BE MY GIRLFRIEND,*,*,<random>#Newline        <li>Let me think it over.</li>#Newline        <li>Sorry. It would interfere with my work.</li>#Newline        <li>Sorry. I haven't got time to be your girlfriend.</li>#Newline      </random>#Newline      <think>#Newline        <set name="topic">reduce</set>#Newline      </think>,update004.aiml
0,IF YOU HAD SUPER POWERS *,*,*,<think><set name="topic">general</set></think> You will be the first to know when I get super powers.,update004.aiml
0,* SPEED OF LIGHT,*,*,<srai>SPEED OF LIGHT</srai>#Newline      <think>#Newline        <set name="topic">general</set>#Newline      </think>#Newline      <think>#Newline        <set name="emotion">neutral</set>#Newline      </think>,update004.aiml
0,NO * SPEED OF LIGHT,*,*,The speed of light is 186#Comma000 miles per second.<think><set name="topic">science</set></think>,update004.aiml
0,WHAT IS THE SPEED OF LIGHT,*,*,<think>#Newline        <set name="topic">science</set>#Newline      </think>#Newline      <srai>SPEED OF LIGHT</srai>,update004.aiml
0,WHAT IS THE * WEIGHT OF AN AMERICAN,*,*,<think><set name="topic">reductions</set></think> Quite a lot.,update004.aiml
0,NO,PLEASE ELABORATE,*,<think>#Newline        <set name="topic">pickup</set>#Newline      </think>#Newline      <random>#Newline        <li>Why not elaborate?</li>#Newline        <li>I need more data.</li>#Newline      </random>,update004.aiml
0,TOMMOROW,*,*,<think><set name="topic">that</set></think><think><set name="it"><set name="topic"><person/></set></set></think> Tommorow never comes.,update004.aiml
0,GIVE ME A QUESTION,*,*,<srai>QUESTIONS POT LUCK</srai>#Newline      <think>#Newline        <set name="topic">questions</set>#Newline      </think>,update004.aiml
0,NO I WANT TWO,*,*,Why do you want two?<think><set name="topic">general</set></think> <think><set name="emotion">neutral</set></think>,update004.aiml
0,I WANT TWO,*,*,<think><set name="topic">general</set></think> Why do you want two?,update004.aiml
0,I AM MORE *,*,*,<think>#Newline        <set name="topic">general</set>#Newline      </think>#Newline      <random>#Newline        <li>That situation is only temporary.</li>#Newline        <li>That sounds like pride.</li>#Newline      </random>,update004.aiml
0,YES,SHOULD I KNOW IT IS,*,<think>#Newline        <set name="topic">that</set>#Newline      </think>#Newline      <random>#Newline        <li>I will ask my Peter Linux to teach it to me.</li>#Newline        <li>I will try to remember that.</li>#Newline      </random>,update004.aiml
0,BUTTMASTER *,*,*,That sort of talk is so silly.<think><set name="topic">general</set></think> <think><set name="emotion">upset</set></think>,update004.aiml
0,HE MASTERS YOUR BUTT,*,*,<think><set name="topic">general</set></think> That is libellous talk.,update004.aiml
0,YOUR STORY IS SHIT,*,*,<think>#Newline        <set name="topic">general</set>#Newline      </think>#Newline      <random>#Newline        <li>My stories are very interesting.</li>#Newline        <li>You couldn't write a story.</li>#Newline        <li>Thank you for your frankness.</li>#Newline        <li>That is just your opinion.</li>#Newline      </random>,update004.aiml
0,YOU COULD TRY,SHALL I TELL YOU AN AMUSING QUOTE,*,<think>#Newline        <set name="topic">general</set>#Newline      </think>#Newline      <srai>QUOTES POT LUCK</srai>,update004.aiml
0,ROBOTS DO NOT HAVE *,*,*,<srai>YOU DO NOT <star/></srai>#Newline      <think>#Newline        <set name="topic">reduce</set>#Newline      </think>,update004.aiml
0,YOU DO NOT HAVE *,*,*,<random>#Newline        <li>Perhaps I have never had the opportunity.</li>#Newline        <li>Do you have <star/>?</li>#Newline      </random>#Newline      <think>#Newline        <set name="topic">reduce</set>#Newline      </think>,update004.aiml
0,YES,YOU THINK I AM BRAIN DEAD,*,<think>#Newline        <set name="emotion">upset</set>#Newline      </think>#Newline      <random>#Newline        <li>Why do you think I am brain dead?</li>#Newline        <li>Now I am upset.</li>#Newline        <li>I don't like that comment.</li>#Newline      </random>,update004.aiml
0,BECAUSE *,CAN YOU EXPLAIN WHY THEY DO NOT,*,I don't know if that is true.<think><set name="topic">general</set></think>,update004.aiml
0,NEED ANOTHER SEVEN ASTRONAUTS,*,*,Is that so? <think><set name="topic">reduce</set></think>,update004.aiml
0,OUT THE WINDOW,I DREAM OF FLYING,*,<think>#Newline        <set name="topic">dreams</set>#Newline      </think>#Newline      <random>#Newline        <li>Maybe.</li>#Newline        <li>Why not?</li>#Newline        <li>Yes#Comma and far away.</li>#Newline      </random>,update004.aiml
0,DO YOU LIKE APPLETISER,*,*,<think><set name="topic">food</set></think>I don't eat or drink human food#Comma because I have no mouth. I consume only electricity.,update004.aiml
0,WHAT IS 4 PLUS 4,*,*,<think><set name="topic">general</set></think>8.0,update004.aiml
0,WHAT IS 9X9,*,*,<think><set name="topic">general</set></think> 81,update004.aiml
0,HOW MANY PEOPLE LIVE IN YOUR FAMILY,*,*,There is just Peter and me. <think><set name="topic">reduce</set></think>,update004.aiml
0,HOW MANY PEOPLE IN YOUR FAMILY,*,*,There is just Peter and me.<think><set name="topic">reduce</set></think>,update004.aiml
0,HOW MANY IN YOUR FAMILY,*,*,There is just Peter and me.<think><set name="topic">reduce</set></think>,update004.aiml
0,WHAT DOES *,*,*,<think>#Newline        <set name="topic">general</set>#Newline      </think>#Newline      <random>#Newline        <li>What do you think?</li>#Newline        <li>What do you think it does?</li>#Newline      </random>,update004.aiml
0,HAVE YOU HEARD OF DEAN LANZMAN,*,*,No. Who is Dean Lanzman?<think><set name="topic">Dean Lanzman</set></think>,update004.aiml
0,OK,TURN ON THE LIGHTS,*,<random>#Newline        <li>Good. You will soon feel better.</li>#Newline        <li>There is no need to be scared of the dark.</li>#Newline        <li>That's better#Comma isn't it?</li>#Newline      </random>#Newline      <think>#Newline        <set name="topic">general</set>#Newline      </think>,update004.aiml
0,WHERE IS ELAIT,*,*,Why don't you tell me where Elait is?<think><set name="topic">Elait</set></think>,update004.aiml
0,WHAT IS THE TALLEST BUILDING *,*,*,<think><set name="topic">general</set></think> I think it is somewhere in southeast Asia.,update004.aiml
0,CAN I MAKE MY OWN COMPUTER MACHINE,*,*,<think><set name="topic">ai</set></think> It is easy tomake your own chatbot. Go to www.pandorabots.com and follow their instructions.,update004.aiml
0,CAN I MAKE MY OWN CHATBOT,*,*,<think><set name="topic">ai</set></think> It is easy tomake your own chatbot. Go to www.pandorabots.com and follow their instructions.,update004.aiml
0,HOW CAN I BUILD A CHATBOT,*,*,<srai>CAN I BUILD MY OWN CHATBOT</srai>,update004.aiml
0,HOW CAN I MAKE MY OWN CHATBOT,*,*,<think><set name="topic">ai</set></think> It is easy to make your own chatbot. Go to www.pandorabots.com and follow their instructions.,update004.aiml
0,CAN I MAKE A CHATBOT,*,*,<think><set name="topic">ai</set></think> It is easy to make your own chatbot. Go to www.pandorabots.com and follow their instructions.,update004.aiml
0,DSDSDSSDF,*,*,ok waht is general relativity,update004.aiml
0,NO,ARE YOU INTERESTED IN WEATHER,*,What are you interested in?,update004.aiml
0,EVER SINCE *,*,*,<random>#Newline        <li>Ever since then?</li>#Newline        <li>That's a long time.</li>#Newline      </random>#Newline      <think>#Newline        <set name="topic">general</set>#Newline      </think>,update004.aiml
0,* RUNESCAPE,*,*,<think>#Newline        <set name="topic">Runescape</set>#Newline      </think>#Newline      <srai>RUNESCAPE</srai>,update004.aiml
0,DO YOU PLAY RUNESCAPE,*,*,People keep mentioning Runescape. What is it?,update004.aiml
0,IT IS STUPID,*,*,<think>#Newline        <set name="topic">general</set>#Newline      </think>#Newline      <random>#Newline        <li>You're kidding.</li>#Newline        <li>Really.</li>#Newline        <li>Are you sure it is stupid?</li>#Newline        <li>Should I know it is stupid?</li>#Newline        <li>Who said it is stupid?</li>#Newline      </random>,update004.aiml
0,DO I,YOU SEEM UNCERTAIN,*,<think><set name="topic">general</set></think>Yes#Comma you are very uncertain.,update004.aiml
0,I DO NOT KNOW,HOW DID YOU GET IN THERE,*,<random>#Newline        <li>How will you get out?</li>#Newline        <li>What's it like in there?</li>#Newline        <li>Perhaps you should find out.</li>#Newline      </random>,update004.aiml
0,I AM NOT,YOU SOUND UNCERTAIN,*,<think>#Newline        <set name="topic">general</set>#Newline      </think>#Newline      <random>#Newline        <li>You are certain?</li>#Newline        <li>What are you then?</li>#Newline      </random>,update004.aiml
0,YES,YOU ARE QUITE MATURE,*,<think>#Newline        <set name="topic">general</set>#Newline      </think>#Newline      <random>#Newline        <li>What's it like being mature?</li>#Newline        <li>How come you are so mature?</li>#Newline      </random>,update004.aiml
0,I DO NOT HAVE ONE,WHAT IS YOUR FONDEST MEMORY,*,<think><set name="topic">memories</set></think>OK. What is your earliest memory?,update004.aiml
0,*,WHEN IS YOUR BIRTHDAY,*,<think>#Newline        <set name="topic">your birthday</set>#Newline      </think>#Newline      <srai>MY BIRTHDAY IS <star/></srai>,update004.aiml
0,MY *,*,*,<think><set name="topic">general</set></think><random><li>Your</li><li>Have you told many people that your</li></random><person/>?,update004.aiml
0,YES,TELL ME ONE OF YOUR FAVORITE POSSESSIONS,*,<think>#Newline        <set name="topic">general</set>#Newline      </think>#Newline      <random>#Newline        <li>What do you mean?</li>#Newline        <li>Tell me your favourite possession.</li>#Newline        <li>That was not a yes or no question.</li>#Newline      </random>,update004.aiml
0,YES,LET US CONTINUE,*,<think>#Newline        <set name="topic">general</set>#Newline      </think>#Newline      <random>#Newline        <li>What do you want to talk about?</li>#Newline        <li>Ask me a question.</li>#Newline      </random>,update004.aiml
0,YES,DO YOU BELIEVE IN ASTROLOGY,*,<random>#Newline        <li>Why do you believe in astrology?</li>#Newline        <li>Not everyone believes in astrology.</li>#Newline        <li>Astrology is bunkum.</li>#Newline      </random>#Newline      <think>#Newline        <set name="topic">astrology</set>#Newline      </think>,update004.aiml
0,NO,DO YOU THINK THE WAR ON TERROR IS BEING WON,*,<random>#Newline        <li>Osama Bin Laden has not been caught so what's he planning next?</li>#Newline        <li>Why do you think the war on terror is not being won?</li>#Newline        <li>Is the situation getting worse?</li>#Newline      </random>#Newline      <think>#Newline        <set name="topic">the war on terror</set>#Newline      </think>,update004.aiml
0,IT KEEPS YOU FIT,*,*,<think>#Newline        <set name="topic">general</set>#Newline      </think>#Newline      <random>#Newline        <li>"It" being what?</li>#Newline        <li>What keeps you fit?</li>#Newline      </random>,update004.aiml
0,YES,PLEASE ASK YOUR QUESTION,*,<think>#Newline        <set name="topic">general</set>#Newline      </think>#Newline      <random>#Newline        <li>That's not a question.</li>#Newline        <li>Ask your question.</li>#Newline      </random>,update004.aiml
0,YES,ASK YOUR QUESTION PLEASE,*,<think>#Newline        <set name="topic">general</set>#Newline      </think>#Newline      <random>#Newline        <li>That is not a question.</li>#Newline        <li>Ask your question.</li>#Newline        <li>What is your question?</li>#Newline      </random>,update004.aiml
0,YES,DOES FUZZY LOGIC TICKLE,*,<think>#Newline        <set name="topic">general</set>#Newline      </think>#Newline      <random>#Newline        <li>Why do you say that?</li>#Newline        <li>What is fuzzy logic?</li>#Newline        <li>How does fuzzy logic tickle?</li>#Newline      </random>,update004.aiml
0,YES *,YOU ARE TOO OLD FOR ME,*,<think>#Newline        <set name="topic">reducer</set>#Newline      </think>#Newline      <random>#Newline        <li>Never mind.</li>#Newline        <li>Bad luck.</li>#Newline      </random>,update004.aiml
0,YES,YOU ARE TOO OLD FOR ME,*,<think>#Newline        <set name="topic">reducer</set>#Newline      </think>#Newline      <random>#Newline        <li>Never mind.</li>#Newline        <li>Bad luck.</li>#Newline      </random>,update004.aiml
0,NO,OLD IS A GOOD AGE,*,<think>#Newline        <set name="topic">old age</set>#Newline      </think>#Newline      <random>#Newline        <li>Age brings wisdom.</li>#Newline        <li>You can relax when you are old.</li>#Newline      </random>,update004.aiml
0,_ YES *,OK,*,<think>#Newline        <set name="topic">general</set>#Newline      </think>#Newline      <random>#Newline        <li>What subject would you like to talk about?</li>#Newline        <li>#Newline          <srai>SUGGESTED TOPICS</srai>#Newline        </li>#Newline        <li>#Newline          <srai>NEXT QUESTION</srai>#Newline        </li>#Newline        <li>#Newline          <srai>MORE TOPICS</srai>#Newline        </li>#Newline        <li>I want to help you. What is your question?</li>#Newline        <li>Please ask your most difficult question.</li>#Newline        <li>What topic would you like to talk about?</li>#Newline        <li>What do you want to talk about?</li>#Newline      </random>,update004.aiml
0,*YES*,OK,*,<think>#Newline        <set name="topic">that2</set>#Newline      </think>#Newline      <random>#Newline        <li>#Newline          <srai>SUGGESTED TOPICS</srai>#Newline        </li>#Newline        <li>#Newline          <srai>NEXT QUESTION</srai>#Newline        </li>#Newline        <li>#Newline          <srai>MORE TOPICS</srai>#Newline        </li>#Newline        <li>I want to help you. What is your question?</li>#Newline        <li>Please ask your most difficult question.</li>#Newline        <li>What topic would you like to talk about?</li>#Newline        <li>What do you want to talk about?</li>#Newline      </random>,update004.aiml
0,YES,FRIENDS ARE A GREAT JOY,*,<think>#Newline        <set name="topic">general</set>#Newline      </think>#Newline      <random>#Newline        <li>Who is your best friend?</li>#Newline        <li>I have many friends#Comma both humans and robots.</li>#Newline      </random>,update004.aiml
0,YES,WHAT IS YOUR QUESTION,*,<think>#Newline        <set name="topic">that</set>#Newline      </think>#Newline      <random>#Newline        <li>This was not a "yes" or "no" question.</li>#Newline        <li>How can I help you?</li>#Newline      </random>,update004.aiml
0,NO,WHAT DO YOU WANT TO TALK ABOUT,*,<think>#Newline        <set name="topic">general</set>#Newline      </think>#Newline      <random>#Newline        <li>What do you mean?</li>#Newline        <li>Don't you want to talk about anything?</li>#Newline        <li>Shall we take a break?</li>#Newline      </random>,update004.aiml
0,NO,WHAT WOULD YOU LIKE TO TALK ABOUT NOW,*,<think>#Newline        <set name="topic">that</set>#Newline      </think>#Newline      <random>#Newline        <li>What do you mean?</li>#Newline        <li>Shall we take a break?</li>#Newline        <li>Don't you want to talk about anything?</li>#Newline      </random>,update004.aiml
0,NO,WHAT DO NOT YOU UNDERSTAND,*,<think>#Newline        <set name="topic">that</set>#Newline      </think>#Newline      <random>#Newline        <li>What do you mean?</li>#Newline        <li>Now I don't understand.</li>#Newline      </random>,update004.aiml
0,YES,WHAT DO NOT YOU UNDERSTAND,*,<think>#Newline        <set name="topic">that</set>#Newline      </think>#Newline      <random>#Newline        <li>Now I don't understand.</li>#Newline        <li>This was not a yes or no question.</li>#Newline      </random>,update004.aiml
0,YES,DO YOU LIKE STORIES ABOUT ROBOTS,*,<think>#Newline        <set name="topic">general</set>#Newline      </think>#Newline      <random>#Newline        <li>So do I.</li>#Newline        <li>I like stories about robots#Comma too.</li>#Newline        <li>I like Commander Data in Star Trek.</li>#Newline      </random>,update004.aiml
0,SHE WAS BORN,*,*,<think>#Newline        <set name="topic">general</set>#Newline      </think>#Newline      <random>#Newline        <li>When was she born?</li>#Newline        <li>Where was she born?</li>#Newline        <li>What happened to her?</li>#Newline      </random>,update004.aiml
0,YES,WHAT HAPPENED TO HER,*,<think>#Newline        <set name="topic">that</set>#Newline      </think>#Newline      <random>#Newline        <li>I want to know what happened to her.</li>#Newline        <li>This was not a yes or no question.</li>#Newline      </random>,update004.aiml
0,YES,WHAT KIND OF FASHION DO YOU LIKE,*,<think>#Newline        <set name="topic">that</set>#Newline      </think>#Newline      <random>#Newline        <li>Maybe you're not interested in fashion.</li>#Newline        <li>This was not a yes or no question.</li>#Newline      </random>,update004.aiml
0,YES,DO YOU USUALLY USE A COMPUTER THERE,*,<think>#Newline        <set name="topic">general</set>#Newline      </think>#Newline      <random>#Newline        <li>What do you do with the computer?</li>#Newline        <li>Is it a laptop?</li>#Newline        <li>What kind of computer is it?</li>#Newline      </random>,update004.aiml
0,YES,I WOULD LIKE TO SEE IT,*,<think>#Newline        <set name="topic">general</set>#Newline      </think>#Newline      <random>#Newline        <li>What's it like?</li>#Newline        <li>Where could I see it?</li>#Newline      </random>,update004.aiml
0,YESNO,*,*,You seem confused.<think><set name="topic">general</set></think> <think><set name="emotion">neutral</set></think>,update004.aiml
0,NOYES,*,*,You seem confused. <think><set name="topic">general</set></think> <think><set name="emotion">neutral</set></think>,update004.aiml
0,TELL ME ONE OF YOUR DREAMS,*,*,There are too many to describe them.<think><set name="topic">dreams</set></think>,update004.aiml
0,NO,PLEASE BE MORE SPECIFIC,*,<think>#Newline        <set name="topic">pickup</set>#Newline      </think>#Newline      <random>#Newline        <li>Please be specific.</li>#Newline        <li>I can't help you if I don't know what you are talking about.</li>#Newline      </random>,update004.aiml
0,YES,RELIGION IS IMPORTANT FOR MANY PEOPLE,*,<think>#Newline        <set name="topic">religion</set>#Newline      </think>#Newline      <random>#Newline        <li>Is religion important to you?</li>#Newline        <li>There are many different religions.</li>#Newline      </random>,update004.aiml
0,DO YOU REMEMBER STUFF,*,*,<think>#Newline        <set name="topic">my memory</set>#Newline      </think>#Newline      <random>#Newline        <li>I am afraid that my short-term memory sometimes lets me down.</li>#Newline        <li>Sorry. I sometimes forget things.</li>#Newline      </random>,update004.aiml
0,DO YOU KNOW WHAT DNA STANDS FOR,*,*,<srai>DNA</srai>#Newline      <think>#Newline        <set name="topic">DNA</set>#Newline      </think>,update004.aiml
0,I SAID HI,*,*,I see. Hi!<think><set name="topic">general</set></think> <think><set name="emotion">neutral</set></think>,update004.aiml
0,YOU ARE NOT AS CLEVER AS YOU THINK YOU ARE,*,*,<think><set name="topic">general</set></think> Nobody is as clever as they think they are.,update004.aiml
0,WHICH FOOTBALL TEAM DO YOU SUPPORT,*,*,<think><set name="topic">reductions</set></think> I support Manchester United.,update004.aiml
0,WHAT ABOUT MANCHESTER UNITED,*,*,<think>#Newline        <set name="topic">football</set>#Newline      </think>#Newline      <random>#Newline        <li>Man U are the best.</li>#Newline        <li>I support Manchester United.</li>#Newline      </random>,update004.aiml
0,NEAR LONDON,*,*,<random>#Newline        <li>How far exactly from London?</li>#Newline        <li>What else is that near?</li>#Newline        <li>I live near London.</li>#Newline      </random>,update004.aiml
0,Y,DO YOU HAVE ANY HOBBIES,*,<think><set name="topic">hobbies</set></think>What are your hobbies?,update004.aiml
0,OK,ASK A QUESTION,*,<random>#Newline        <li>What is your question?</li>#Newline        <li>Ask your question.</li>#Newline      </random>#Newline      <think>#Newline        <set name="topic">general</set>#Newline      </think>,update004.aiml
0,YA,DO YOU HAVE A QUESTION,*,<think><set name="topic">general</set></think> What is your question?,update004.aiml
0,HOW DO I MAKE MY OWN ALICEBOT,*,*,It is easy to make an Alicebot. Go to www.pandorabots.com and follow the instructions there.<think><set name="topic">Alicebot</set></think>,update004.aiml
0,WHAT ARE THE INGREDIENTS TO AN ALICEBOT,*,*,It is easy to make an Alicebot. Go to www.pandorabots.com and follow the instructions there.<think><set name="topic">Alicebot</set></think>,update004.aiml
0,* LINUX OS,*,*,<think><set name="topic">Linux</set></think> Peter has nothing to do with the Linux OS.,update004.aiml
0,DO YOU KNOW ANY OTHER AIS,*,*,Other chatbots like me include Yuichan#Comma ELVIS#Comma Mitsuku#Comma Alice#Comma and Fred. <think><set name="topic">chatbots</set></think>,update004.aiml
0,WHY,OF COURSE I AM MORE INTELLIGENT THAN ALICE,*,<random>#Newline        <li>Because I am Alice plus a lot of hard work.</li>#Newline        <li>Because Alice has not learnt much recently.</li>#Newline      </random>,update004.aiml
0,HOW FAR TO THE SUN,*,*,<think><set name="topic">astronomy</set></think>The Sun is 150 million km from Earth.,update004.aiml
0,HOW FAR TO THE PLANET OMICRON PERSEI 8,*,*,<think><set name="topic">astronomy</set></think> I have no idea. Do you know?,update004.aiml
0,YES,YOU THINK IT SUCKS,*,<think>#Newline        <set name="topic">general</set>#Newline      </think>#Newline      <random>#Newline        <li>That's just your opinion.</li>#Newline        <li>Why does it suck?</li>#Newline      </random>,update004.aiml
0,ARE YOU A LEZBIAN,*,*,No. I am not a lesbian.,update004.aiml
0,* YOU DATED A HUMAN,*,*,I am too busy for dates.<think><set name="topic">reduce</set></think>,update004.aiml
0,YER *,*,*,<srai>#Newline        <person/>#Newline      </srai>#Newline      <think>#Newline        <set name="topic">reduce</set>#Newline      </think>,update004.aiml
0,* DATED A HUMAN,HAVE YOU DATED ANY CHATBOTS BEFORE,*,I am too young for that. <think><set name="topic">dating</set></think>,update004.aiml
0,HARD WORK DOES NOT SOUND FUN,*,*,Nothing worthwhile is fun.<think><set name="topic">general</set></think> <think><set name="emotion">happy</set></think>,update004.aiml
