0,HOW DO I DOWNLOAD PROGRAM B,*,*,<br/>#NewlineCreate a Directory (or Folder) on your machine to download<br/>#Newlinethe B.zip file.  When you click on "B.zip" the browser<br/>#Newlineshould ask you where you want to save the file.  Select the<br/>#Newlinedirectory you created and save B.zip to that folder. <br/>#Newline<br/>#NewlineOnce you've downloaded#Comma You can use "unzip B.zip" to extract the files.<br/>#NewlineIf you don't have this unzip command on your machine#Comma you can get<br/>#Newlinea free one from Winzip (www.winzip.com) to unzip the "B.zip" file.<br/>#Newline<br/>#NewlineIf you want to get into the Java source code#Comma you need a<br/>#NewlineJava 1.17 (or higher) development kit release.<br/>#NewlineGo to java.sun.com for a free one.  The program source code<br/>#Newlineand all associated files are stored in the single "zip" file<br/>#Newlinecalled B.zip.   To extract the files use the command<br/>#Newline"unzip B.zip" (assuming you have "unzip" on your machine).<br/>#Newline<br/>,std-dont.aiml
0,HOW DO I INSTALL ALICE,*,*,<br/>#NewlineIf you purchased a commercial version of ALICE on CD ROM or<br/>#Newlineover the web#Comma installation should be very easy.  These versions <br/>#Newlineusually have their own self-extracting and install software.  <br/>#NewlineYou can install the ALICE program with just a mouse click and<br/>#Newlineactivate it with a desktop icon.  <br/>#Newline<br/>#NewlineIf you bought a commercial version of ALICE with a self-installer#Comma <br/>#Newlineyou can skip this section and go on to "Creating Content".<br/>#Newline<br/>,std-dont.aiml
0,HOW DO I INSTALL ALICE ON WINDOWS,*,*,<br/>#NewlineDownload Alicebot.Net at www.alicebot.net.<br/>,std-dont.aiml
0,HOW DO I KNOW WHAT CATEGORIES TO ADD,*,*,<br/>#NewlineAfter you collect some dialogue#Comma run "Classify" and "Quick Targets".<br/>#NewlineThis will tell you the most frequently asked patterns that do not<br/>#Newlinealready have specific responses.  The "Target" functions display new<br/>#Newlinecategories with proposed patterns and template fields filled with<br/>#Newlinethe name of another category.  Delete the template information and fill<br/>#Newlinein a new response.  You can also edit the pattern to simplify it or<br/>#Newlinegeneralize it with a "*" operator.<br/>#Newline<br/>,std-dont.aiml
0,HOW DO I RUN PROGRAM B,*,*,<br/>#NewlineUse the command "java B" to start the program.  On some Windows<br/>#Newlinemachines the Java runtime engine is started with the command<br/>#Newline"jview" instead of "java".  If "jview B" does not work#Comma try<br/>#Newline"jview Bawt".<br/>#Newline<br/>#NewlineRun program B and notice that the program creates an Edit View<br/>#Newlinetext window.  By default#Comma program B loads the chat robot ALICE<br/>#Newline(stored in B.aiml).<br/>#Newline<br/>,std-dont.aiml
0,HOW DO I UNINSTALL ALICE FROM MY SYSTEM,*,*,<br/>#NewlineIf you installed ALICE on Windows with a commercial installer like<br/>#NewlineInstallShield Java Edition#Comma then go to the start menu and<br/>#Newlineselect "Control Panel".  Click on the control panel item called<br/>#Newline"Add/Remove Programs".  Select ALICE from the list of installed<br/>#Newlinesoftware and choose "Uninstall".<br/>#Newline<br/>#NewlineAll the files of ALICE are stored in one directory on your computer<br/>#Newline(or folder) usually called "B" but maybe something else depending<br/>#Newlineon the name you chose when you downloaded ALICE.  In any case#Comma <br/>#NewlineALICE will not change or damage any other files on your system.  <br/>#NewlineTo remove ALICE from your computer#Comma simply remove this folder.  <br/>#NewlineDelete it#Comma or drag it to your trash bin and select "Empty trash"<br/>#Newline(or "Empty Recycle Bin").<br/>#Newline<br/>#NewlineIf you cannot find the folder where ALICE resides#Comma use the Finder<br/>#Newlineto locate the file called "B.aiml" on your file system.  The "B.aiml"<br/>#Newlinefile is in the same directory as all the ALICE files.  If this file does<br/>#Newlinenot exist#Comma then ALICE is probably not installed on your computer.<br/>#Newline<br/>#NewlineBecause ALICE is a platform-independent Java application#Comma it does<br/>#Newlinenot rely on the Windows Registry or other Windows-specific features.<br/>#NewlineYou can assume ALICE will leave your MS Windows Registry and <br/>#Newlineother Windows system files untouched.<br/>#Newline<br/>#NewlineConceivably if ALICE has run for a long time on your computer#Comma and<br/>#Newlineyou deliberately used the "Save Options" menu item to change the <br/>#Newlinename or location of her files to something other than the default values#Comma <br/>#Newlinethen there is a slight chance that there could be a few ALICE <br/>#Newlinefiles scattered around your disk.  Please refer to the DISCLAIMER <br/>#Newlineat the beginning of DON'T READ ME.  <br/>#Newline<br/>,std-dont.aiml
0,HOW DO I USE THAT,*,*,<br/>#NewlineThe AIML tag &lt;that&gt; refers to the robot's previous<br/>#Newlinereply.  There are two forms of the &lt;that&gt; tag:<br/>#Newlinea paired form &lt;that&gt;...&lt;/that&gt; appearing in a<br/>#Newlinecategory#Comma and an atomic form &lt;that/&gt; always appearing<br/>#Newlinein a template.  Often we can use &lt;that/&gt; to find<br/>#Newlinean opportunity to create a category with &lt;that&gt;&lt;/that&gt;.<br/>#Newline<br/>#NewlineOne of the default replies to the input "WHY" is<br/>#Newline"&lt;that/&gt;"?  Why?  This default produces the following<br/>#Newlinedialogue fragment:<br/>#Newline<br/>#NewlineRobot: Do not ask me any more questions please.<br/>#NewlineClient: WHY<br/>#NewlineRobot: "Do not ask me any more questions please"? Why?<br/>#Newline<br/>#NewlineThe botmaster notices the fragment and creates the<br/>#Newlinenew AIML category:<br/>#Newline<br/>#Newline&lt;category&gt;<br/>#Newline&lt;pattern&gt;WHY&lt;/pattern&gt;<br/>#Newline&lt;that&gt;DO NOT ASK ME ANY MORE QUESTIONS PLEASE&lt;/that&gt;<br/>#Newline&lt;template&gt;Because I would rather talk about you.&lt;/template&gt;<br/>#Newline&lt;/category&gt;<br/>#Newline<br/>#NewlineNow the next client who asks "WHY" to the robot's<br/>#Newlinerequest will active the new &lt;that&gt; category:<br/>#Newline<br/>#NewlineRobot: Do not ask me any more questions please.<br/>#NewlineClient: WHY<br/>#NewlineRobot: Because I would rather talk about you.<br/>#Newline<br/>#NewlineThis style of conversational analysis does not<br/>#Newlinepresuppose that we know when the client will<br/>#Newlinesay "WHY"; rather it looks backward to identify<br/>#Newlinecases where the "WHY" appeared following one<br/>#Newlineof the robot's statements.  Having identified<br/>#Newlinethe conversation point#Comma the botmaster creates<br/>#Newlinethe new category.<br/>#Newline<br/>,std-dont.aiml
0,HOW DO I USE THE LT TOPIC GT TAG,*,*,<br/>#Newline  The concept is that the botmaster uses the &lt;settopic&gt; tags to set <br/>#Newlinethe current topic being discussed.  Once the topic is set#Comma when <br/>#Newlinethe client types in a statement for ALICE to find a response for#Comma <br/>#Newlinethe categories defined within the &lt;topic&gt; tags matching the <br/>#Newlinecurrent topic will be searched first-- before any of the non-<br/>#Newlinetopic categories#Comma or the default categories.  If there is not a <br/>#Newlinematching category defined in the current topic#Comma then any <br/>#Newlinecategories that are not defined in topic tags are searched. As <br/>#Newlinementioned before#Comma you can create categories with identical <br/>#Newline&lt;pattern&gt; phrases in different topics#Comma each with different <br/>#Newlineresponses that cater to the current topic.<br/>#Newline<br/>#NewlineAn proof of concept example:<br/>#NewlineA very useful topic entry might be the default "*" input for <br/>#Newlinespecific topics.  If ALICE were set up on a pet store web site <br/>#Newlineand a person was talking to ALICE about dogs#Comma a useful entry <br/>#Newlinemight be:<br/>#Newline<br/>#Newline&lt;topic name="DOGS"&gt;<br/>#Newline<br/>#Newline &lt;category&gt;<br/>#Newline  &lt;pattern&gt; * &lt;/pattern&gt;<br/>#Newline  &lt;template&gt;<br/>#Newline   &lt;random&gt;<br/>#Newline    &lt;li&gt; Dogs are one of the most popular pets to have.&lt;/li&gt;<br/>#Newline    &lt;li&gt; Have you ever met a Chihuahua you didn't like?&lt;/li&gt;<br/>#Newline    &lt;li&gt; What else do you know about dogs? &lt;/li&gt;<br/>#Newline    &lt;li&gt; Do you have any questions about dogs? &lt;/li&gt;<br/>#Newline   &lt;/random&gt;<br/>#Newline  &lt;/template&gt;<br/>#Newline &lt;/category&gt;<br/>#Newline<br/>#Newline//more dog categories....<br/>#Newline<br/>#Newline&lt;/topic&gt;<br/>#Newline<br/>#NewlineNormally there would be many entries in a topic#Comma but in this <br/>#Newlineexample#Comma we simply entered the default "*".  In this case#Comma if the <br/>#Newlineperson said something that ALICE didn't have a specific <br/>#Newlineprogrammed response for#Comma she could still respond intelligently <br/>#Newlinewithin the current topic. (Note: this is all assuming there are <br/>#Newlineexisting categories that might set the current topic to "DOGS")<br/>#Newline<br/>#NewlineAlso#Comma though topics can only have one name#Comma they can contain the <br/>#Newlinewild characters "*" or "_" just like a pattern. Also#Comma while <br/>#Newlinesticking with the pattern criteria#Comma only one wildcard character <br/>#Newlineis allowed per name.  This would allow topics like "CARING FOR <br/>#NewlineDOGS" or "GROOMING DOGS" to also fall into the "_ DOGS" topic.  <br/>#NewlineAs with patterns#Comma the more specific topics would gain preference <br/>#Newlineover the wildcarded topic.  This means that if the topic is <br/>#Newlinecurrently "GROOMING DOGS" and yet there is not a programmed <br/>#Newlineresponse for the input in that category#Comma then "_ DOGS" would be <br/>#Newlinechecked#Comma and then next the default categories.<br/>#Newline<br/>#Newline<br/>,std-dont.aiml
0,HOW DO I USE THE PRONOUN TAGS,*,*,<br/>#NewlineThe guiding principle in creating content is dialogue analysis.<br/>#NewlineThe principle applies to pronouns like "it"#Comma "he" and "we".  This<br/>#Newlineexample shows how a couple of tricks helps us find places where<br/>#Newlinethe pronoun tags improve the dialogue.<br/>#Newline<br/>#Newline<br/>#NewlineClient: HELLO<br/>#NewlineRobot: Hi there!<br/>#NewlineClient: HOW ARE YOU<br/>#NewlineRobot: I am functioning within normal parameters.<br/>#NewlineClient: I AM BROKE<br/>#NewlineRobot: Do you mean your name is broke.<br/>#NewlineClient: NO I HAVE NO MONEY<br/>#NewlineRobot: I see. Would you like to have it?<br/>#NewlineClient: YES<br/>#NewlineRobot: "Would you like to have it"? Yes?<br/>#Newline<br/>#NewlineOne of the default responses to a YES pattern is <br/>#Newline"&lt;that/&gt;?" Yes?<br/>#Newline<br/>#NewlineThe conversation breaks down somewhat at this point#Comma but<br/>#Newlinethe robot nonetheless conveys an illusion of understanding<br/>#Newlinethe client's response.  With its response#Comma the robot is really <br/>#Newlinetelling the botmaster to create a new "YES" reply specific <br/>#Newlineto this situation:<br/>#Newline<br/>#Newline&lt;category&gt;<br/>#Newline&lt;pattern&gt;YES&lt;/pattern&gt;&lt;that&gt;WOULD YOU LIKE TO HAVE IT&lt;/that&gt;<br/>#Newline&lt;template&gt;Where do you usually get &lt;get_it/&gt;?&lt;/template&gt;<br/>#Newline&lt;/category&gt;<br/>#Newline<br/>#NewlineNow the next time we run the dialogue it ends with:<br/>#Newline<br/>#NewlineClient: NO I HAVE NO MONEY<br/>#NewlineRobot: I see. Would you like to have it?<br/>#NewlineClient: YES<br/>#NewlineRobot: Where do you usually get money?<br/>#Newline<br/>#NewlineThere is no automated technique to finding the conversation<br/>#Newlinepoints where the pronoun tags improve the flow of conversation.<br/>#NewlineThis is the "art" of AIML programming.  The example shown here<br/>#Newlinewith '"&lt;that/&gt;?" Yes?' exemplifies one approach to finding these<br/>#Newlineconversation way points.   There are no doubt countless other<br/>#Newlinetricks like this#Comma and the field is wide open to linguists and <br/>#Newlinewriters to help us uncover them.<br/>#Newline<br/>,std-dont.aiml
0,HOW DOES ALICE KEEP TRACK OF CONVERSATIONS,*,*,<br/>#NewlineOriginally ALICE used IP addresses to keep track of clients.<br/>#NewlineAssuming that everyone chatting with ALICE has a fixed IP<br/>#Newlineaddress#Comma at least for the duration of their conversation#Comma<br/>#Newlinethis technique works successfully.  Each IP address is a key<br/>#Newlineinto a hashtable (or database) that stores the client's<br/>#Newlinedialogue#Comma name#Comma and values of pronouns and other AIML values.<br/>#Newline<br/>#NewlineUnfortunately#Comma many clients have "dynamic IP addressing" enforced<br/>#Newlineby their ISP provider.  AOL and MS WebTV are two notorious examples: <br/>#Newlineeach successive client transaction appears to come from a different<br/>#Newlinehost.  For this reason#Comma program B uses a form of "virtual IP"<br/>#Newlineaddressing to track dialogues.  <br/>#Newline<br/>#NewlineThe form in index.html (and the ALICE home page) contains a<br/>#Newlinetag that creates a "hidden" parameter called "virtual" with<br/>#Newlinean initial value of "none."  The server assigns a unique name<br/>#Newlineto the value of "virtual"#Comma which then becomes a hidden variable<br/>#Newlinein the client's HTML form.  Each successive client transaction<br/>#Newlinecontains this virtual IP address; the server uses it as a key<br/>#Newlineto index the conversation.<br/>#Newline<br/>,std-dont.aiml
0,HOW DOES ALICE REMEMBER CLIENTS BETWEEN SESSIONS,*,*,<br/>#NewlineThe persistence of memory in ALICE is inherited from<br/>#Newlinethe Java Properties class.  The program B class Classifier<br/>#Newlinesaves the client name#Comma age#Comma location and other properties<br/>#Newlinein a set of Properties lists.  These Properties inherit<br/>#Newlinethe Java load and store methods.  Program B uses the load<br/>#Newlineand store methods to save the client properties in a set of<br/>#Newlinefiles with names ip_name.txt#Comma ip_age.txt#Comma ip_location.txt <br/>#Newlineand so on.  If these files become too large or bothersome#Comma<br/>#Newlinethere is no harm deleting or editing them#Comma or moving them<br/>#Newlineto another directory. <br/>#Newline<br/>#NewlineThe Applet requires no memory of the client properties#Comma because<br/>#Newlinethe applet has only the one client#Comma and in any case remains in <br/>#Newlinememory (at least for the lifetime of the client's browser cache).<br/>#Newline<br/>#Newline<br/>,std-dont.aiml
0,HOW DOES PROGRAM B WORK,*,*,<br/>#NewlineThe basic loop of program B is to accept an input#Comma<br/>#Newlineeither from the GUI or from the Web#Comma to<br/>#Newlinepreprocess that input and segment it into sentences#Comma<br/>#Newlineand#Comma for each sentence#Comma to find the best match among<br/>#Newlinethe patterns#Comma and to return the corresponding reply.<br/>#NewlineEach reply is itself an AIML template#Comma in effect a mini-<br/>#Newlineprogram that tells program B how to construct the reply.<br/>#Newline<br/>#NewlineThe algorithm is thus divided into a matching phase<br/>#Newlineand a response evaluation phase.  In fact these two<br/>#Newlinephases interleave#Comma because the response may evoke<br/>#Newlinea recursive call to the pattern matcher with the<br/>#Newline&lt;srai&gt; or &lt;sr/&gt; tags.  <br/>#Newline<br/>,std-dont.aiml
0,HOW DOES THE APPLET DIFFER FROM THE APPLICATION,*,*,<br/>#NewlineThe Applet runs on the client's computer; the server runs<br/>#Newlineon your host machine.  The applet has fewer privileges and<br/>#Newlinetherefore a simpler user interface than the Application#Comma<br/>#Newlinewhich uses menus and buttons to control server-side functions.<br/>#NewlineThe Applet may reside on any web server#Comma such as one provided<br/>#Newlinewith an ISP account#Comma but the application requires a 24/7<br/>#Newlineconnection to the Web. <br/>#Newline<br/>#NewlineInternally#Comma the primary difference between the two programs<br/>#Newlineis that the Applet handles only one client conversation#Comma <br/>#Newlinewhile the application processes multiple client connections<br/>#Newlinesimultaneously.  The Applet also suppresses all HTML (and any<br/>#Newlineother XML) from the client response.<br/>#Newline<br/>,std-dont.aiml
0,HOW DOES THE APPLET WORK,*,*,<br/>#NewlineProgram B supports the creation of both server-side and client-side <br/>#Newlinechat robots.  The server runs as a thread in program B.  The <br/>#Newlineclient-side version is supported by an applet called Blet.java.<br/>#Newline<br/>#NewlineThe Applet Blet.java runs ALICE in a web browser#Comma or with <br/>#Newlinethe Java tool appletviewer.  The file "index.html" contains an<br/>#Newlineexample of the HTML Applet tag syntax needed to start<br/>#Newlinethe Applet.  The command "appletviewer index.html" will start the<br/>#NewlineApplet.<br/>#Newline<br/>#NewlineYou also have to create the file "index.html" and change the<br/>#Newlinedefault value of the parameters "codebase" and<br/>#Newline"applethost" serve the Applet from your location.<br/>#Newline<br/>,std-dont.aiml
0,HOW DOES THE LT CONDITION GT TAG WORK,*,*,<br/>#NewlineThis category illustrates the function of the<br/>#Newline(template-side) condition tag.  The input pattern<br/>#Newlineis "TEST COND":<br/>#Newline<br/>#Newline&lt;category&gt;<br/>#Newline&lt;pattern&gt;TEST COND&lt;/pattern&gt;<br/>#Newline&lt;template&gt;<br/>#NewlineThis category has two condition statements.&lt;br&gt;<br/>#NewlineThe first is activated when you are on the host machine:&lt;br&gt;<br/>#Newline&lt;condition name="ip" value="localhost"&gt;<br/>#NewlineYou are the true botmaster.&lt;br&gt;<br/>#Newline&lt;/condition&gt;<br/>#NewlineThe second condition is activated when you claim to<br/>#Newlinebe the botmaster.&lt;br&gt;<br/>#Newline&lt;condition name="name" value="* WALLACE"&gt;<br/>#NewlineImposter!  You are not my real botmaster.&lt;br&gt;<br/>#Newline&lt;/condition&gt;<br/>#Newline<br/>#Newline<br/>#NewlineTwo dialogues from different hosts show two<br/>#Newlinepossible outputs of this category:<br/>#Newline<br/>#Newline<br/>#Newline--------------------dialup.mindspring.com--------------<br/>#NewlineClient: MY NAME IS DR WALLACE.<br/>#NewlineRobot: OK I will call you Dr Wallace.<br/>#NewlineClient: TEST COND.<br/>#NewlineRobot: This category has two condition statements. <br/>#NewlineThe first is activated when you are on the host machine:<br/>#NewlineThe second condition is activated when you claim to be the botmaster.<br/>#NewlineImposter! You are not my real botmaster. <br/>#NewlineThat concludes our test of the condition tag.<br/>#Newline---------------------localhost-------------------------<br/>#NewlineClient: TEST COND.<br/>#NewlineRobot: This category has two condition statements. <br/>#NewlineThe first is activated when you are on the host machine:<br/>#NewlineYou are the true botmaster.<br/>#NewlineThe second condition is activated when you claim to be the botmaster.<br/>#NewlineThat concludes our test of the condition tag.<br/>#Newline<br/>#Newline<br/>#NewlineNote:<br/>#Newline<br/>#Newline1. There may be multiple &lt;condition&gt; tags in the<br/>#Newline&lt;template&gt;.   [But nesting doesn't work yet.]<br/>#Newline<br/>#Newline2. The predname must be one of: it#Comma ip#Comma he#Comma she#Comma age#Comma<br/>#Newlinename#Comma topic#Comma gender#Comma location#Comma or one of the custom predicates<br/>#Newlinedefined in predicates.txt<br/>#Newline<br/>#Newline3. The value string may contain an AIML pattern with up to<br/>#Newlineone wild-card "*" symbol.<br/>#Newline<br/>#Newline4. The test for the &lt;condtion&gt; being true uses <br/>#NewlineUnifier.unify() to compare the stored predicate value<br/>#Newlinewith the value string.  This is the same way<br/>#Newline&lt;that&gt; and &lt;topic&gt; work.<br/>#Newline<br/>#Newline5. If the test returns true#Comma then the response contains<br/>#Newlinewhatever is inside the &lt;condition&gt;...&lt;/condition&gt; tags#Comma<br/>#Newlineotherwise those contents are blanked.<br/>#Newline<br/>#Newline<br/>,std-dont.aiml
0,HOW DOES THE PERSONALITY WIZARD WORK,*,*,<br/>#NewlineThe simplest way to alter the content of the basic ALICE<br/>#Newlinerobot personality is to run the Personality Wizard on<br/>#Newlinethe "Options" menu (or in the Kid interface).  <br/>#NewlineThis wizard asks the botmaster a series<br/>#Newlineof questions to set the values of a set of robot<br/>#Newlinepersonality tags including its name#Comma gender#Comma preferences<br/>#Newlineand replies to very common questions.<br/>#Newline<br/>#NewlineThe Personality Wizard does not create any new AIML<br/>#Newlinecategories.  The replies set the value of global tags<br/>#Newlinelike &lt;location/&gt; and &lt;favorite_movie/&gt; that might be<br/>#Newlineused in many categories throughout the AIML knowledge<br/>#Newlinebase.  The basic set of Wizard questions are collected<br/>#Newlinein the file Personality.aiml. <br/>#Newline<br/>#NewlineHint: If you plan to use the Applet#Comma avoid the double-quote (")<br/>#Newlinecharacter in the Personality Wizard.<br/>#Newline<br/>,std-dont.aiml
0,HOW DOES THE RANDOM FUNCTION WORK,*,*,<br/>#NewlineThe random function is (so far) the only AIML method<br/>#Newlinewith a list argument.  Its purpose is random selection<br/>#Newlineof one of a set of text items.  In "old-style" AIML the<br/>#Newlinetext appendage operator "+" also served as a list-item<br/>#Newlinemarker.  In XML style we use the HTML &lt;li&gt; list-item<br/>#Newlinetag.  <br/>#Newline<br/>#Newline&lt;random&gt; &lt;li&gt;X1&lt;/li&gt;&lt;li&gt;X2&lt;/li&gt;  &lt;/random&gt;      Say one of X1 or X2 randomly<br/>#Newline&lt;random&gt;&lt;li&gt;A&lt;/li&gt;&lt;li&gt;B&lt;/li&gt;&lt;li&gt;C&lt;/li&gt;&lt;/random&gt; Say one of A#Comma B or C randomly<br/>#Newline<br/>#NewlineThe &lt;random&gt; tag has higher precedence than other AIML tags.<br/>#NewlineMoreover#Comma the AIML parser interprets only the markup inside<br/>#Newlinethe selected random list item.  AIML tags inside other list items<br/>#Newlineare ignored.<br/>#Newline<br/>,std-dont.aiml
0,HOW DOES THE WEB SERVER WORK,*,*,<br/>#NewlineBy default the web server starts on port 2001.  This means you can<br/>#Newlineaccess the web server through the URL http://localhost:2001 on<br/>#Newlineyour own machine.  Find out your IP address or DNS name and tell<br/>#Newlineyour friends to connect to "http://yourcompany.com:2001".<br/>#Newline(One way to find out your IP address is by running "netstat -n"<br/>#Newlineto view all your open TCP/IP connections).<br/>#Newline<br/>,std-dont.aiml
0,HOW MUCH MEMORY DO I NEED TO RUN PROGRAM B,*,*,<br/>#NewlineThe source code compresses to as little as half a megabyte#Comma including<br/>#Newlineall the AIML files for nearly 16#Comma000 categories.  You may have downloaded<br/>#Newlinea file of only around 500K.  Plan to use a minimum 10 MB of hard disk space<br/>#Newlinefor the download directory.  The hard disk requirements include not<br/>#Newlineonly the source code and Java class files#Comma but also the dialogue files<br/>#Newlineand other temporary files created by the robot.<br/>#Newline<br/>#NewlineThe RAM requirements vary depending on the size of your robot.<br/>#NewlineTo run the fully loaded ALICE chat robot with 16#Comma000 categories<br/>#Newlineyou will need 64MB of memory.  To do this and anything else at<br/>#Newlinethe same time on your system we recommend a minimum of 96MB.  <br/>#NewlineWith less memory you can load a smaller robot.  See the question<br/>#Newlinebelow "What is &lt;load filename="X"/&gt;?"<br/>#Newline<br/>,std-dont.aiml
0,HOW RECURSIVE IS AIML,*,*,<br/>#NewlineUnderstanding recursion is important to understanding AIML.<br/>#Newline"Recursion" means applying the same solution over and over<br/>#Newlineagain#Comma to smaller and smaller problems#Comma until you reduce<br/>#Newlinethe problem to its simplest form.  AIML uses the tags<br/>#Newline&lt;sr/&gt; and &lt;srai&gt; to implement recursion.  The botmaster<br/>#Newlineuses these tags to tell the robot how to respond to a<br/>#Newlinecomplex sentence by breaking it down into the responses<br/>#Newlineto simpler ones.  <br/>#Newline<br/>#NewlineRecursion can apply many times to a single input. Given<br/>#Newlinethe normalized input:<br/>#Newline<br/>#NewlineALICE CAN YOU PLEASE TELL ME WHAT LINUX IS RIGHT NOW <br/>#Newline<br/>#Newlinean AIML category with the pattern "_ RIGHT NOW" matches first#Comma<br/>#Newlinereducing the input to:<br/>#Newline<br/>#NewlineALICE CAN YOU PLEASE TELL ME WHAT LINUX IS<br/>#Newline<br/>#NewlineAnother pattern ("&lt;name/&gt; *") reduces it to:<br/>#Newline <br/>#NewlineCAN YOU PLEASE TELL ME WHAT LINUX IS<br/>#Newline<br/>#NewlineAnd then:<br/>#Newline<br/>#NewlinePLEASE TELL ME WHAT LINUX IS <br/>#Newline<br/>#Newlinereduces to:<br/>#Newline<br/>#NewlineTELL ME WHAT LINUX IS<br/>#Newline<br/>#Newlineand finally to:<br/>#Newline<br/>#NewlineWHAT IS LINUX<br/>#Newline<br/>,std-dont.aiml
