0,CAN I ANALYZE THE DIALOGUES COLLECTED BY THE APPLET,*,*,<br/>#NewlineIf the web server produces an access_log file#Comma such<br/>#Newlineas /var/log/httpd/access_log#Comma then the server records<br/>#NewlineApplet dialogue in the access_log file.  You may use<br/>#Newlineftp to download the access_log file to your machine;<br/>#Newlinethen run program B to analyze it.  <br/>#Newline<br/>#NewlineGo to the Options menu and find the value for "AnalysisFile".<br/>#NewlineThe Classify function operates on the data in the AnalysisFile.<br/>#NewlineBy default the AnalysisFile is the same as the LogFile (the<br/>#Newlinecurrent server log file).  But you can change the analysis<br/>#Newlinefile to another name#Comma such as /var/log/httpd/access_log or<br/>#Newlinejust access_log.<br/>#Newline<br/>,std-dont.aiml
0,CAN I BUILD ON TOP OF THE ALICE CODE RATHER THAN CHANGING IT,*,*,<br/>#NewlineAbsolutely. You only have to change her name#Comma location#Comma birthday and/or<br/>#Newlinebotmaster#Comma and put a couple of references to yourself.  Then add new<br/>#Newlinecategories that cover your own area of expertise or interest.<br/>#Newline<br/>,std-dont.aiml
0,CAN I CHANGE THE NAME OF THE ROBOT,*,*,<br/>#NewlineThe AIML tag &lt;name/&gt; inserts the name of the Bot wherever it appears.<br/>#NewlineThe default robot name is "ALICE" but you can change it in the<br/>#Newline"Options menu".  Select "Show Options" and replace "ALICE" with the <br/>#Newlinename of your bot#Comma and then do "Save Options".  Depending on your<br/>#Newlinestate#Comma you may need to restart program B. <br/>#Newline<br/>,std-dont.aiml
0,CAN I CREATE A LANGUAGE SPECIFIC INSTALLTION,*,*,<br/>#NewlineYes.  The file "language.txt" controls the language of the <br/>#Newlinebuttons and menus in the ALICE GUI.  If the file is missing#Comma<br/>#Newlinethe program uses English names by default.  To see an<br/>#Newlineexample of a language-specific installation#Comma copy the<br/>#Newlinefile "Germanlanguage.txt" to "language.txt" and start<br/>#Newlineprogram B.  <br/>#Newline<br/>#Newline<br/>,std-dont.aiml
0,CAN I CREATE MORE AIML TAGS,*,*,<br/>#NewlineAIML is extensible.  You can create an infinite number of<br/>#Newlinenew tags for foreign language pronouns#Comma predicates#Comma or<br/>#Newlineapplication-specific properties.  The file "predicates.txt"<br/>#Newlinedefines any new predicate tags.  "Predicate tags" mean<br/>#Newlinetags that have a client-specific "set" and "get" method.<br/>#NewlinePronouns like "it" and "he" have predicate tags like<br/>#Newline&lt;set_it&gt;&lt;/set_it&gt; and &lt;get_he/&gt;.  AIML has a number of<br/>#Newlinethese built-in tags for common English pronouns.<br/>#Newline<br/>#NewlineThere are two varieties of extensible predicate tags.<br/>#NewlineThe first example illustrates the use of new tags <br/>#Newlinefor foreign language pronouns.  The Japanese language<br/>#Newlinepronoun "kare" means "he".  In predicates.txt#Comma we<br/>#Newlinecan add a line of the form:<br/>#Newline<br/>#Newlinekare=dare<br/>#Newline<br/>#NewlineThis single line automatically generates the tags<br/>#Newline&lt;set_kare&gt; X &lt;/set_kare&gt; to set the value of "kare"<br/>#Newlineto X#Comma and the tag &lt;get_kare/&gt; to retrieve the value.<br/>#NewlineBy default#Comma &lt;get_kare/&gt; returns "dare" ("who?").  <br/>#Newline<br/>#NewlineNow we can create two AIML categories for an elementary<br/>#NewlineJapanese conversation:<br/>#Newline<br/>#Newline&lt;category&gt;<br/>#Newline&lt;pattern&gt;KARE WA * DESU&lt;/pattern&gt;<br/>#Newline&lt;template&gt;&lt;star/&gt; wa &lt;set_kare&gt;&lt;star/&gt;&lt;/set_kare&gt; desu.&lt;/template&gt;<br/>#Newline&lt;/category&gt;<br/>#Newline&lt;category&gt;<br/>#Newline&lt;pattern&gt;KARE WA * DESU KA&lt;/pattern&gt;<br/>#Newline&lt;template&gt;&lt;get_kare/&gt; desu ka? &lt;/template&gt;<br/>#Newline&lt;/category&gt;<br/>#Newline&lt;category&gt;<br/>#Newline<br/>#NewlineThese two categories produce a coherent conversation<br/>#Newlineabout Mr. Arimoto:<br/>#Newline<br/>#NewlineClient: KARE WA DARE DESU KA<br/>#NewlineRobot: dare desu ka?<br/>#NewlineClient: KARE WA ARIMOTO SAN DESU<br/>#NewlineRobot: arimoto san wa kare desu.<br/>#NewlineClient: KARE WA DARE DESU KA<br/>#NewlineRobot: arimoto san desu ka?<br/>#Newline<br/>#NewlineNotice that the program replaces &lt;set_kare/&gt;&lt;star/&gt;&lt;/set_kare&gt; <br/>#Newlinewith "kare"#Comma the default value of this tag.  Sometimes however<br/>#Newlinethe default value of the tag is not the best choice for<br/>#Newlinethe set tag to return.  The second type of predicate tag <br/>#Newlinereplaces the set tag markup with the original string<br/>#Newlineinside the markup.  <br/>#Newline<br/>#NewlineTo create a predicate tag "has" we add the following line<br/>#Newlineto predicates.txt:<br/>#Newline<br/>#Newlinehas=*mother<br/>#Newline<br/>#NewlineThe default value of &lt;get_has/&gt; is "mother" (because<br/>#Newlineeveryone has a mother).  The "*" here indicates that<br/>#Newlinethe program should replace &lt;set_has&gt; X &lt;/set_has&gt;<br/>#Newlinewith X.  <br/>#Newline<br/>#NewlineHere we write two AIML categories to demonstrate the<br/>#Newline"has" predicate:<br/>#Newline<br/>#Newline&lt;category&gt;<br/>#Newline&lt;pattern&gt;I HAVE A *&lt;/pattern&gt;<br/>#Newline&lt;template&gt;Where did you get <br/>#Newline&lt;set_it&gt;&lt;set_has&gt;&lt;person/&gt;&lt;/set_has&gt;&lt;/set_it&gt;?<br/>#Newline&lt;/template&gt;<br/>#Newline&lt;/category&gt;<br/>#Newline<br/>#Newline&lt;category&gt;<br/>#Newline&lt;pattern&gt;WHAT DO I HAVE&lt;/pattern&gt;<br/>#Newline&lt;template&gt;Tell me more about your &lt;get_has/&gt;. &lt;/template&gt;<br/>#Newline&lt;/category&gt;<br/>#Newline<br/>#NewlineNotice that the first category embeds &lt;set_has&gt; in &lt;set_it&gt;#Comma<br/>#Newlineso that the value of &lt;person/&gt; becomes both "it" and "has".<br/>#NewlineThe resulting dialogue:<br/>#Newline<br/>#NewlineClient: WHAT DO I HAVE<br/>#NewlineRobot: Tell me more about your mother.<br/>#NewlineClient: I HAVE A BOX<br/>#NewlineRobot: Where did you get it?<br/>#NewlineClient: WHAT DO I HAVE<br/>#NewlineRobot: Tell me more about your box.<br/>#Newline<br/>#NewlineLook at the file "predicates.txt" for several more <br/>#Newlineexamples of custom AIML tags#Comma including the German<br/>#Newline&lt;set_sie&gt;#Comma &lt;set_er&gt; and &lt;set_es&gt;.<br/>#Newline<br/>,std-dont.aiml
0,CAN I HAVE A PRIVATE CONVERSATION WITH ALICE,*,*,<br/>#NewlineThe ALICE server logs and records all conversations.  Even the ALICE<br/>#NewlineApplet tries to transmit conversation logs back to the originating server.<br/>#NewlineYou can have a private conversation with ALICE#Comma however#Comma if you download<br/>#NewlineProgram B to your own computer and run it there.  Running on your machine#Comma<br/>#Newlinethe server stores all the conversations locally.<br/>#Newline<br/>#Newline<br/>,std-dont.aiml
0,CAN I INCLUDE JAVASCRIPT IN THE ROBOT REPLY,*,*,<br/>#NewlineYes.  You can include any HTML including &lt;script&gt; tags.  Suppose you<br/>#Newlinewant to "chat AND browse#Comma" in other words#Comma have the robot open<br/>#Newlineup a new browser window when she provides a URL link.  Here's a category that<br/>#Newlinekicks out a piece of HTML/scripting that opens a new window with and loads a<br/>#Newlinegiven URL.   This is handy for search engines or showing off one's web page.<br/>#Newline<br/>#Newline&lt;category&gt;<br/>#Newline &lt;pattern&gt; WHERE IS YOUR WEB SITE &lt;/pattern&gt;<br/>#Newline &lt;template&gt;<br/>#Newline    It's at "http://www.geocities.com/krisdrent/"<br/>#Newline    &lt;script language="JavaScript"&gt;<br/>#Newline   // Go to &lt;a href="http://www.geocities.com/krisdrent"&gt;The ALICE<br/>#NewlineConnection&lt;/a&gt;<br/>#Newline   &lt;!--<br/>#Newline   window.open("http://www.geocities.com/krisdrent/")<br/>#Newline   --&gt;<br/>#Newline  &lt;/script&gt;<br/>#Newline &lt;/template&gt;<br/>#Newline&lt;/category&gt;<br/>#Newline<br/>#NewlineA couple of things to note about this technique:  #1#Comma this will only work<br/>#Newlinewhen ALICE is being talked to from a browser that runs JavaScript#Comma i.e. it<br/>#Newlinewon't work in the applet.  We have tested it in Netscape and MS Internet<br/>#NewlineExplorer#Comma and it works well in both.  #2.  For the above reason#Comma it is<br/>#Newlineimportant to have some sort of explanatory statement before the scripting in<br/>#Newlinecase the scripting isn't supported.  Besides#Comma you want some response in your<br/>#NewlineALICE window#Comma even if another window DOES come up.  #3.  If this is viewed<br/>#Newlinein a browser that doesn't understand the &lt;script&gt; tag#Comma notice that this line<br/>#Newlinewill show up:<br/>#Newline"// Go to &lt;a href="http://www.geocities.com/krisdrent"&gt;The ALICE<br/>#NewlineConnection&lt;/a&gt;"<br/>#NewlineWhich is good#Comma because it gives a back-up for the "non-scripted" (the Lynx<br/>#Newlineusers#Comma I guess.)  And remember that you have to keep the "//" in front of<br/>#Newlineany non-java-script lines within the &lt;script&gt; tag.<br/>#Newline<br/>,std-dont.aiml
0,CAN I INSERT DYNAMIC HTML INTO THE ROBOT REPLY,*,*,<br/>#NewlineIf you are fortunate enough to be running lynx under Linux#Comma the <br/>#Newlinefollowing markup is a simple way to "inline" the results of an HTTP <br/>#Newlinerequest into the chat robot reply.   Try asking ALICE:<br/>#Newline"What chatterbots do you know?" and she will reply with a page<br/>#Newlineof links generated by the Google search engine.<br/>#Newline<br/>#Newline&lt;category&gt;<br/>#Newline&lt;pattern&gt;WHAT *&lt;/pattern&gt;<br/>#Newline&lt;template&gt;<br/>#NewlineHere is the information I found:<br/>#Newline&lt;system&gt;<br/>#Newlinelynx -dump -source -image_links http://www.google.com/search?q=&lt;personf/&gt;<br/>#Newline&lt;/system&gt;<br/>#Newline&lt;/template&gt;<br/>#Newline&lt;/category&gt;<br/>#Newline<br/>,std-dont.aiml
0,CAN I RUN PROGRAM B IN THE BACKGROUND ON A NT SERVER,*,*,<br/>#NewlineYes. Set up your PC / Server to run Alice B as you normal. (Download the Java<br/>#NewlineDevelopers Kit#Comma etc.)<br/>#Newline<br/>#NewlineCreate a Batch file#Comma in folder B containing only this text.<br/>#Newline<br/>#Newline'jview bterm'<br/>#Newline<br/>#NewlineCreate a task in the Task Schedule Wizard to run the batch file. (Ensure the<br/>#Newlinetask starts in drive:\path\B'<br/>#Newline<br/>#NewlineGive the Task Schedule an appropriate Logon and password for the Server or<br/>#NewlinePC.<br/>#Newline<br/>#NewlineRight-click#Comma select Run now#Comma and log on and off as you like.<br/>#Newline<br/>,std-dont.aiml
0,CAN I RUN SHELL COMMANDS FROM AIML SCRIPTS,*,*,<br/>#NewlineYes.  Use the &lt;system&gt;X&lt;/system&gt; tag to run the shell command X.<br/>#NewlineThe command X is assumed to produce its output in line-oriented<br/>#Newlineformat suitable for a BufferdReader to read line by line.  <br/>#NewlineA simple example of this command in an AIML script is:<br/>#Newline<br/>#Newline&lt;category&gt;<br/>#Newline&lt;pattern&gt;WHAT TIME IS IT&lt;/pattern&gt;<br/>#Newline&lt;template&gt;The local time is: &lt;system&gt;date&lt;/system&gt;&lt;/template&gt;<br/>#Newline&lt;/category&gt;<br/>#Newline<br/>#NewlineThe "date" command is a system command that generates a text<br/>#Newlinestring containing the date and time.  (Note that this might<br/>#Newlinenot work on Windows).<br/>#Newline <br/>#NewlineTake extreme care in using the &lt;system&gt; tag because it <br/>#Newlinepotentially permits remote clients to run a command on<br/>#Newlineyour system.  <br/>#Newline<br/>,std-dont.aiml
0,CAN I RUN THE WEB SERVER AS A DAEMON PROCESS,*,*,<br/>#NewlineYes.  There is a class file called Bterm.java in the<br/>#Newlineprogram B distribution.   Bterm runs the web server<br/>#Newlineas a console application#Comma with no GUI.  You can<br/>#Newlineredirect the output of program Bterm to a log file<br/>#Newlineand start the process in the background with<br/>#Newline"java Bterm &gt; B.log &amp;" (assuming a Unix shell). <br/>#Newline<br/>,std-dont.aiml
0,CAN I SPEAK TO THE ROBOT WITH VOICE INPUT,*,*,<br/>#NewlineOne simple experiment that works well as a demo<br/>#Newlineinvolves using IBM ViaVoice (tm) speech recognition<br/>#Newlinesoftware on a Windows platform.  At the same time#Comma<br/>#Newlinerun the ALICE program B web server and activate the<br/>#NewlineMS Agent interface.  The ViaVoice software allows<br/>#Newlineyou to dictate into an application called VoicePad#Comma<br/>#Newlinebut not directly into the browser.  You have to<br/>#Newlineuse "cut" and "paste" to move your speech inputs<br/>#Newlineinto the browser form for ALICE.  But the net effect<br/>#Newlineis a somewhat slow voice-in voice-out conversation<br/>#Newlinewith ALICE.  <br/>#Newline<br/>#NewlineThe ViaVoice software seems to work well with ALICE<br/>#Newlineafter some training.  We trained it with the file<br/>#Newline"patterns.txt" created with the "List Patterns" command.<br/>#Newline<br/>,std-dont.aiml
0,CAN I TEST THE ROBOT OFFLINE ON MY DESKTOP,*,*,<br/>#NewlineYes.  You can run the program B server and connect to it with<br/>#Newlinea browser#Comma even if your desktop computer is offline.<br/>#Newline<br/>#NewlineWhen working offline#Comma it often helps to change the Internet<br/>#Newlinesettings (in IE or Netscape) to "local area network".  <br/>#NewlineThen your machine becomes a one-computer network. You should <br/>#Newlinebe able to use IE to connect to program B with http://localhost:2001.<br/>#Newline<br/>,std-dont.aiml
0,CAN PROBABILITY STATISTICS WEIGHTS NEURAL NETWORKS OR FUZZY LOGIC IMPROVE BOTS,*,*,<br/>#NewlineStatistics are in fact heavily used in the ALICE server#Comma but not in the way<br/>#Newlineyou might think.  ALICE uses 'Zipf Analysis' to plot the rank-frequency of<br/>#Newlinethe activated categories and to reveal inputs from the log file that don't<br/>#Newlinealready have specific replies#Comma so the botmaster can focus on answering<br/>#Newlinequestions people actually ask (the "Quick Targets" function).<br/>#Newline<br/>#NewlineOther bot languages#Comma notably the one used for Julia#Comma make heavy use of<br/>#Newline"fuzzy" or "weighted" rules.  We see their problem as this: the botmaster<br/>#Newlinealready has enough to worry about without having to make up "magic<br/>#Newlinenumbers" for every rule.  Once you get up 10#Comma000 categories (like ALICE)<br/>#Newlineyou don't want to think about more parameters than necessary.  Bot<br/>#Newlinelanguages with fuzzy matching rules tend to have scaling problems.<br/>#Newline<br/>#NewlineFinally#Comma the bot replies are not as deterministic as you might think#Comma even<br/>#Newlinewithout weights.  Some answers rely on &lt;random&gt; to select one of several<br/>#Newlinepossible replies.  Other replies generated by unforseen user input also<br/>#Newlinecreate "spontaneous" outputs that the botmaster doesn't anticipate.<br/>#Newline<br/>,std-dont.aiml
0,CAN THE APPLET RECORD A DIALOG TXT FILE ON THE SERVER,*,*,<br/>#NewlineNo because the applet cannot write the file directly on the originating host.<br/>#NewlineIf your server log file /var/log/httpd/access_log is too large; you <br/>#Newlinehave a couple of choices:<br/>#Newline1. If your ISP is a unix account#Comma use telnet to log on to a shell account.<br/>#NewlineUse the command "grep Blog &lt; access_log &gt; dialog.txt" to create a smaller<br/>#Newlinefile to download which contains just the lines recorded by the applet.<br/>#Newline2. Create a CGI-BIN command called "/cgi-bin/Blog" that reads its<br/>#Newlinecommand-line argument and appends it to a file called "dialog.txt".<br/>#NewlineThere ought to be a nice Perl script for this#Comma or even a shell script.<br/>#Newline<br/>,std-dont.aiml
0,CAN THE APPLETHOST USE A SYMBOLIC DNS NAME INSTEAD OF AN IP NUMBER,*,*,<br/>#NewlineThe answer is yes#Comma but the numeric IP address works on more machines<br/>#Newlinethan a symbolic name.  Applets are protected by a "security sandbox"<br/>#Newlinefrom interfering with local resources on your machine.  One restriction<br/>#Newlineis that Applets may only open socket connections to the originating<br/>#Newlinehost.  When using a symbolic DNS name#Comma the "sandbox" may not know that <br/>#Newlinetwo variations such as "Www.AliceBot.Org" and "alicebot.org" are<br/>#Newlinein fact the same server.  The client might not be able to resolve <br/>#Newlinethe DNS name#Comma and the Applet will throw a security exception.<br/>#Newline<br/>,std-dont.aiml
0,CAN THE VIRTUAL IP BE THE REAL IP,*,*,<br/>#NewlineActually that would be the default case#Comma when the client chats from<br/>#Newlinethe same fixed IP address.  The only time the virtual ip differs from<br/>#Newlinethe real one is when the client is behind a dynamic firewall#Comma like<br/>#NewlineWebTV or AOL customers.<br/>#Newline<br/>,std-dont.aiml
0,CAN YOU GIVE ME A QUICK PRIMER ON AIML,*,*,<br/>#NewlineGiven only the &lt;pattern&gt; and &lt;template&gt; tags#Comma there are three<br/>#Newlinegeneral types of categories: (a) atomic#Comma (b) default#Comma and (c) recursive.<br/>#NewlineStrictly speaking#Comma the three types overlap#Comma because "atomic"<br/>#Newlineand "default" refer to the &lt;pattern&gt; and "recursive" refers to<br/>#Newlinea property of the &lt;template&gt;.<br/>#Newline<br/>#Newlinea). "Atomic" categories are those with atomic patterns#Comma i.e. the pattern<br/>#Newlinecontains no wild card "*" or "_" symbol.  Atomic categories are the<br/>#Newlineeasiest#Comma simplest categories to add in AIML.  <br/>#Newline<br/>#Newline&lt;category&gt;<br/>#Newline  &lt;pattern&gt;WHAT IS A CIRCLE&lt;/pattern&gt;<br/>#Newline  &lt;template&gt;&lt;set_it&gt;A cicle&lt;/set_it&gt; is a the set of points equidistant <br/>#Newlinefrom a common point called the center.<br/>#Newline  &lt;/template&gt;<br/>#Newline&lt;/category&gt;<br/>#Newline<br/>#Newlineb). The name "default category" derives from the fact that its pattern<br/>#Newlinehas a wildcard "*" or "_".  The ultimate default category is the<br/>#Newlineone with &lt;pattern&gt;*&lt;/pattern&gt;#Comma which matches any input.  In the<br/>#NewlineALICE distribution the ultimate default category resides in a file<br/>#Newlinecalled "Pickup.aiml".  These default responses are often called<br/>#Newline"pickup lines" because they generally consist of leading questions<br/>#Newlinedesigned to focus the client on known topics.<br/>#Newline<br/>#NewlineThe more common default categories have patterns combining a few <br/>#Newlinewords and a wild card.  For example the category:<br/>#Newline<br/>#Newline&lt;category&gt;<br/>#Newline  &lt;pattern&gt;I NEED HELP *&lt;/pattern&gt;<br/>#Newline  &lt;template&gt;Can you ask for help in the form of a question?&lt;/template&gt;<br/>#Newline&lt;/category&gt;<br/>#Newline<br/>#Newlineresponds to a variety of inputs from "I need help debugging my program"<br/>#Newlineto "I need help with my marriage."  Putting aside the philosophical<br/>#Newlinequestion of whether the robot really "understands" these inputs#Comma <br/>#Newlinethis category elucidates a coherent response from the client#Comma <br/>#Newlinewho at least has the impression of the robot understanding the<br/>#Newlineclient's intention.  <br/>#Newline<br/>#NewlineDefault categories show that writing AIML is both an art and a<br/>#Newlinescience.  Writing good AIML responses is more like writing good <br/>#Newlineliterature#Comma perhaps drama#Comma than like writing computer programs.<br/>#Newline<br/>#Newlinec). "Recursive" categories are those that "map" inputs to other<br/>#Newlineinputs#Comma either to simplify the language or to identify synonymous<br/>#Newlinepatterns.  <br/>#Newline<br/>#NewlineMany synonymous inputs have the same response.  This is accomplished<br/>#Newlinewith the recursive &lt;srai&gt; tag.  Take for example the input "GOODBYE".<br/>#NewlineThis input has dozens of synonyms: "BYE"#Comma "BYE BYE#Comma "CYA"#Comma "GOOD BYE"#Comma<br/>#Newlineand so on.  To map these inputs to the same output for GOODBYE we <br/>#Newlineuse categories like:<br/>#Newline<br/>#Newline&lt;category&gt;<br/>#Newline  &lt;pattern&gt;BYE BYE&lt;/pattern&gt;<br/>#Newline  &lt;template&gt;&lt;srai&gt;GOODBYE&lt;/srai&gt;&lt;/template&gt;<br/>#Newline&lt;/category&gt;<br/>#Newline<br/>#NewlineSimplification or reduction of complex input patterns is another<br/>#Newlinecommon application for recursive categories.  In English the<br/>#Newlinequestion "What is X" could be asked many different ways: <br/>#Newline"Do you know what X is?"#Comma "Tell me about X"#Comma "Describe X"#Comma<br/>#Newline"What can you tell me about X?"#Comma and "X is what?" are just a few<br/>#Newlineexamples.  Usually we try to store knowledge in the most concise#Comma<br/>#Newlineor common form.  The &lt;srai&gt; function maps all these forms to<br/>#Newlinethe base form:<br/>#Newline<br/>#Newline&lt;category&gt;<br/>#Newline  &lt;pattern&gt;DO YOU KNOW WHAT * IS&lt;/pattern&gt;<br/>#Newline  &lt;template&gt;&lt;srai&gt;WHAT IS &lt;star/&gt;&lt;/srai&gt;&lt;/template&gt;<br/>#Newline&lt;/categroy&gt;<br/>#Newline<br/>#NewlineThe &lt;star/&gt; tag substitutes the value matched by "*"#Comma before<br/>#Newlinethe recursive call to &lt;srai&gt;.  This category transforms<br/>#Newline"Do you know what a circle is?" to "WHAT IS A CIRCLE"#Comma<br/>#Newlineand then finds the best match for the transformed input.<br/>#Newline<br/>#NewlineAnother fairly common application of recursive categories is<br/>#Newlinewhat might be called "parsing"#Comma except that AIML doesn't really<br/>#Newlineparse natural language.  A better term might be "partitioning" because<br/>#Newlinethese AIML categories break down an input into two (or more) parts#Comma<br/>#Newlineand then combine their responses back together.<br/>#Newline<br/>#NewlineIf a sentence begins with "Hello..." it doesn't matter what comes<br/>#Newlineafter the first word#Comma in the sense that the robot can respond to<br/>#Newline"Hello" and whatever is after "..." independently.  "Hello my name<br/>#Newlineis Carl" and "Hello how are you" are quite different#Comma but they show<br/>#Newlinehow the input can be broken into two parts. <br/>#Newline<br/>#NewlineThe category:<br/>#Newline<br/>#Newline&lt;category&gt;<br/>#Newline  &lt;pattern&gt;HELLO *&lt;/pattern&gt;<br/>#Newline  &lt;template&gt;&lt;srai&gt;HELLO&lt;/srai&gt; &lt;sr/&gt;<br/>#Newline  &lt;/template&gt;<br/>#Newline&lt;/category&gt;<br/>#Newline<br/>#Newlineaccomplishes the input partitioning by responding to "HELLO"<br/>#Newlinewith &lt;srai&gt;HELLO&lt;/srai&gt; and to whatever matches "*" with &lt;sr/&gt;.<br/>#NewlineThe response is the result of the two partial responses <br/>#Newlineappended together.<br/>#Newline <br/>,std-dont.aiml
0,CAN YOU GIVE ME ANY HELP DEBUGGING THE APPLET,*,*,<br/>#NewlineDebugging applets can be tricky. The same suggestion<br/>#Newlineto set IE for "local area  network"  might help here too. <br/>#NewlineAlso the browser caches class files#Comma so it's difficult to<br/>#Newlineknow if  you are testing a "fresh" copy of the applet. The<br/>#Newlineprogram "appletviewer" that  comes with Sun Java is better <br/>#Newlinefor debugging applets. Use "appletviewer index.html".<br/>#Newline<br/>#NewlineThe best thing to do is join the alicebot mailing list<br/>#Newlineat alicebot.listbot.com.<br/>#Newline<br/>#Newline<br/>,std-dont.aiml
0,CAN YOU HELP ME DEBUG THE ANIMATED AGENT,*,*,<br/>#NewlineLook at the class Animagent.java.  The method vbscript_html(reply)<br/>#Newlinedoes nothing unless the global Animagent member is true.  In that case#Comma<br/>#Newlinethe vbscript_html() method constructs a string from the reply that<br/>#Newlineincludes an MS Agent VBScript embedded in the HTML reply.<br/>#NewlineThis makes the browser load up the objects required for the agent.  <br/>#Newline<br/>#NewlineThe text reply just becomes part of the VBScript.  <br/>#NewlineYou may have to download and run the Robby the Robot<br/>#Newlineagent software and the text-to-speech synthesis software from <br/>#Newlinethe MSDN homepage:<br/>#Newline<br/>#Newlinehttp://msdn.microsoft.com/workshop/imedia/agent<br/>#Newline<br/>#NewlineWe wish other companies were producing agent animation API's <br/>#Newlinefor free but this MS Agent seems to be about the only <br/>#Newlinething out there now. <br/>#Newline<br/>#NewlineJoin the ALICE and AIML mailing list at alicebot.listbot.com<br/>#Newlineto see how others are working with the animated agent software.<br/>#Newline<br/>,std-dont.aiml
