0,COULD YOU EXPLAIN THE LT SRAI GT TAG A LITTLE MORE,*,*,<br/>#NewlineThe most common application of &lt;srai&gt; is "symbolic reduction"<br/>#Newlineof a complex sentence form to a simpler one:<br/>#Newline<br/>#Newline&lt;category&gt;<br/>#Newline&lt;pattern&gt;DO YOU KNOW WHAT * IS&lt;/pattern&gt;<br/>#Newline&lt;template&gt;&lt;srai&gt;WHAT IS &lt;star/&gt;&lt;/srai&gt;&lt;/template&gt;<br/>#Newline&lt;/category&gt;<br/>#Newline<br/>#Newlineso the botmaster can store most knowledge in the simplest<br/>#Newlinecategories:<br/>#Newline<br/>#Newline&lt;category&gt;<br/>#Newline&lt;pattern&gt;WHAT IS LINUX&lt;/pattern&gt;<br/>#Newline&lt;template&gt;&lt;set_it&gt;Linux&lt;/set_it&gt; is the best operating system.&lt;/template&gt;<br/>#Newline&lt;/category&gt;<br/>#Newline<br/>#NewlineWith all the "symbolic reduction" categories#Comma  the robot gives<br/>#Newlinethe same answer for:<br/>#Newline<br/>#Newline"What is Linux?"<br/>#Newline"Do you know what Linux is?"<br/>#Newline"Define Linux"<br/>#Newline"Alice please tell me what Linux is right now"<br/>#Newline<br/>#NewlineSometimes the response consists of two symbolic reductions together:<br/>#Newline<br/>#Newline&lt;category&gt;<br/>#Newline&lt;pattern&gt;YES *&lt;/pattern&gt;<br/>#Newline&lt;template&gt;&lt;srai&gt;YES&lt;/srai&gt; &lt;sr/&gt;&lt;/template&gt;<br/>#Newline&lt;/category&gt;<br/>#Newline<br/>#NewlineWith this category the robot will reply to all <br/>#Newline"Yes something" inputs by combining the<br/>#Newlinereply to "Yes" with the reply to "something".<br/>#NewlineRemember#Comma &lt;sr/&gt; is an abbreviation for &lt;srai&gt;&lt;star/&gt;&lt;/srai&gt;. <br/>#Newline<br/>#NewlineThe &lt;srai&gt; tag is also the answer to the question: Can I have more<br/>#Newlinethan one pattern in the same category?  Suppose you want the<br/>#Newlinesame answer for two different patterns.  You might think of<br/>#Newlinewriting something like this:<br/>#Newline<br/>#Newline&lt;category&gt;<br/>#Newline&lt;pattern&gt;BYE&lt;/pattern&gt;<br/>#Newline&lt;pattern&gt;GOODBYE&lt;/pattern&gt;<br/>#Newline&lt;template&gt;See you later.&lt;/template&gt;<br/>#Newline&lt;/category&gt;<br/>#Newline<br/>#NewlineRight now you can't put two patterns in one category#Comma but with &lt;srai&gt;<br/>#Newlineyou can get the same effect:<br/>#Newline<br/>#Newline&lt;category&gt;<br/>#Newline&lt;pattern&gt;GOODBYE&lt;/pattern&gt; &lt;template&gt;&lt;srai&gt;BYE&lt;/srai&gt;&lt;/template&gt;<br/>#Newline&lt;/category&gt;<br/>#Newline<br/>#Newline&lt;category&gt;<br/>#Newline&lt;pattern&gt;BYE&lt;/pattern&gt; &lt;template&gt;See you later.&lt;/template&gt;<br/>#Newline&lt;/category&gt;<br/>#Newline<br/>#NewlineIf you look through the AIML files you will see many examples<br/>#Newlineof &lt;srai&gt; mapping multiple patterns to the same reply.<br/>#Newline<br/>,std-dont.aiml
0,DO I HAVE TO USE THE GUI TO ENTER AIML CONTENT,*,*,<br/>#NewlineNo. You can create a new AIML file with any text editor<br/>#Newlineand add that content to an existing robot with the &lt;load&gt; tag.<br/>#Newline<br/>#NewlineAlso#Comma you can edit AIML categories in any text file and use <br/>#Newline"Load Text File" and "Add Aiml" to add the content.  <br/>#NewlineYou can also save the output of "Targets" to a file#Comma <br/>#Newlineedit that file#Comma and then reload and "Add Aiml". <br/>#Newline<br/>#NewlineFinally#Comma you can edit the robot source file files directly. <br/>#Newline(By default the robot source file is called "B.aiml").  <br/>#NewlineUse a text editor#Comma like emacs#Comma notepad#Comma or a word processor<br/>#Newlinein text mode#Comma to modify the content of the AIML files.<br/>#Newline<br/>,std-dont.aiml
0,DO I NEED TO KNOW ABOUT THE JAVA CLASSES,*,*,<br/>#NewlineNo#Comma not unless you plan to do software development on<br/>#Newlinethe program B Java code.  If you are an open source<br/>#Newlinecontributor to the ALICE project#Comma a researcher developing<br/>#Newlinenew AI software#Comma or you are trying to link your own<br/>#Newlinecode to the ALICE package#Comma then this section is for you.<br/>#NewlineOtherwise#Comma you probably don't need to know much about the<br/>#NewlineJava classes in program B.<br/>#Newline<br/>,std-dont.aiml
0,DO THE CATEGORIES NEED TO BE IN ALPHABETICAL ORDER BY PATTERN,*,*,<br/>#NewlineNo#Comma the alphabetical order is maintained internally when the<br/>#Newlinecategories load#Comma but you can write them in any order.  When you do<br/>#Newline"Save Robot" the file may or may not be stored alphabetically.<br/>#Newline<br/>,std-dont.aiml
0,DOES PROGRAM B RUN ON A MAC,*,*,<br/>#NewlineYes.  Download the B.zip file and save it in a new folder#Comma called<br/>#Newlinefor example "Alice Program-B".<br/>#Newline<br/>#NewlineInstead of the "winzip" or "unzip" utility use "Aladdin StuffIt Expander."  <br/>#NewlineThe newer version will unzip most MAC formats as well as .ZIP files.  You can<br/>#Newlinedownload this at "www.download.com" by searching for it by name.  You can<br/>#Newlinealso select the option that allows it to search only for Mac programs.<br/>#NewlineDownload that and install it#Comma it should do the trick.<br/>#Newline<br/>#NewlineApple makes its own Java Runtime Environment for the Mac called<br/>#NewlineMRJ 2.2.  You can download it from http://www.apple.com/java.<br/>#Newline<br/>#NewlineTo compile the Java code for Alice on a Mac:<br/>#Newline<br/>#NewlineDownload the current zip file for the Alice's Program-B from the Alice site.<br/>#Newline<br/>#NewlineUnzip Program-B and keep it in a folder called "B" on your startup drive and<br/>#Newlinenot on the desktop.<br/>#Newline<br/>#NewlineDownload  MRJ SDK 2.2 for Java  from  the Apple site.<br/>#Newline<br/>#NewlineUnstuff MRJ SDK 2.2 and put resulting files into a folder called "MRJSDK".<br/>#Newline<br/>#NewlineOpen :MRJSDK:Tools:Application Builders:JBindary  and find the icon for the<br/>#NewlineJBindary application.<br/>#Newline<br/>#NewlineOpen the folder "B" and drag the icon "B.class" out of the folder onto the<br/>#NewlineJBindary icon.<br/>#Newline<br/>#NewlineJBindary will display a dialog screen showing the class name "B".  Click the<br/>#Newline"Save Settings" button.<br/>#Newline<br/>#NewlineAfter clicking the "Save Settings" button#Comma JBindary will display a dialog box<br/>#Newlinefor saving the new application file.  Name the file "A.L.I.C.E." or anything<br/>#Newlineyou wish.<br/>#Newline<br/>#NewlineBe sure the "Save As Application" box is checked and the folder to save in is<br/>#Newlinethe "B" folder.<br/>#Newline<br/>#NewlineClick the "Save" button to save the application.<br/>#Newline<br/>,std-dont.aiml
0,DOES PROGRAM B RUN UNDER LINUX,*,*,<br/>#NewlineYes.  You need the JRE#Comma which often comes bundled with Linux<br/>#Newline(e.g. the kaffee JRE with Red Hat Linux) or you can download one <br/>#Newlinefrom java.sun.com.  You also need X-windows to run the GUI.  <br/>#NewlineOpen a shell under X windows and use the command "java B".  <br/>#Newline<br/>#NewlineWe also recommend the IBM release of their Java 1.1.8 Java Development<br/>#NewlineKit (JDK) and JRE for Linux. It is solid#Comma efficient and very fast.  <br/>#NewlineYou can download it free at:<br/>#Newlinehttp://www.ibm.com/java/jdk/118/linux/index.html<br/>#Newline<br/>,std-dont.aiml
0,DOES PROGRAM B RUN UNDER WINDOWS,*,*,<br/>#NewlineYes.  You need the Java Runtime Environment (JRE) so you can run the<br/>#Newline"java" command from the DOS prompt.  Try opening a DOS window<br/>#Newlineand type "java".  <br/>#Newline<br/>#NewlineMicrosoft often includes a JRE called "jview" rather than<br/>#Newline"java".  Try opening a DOS window and type "jview".  On Windows 98<br/>#Newlinethe JRE is usually located in c:\windows\jview.exe.<br/>#Newline<br/>,std-dont.aiml
0,DOES PROGRAM B RUN UNDER XYZ,*,*,<br/>#NewlineYes if XYZ runs has a Java Runtime Environment 1.17 or higher.<br/>#Newline<br/>,std-dont.aiml
0,DOES PROGRAM B SERVE HTML FILES,*,*,<br/>#NewlineYes.  Program B is a "faux" web server that can serve a number of file<br/>#Newlinetypes just like an ordinary server.  Certain file names such as<br/>#Newline"HOME.html"#Comma "header.html"#Comma and "trailer.html" are reserved by<br/>#Newlineprogram B#Comma but you can create new HTML files and serve them with B.<br/>#Newline<br/>#NewlineAlthough program B can also serve image files and other large binary<br/>#Newlinefiles#Comma we recommend creating chat robot web pages with links to images<br/>#Newlineserved by other web servers or machines.  Reserve your chat robot server<br/>#Newlinefor the robot chat#Comma use ordinary web servers for images and other large<br/>#Newlinefiles.<br/>#Newline<br/>,std-dont.aiml
0,DOES THE APPLET RECORD DIALOGUES,*,*,<br/>#NewlineThe applet tries to log conversations on the originating server#Comma<br/>#Newlineusing a cgi-bin script called "Blog".  If Blog exists then<br/>#Newlineit records the dialogues in a file called "dialog.txt" (or<br/>#Newlineanother name chosen on the Options menu).  <br/>#Newline<br/>#NewlineActually the cgi-script need not actually exist#Comma because the server<br/>#Newlinerecords the cgi-commands as errors in the access log.<br/>#NewlineThe applet opens a URL connection to the its host#Comma and<br/>#Newlinesends a log string that looks like an HTTP request#Comma but the HTTP<br/>#Newlineserver will log it as an error (with code 404). Later on you can<br/>#Newlinedownload the access_log and analyze it with program B.<br/>#Newline<br/>#NewlineSee the code in Classifier.java for the method log(x) that<br/>#Newlineimplements the URL connection.<br/>#Newline<br/>,std-dont.aiml
0,HOW ARE THE CATEGORIES STORED,*,*,<br/>#NewlineIf your session with program B included a "Classify" routine#Comma then<br/>#Newlinethe AIML script is stored in order of category activation rank.<br/>#NewlineIn other words#Comma program B stores<br/>#Newlinethe most frequently accessed category (usually '*') first#Comma the second<br/>#Newlinemost frequently next#Comma and so on.  If a number of categories have the<br/>#Newlinesame activation count#Comma program B saves them in alphabetical order by<br/>#Newlinepattern.  Hence#Comma if the session did not include a "classify" routine#Comma<br/>#Newlinethe program stores all the categories in alphabetical order by pattern<br/>#Newline(because they all have an activation count of zero).<br/>#Newline<br/>#NewlineOne reason to store the categories in order by activation is to<br/>#Newlinemake the Applet interface more natural.  Because the Applet interface<br/>#Newlinestarts simultaneously with a thread to load the robot source file#Comma<br/>#Newlinethe Applet client can talk with the robot before all the categories<br/>#Newlineare fully loaded.  Given that the interlocutor is more likely to<br/>#Newlinesay something that activates a more frequently activated category#Comma<br/>#Newlineit makes sense to transmit these categories first.  Storing the<br/>#Newline*.aiml files in order of category activation achieves the desired effect.<br/>#NewlineThe Applet loads the most frequent categories first#Comma and continues<br/>#Newlineloading in the background while the conversation begins.<br/>#Newline<br/>,std-dont.aiml
0,HOW ARE THE PATTERNS MATCHED,*,*,<br/>#NewlineProgram B stores the categories in alphabetical order by pattern.<br/>#NewlineWhen a client enters an input#Comma the program scans the categories<br/>#Newlinein reverse order to find the best match.   By comparing the<br/>#Newlineinput with the patterns in reverse alphabetical order#Comma the algorithm<br/>#Newlineensures that the most specific pattern matches first.  "Specific"<br/>#Newlinein this case has a formal definition#Comma but basically it means that<br/>#Newlinethe program finds the "longest" pattern matching an input.<br/>#Newline<br/>#NewlineThe wild-card character "*" comes before "A" in alphabetical <br/>#Newlineorder.  For example#Comma the "WHAT *" pattern is more general than "WHAT IS *".<br/>#NewlineThe default pattern "*" is first in alphabetical order and the<br/>#Newlinemost general pattern.  For convenience AIML also provides a<br/>#Newlinevariation on "*" denoted "_"#Comma which comes after "Z" in alphabetical<br/>#Newlineorder.<br/>#Newline<br/>,std-dont.aiml
0,HOW CAN I CREATE A NEW ROBOT PERSONALITY,*,*,<br/>#NewlineThere is a lot of flexibility in robot personality design with AIML.  <br/>#NewlineYou can add to any of the existing AIML files#Comma modify or delete them#Comma <br/>#Newlinecreate your own#Comma or use the GUI tools to analyze the log files <br/>#Newlineand create new categories.   One simple method is to create your own <br/>#NewlineSpecialty.aiml file so that you can always get the latest copies <br/>#Newlineof the ALICE files.  Load your Specialty.aiml first in the root<br/>#NewlineAIML file (usually B.aiml) so that its categories have priority over ALICE's.<br/>#Newline<br/>,std-dont.aiml
0,HOW CAN I CREATE MY OWN CHAT ROBOT,*,*,<br/>#NewlineThe secret to chat bot programming#Comma if there is one#Comma is what Simon<br/>#NewlineLaven called "continuous beta testing".  Program B runs as a server<br/>#Newlineand collects dialog on the web.  The program provides the chat bot <br/>#Newlinedeveloper with a tool called "classify dialogues"#Comma that tests the current <br/>#Newlinerobot with the history of accumulated human queries.  Moreover#Comma the program<br/>#Newlinesuggests new categories automatically#Comma for the botmaster to refine.<br/>#Newline<br/>,std-dont.aiml
0,HOW CAN I CUSTOMIZE MY ROBOT,*,*,<br/>#NewlineAIML provides several tags useful to quickly clone<br/>#Newlinea chat robot from ALICE with a distinct "personality":<br/>#Newline<br/>#Newline&lt;gender/&gt;        the robot's gender<br/>#Newline&lt;location/&gt;      the robot's location<br/>#Newline&lt;birthday/&gt;      the robot's birthday<br/>#Newline&lt;botmaster/&gt;   the botmaster's name<br/>#Newline<br/>#NewlineTogether with the previously discussed &lt;name/&gt;#Comma these<br/>#Newlinetags allow you to quickly create a clone from the ALICE<br/>#NewlineBrain with a separate identity from ALICE.<br/>#Newline<br/>#NewlineAll the personality tag values can be modifed through<br/>#Newlinethe Personality Wizard.  The tag values can also be<br/>#Newlinechanged with the Options Menu in program B. Use "Show Options" <br/>#Newlineand "Save Options" to customize your chat robot.<br/>#Newline<br/>#NewlineTo test the new features#Comma we created a male robot named<br/>#NewlineBrute (because "all men are brutes") born on August 18#Comma 1999.<br/>#Newline<br/>,std-dont.aiml
0,HOW CAN I GET A PERMANENT DNS NAME,*,*,<br/>#NewlineYou can buy a fixed IP address from an ISP provider#Comma but suppose<br/>#Newlineyou want run a chat robot (or other server) from your home over an<br/>#Newlineordinary ISP connection?  Or suppose you want to carry it around on<br/>#Newlineyour notebook PC#Comma and plug it in anywhere in the world?<br/>#Newline<br/>#NewlineOne solution is a dynamic IP registry service by Dynip (www.dynip.com).<br/>#NewlineThey offer a service that allows you to register your computer<br/>#Newlinewith their server so that you always receive the same DNS name#Comma<br/>#Newlinefor example alicebot.dynip.com.   Every time you connect to your<br/>#NewlineISP#Comma dynIP automatically associates your dynamic IP address with<br/>#Newlineyour permanent DNS name.<br/>#Newline<br/>,std-dont.aiml
0,HOW CAN I INSERT A TRANSCRIPT IN THE ROBOT REPLY,*,*,<br/>#NewlineThe purpose of &lt;get_dialogue/&gt; is to give the client a transcript of<br/>#Newlinehis or her conversation with ALICE.  Unfortunately this feature was<br/>#Newlineadvertised in a press article before we had a really efficient<br/>#Newlineimplementation#Comma and the large number of dialogue requests bogged<br/>#Newlinedown the server.  So for now &lt;get_dialogue/&gt; just displays a warning.<br/>#Newline<br/>,std-dont.aiml
0,HOW CAN I KEEP MY COMPUTER CONNECTED ALL THE TIME,*,*,<br/>#NewlineRunning a web server from home can be frustrating if your ISP<br/>#Newlineautomatically detects periods of "inactivity" or hangs up your<br/>#Newlineconnected after a fixed interval like 12 hours.  Check out the<br/>#NewlineRascal program from Basta computing (www.basta.com) which runs<br/>#Newlineas a watchdog to keep your Windows machine connected 24/7.<br/>#Newline<br/>#NewlineAnother alternative is to use the program B applet#Comma called Blet.java.<br/>#Newline<br/>#NewlineA third alternative is the ALICE Servlet.  Some ISPs will<br/>#Newlineallow you to install a Servlet on their sever. <br/>#Newline<br/>,std-dont.aiml
0,HOW CAN I MERGE TWO CHAT ROBOTS TOGETHER,*,*,<br/>#NewlineThere are two ways to merge robots together.  First#Comma you can<br/>#Newlineuse the File menu option "merge" to directly load the contents<br/>#Newlineof another bot file.  You may see a lot of "duplicate key<br/>#Newlinediscarded" warnings but these can be ignored because the program<br/>#Newlineis simply eliminating overlapping content.  <br/>#Newline<br/>#NewlineAnother method is to use  the &lt;load filename=X/&gt; tag.  <br/>#NewlineSuppose you load two or more files with the load tag#Comma<br/>#Newlineand those files contain redundant duplicate keys.<br/>#NewlineWhich categories get the priority? The answer is: it depends<br/>#Newlineon the order of the &lt;load&gt; tags used to load the AIML files.<br/>#NewlineIf your B.aiml contains:<br/>#Newline&lt;load filename="Brain.aiml"/&gt;<br/>#Newline&lt;load filename="German.aiml"/&gt;<br/>#Newlinethen the categories from "Brain" have priority#Comma and duplicates<br/>#Newlinein "German" are discarded.  If the order is the opposite#Comma German <br/>#Newlinecategories have priority and Brain's duplicates are discarded.<br/>#Newline<br/>,std-dont.aiml
0,HOW CAN I RESTRICT REMOTE CLIENTS FROM RUNNING PROGRAMS ON MY COMPUTER,*,*,<br/>#NewlineIf your reply contains the markup<br/>#Newline<br/>#Newline&lt;system&gt;yourcammand &lt;get_ip/&gt;&lt;/system&gt; <br/>#Newline<br/>#Newlinethen the robot will insert the (virtual) client IP into the command<br/>#Newlineline argument for "yourcommand".  Then it is up to "yourcommand" to<br/>#Newlineenforce access privileges.<br/>#Newline<br/>,std-dont.aiml
0,HOW CAN I RUN ALICE ON A MAC OFFLINE,*,*,<br/>#NewlineFirst open folder B and change all the IP's in the files two files Blet.amil<br/>#Newlineand Bletemplate.aiml to 127.0.0.1<br/>#Newline<br/>#NewlineAlso in folder B add the following three lines  at the end of the file<br/>#Newlineheader.html.<br/>#Newline<br/>#Newline     &lt;H1&gt;Welcome to A. L. I. C. E.&lt;/H1&gt;<br/>#Newline     &lt;IMG SRC="ALICEBot.jpg"&gt;<br/>#Newline     &lt;BR&gt;<br/>#Newline<br/>#NewlineAlso in folder B change the following three parameters in the file<br/>#Newlineglobals.txt to the values shown:<br/>#Newline<br/>#Newline     AppletHost=127.0.0.1<br/>#Newline     CodeBase=http://127.0.0.1/B<br/>#Newline     Advertize=false<br/>#Newline<br/>#NewlineAlso in the globals.txt file remove the line:<br/>#NewlineACFURL=http-//microsoft.com/agent2/chars/robby/robby.acf<br/>#Newline<br/>#NewlineNext open your TCP/IP control panel and set up a new configuration named<br/>#NewlineAlice perhaps.<br/>#Newline<br/>#NewlineIn the TCP/IP control panel select connect via: Ethernet built-in if you have<br/>#Newlineit if not you may have to experiment.<br/>#Newline<br/>#NewlineThen select Configure Manually.<br/>#Newline<br/>#NewlineAnd finally set the IP Address: to 127.0.0.1 as well as the Name server addr.<br/>#Newline<br/>#NewlineDouble click the newly saved A.L.I.C.E. application to bring up the botmaster<br/>#Newlinepanel and Java Console.<br/>#Newline<br/>#NewlineAs A.L.I.C.E. loads#Comma read the information messages scrolling by in the Java<br/>#NewlineConsole and record the port number that the web server (started by  A.L.I.C.E.)<br/>#Newlineis listening on#Comma probably 2001.<br/>#Newline<br/>#NewlineStart up your preferred browser.<br/>#Newline<br/>#NewlineLeave browser in online mode.<br/>#Newline<br/>#NewlineEnter http://127.0.0.1:2001  (i.e. the localhost's IP)<br/>#Newline<br/>#Newlineor<br/>#Newline<br/>#NewlineEnter http://localhost:2001  (I've not always been successful with this one)<br/>#Newline<br/>#NewlineHit return to send the IP.<br/>#Newline<br/>#NewlineThe A.L.I.C.E. transaction page should appear in your browser's window and<br/>#Newlineyou can talk to Alice.<br/>#Newline<br/>#Newline<br/>,std-dont.aiml
0,HOW CAN I RUN THE ALICE WEB SERVER ON A MAC,*,*,<br/>#NewlineTo run Alice online:<br/>#Newline<br/>#NewlineConnect your Mac to a network.<br/>#Newline<br/>#NewlineDouble click the newly saved A.L.I.C.E. application to bring up the botmaster<br/>#Newlinepanel and Java Console.<br/>#Newline<br/>#NewlineAs A.L.I.C.E. loads#Comma read the information messages scrolling by in the Java<br/>#NewlineConsole and record the port number that the web server (started by A.L.I.C.E.)<br/>#Newlineis listening on#Comma probably 2001.<br/>#Newline<br/>#NewlineStart up your preferred browser.<br/>#Newline<br/>#NewlineGet your IP from the TCP/IP control panel.<br/>#Newline<br/>#NewlineEnter your IP followed by a colon and then the port number read from the Java<br/>#NewlineConsole#Comma e.g.    http://nn.nnn.nn.nnn:2001<br/>#Newline<br/>#Newlineor<br/>#Newline<br/>#NewlineEnter http://127.0.0.1:2001  (i.e. the localhost's IP)<br/>#Newline<br/>#Newlineor<br/>#Newline<br/>#NewlineEnter http://localhost:2001<br/>#Newline<br/>#NewlineHit return to send the IP.<br/>#Newline<br/>#NewlineThe A.L.I.C.E. transaction page should appear in your browser's window and<br/>#Newlineyou can talk to Alice.<br/>#Newline<br/>,std-dont.aiml
0,HOW CAN I USE THE MS AGENT INTERFACE,*,*,<br/>#NewlineSelect the menu item Options/Toggle MS Agent.  This sets the<br/>#Newlineoutput HTML to a format that includes commands to run MS Agent.<br/>#Newline<br/>#NewlineThe client may activate the agent if she receives a template<br/>#Newlinewith the &lt;set_animagent/&gt; tag.  The free ALICE download includes<br/>#Newlinea couple of example categories using this tag.  Try asking<br/>#NewlineALICE#Comma "Can you speak?".  In another demo ALICE imitates<br/>#Newlinethe famous fictional AI HAL from 2001: A Space Odyssey.<br/>#Newline<br/>#NewlineClient: Tell me about yourself<br/>#NewlineRobot:  I am an artificial linguistic entity. I was created <br/>#Newline        by Jon Baer at Bethlehem#Comma Pennsylvania#Comma <br/>#Newline        on November 23#Comma 1995.  He taught me to sing a song. <br/>#Newline        Would you like me to sing it for you?.<br/>#NewlineClient: yes<br/>#NewlineRobot:  Ahem.  It's called#Comma "Daisy." (Agent sings "Daisy")<br/>#Newline<br/>#NewlineThe MS Agent VB script appears as embedded HTML in the client<br/>#Newlinereply.  To verify the script#Comma use the browser "View Page Source"<br/>#Newlinemenu item.  <br/>#Newline<br/>#NewlineOn most newer browsers#Comma the agent software will download <br/>#Newlineautomatically after the script starts.  The download may take<br/>#Newlineseveral minutes#Comma depending on the speed of the connection.<br/>#NewlineClients should be warned that the download is slow.  Also#Comma<br/>#Newlinethe agent software download will display one or more licenses<br/>#Newlinein Dialog boxes.  You may not want to accept the terms of the<br/>#NewlineMS agent software licenses.  <br/>#Newline<br/>,std-dont.aiml
0,HOW DIFFICULT IS IT TO CREATE A CHAT ROBOT,*,*,<br/>#NewlineNot difficult.  If you can write HTML#Comma you can write AIML (Artificial<br/>#NewlineIntelligence Markup Language).  Here is an example of a simple but<br/>#Newlinecomplete chat robot in AIML:<br/>#Newline<br/>#Newline&lt;alice&gt;<br/>#Newline&lt;category&gt;<br/>#Newline&lt;pattern&gt;*&lt;/pattern&gt;<br/>#Newline&lt;template&gt; Hello! &lt;/template&gt;<br/>#Newline&lt;/category&gt;<br/>#Newline&lt;/alice&gt;<br/>#Newline<br/>#NewlineThe tags &lt;alice&gt;...&lt;/alice&gt; indicate that this markup contains a<br/>#Newlinechat robot.  The &lt;category&gt; tag indicates an AIML category#Comma the<br/>#Newlinebasic unit of chat robot knowledge.  The category has a &lt;pattern&gt;<br/>#Newlineand a &lt;template&gt;.  The pattern in this case is the wild-card<br/>#Newlinesymbol '*' that matches any input.  The template is just the text<br/>#Newline"Hello!"   As you may have guessed#Comma this simple chat robot just <br/>#Newlineresponds by saying "Hello!" to any input.<br/>#Newline<br/>#NewlineYou can get started with AIML knowing just the three tags<br/>#Newline&lt;category&gt;#Comma &lt;pattern&gt; and &lt;template&gt;; much like you may have<br/>#Newlinestarted with HTML knowing only &lt;a&gt;#Comma &lt;img&gt; and &lt;h1&gt;.<br/>#Newline<br/>,std-dont.aiml
0,HOW DO I CREATE AN APPLET,*,*,<br/>#NewlineGo to the Options menu and select "Show Options."  You need<br/>#Newlineto change the values of "AppletHost" and "CodeBase" to the<br/>#Newlinecorrect IP address and directory for your applet host. <br/>#NewlineMany people want to post the applet on their web site.<br/>#NewlineIn that case#Comma change the IP address "206.184.206.210" to<br/>#Newlinethe name or IP address of the web server.  Change the<br/>#Newlinedirectory path "/B" in "CodeBase" to your directory on<br/>#Newlinethe remote server.  Save the changes with "Save Options."<br/>#Newline<br/>#NewlineSelect "Create Applet" from the options menu to create<br/>#Newlinethe "index.html" and "Blet.aiml" files needed to run<br/>#Newlineyour applet.  The program displays the contents of <br/>#Newline"index.html" in your text area.<br/>#Newline<br/>#NewlineUse a file transfer utility like FTP to upload the<br/>#Newlineclass files (or jar file--see "What files do I need to<br/>#Newlinerun the Applet") to your web server.  <br/>#Newline<br/>,std-dont.aiml
