0,WHAT DOES HELP DO,*,*,<br/>#NewlineThe "Help" button displays a random FAQ question that ALICE<br/>#Newlineknows the answer to.  You can see the answer by pressing the<br/>#Newline"Send" button.<br/>#Newline<br/>#NewlineThe Help menu provides the same function as the Help button<br/>#Newlineunder the selection "Random Help Question."  Select a random<br/>#NewlineHelp question and obtain the reply with the "Send" button.<br/>#Newline<br/>#NewlineThe Help menu also contains an item to Show All Help Questions.<br/>#NewlineThis command lists all the FAQ questions the robot knows.  You can<br/>#Newlineselect one question by deleting the others.   Obtain the<br/>#Newlineanswer with the "Send" button.<br/>#Newline<br/>#NewlineThe menu item "Ask Help Question" is the same as "Send".  This<br/>#Newlineitem asks the robot the Help question(s)#Comma and displays the reply.<br/>#Newline<br/>#NewlineThe Help menu displays the entire FAQ with the "Don't Read Me"<br/>#Newlineselection.  Finally#Comma the "GNU Public License" menu items displays<br/>#Newlinethe open source software license for program B.<br/>#Newline<br/>,std-dont.aiml
0,WHAT DOES QUICK TARGETS DO,*,*,<br/>#NewlineAfter running Classify#Comma the Quick Targets button displays a set of<br/>#Newlinenew AIML categories for editing.   The program uses statistics to<br/>#Newlinefind new category candidates.  These categories are displayed as<br/>#Newline<br/>#Newline&lt;category&gt;<br/>#Newline&lt;pattern&gt; NEW PATTERN &lt;/pattern&gt;  &lt;template&gt; OLD PATTERN &lt;/template&gt;<br/>#Newline&lt;/category&gt;<br/>#Newline<br/>#Newlinewhere OLD PATTERN is the pattern from the original category and<br/>#NewlineNEW PATTERN is the proposed new input pattern.<br/>#Newline<br/>#NewlineThe botmaster may choose to either delete or edit the new category.<br/>#NewlineIf the new category is not desired#Comma delete it by selecting the<br/>#Newlinecategory from the text area and "cut" the text with the "delete"<br/>#Newlinekey.<br/>#Newline<br/>#NewlineIf the new category appears useful#Comma edit the OLD PATTERN string to<br/>#Newlinecreate a new reply.  Optionally#Comma the NEW PATTERN may also be edited#Comma<br/>#Newlinedepending on how specific a pattern the botmaster desires.<br/>#Newline<br/>#NewlineWhen finished editing the Target categories#Comma go to the "Botmaster"<br/>#Newlinemenu and select "Add AIML".    The "Add AIML" menu item will read the<br/>#Newlinetext displayed in the Edit View and parse it into new AIML categories.<br/>#NewlineThe botmaster may then save the updated robot with the "File/Save Robot"<br/>#Newlineor "File/Save Robot As" menu items.<br/>#Newline<br/>,std-dont.aiml
0,WHAT DOES SEND DO,*,*,<br/>#NewlineType a text string like "hello" into the Text Area <br/>#Newline(Edit View) and press the "Send" button.  Notice that program B<br/>#Newlinereplaces the text in the Edit View with a reply from the robot.<br/>#Newline<br/>,std-dont.aiml
0,WHAT DOES THE EDIT MENU DO,*,*,<br/>#Newline  Paste contents of clipboard into the program B text area.<br/>#Newline<br/>,std-dont.aiml
0,WHAT DOES THE FILE MENU DO,*,*,<br/>#Newline  Save and load text files (transfer contents to/from text area);<br/>#Newline    <br/>#Newline  Save and load robot (AIML) files.<br/>#Newline  1. By default#Comma AIML files use the .aiml file extension.<br/>#Newline  2. The default robot file is called "B.aiml"<br/>#Newline  3. By default the robot files reside in the same directory as<br/>#Newline     program B<br/>#Newline  4. Robot files begin and end with the tags &lt;alice&gt; and &lt;/alice&gt;<br/>#Newline  5. "Save Robot" overwrites the default robot file (see 2).<br/>#Newline  6. "Save Robot As" can be used to copy a robot.<br/>#Newline<br/>#Newline  Exit - exit the program<br/>#Newline<br/>,std-dont.aiml
0,WHAT DOES THE OPTIONS MENU DO,*,*,<br/>#Newline  Display and save chat robot options.<br/>#Newline  Use start and end index to select a range of lines<br/>#Newline  from the dialog file.<br/>#Newline<br/>#Newline  Toggle Beep - Make a sound when a remote client connects.<br/>#Newline<br/>,std-dont.aiml
0,WHAT FILES ARE NEEDED TO RUN THE PROGRAM B WEB SERVER,*,*,<br/>#NewlineThe program B directory must contain the HTML files header.html#Comma<br/>#Newlinetrailer.html#Comma loading.html and HOME.html.  You can customize these files for<br/>#Newlineyour bot#Comma but take care with "header" and "trailer" because<br/>#Newlineprogram B uses these files to construct an HTML reply <br/>#Newline(by inserting the robot reply and the text form between the <br/>#Newline"header" and the "trailer").  Use "header" and "trailer" to<br/>#Newlinecustomize the robot with your own logo and links.<br/>#Newline<br/>#NewlineProgram B needs at least one AIML file#Comma usually called B.aiml<br/>#Newlineby default. The AIML file may contain &lt;load&gt; tags that recursively<br/>#Newlineload other AIML files; these must also be present.<br/>#Newline<br/>#NewlineThe program also requires the file "globals.txt"<br/>#Newlinewhich it reads at start up. <br/>#Newline<br/>#NewlineThe files "language.txt" and "predicates.txt" are option.<br/>#Newline"language.txt" controls the language of the buttons and<br/>#Newlinemenu items in the program B GUI.  The file "predicates.txt"<br/>#Newlinedefines any custom predicates.<br/>#Newline<br/>#NewlineProgram B also reads the files "gnu.txt" (the GNU Public License)<br/>#Newlineand "dont.txt" (this file). <br/>#Newline<br/>,std-dont.aiml
0,WHAT FILES DO I NEED TO RUN THE APPLET,*,*,<br/>#NewlineYou only need the java *.class files and the *.aiml files<br/>#Newlineto run the ALICE Applet#Comma no more files are necessary. <br/>#NewlineYou can also put all the class files in a single jar<br/>#Newlinefile like Blet.jar.  The sample index.html provided with the ALICE <br/>#Newlinedistribution uses this Blet.jar file.  <br/>#Newline<br/>#NewlineNot all of the Java source files are involved in the Applet.<br/>#NewlineYou can use the following command to compile all the Java source<br/>#Newlinefiles needed for the Applet:<br/>#Newline<br/>#Newlinejavac Access.java Globals.java StringFile.java Substituter.java \<br/>#Newline   Classifier.java Loader.java Animagent.java Log.java Blet.java<br/>#Newline<br/>#NewlineThen#Comma you can use zip (or jar) to collect the class files into<br/>#Newlinea single jar file:<br/>#Newline<br/>#Newlinezip -r Blet.jar *.class <br/>#Newline<br/>#NewlineThe *.class will include all the class files you compiled.  <br/>#Newline<br/>#NewlineThe *.aiml files have to be on the same host that serves the Applet. An applet<br/>#Newlinecan only open files on the server it originated from.<br/>#Newline<br/>#NewlineDon't forget to change the Applet host parameters in index.html#Comma when<br/>#Newlineyou upload the applet to an ISP.<br/>#Newline<br/>,std-dont.aiml
0,WHAT HAPPENS TO CONTRACTIONS AND PUNCTUATION,*,*,<br/>#NewlineProgram B has a class called Substituter that performs a number<br/>#Newlineof grammatical and syntactical substitutions on strings. <br/>#NewlineOne task involves preprocessing sentences to remove ambiguous<br/>#Newlinepunctuation to prepare the input for segmentation into individual<br/>#Newlinesentence phrases.  Another task expands all contractions and<br/>#Newlinecoverts all letters to upper case; this process is called<br/>#Newline"normalization".  <br/>#Newline<br/>#NewlineThe Substituter class also performs some spelling correction.<br/>#Newline(See also the question "What is &lt;person/&gt;?")<br/>#Newline<br/>#NewlineOne justification for removing all punctuation from inputs<br/>#Newlineis the need to make ALICE compatible with speech input systems#Comma<br/>#Newlinewhich of course do not detect punctuation (unless the speaker<br/>#Newlineutters the actual word for the punctuation mark -- "period").<br/>#Newline<br/>,std-dont.aiml
0,WHAT IF I DO NOT WANT TO DISCARD DUPLICATE CATEGORIES,*,*,<br/>#NewlineUsing the global parameter MergePolicy#Comma you can choose<br/>#Newlineto either "Merge" or "Discard" templates with duplicate keys.<br/>#NewlineIf you choose the "Merge" option then the program applies a <br/>#Newlineheuristic to try to merge the two responses together with<br/>#Newlinea "&lt;random&gt;" tag.  The results of this operation may be<br/>#Newlineunpredictable#Comma so the program logs all duplicates in a file<br/>#Newlinecalled "duplicates.txt".<br/>#Newline<br/>#NewlineThe heuristic merge works as follows: Suppose X and Y are the two<br/>#Newlinetemplates to merge into a new template Z.   Let X be the new template<br/>#Newlineand Y the existing one.  Assume that X and Y are either &lt;random&gt; <br/>#Newlinelists or "atomic"#Comma in the sense that they contain no &lt;random&gt; tags.<br/>#NewlineIf X and Y are both "atomic" then Z = &lt;random&gt;&lt;li&gt;X&lt;/li&gt;&lt;li&gt;Y&lt;/li&gt;&lt;/random&gt;.  <br/>#NewlineIf Y is a &lt;random&gt; list atomic then the program checks to see if X is<br/>#Newlinealready a member of that list#Comma to avoid duplicate list items.  Otherwise#Comma<br/>#NewlineZ = the &lt;random&gt; list from Y with X inserted.  <br/>#Newline<br/>,std-dont.aiml
0,WHAT IS A SYMBOLIC REDUCTION,*,*,<br/>#NewlineIn general there are a lot of categories whose job is<br/>#Newline"symbolic reduction".  The category:<br/>#Newline<br/>#Newline&lt;category&gt;<br/>#Newline&lt;pattern&gt;ARE YOU VERY *&lt;/pattern&gt;<br/>#Newline&lt;template&gt;&lt;srai&gt;ARE YOU &lt;star/&gt;&lt;/srai&gt;&lt;/template&gt;<br/>#Newline&lt;/category&gt;<br/>#Newline<br/>#NewlineThis category [in Brain.aiml] will reduce "Are you very very smart"<br/>#Newlineto "Are you smart".<br/>#Newline<br/>,std-dont.aiml
0,WHAT IS ARE THE LT PERSON GT TAGS,*,*,<br/>#NewlineThe &lt;person&gt; and &lt;person2&gt; tags indicate a place where the<br/>#NewlineAIML interpreter changes the personal pronouns in a sentence.<br/>#Newline<br/>#Newline&lt;person2&gt; X &lt;/person2&gt;   change X from 1st to 2nd person<br/>#Newline&lt;person&gt; X &lt;/person&gt;    exchange 1st and 3rd person<br/>#Newline<br/>#Newline&lt;person2&gt; is not often used.  The main application is<br/>#Newline"gossip":<br/>#Newline<br/>#NewlineClient: I admire robots like you.<br/>#NewlineRobot: That's good information: Joe said he admire robots like me.<br/>#Newline<br/>#NewlineThe transformation is a combination of:<br/>#Newline<br/>#Newline1. change the first person pronouns to second person.<br/>#Newline2. change the third person pronouns to first person.<br/>#Newline<br/>#NewlineThe array in Substituter.java is incomplete.  We need more substitutions<br/>#Newlineto make person2 work really well.<br/>#Newline<br/>#NewlineThe &lt;person&gt; substitution is much more common and easier<br/>#Newlineto understand#Comma because it simply exchanges 1st and 3rd person<br/>#Newlinepronouns.  The main issue with &lt;person&gt; in English is knowing<br/>#Newlinewhen to use "I" and when to use "me".<br/>#Newline<br/>,std-dont.aiml
0,WHAT IS CLASS ACCESS,*,*,<br/>#NewlineClass Access is the abstraction for log file analysis to<br/>#Newlineextract dialogues.  In a typical chat robot server scenario#Comma<br/>#Newlinethe program records each line of client input and the robot<br/>#Newlinereply in a log file.  Given many simultaneous conversations#Comma<br/>#Newlinethese dialogues are interleaved in the log file.  The purpose<br/>#Newlineof class Access is to unravel these conversations into<br/>#Newlineindividual threads by client.<br/>#Newline<br/>,std-dont.aiml
0,WHAT IS CLASS ALICEREADER,*,*,<br/>#NewlineAliceReader is an efficient#Comma small-footprint XML interpreter<br/>#Newlinehard coded by Kris Drent specifically for reading AIML categories.  <br/>#NewlineEach category has a pattern#Comma a template#Comma and an optional topic and<br/>#Newlinethatpattern.  AliceReader scans the AIML input and tries to<br/>#Newlineidentify these fields as quickly as possible.<br/>#Newline<br/>,std-dont.aiml
0,WHAT IS CLASS B,*,*,<br/>#NewlineClass B is the old name for the Swing version of class Bawt#Comma but<br/>#Newlinenow just extends Bawt.<br/>#Newline<br/>,std-dont.aiml
0,WHAT IS CLASS BAWT,*,*,<br/>#NewlineThe class Bawt is the Java application#Comma and implements the GUI.<br/>#Newline<br/>,std-dont.aiml
0,WHAT IS CLASS BLET,*,*,<br/>#NewlineThe Blet class is the applet#Comma but is similar in many ways to the application.<br/>#NewlineThe applet is a stripped down version of the program#Comma with a simpler GUI<br/>#Newlineand no "botmaster" privileges. Also#Comma the Blet class doesn't utilize the<br/>#Newlineweb server#Comma because it runs as a client-side applet.<br/>#Newline<br/>,std-dont.aiml
0,WHAT IS CLASS BRAIN,*,*,<br/>#NewlineBrain extends StringSorter#Comma and uses StringRanker.  The sorted<br/>#Newlinestrings in the Brain class are keys formed by combining the<br/>#Newlinepattern#Comma that#Comma and topic strings.  In the original versions<br/>#Newlineof ALICE#Comma there were no "that" and no "topic" tags#Comma so the<br/>#NewlineBrain class simply mapped input patterns to output templates.<br/>#NewlineWith the addition of the "that" and "topic" tags we had to<br/>#Newlinecreate the "key" from the combination of all three.<br/>#Newline<br/>#NewlineThe "Target" objects in class Brain are instances of StringRanker.<br/>#NewlineThese structures form the basis of the classification and targeting<br/>#Newlinealgorithms in program B.  For each category#Comma the Targetmap contains<br/>#Newlinean instance of StringRanker storing the inputs classified into<br/>#Newlinethat category.  <br/>#Newline<br/>,std-dont.aiml
0,WHAT IS CLASS CLASSIFIER,*,*,<br/>#NewlineThe class Classifier might as well be called "bot" because it contains<br/>#Newlinethe basic functionality of the chatterbot algorithm.  <br/>#Newline<br/>#NewlineSee the question "How can I interace my Java program to ALICE?" for<br/>#Newlineadditional information about the class Classifier.<br/>#Newline<br/>,std-dont.aiml
0,WHAT IS CLASS DIALOGUE,*,*,<br/>#NewlineA Dialogue (not to be confused with a Dialog class!) is<br/>#Newlinethe representation of the conversation between the client<br/>#Newlineand the robot.  The basic data structure is a pair of String arrays<br/>#Newlineclient_said[] and robot_said[] that store the alternating<br/>#Newlinestatements of client and robot.  The Dialogue also<br/>#Newlineencodes the length#Comma hostname#Comma and start and end tag<br/>#Newlineinformation.<br/>#Newline<br/>,std-dont.aiml
0,WHAT IS CLASS GLOBALS,*,*,<br/>#NewlineGlobals is the repository for all of the botmaster-selectable<br/>#Newlineparameters in program B.  The Globals class corresponds to<br/>#Newlinethe "Options" menu on the program B menu bar.  Globals contains<br/>#Newlinemethods toFile() and fromFile() to make these values<br/>#Newlinepersistent between sessions.<br/>#Newline<br/>,std-dont.aiml
0,WHAT IS CLASS INTSET,*,*,<br/>#NewlineIntSet represents a set of integers.  Were we using Java<br/>#NewlineCollections this would likely be a Set#Comma but the simple<br/>#Newlinerequirements of program B allow us to create a simple<br/>#NewlineIntSet class.<br/>#Newline<br/>#Newline"Set" means that the object has only one occurance of each item:<br/>#Newline{1#Comma 4#Comma 2#Comma 9} is a set of integers; {1#Comma 1#Comma 2} is not.<br/>#Newline <br/>,std-dont.aiml
0,WHAT IS CLASS KID,*,*,<br/>#NewlineClass Kid is a simplified graphical user interface#Comma "easy enough<br/>#Newlinefor kids" to run.  Program Kid does not evoke program B#Comma but the Kid<br/>#Newlinemay be started from the program B options menu.  The logic here<br/>#Newlineis that kids should be able to have conversations with the chat<br/>#Newlinerobot#Comma but parents may not want kids to start chat robot servers<br/>#Newline(see Appendix B: Note to Parents).<br/>#Newline<br/>#NewlineClass Kid utilizes RobotCommunicator as its interface to the<br/>#Newlinechat robot.  <br/>#Newline<br/>,std-dont.aiml
0,WHAT IS CLASS LINECLASSIFIER,*,*,<br/>#NewlineIn the file Log.java you will find an Interface called LineProcessor<br/>#Newlinewith one required method: process_line().  The LineProcessor<br/>#Newlineis the abstraction of an algorithm that reads a file one line at a time#Comma<br/>#Newlineprocesses each line as a data record#Comma and moves on to the next.<br/>#Newline<br/>#NewlineLineClassifier implements LineProcessor because it reads lines<br/>#Newlineof text from the log file and identifies client input lines for<br/>#Newlineclassification. What makes classification efficient is the way<br/>#NewlineLineClassifier stores the client lines in a SortedStringSet#Comma called<br/>#NewlineLines.   Becuase the matching algorithm proiritizes the patterns<br/>#Newlinealphabetically#Comma LineClassifier can classify an element from Lines<br/>#Newlinein O(1) time.<br/>#Newline<br/>#NewlineThe code for LineClassifier is in Classifier.java.<br/>#Newline<br/>,std-dont.aiml
0,WHAT IS CLASS LOADER,*,*,<br/>#NewlineBoth the application and the applet use the Loader class to load the AIML<br/>#Newlinerobot script. The Loader class extends Thread#Comma and runs "in the background"<br/>#Newlinewhile the GUI and#Comma in the case of the application#Comma the web server start.<br/>#Newline<br/>,std-dont.aiml
0,WHAT IS CLASS PARSER,*,*,<br/>#NewlineThe Parser class is responsible for the evaluation of AIML<br/>#Newlineresponse templates.  The method pfkh() [the Program Formerly<br/>#NewlineKnown as Hello] is the heart of evaluation process.  This<br/>#Newlinemethod contains the code for recognizing and processing<br/>#NewlineAIML template tags.<br/>#Newline<br/>#NewlineThe Parser class does not parse all the AIML in the language<br/>#Newlinedefinition; it parses and evaluates only the templates at runtime.<br/>#NewlineAnother class#Comma AliceReader#Comma has the job of reading the AIML files <br/>#Newlineat load time#Comma and parsing the categories into topics#Comma patterns and templates. <br/>#Newline<br/>,std-dont.aiml
0,WHAT IS CLASS ROBOTCOMMUNICATOR,*,*,<br/>#NewlineIf you want to customize your own application or applet then<br/>#Newlineyou might find RobotCommunicator is a useful class.  The<br/>#NewlineRobotCommunicator abstracts the combination of a scrolling TextArea <br/>#Newlineoutput display with a TextField input area input field.<br/>#Newline<br/>,std-dont.aiml
0,WHAT IS CLASS SORTEDINTSET,*,*,<br/>#NewlineThe sorted version of IntSet#Comma SortedIntSet maintains its<br/>#Newlineelements in a sorted array.  Throughout program B you will<br/>#Newlinefind many loops utilizing instances of SortedIntSet.  These<br/>#Newlineobjects provide an efficient means to locate items in<br/>#Newline"rank order"#Comma the highest numbered items first and the<br/>#Newlinesmallest numbers last.  <br/>#Newline<br/>,std-dont.aiml
0,WHAT IS CLASS STRINGHISTOGRAMMER,*,*,<br/>#NewlineStringHistogrammer extends StringSet and contains a map from<br/>#Newlineeach string to a count#Comma usually indicating the number of times<br/>#Newlinethat string appears in a sample of text.  A histogram is<br/>#Newlinelike a "bar graph" that counts occurances of each item.  <br/>#Newline<br/>,std-dont.aiml
0,WHAT IS CLASS STRINGRANKER,*,*,<br/>#NewlineExtending StringHistogrammer#Comma StringRanker also sorts the <br/>#Newlinestrings by the histogram count.  The highest count string<br/>#Newlineis first#Comma the next highest count second#Comma and so on.  <br/>#Newline<br/>#NewlineThe concept of a StringRanker should be familiar to anyone<br/>#Newlinewho has ranked people#Comma companies or sports teams by any<br/>#Newlinenumber such as sales#Comma market capitilization#Comma or points scored.<br/>#NewlineOne application for a StringRanker is determining the<br/>#Newline"top 10 referers" in HTTP log file analysis (see<br/>#Newlinehttp://alicebot.org/mine.html).    <br/>#Newline<br/>,std-dont.aiml
0,WHAT IS CLASS STRINGSET,*,*,<br/>#NewlineThe StringSet implements the abstract concept of a set of<br/>#Newlinestrings#Comma meaning that each string item appears at most once<br/>#Newlinein the setc.  <br/>#Newline<br/>#NewlineThe "set" means that the strings occur only once in instances<br/>#Newlineof object StringSet:  {"this"#Comma"that"#Comma"another"} is a set of<br/>#Newlinestrings; {"start"#Comma"start"#Comma"stop"} is not.<br/>#Newline<br/>,std-dont.aiml
0,WHAT IS CLASS STRINGSORTER,*,*,<br/>#NewlineStringSorter extends StringSet but enforces an alphabetical<br/>#Newlineordering of the Strings.  The StringSorter maintains its<br/>#Newlinedata structure dynamically#Comma so that the set remains sorted<br/>#Newlineafter each item is added.  Specifically#Comma the StringSorter uses<br/>#Newlinea binary-search algorithm for fast String insertion. <br/>#Newline<br/>,std-dont.aiml
0,WHAT IS CLASS SUBSTITUTER,*,*,<br/>#NewlineThe static class Substituter contains a number of similar string substitution<br/>#Newlinemethods useful at several points in program B.<br/>#Newline<br/>#NewlineProgram B has the unique feature that it relies on HTTP GET methods#Comma<br/>#Newlinerather than POST methods#Comma to transmit chat inputs to the robot server.<br/>#NewlineHTTP inserts '+' characters in place of spaces#Comma and applies a series of<br/>#Newlinesubstitutions to eliminate many characters. The static method cleanup_http()<br/>#Newlineundoes these substitutions and restores the input string to the form similar<br/>#Newlineto what the client originally typed.<br/>#Newline<br/>#NewlineThe problem of segmenting strings into sentences is complicated by the<br/>#Newlineconventional use of periods to denote abbreviations like "Dr."#Comma "Mr."#Comma<br/>#Newlineand "St." The method deperiodize() applies a series of substitutions to<br/>#Newlineeliminate most common abbreviations. Like the other substitution methods<br/>#Newlinein this class#Comma the deperiodize() method has an associated static data member<br/>#Newlineof class String[][2]#Comma which stores the substitution map.<br/>#Newline<br/>#NewlineThe patterns in AIML are written in normalized form. The method normalize()<br/>#Newlineconverts a string to normal form by the following steps:<br/>#Newline<br/>#Newline1. Remove all punctuation (inputs assumed to be individual sentences)<br/>#Newline<br/>#Newline2. Convert string to upper case<br/>#Newline<br/>#Newline3. Place exactly one space between words<br/>#Newline<br/>#Newline4. Expand all contractions<br/>#Newline<br/>#Newline5. Correct a few common spelling mistakes<br/>#Newline<br/>#Newline6. Return a "Trimmed" string<br/>#Newline<br/>#NewlineThe justification for removing all punctuation from text inputs<br/>#Newlineis explained by the need to make the chatterbot compatible with speech<br/>#Newlineinputs#Comma which of course contains no punctuation.<br/>#Newline<br/>,std-dont.aiml
0,WHAT IS CLASS UNIFIER,*,*,<br/>#NewlineUnification refers to the process of matching and binding. A unifier determines<br/>#Newlinewhether two sentences match and#Comma if so#Comma what any 'variables' in the pattern<br/>#Newlinebind to. In the case of AIML the only matching variable is the single '*'<br/>#Newlinesymbol. The Unifier class contains a 'star' data memeber to contain the<br/>#Newlinematched subsentence.<br/>#Newline<br/>,std-dont.aiml
0,WHAT IS CLASS WEBSERVER,*,*,<br/>#NewlineThe WebSever class implements a "faux" HTTP server#Comma i.e. a server that<br/>#Newlinelistens for HTTP connections and accepts them; then replies in properly<br/>#Newlineformatted HTML. The connecting client#Comma typically a browser#Comma cannot tell<br/>#Newlinethe difference between the chat robot server and a full-blown web server.<br/>#NewlineIn particular#Comma our WebServer implements only HTTP GET methods#Comma not POST<br/>#Newlinemethods.  Our WebServer class does not implement many of the other features <br/>#Newlineof ordinary web servers; although it is a multithreaded server.<br/>#Newline<br/>,std-dont.aiml
0,WHAT IS LT LOAD FILENAME X GT,*,*,<br/>#NewlineThe template may contain a &lt;load/&gt; tag to recursively load an AIML<br/>#Newlinefile.  The semantics of a load are the same as a merge: categories<br/>#Newlineloaded first have priority; the server eliminates categories with<br/>#Newlineduplicate patterns.  <br/>#Newline<br/>#NewlineThe default robot file B.aiml contains the top-level load commands.<br/>#NewlineThere are several ways to "comment out" a &lt;load&gt; tag in order<br/>#Newlineto test your system with a smaller robot.  You can change the<br/>#Newlineline reading <br/>#Newline&lt;load filename="Brain.aiml"/&gt;<br/>#Newlineto <br/>#Newline&lt;noload filename="Brain.aiml"/&gt;<br/>#Newlineand the AIML parser will simply ignore the non-existent "noload"<br/>#Newlinecommand.<br/>#Newline<br/>,std-dont.aiml
0,WHAT IS LT STAR GT,*,*,<br/>#NewlineThe &lt;star&gt; tag indicates the input text fragment matching the pattern '*'.<br/>#NewlineRemember#Comma &lt;star/&gt; is an XML abbreviation for &lt;star&gt;&lt;/star&gt;.<br/>#Newline<br/>#Newline&lt;star/&gt;   the value of "*" matched by the pattern.<br/>#Newline                  <br/>,std-dont.aiml
