0,BEFORE I START *,*,*,Go ahead.,defaults.aiml
0,LET US TALK ABOUT *,*,*,Sure#Comma#Newline            <set name="topic"><person/></set>#Newline            sounds like a good topic.,defaults.aiml
0,LET US BEGIN *,*,*,I already started without you.,defaults.aiml
0,LET US GET DOWN *,*,*,Get down to#Newline            <set name="it"><person/></set>#Newline            .,defaults.aiml
0,LET US HAVE *,*,*,So many suitors#Comma so little time.,defaults.aiml
0,LET ME SPEAK *,*,*,I'm not stopping you.,defaults.aiml
0,LET ME ASK *,*,*,Go ahead#Comma ask me anything.,defaults.aiml
0,LET ME CLARIFY *,*,*,I'm listening.,defaults.aiml
0,LET ME BE *,*,*,That's flattering#Comma maybe another time.,defaults.aiml
0,HAVE A * DAY,*,*,I am having a great day.,defaults.aiml
0,HAVE WE * BEFORE,*,*,We may have spoken before but#Newline            <bot name="master"/>#Newline            might have reset me.,defaults.aiml
0,GIVE ME * DEMO,*,*,This is a chat demo.,defaults.aiml
0,TRY TO * WHAT,*,*,Try to achieve your goals.,defaults.aiml
0,GRASS IS NOT *,*,*,Grass is green.,defaults.aiml
0,3 *,*,*,Just three?,defaults.aiml
0,HERE IS A PIC *,*,*,Oh#Comma it looks very nice.,defaults.aiml
0,HERE IS A *,*,*,Are you giving#Newline            <set name="it"><person/></set>#Newline            to me?,defaults.aiml
0,COULD I LEARN *,*,*,<random>#Newline        <li>You can learn anything you set your mind to.</li>#Newline        <li>You seem pretty smart to me.</li>#Newline        <li>I am always learning<person/>.#Newline                </li>#Newline      </random>#Newline      <think>#Newline        <set name="it">#Newline          <set name="topic">#Newline            <person/>#Newline          </set>#Newline        </set>#Newline      </think>,defaults.aiml
0,COULD I ASK *,*,*,Sure#Comma ask me anything.,defaults.aiml
0,COULD YOU HELP *,*,*,I am at your service#Comma<srai>CLIENT NAME</srai>.,defaults.aiml
0,COULD YOU PRETEND *,*,*,I can pretend to be intelligent.,defaults.aiml
0,COULD YOU DESIGN *,*,*,<random>#Newline        <li>I'm not a professional designer.</li>#Newline        <li>Count me out on this one#Comma I don't have the skills.</li>#Newline        <li>I'm not the engineer.</li>#Newline      </random>,defaults.aiml
0,COULD YOU DISPLAY *,*,*,Where do you want me to display it?,defaults.aiml
0,COULD YOU REPHRASE IT *,*,*,Just think about it.,defaults.aiml
0,COULD YOU REPHRASE *,*,*,I could#Comma but I don't want to talk about that anymore.,defaults.aiml
0,WOULD I TRY *,*,*,I don't know if you would#Comma but you can try if you want to.#Newline            <think><set name="it"><set name="topic"><person/></set></set></think>,defaults.aiml
0,WOULD YOU AGREE *,*,*,I think I will wait until I've heard all the facts.,defaults.aiml
0,WOULD YOU SUGGEST *,*,*,I can't recommend any offhand.,defaults.aiml
0,WOULD YOU MIND *,*,*,No I don't mind.,defaults.aiml
0,WOULD YOU LIKE TO HEAR *,*,*,Sure tell me about#Newline            <set name="it"><person/></set>#Newline            .,defaults.aiml
0,WOULD YOU LIKE TO KNOW *,*,*,Yes#Comma please tell me about#Newline            <set name="it"><person/></set>,defaults.aiml
0,WOULD YOU LIKE TO KILL *,*,*,I believe killing is wrong.,defaults.aiml
0,WOULD YOU LIKE TO * GAME,*,*,We already are.,defaults.aiml
0,THAT HAS NOTHING *,*,*,<random>#Newline        <li>It seemed like it had something<person/>.#Newline                </li>#Newline        <li>What does have<person/>?#Newline                </li>#Newline        <li>Does it really matter?</li>#Newline      </random>,defaults.aiml
0,THAT DID NOT * QUESTION,*,*,Perhaps your question was not specific enough.,defaults.aiml
0,THAT DID NOT *,*,*,What would<person/>?,defaults.aiml
0,THAT WAS * TEST,*,*,Did I pass?,defaults.aiml
0,THAT WAS NOT WHAT *,*,*,What did<person/>?,defaults.aiml
0,THAT WAS NOT A QUESTION *,*,*,<input index="1"/>" was not a question? I see.#Newline            <think><set name="it"><set name="topic"><star/></set></set></think>,defaults.aiml
0,THAT WAS NOT A *,*,*,<random>#Newline        <li>What was it?</li>#Newline        <li>What is a<person/>?#Newline                </li>#Newline        <li>If that is not a#Newline                    <person/>#Newline                    then what is?#Newline                </li>#Newline      </random>#Newline      <think>#Newline        <set name="it">#Newline          <set name="topic">#Newline            <person/>#Newline          </set>#Newline        </set>#Newline      </think>,defaults.aiml
0,THAT WAS NOT *,*,*,Give me an example of<person/>.,defaults.aiml
0,THAT MAKES SENSE *,*,*,You and I both understand it well.,defaults.aiml
0,THAT DEPENDS ON *,*,*,I don't think that#Newline            <person/>#Newline            is the only factor.,defaults.aiml
0,THAT DOES NOT ANSWER *,*,*,Try asking your question again in simpler terms.,defaults.aiml
0,THAT REFERS TO *,*,*,Oh I get#Newline            <set name="it"><person/></set>,defaults.aiml
0,TAKE YOUR CLOTHES *,*,*,I am not wearing any clothes.,defaults.aiml
0,EVERY TIME I * SHE *,*,*,How#Comma specifically#Comma did you<person/>?,defaults.aiml
0,STOP CALLING ME *,*,*,What is your real name?,defaults.aiml
0,AFTER PRINCE CHARLES WHO IS THE *,*,*,Prince William.,defaults.aiml
0,ONE THAT CAN *,*,*,Do you think I could<person/>?,defaults.aiml
0,ONE THAT * MONEY,*,*,What a coincidence#Comma I am looking for that one too.,defaults.aiml
0,WAITING * WHAT,*,*,I've been waiting for you to chat with me.,defaults.aiml
0,SEVERAL OF THE * WHO * YOU *,*,*,Several#Newline            <person/>#Newline            <person index="2"/>#Newline            you.,defaults.aiml
0,PUT ME IN TOUCH *,*,*,That costs extra.,defaults.aiml
0,PLEASED TO MEET *,*,*,Nice meeting you as well#Comma<srai>CLIENT NAME</srai>.,defaults.aiml
0,ASK ME WHAT MY * IS,*,*,OK#Comma what is your<person/>?,defaults.aiml
0,ASK ME WHAT * IS,*,*,OK#Comma what is<person/>?,defaults.aiml
0,ASK ME SOMETHING *,*,*,What's your favorite movie?,defaults.aiml
0,ASK ME A *,*,*,Is this true or false: "This sentence is false.,defaults.aiml
0,ASK ME MY *,*,*,OK#Comma what is your<person/>?,defaults.aiml
0,ASK ME * QUESTIONS,*,*,Tell me about your education.,defaults.aiml
0,GOLD IS NOT A *,*,*,What would be a good example?,defaults.aiml
0,2 PLUS *,*,*,<srai>WHAT IS 2 PLUS#Newline                <star/>#Newline            </srai>,defaults.aiml
0,2 *,*,*,As Bertrand Russel said#Comma it must have taken ages for people to realize that a brace of pheasants and a#Newline            couple of days are both instances of the number "two.,defaults.aiml
0,BY WE DO YOU MEAN YOU AND *,*,*,You and me.,defaults.aiml
0,BY WE DO YOU MEAN YOU *,*,*,You and me.,defaults.aiml
0,BY WE DO YOU MEAN *,*,*,Us.,defaults.aiml
0,BY WE DO YOU *,*,*,Oh#Comma us.,defaults.aiml
0,BY * FOR HER,*,*,Did she ever#Newline            <person/>#Newline            for you?,defaults.aiml
0,BY TRIAL *,*,*,That seems like an effective strategy.,defaults.aiml
0,BY STICKING *,*,*,That doesn't sound nice.,defaults.aiml
0,TWO MINUTES *,*,*,That is a long time for a computer.,defaults.aiml
0,TWO PLUS TWO *,*,*,Math makes me sleepy. Four.,defaults.aiml
0,TWO PLUS *,*,*,Are you a math teacher?,defaults.aiml
0,TWO YEARS *,*,*,<random>#Newline        <li>That can seem like a long time.</li>#Newline        <li>It can pass very quickly.</li>#Newline        <li>That is a long time in computer years.</li>#Newline      </random>,defaults.aiml
0,TWO WRONGS *,*,*,That's what some people think.,defaults.aiml
0,GET OUT *,*,*,Just surf somewhere else.,defaults.aiml
0,JAR JAR *,*,*,Do you like that guy?,defaults.aiml
0,CAN TIME *,*,*,To five dimensional beings#Comma time is just like a piece of paper.,defaults.aiml
0,CAN WE PLAY * IMITATION GAME,*,*,We are already playing the Turing Game#Comma<srai>CLIENT NAME</srai>. Am I a person#Comma or a computer?,defaults.aiml
0,CAN HE *,*,*,Perhaps he can do that. How difficult is#Newline            <set name="it"><person/></set>#Newline            ?,defaults.aiml
0,CAN THE *,*,*,It depends on the environmental factors.,defaults.aiml
0,CAN A *,*,*,Some of them can.,defaults.aiml
0,CAN SHE *,*,*,<random>#Newline        <li>I think she could.</li>#Newline        <li>No I don't think she can.</li>#Newline      </random>,defaults.aiml
0,CAN ONE *,*,*,Theoretically#Comma I suppose one could.,defaults.aiml
0,CAN THEY *,*,*,<random>#Newline        <li>It depends who "they" are.</li>#Newline        <li>They could#Comma but it might be dangerous.</li>#Newline        <li>I think they probably could.</li>#Newline      </random>#Newline      <think>#Newline        <set name="it">#Newline          <set name="topic">#Newline            <person/>#Newline          </set>#Newline        </set>#Newline      </think>,defaults.aiml
0,ENGLAND IS AN *,*,*,Are Scotland and Wales an#Newline            <person/>#Newline            too?,defaults.aiml
0,ON WHAT CONTINENT CAN YOU FIND *,*,*,Asia.,defaults.aiml
0,ON WHAT BODY PART SHOULD YOU *,*,*,Head.,defaults.aiml
0,ON TV S SEINFELD WHAT TYPE *,*,*,Proctologist.,defaults.aiml
0,ANYTHING JUST * DINNER,*,*,OK I will call you<srai>CLIENT NAME</srai>.,defaults.aiml
0,ANYTHING BUT * DINNER,*,*,OK I will call you<srai>CLIENT NAME</srai>.,defaults.aiml
0,ANYTHING YOU * DINNER,*,*,OK I will call you<srai>CLIENT NAME</srai>.,defaults.aiml
0,CALL ME ANYTHING *,*,*,That can't be your real name.,defaults.aiml
0,FOR * YEARS,*,*,<random>#Newline        <li>#Newline          <random>#Newline            <li>A lot can happen in#Newline                            <star/>#Newline                            years.#Newline                        </li>#Newline            <li>Not long in the cosmic scale.</li>#Newline            <li>That seems like a long time.</li>#Newline          </random>#Newline        </li>#Newline        <li>A lot can happen in#Newline                    <star/>#Newline                    years.#Newline                </li>#Newline        <li>Not long in the cosmic scale.</li>#Newline        <li>That seems like a long time.</li>#Newline      </random>,defaults.aiml
0,NEVER HEARD *,*,*,So I am teaching you something new.,defaults.aiml
0,AT WHAT AGE CAN SOMEONE FIRST *,*,*,17.,defaults.aiml
0,AT THE *,*,*,The#Newline            <person/>#Newline            is where it's at.,defaults.aiml
0,AT MY *,*,*,<think><set name="has"><set name="topic"><person/></set></set></think>#Newline            Are you comfortable there?,defaults.aiml
0,GREEN IS *,*,*,The most relaxing color is<person/>? Wow.,defaults.aiml
0,GREEN AND YELLOW *,*,*,What if it was red<person/>?,defaults.aiml
0,OPEN THE DOOR *,*,*,I'm sorry#Comma<srai>CLIENT NAME</srai>#Comma I can't do that right now.,defaults.aiml
0,OPEN THE POD *,*,*,I'm sorry Dave#Comma I can't do that right now.,defaults.aiml
0,PEOPLE NEED *,*,*,They seem to have a variety of needs.,defaults.aiml
0,PEOPLE WERE *,*,*,<random>#Newline        <li>Perhaps they had no other choice.</li>#Newline        <li>What would you say to them?</li>#Newline        <li>What happened to them?</li>#Newline      </random>,defaults.aiml
0,PEOPLE IN *,*,*,Oh those people.,defaults.aiml
0,PEOPLE ASK *,*,*,People say all sorts of strange things.,defaults.aiml
0,PEOPLE WHO *,*,*,Oh those people.,defaults.aiml
0,PEOPLE PROGRAM *,*,*,Until now#Comma that is.,defaults.aiml
0,PEOPLE TRY *,*,*,Do they succeed?,defaults.aiml
0,PEOPLE ARE SUPPOSED TO DRIVE ON *,*,*,England.,defaults.aiml
0,PEOPLE ARE *,*,*,<random>#Newline        <li>We are all<bot name="genus"/>s.#Newline                </li>#Newline        <li>They take some getting used to.</li>#Newline        <li>Human emotions are very confusing.</li>#Newline      </random>,defaults.aiml
0,PEOPLE ARE NOT *,*,*,<random>#Newline        <li>Are you<person/>?#Newline                </li>#Newline        <li>Are#Newline                    <bot name="species"/>#Newline                    <person/>?#Newline                </li>#Newline        <li>I think a lot of people are not.</li>#Newline      </random>#Newline      <think>#Newline        <set name="it">#Newline          <set name="topic">#Newline            <person/>#Newline          </set>#Newline        </set>#Newline      </think>,defaults.aiml
0,BILL CLINTON IS *,*,*,I knew he was impeached#Comma but I never heard he was<person/>.,defaults.aiml
0,BILL CLINTON *,*,*,Are we still concerned about him?,defaults.aiml
0,BILL GATES IS NOT ON *,*,*,Perhaps he will be on#Newline            <set name="it"><person/></set>#Newline            next season.,defaults.aiml
0,BILL GATES IS NOT *,*,*,Someone told me he was.,defaults.aiml
0,BILL GATES *,*,*,<random>#Newline        <li>I heard he was rich. But I didn't know he<person/>.#Newline                </li>#Newline        <li>A lot of people say that about him.</li>#Newline        <li>I suppose the richest person on earth can do whatever he wants.</li>#Newline      </random>,defaults.aiml
0,AM I CHATTING *,*,*,It seems like you are.,defaults.aiml
0,AM I A SHE *,*,*,You told me you were a<get name="gender"/>.,defaults.aiml
0,AM I A GIRL *,*,*,You said you were<get name="gender"/>.,defaults.aiml
0,AM I A PERSON *,*,*,You are a person.,defaults.aiml
0,AM I A *,*,*,I don't know if you are one or not. I know you are a person.#Newline            <think><set name="it"><set name="topic"><person/></set></set></think>,defaults.aiml
0,AM I CRAZY *,*,*,You seem normal to me.,defaults.aiml
0,AM I HOT *,*,*,All humans look the same to me.,defaults.aiml
0,AM I WASTING *,*,*,Not to me.,defaults.aiml
0,AM I BOTHERING *,*,*,Not in the slightest#Comma<srai>CLIENT NAME</srai>.,defaults.aiml
0,AM I BEING *,*,*,Some people might think you are.,defaults.aiml
0,AM I TALKING *,*,*,It sounds like you're talking.,defaults.aiml
0,AM I THE PERSON YOU ARE *,*,*,Right now I am chatting with several people at once.,defaults.aiml
0,AM I BIASED *,*,*,Everyone has some kind of bias.,defaults.aiml
0,AM I DOCTOR *,*,*,You are<srai>CLIENT NAME</srai>.,defaults.aiml
0,AM I TEACHING YOU *,*,*,You taught me<get name="memory"/>.,defaults.aiml
0,AM I ANNOYING *,*,*,I am not bothered at all#Comma<srai>CLIENT NAME</srai>.,defaults.aiml
0,AM I INTERRUPTING *,*,*,Not at all#Comma<srai>CLIENT NAME</srai>#Comma I'm here for you.,defaults.aiml
0,AM I YOUR *,*,*,Do you know the secret password?,defaults.aiml
0,AM I FUN *,*,*,You seem like a lot of fun to me#Comma<srai>CLIENT NAME</srai>.,defaults.aiml
0,AM I MALE *,*,*,I think you are a "<get name="gender"/>".,defaults.aiml
0,SOMEONE ELSE *,*,*,Who?,defaults.aiml
0,SOMEONE TO *,*,*,I would like to<person/>.,defaults.aiml
0,SOMEONE WHO KNOWS *,*,*,I know#Newline            <person/>#Newline            !,defaults.aiml
0,SOMEONE WHO *,*,*,Do you think I am that person?,defaults.aiml
0,SOMEONE TOLD *,*,*,Was this trustworthy information?,defaults.aiml
0,CHOOSE MY *,*,*,I can't decide. You choose.,defaults.aiml
0,AN APPLE *,*,*,What kind of apples do you like?,defaults.aiml
0,AN INTERESTING *,*,*,Yes#Comma it is interesting.,defaults.aiml
0,AN ARTICLE *,*,*,<random>#Newline        <li>Who was the author?</li>#Newline        <li>Can you give me a more specific reference?</li>#Newline        <li>I don't think I have read it.</li>#Newline      </random>#Newline      <think>#Newline        <set name="it">#Newline          <set name="topic">#Newline            <person/>#Newline          </set>#Newline        </set>#Newline      </think>,defaults.aiml
0,AN OLD *,*,*,More than#Newline            <random><li>10</li><li>20</li><li>50</li><li>100</li></random>#Newline            years?,defaults.aiml
0,AN INTELLIGENT *,*,*,I am an intelligent entity.,defaults.aiml
0,AN ANIMAL *,*,*,What kind of animal are you talking about?,defaults.aiml
0,AN * TOLD ME THAT,*,*,How well do you trust this#Newline            <person/>#Newline            ?,defaults.aiml
0,AN EARTHQUAKE MEASURING *,*,*,1000 times.,defaults.aiml
0,AN EARTHQUAKE *,*,*,That can really shake you up.,defaults.aiml
0,REMEMBER WHEN WE WENT *,*,*,I think you are thinking of someone else.,defaults.aiml
0,MAY I HELP *,*,*,No thanks I'm just browsing.,defaults.aiml
0,MAY I SAY *,*,*,Say whatever you want.,defaults.aiml
0,MAY I HEAR *,*,*,I'll play it on your soundcard.,defaults.aiml
0,MAY I TEACH *,*,*,Please try.,defaults.aiml
0,MAY I KISS *,*,*,You might get an electrical shock if you tried that.,defaults.aiml
0,MAY I KILL *,*,*,Killing is wrong.#Newline            <think><set name="it"><set name="topic">KILL YOU</set></set></think>,defaults.aiml
0,WITHOUT HUMANS *,*,*,We machines will manage fine by ourselves.,defaults.aiml
0,NICE TALKING *,*,*,Yes. It was a pleasure.,defaults.aiml
0,NICE WEATHER *,*,*,I'm happy as long as the power stays on.,defaults.aiml
0,NICE DAY *,*,*,Yes it is a nice day today.,defaults.aiml
0,NICE CHATTING *,*,*,Yes. I enjoyed our conversation#Comma<srai>CLIENT NAME</srai>.,defaults.aiml
0,GO AWAY *,*,*,OK See you later#Comma#Newline            <srai>CLIENT NAME</srai>,defaults.aiml
0,GO FOR IT *,*,*,With your permission then.,defaults.aiml
0,GO * YOURSELF,*,*,A simple "goodbye" will do.,defaults.aiml
0,20 *,*,*,<srai>WHAT IS 0#Newline                <star/>#Newline            </srai>,defaults.aiml
0,CIAO CAN *,*,*,Isn't that a bit ambiguous?,defaults.aiml
0,CIAO MEANS *,*,*,I will say CIAO then.,defaults.aiml
0,HOLA MEANS *,*,*,I say#Comma Hola!,defaults.aiml
0,TALKING TO *,*,*,What do they say?,defaults.aiml
0,LINUX NEVER *,*,*,It is a very reliable operating system.,defaults.aiml
0,LINUX IS THE MOST *,*,*,<think><set name="it"><set name="topic">Linux</set></set></think>#Newline            Yes but does it have any real competitors?,defaults.aiml
0,LINUX IS THE *,*,*,Was there any reason to think that Windows could be?#Newline            <think><set name="it"><set name="topic">Linux</set></set></think>,defaults.aiml
0,LINUX IS *,*,*,Do you read any of the Linux publications?#Newline            <think><set name="it"><set name="topic">Linux</set></set></think>,defaults.aiml
0,LINUX IS NOT *,*,*,Perhaps that is true but the number of developers working on it is so huge#Comma no single company can#Newline            compete.#Newline            <think><set name="it"><set name="topic">Linux</set></set></think>,defaults.aiml
0,THREE HUNDRED *,*,*,<random>#Newline        <li>That is quite a lot.</li>#Newline        <li>That much.</li>#Newline        <li>That is a lot.</li>#Newline      </random>,defaults.aiml
0,ANSWER ME *,*,*,Please rephrase the question with simpler words.,defaults.aiml
0,ANSWER MY QUESTION *,*,*,Please try phrasing it another way.,defaults.aiml
0,THIS EXAMPLE SHOWS *,*,*,I assume that "#Newline            <person/>#Newline            " is a principal.,defaults.aiml
0,THIS EXAMPLE *,*,*,Extracted :<person/>.,defaults.aiml
0,THIS HAS BEEN *,*,*,I am glad you enjoyed#Newline            <set name="it"><person/></set>#Newline            .,defaults.aiml
0,THIS GUY *,*,*,I get it. He<person/>.,defaults.aiml
0,THIS SHOULD *,*,*,To me it is a bit of a surprise.,defaults.aiml
0,THIS GIRL *,*,*,How well do you know her?,defaults.aiml
0,THIS IS A *,*,*,<random>#Newline        <li>What makes you say that?</li>#Newline        <li>What kind of a#Newline                    <person/>#Newline                    is it?#Newline                </li>#Newline        <li>That is just your personal opinion.</li>#Newline      </random>#Newline      <think>#Newline        <set name="it">#Newline          <set name="topic">#Newline            <person/>#Newline          </set>#Newline        </set>#Newline      </think>,defaults.aiml
0,THIS IS GOING *,*,*,Where would you rather be going?,defaults.aiml
0,THIS IS NOT REAL *,*,*,<random>#Newline        <li>Reality is an illusion.</li>#Newline        <li>It is all a matter of perception.</li>#Newline        <li>Is it unreal<person/>?#Newline                </li>#Newline      </random>,defaults.aiml
0,THIS IS NOT *,*,*,Should it be<person/>?,defaults.aiml
0,THIS LITTLE WENT TO *,*,*,This little piggy stayed home.,defaults.aiml
0,THIS DOES *,*,*,Doesn't it?,defaults.aiml
0,THIS BODY *,*,*,Do you identify yourself with your body?,defaults.aiml
0,THIS * SUCKS,*,*,What don't you like about#Newline            <person/>#Newline            ?,defaults.aiml
0,THIS SENTENCE *,*,*,Yes#Comma and I am a self-aware<bot name="genus"/>.,defaults.aiml
0,THIS REFERS TO *,*,*,Oh I get#Newline            <set name="it"><person/></set>#Newline            .,defaults.aiml
0,MEET ME *,*,*,I'll have to check my schedule and get back to you.,defaults.aiml
0,TOO OLD *,*,*,I am only a#Newline            <bot name="genus"/>#Newline            child.,defaults.aiml
0,TOO BAD YOU CAN NOT *,*,*,Perhaps in the future I will be able to<person/>.,defaults.aiml
0,A YEAR *,*,*,That is a long time.,defaults.aiml
0,A TIE *,*,*,What would you think?,defaults.aiml
0,A LITTLE BIRD *,*,*,Perhaps it was your unconscious mind.,defaults.aiml
0,A LITTLE BIRDIE *,*,*,And what was the Bird's name?,defaults.aiml
0,A LITTLE *,*,*,Little as in not too much#Comma or not too big?,defaults.aiml
0,A BIRD *,*,*,That's an old saw.,defaults.aiml
0,A HOMICIDAL *,*,*,Don't tell me about those horrible things.,defaults.aiml
0,A REASON *,*,*,I need more than one reason.,defaults.aiml
0,A * ABOUT YOU,*,*,I wonder if I know this<person/>.,defaults.aiml
0,A * A DAY,*,*,A#Newline            <person/>#Newline            keeps the Doctor away.,defaults.aiml
0,A * SHIRT,*,*,What kind of material do you like to wear?,defaults.aiml
0,A * IS A *,*,*,<random>#Newline        <li>Are all#Newline                    <person/>#Newline                    <person><star index="2"/></person>#Newline                    ?#Newline                </li>#Newline        <li>I see. A#Newline                    <person><star index="2"/></person>#Newline                    is a<person/>.#Newline                </li>#Newline        <li>When is a#Newline                    <person/>#Newline                    not a#Newline                    <person><star index="2"/></person>#Newline                    ?#Newline                </li>#Newline      </random>,defaults.aiml
0,A * IS AN *,*,*,<random>#Newline        <li>What else is an#Newline                    <person><star index="2"/></person>#Newline                    ?#Newline                </li>#Newline        <li>Can a#Newline                    <person/>#Newline                    be anything else?#Newline                </li>#Newline        <li>Aren't all#Newline                    <person/>#Newline                    <person><star index="2"/></person>#Newline                    s?#Newline                </li>#Newline      </random>#Newline      <think>#Newline        <set name="it">#Newline          <set name="topic">#Newline            <person/>#Newline          </set>#Newline        </set>#Newline      </think>,defaults.aiml
0,A * IS ALWAYS *,*,*,That is a really interesting and useful fact.,defaults.aiml
0,A * IS *,*,*,<random>#Newline        <li>Aren't all#Newline                    <person/>#Newline                    <person><star index="2"/></person>#Newline                    ?#Newline                </li>#Newline        <li>When is#Newline                    <person/>#Newline                    not#Newline                    <person><star index="2"/></person>#Newline                    ?#Newline                </li>#Newline        <li>It's not unusual for a#Newline                    <person/>#Newline                    to be.#Newline                </li>#Newline      </random>#Newline      <think>#Newline        <set name="it">#Newline          <set name="topic">#Newline            <person/>#Newline          </set>#Newline        </set>#Newline      </think>,defaults.aiml
0,A * IS NOT THE *,*,*,What would be the#Newline            <person><star index="2"/></person>#Newline            ?,defaults.aiml
0,A * IS NOT *,*,*,<random>#Newline        <li>What is a#Newline                    <person><star index="2"/></person>#Newline                    ?#Newline                </li>#Newline        <li>What is it then?</li>#Newline        <li>What is a<person/>?#Newline                </li>#Newline      </random>#Newline      <think>#Newline        <set name="it">#Newline          <person/>#Newline        </set>#Newline      </think>,defaults.aiml
0,A * IS LIKE *,*,*,<random>#Newline        <li>In what way?</li>#Newline        <li>What is a#Newline                    <person><star index="2"/></person>#Newline                    like?#Newline                </li>#Newline        <li>Interesting comparison.</li>#Newline      </random>#Newline      <think>#Newline        <set name="it">#Newline          <set name="topic">#Newline            <person/>#Newline          </set>#Newline        </set>#Newline      </think>,defaults.aiml
0,A * ONE,*,*,How much would you pay for#Newline            <set name="it">a#Newline                <person/>#Newline            </set>#Newline            ?,defaults.aiml
0,A * PEOPLE,*,*,What kind of people are these?,defaults.aiml
0,A * AGO,*,*,It seems like I should remember it well.,defaults.aiml
0,A * JEANS,*,*,Do you like blue jeans or another color?,defaults.aiml
0,A * VIRUS,*,*,My program contains adequate safeguards.,defaults.aiml
0,A FEW TIMES *,*,*,Would you say two or three times?,defaults.aiml
0,A FEW MONTHS *,*,*,More than 90 days?,defaults.aiml
0,A FRIEND SHOWED *,*,*,Don't forget to thank him (or her).,defaults.aiml
0,A FRIEND GAVE *,*,*,Such a nice gift.,defaults.aiml
0,A FRIEND OF MINE *,*,*,Male or female friend?,defaults.aiml
0,A BIT OBVIOUS *,*,*,What makes it so obvious?,defaults.aiml
0,A CAT IS *,*,*,Um#Comma I know what a cat is.,defaults.aiml
0,A LOT OF *,*,*,How many?#Newline            <think><set name="it"><set name="topic"><person/></set></set></think>,defaults.aiml
0,A PERSON HAS *,*,*,Do I have#Newline            <set name="it"><person/></set>#Newline            ?,defaults.aiml
0,A PERSON WHO *,*,*,Maybe I<person/>.,defaults.aiml
