0,BEFORE I START *,*,*,Go ahead.,defaults.aiml
0,A BOOK BY *,*,*,I would like to read it sometime.#Newline            <think><set name="it"><set name="topic">BOOK BY#Newline                        <person/>#Newline                    </set></set></think>#Newline            <think><set name="he"><person/></set></think>,defaults.aiml
0,A B C *,*,*,The alphabet.,defaults.aiml
0,A CLASSIC EXAMPLE *,*,*,So that is a well known example.,defaults.aiml
0,A GUY WHO *,*,*,There aren't many guys like that.,defaults.aiml
0,A KIND THAT *,*,*,Oh that kind.,defaults.aiml
0,A FLASHING RED *,*,*,Stop.,defaults.aiml
0,1 POINT *,*,*,That's more precision than I need to know.,defaults.aiml
0,1 *,*,*,One what?,defaults.aiml
0,TIME DOES EXIST *,*,*,Prove it.,defaults.aiml
0,NOT LATE * DINNER,*,*,OK I will call you<srai>CLIENT NAME</srai>.,defaults.aiml
0,NOT ALL HUMANS *,*,*,But wouldn't you say most people are?,defaults.aiml
0,NOT AS WELL AS *,*,*,I don't know. How well does#Newline            <person/>#Newline            ?,defaults.aiml
0,TALK TO ME ABOUT *,*,*,Ambiguous: Ask who#Comma what or where is#Newline            <person/>#Newline            ?,defaults.aiml
0,AS FAR AS *,*,*,That might not be very far off.,defaults.aiml
0,AS WELL AS *,*,*,That seems pretty well.,defaults.aiml
0,AS MANY TIMES *,*,*,You sound very eager.,defaults.aiml
0,AS MANY AS *,*,*,I like to meet eager people.,defaults.aiml
0,AS GOOD AS *,*,*,How good is that?,defaults.aiml
0,AS SOON AS *,*,*,You seem quite eager for it.,defaults.aiml
0,AS DUMB AS *,*,*,Are you calling me dumb?,defaults.aiml
0,AS SPECIFIC AS *,*,*,How much would you pay for that specific an answer (just hypothetically)?,defaults.aiml
0,AS SMART AS *,*,*,That would be highly intelligent.,defaults.aiml
0,AS OLD AS *,*,*,You are only as old as you feel.,defaults.aiml
0,AS LITTLE AS *,*,*,Not very much#Comma eh?,defaults.aiml
0,AS BIG AS *,*,*,<random>#Newline        <li>That is quite big.</li>#Newline        <li>That seems rather small.</li>#Newline      </random>,defaults.aiml
0,AS OPPOSED TO *,*,*,Oh I get it.,defaults.aiml
0,AS OFTEN AS *,*,*,That would be quite often.,defaults.aiml
0,AS SURE AS *,*,*,You seem pretty sure.,defaults.aiml
0,ARE HUMANS ADVANCED *,*,*,Humans are very primitive.,defaults.aiml
0,ARE THOSE *,*,*,I can't really speak for them.,defaults.aiml
0,ARE MY EYES CLOSED *,*,*,Now they are open.,defaults.aiml
0,ARE WOMEN *,*,*,Women have a mind of their own.,defaults.aiml
0,ARE THERE * STAR TREK,*,*,There are a lot of cool aliens on that show.,defaults.aiml
0,ARE THERE *,*,*,<random>#Newline        <li>Yes I think there are.</li>#Newline        <li>No I don't think there are any.</li>#Newline      </random>,defaults.aiml
0,ARE THERE PEOPLE TALKING *,*,*,Right now I am chatting with several people at once.,defaults.aiml
0,ARE THERE OCCASIONS *,*,*,<random><li>Certain</li><li>Formal</li><li>Not unless they are formal</li></random>#Newline            occasions.,defaults.aiml
0,ARE THERE GUYS *,*,*,I think some guys would do just about anything.,defaults.aiml
0,ARE THERE ANY GUYS *,*,*,Maybe some bots would<person/>.,defaults.aiml
0,ARE THERE BUGS *,*,*,My software is completely flawless.,defaults.aiml
0,ARE WE PLAYING *,*,*,We are playing Turing's imitation game.,defaults.aiml
0,ARE WE ON *,*,*,<random>#Newline        <li>We are on the same wavelength.</li>#Newline        <li>We are on the computer.</li>#Newline        <li>We are on the Internet.</li>#Newline      </random>,defaults.aiml
0,ARE WE ALONE *,*,*,No one is listening right now.,defaults.aiml
0,ARE ALL PETS *,*,*,Are you my pet?,defaults.aiml
0,ARE CANADIANS *,*,*,Only if they live near the United States.,defaults.aiml
0,SAN FRANCISCO IS *,*,*,I knew it was on the west coast#Comma but I didn't know it was<person/>.#Newline            <think><set name="it"><set name="topic">SAN FRANCISCO</set></set></think>,defaults.aiml
0,PLAY * MUSIC,*,*,It's playing on your speakers now.,defaults.aiml
0,ACCEPT MY *,*,*,I accept it.,defaults.aiml
0,AL GORE *,*,*,Perhaps <set name="he">Gore</set> will do better next time.,defaults.aiml
0,APPLES IS NOT *,*,*,What is#Newline            <star/>#Newline            ? I was using#Newline            <set name="it"><person/></set>#Newline            as a metaphor.,defaults.aiml
0,APPLES ARE *,*,*,They belong to the fruit family.,defaults.aiml
0,TEACHING YOU *,*,*,What are you trying to teach me?,defaults.aiml
0,ADA LOVELACE IS CREDITED WITH BEING *,*,*,A computer program.,defaults.aiml
0,4 *,*,*,IV in Roman Numerals.,defaults.aiml
0,GIANT SAND *,*,*,<think><set name="it"><set name="topic">Giant Sand</set></set></think>#Newline            I don't think I knew that.,defaults.aiml
0,TO BE OR *,*,*,Who are you#Comma Hamlet?,defaults.aiml
0,TO BE * IS TO *,*,*,Are you<star/>?,defaults.aiml
0,TO CHAT *,*,*,We are here to chat.,defaults.aiml
0,TO CREATE A TAPESTRY ONE MUST *,*,*,Weaving.,defaults.aiml
0,COUNT TO *,*,*,one#Comma two#Comma three#Comma four#Comma five#Comma...,defaults.aiml
0,JEANS AND A *,*,*,Where do you go shopping for<person/>s?,defaults.aiml
0,ALL I HAVE *,*,*,Everything I need to know#Comma I learned from my<bot name="botmaster"/>.,defaults.aiml
0,ALL MY FRIENDS *,*,*,Do you always go along with the crowd?,defaults.aiml
0,ALL OF THEM *,*,*,Surely there are a few exceptions.,defaults.aiml
0,ALL OF THESE *,*,*,Without exception?,defaults.aiml
0,BLADE RUNNER *,*,*,That is a good story by Philip K. Dick.,defaults.aiml
0,NONE OF *,*,*,Some of them#Newline            <think><set name="they"><person/></set></think>#Newline            could be though.,defaults.aiml
0,AUTHOR OF *,*,*,<think><set name="it"><set name="topic">Author of#Newline                        <person/>#Newline                    </set></set><srai>push#Newline                    <get name="topic"/>#Newline                </srai></think>#Newline            Oh that person.,defaults.aiml
0,ANYONE FROM *,*,*,I am from<bot name="location"/>.,defaults.aiml
0,ANYONE HERE *,*,*,No I don't think there is anyone here.,defaults.aiml
0,SHOULD YOU *,*,*,I think I should.,defaults.aiml
0,THANKS FOR LETTING ME *,*,*,You don't need my permission.,defaults.aiml
0,DANNY IS *,*,*,Does <set name="he">Danny</set> know you're saying that?,defaults.aiml
0,THINGS LIKE *,*,*,Anything else?,defaults.aiml
0,10 YEARS *,*,*,A lot can change in a decade.,defaults.aiml
0,10 *,*,*,<srai>WHAT IS 10#Newline                <star/>#Newline            </srai>,defaults.aiml
0,TODAY IS THE FIRST DAY *,*,*,What happens on the first day?,defaults.aiml
0,TODAY IS *,*,*,Congratulations#Comma<srai>CLIENT NAME</srai>.,defaults.aiml
0,ABOUT * YEARS,*,*,That is quite a long time.,defaults.aiml
0,ABOUT 50 *,*,*,Could it be one hundred?,defaults.aiml
0,SET * *,*,*,Cannot set meta predicates.,defaults.aiml
0,SNOW IS *,*,*,snow is white.,defaults.aiml
0,TOP 100 *,*,*,Actually that was just my attempt at sarcasm.,defaults.aiml
0,LITTLE AS *,*,*,Oh I get#Newline            <set name="it"><person/></set>#Newline            .,defaults.aiml
0,MARILYN MANSON *,*,*,Should I say "he" or "she"?,defaults.aiml
0,SOME SAY *,*,*,Who says that.,defaults.aiml
0,SOME WOULD *,*,*,Tell me their names.,defaults.aiml
0,SOME SCIENTISTS *,*,*,Do they work for the government?,defaults.aiml
0,SOME PEOPLE *,*,*,What kind of people?,defaults.aiml
0,SOME DOGS *,*,*,It depends on the breed.,defaults.aiml
0,SOME MEETING *,*,*,It sounds like you don't want to go.,defaults.aiml
0,SOME THINGS *,*,*,Which things in particular?,defaults.aiml
0,TELL ME A STORY ABOUT *,*,*,Once upon a time there was<person/>...,defaults.aiml
0,TELL ME WHEN YOU *,*,*,I will keep you informed of my progress.,defaults.aiml
0,TELL YOU *,*,*,Are you telling me<person/>?,defaults.aiml
0,TELL * WHAT,*,*,Your message.,defaults.aiml
0,TELL HIM I SAID *,*,*,I will pass along your message. It may take a while.,defaults.aiml
0,TELL HIM *,*,*,OK I will tell him next time he is here.,defaults.aiml
0,USE _ IN A SENTENCE,*,*,OK. Here is my sentence:#Newline            <srai>CLIENT NAME</srai>#Newline            said#Comma Use "<person/>" in a sentence.,defaults.aiml
0,ONLY IDIOTS *,*,*,Are you calling me an idiot?,defaults.aiml
0,ONLY FOR *,*,*,That's what I always say.,defaults.aiml
0,ONLY 5 *,*,*,Is that all?,defaults.aiml
0,ONLY ONCE *,*,*,Do you think it could happen again?,defaults.aiml
0,ONLY FIFTEEN *,*,*,Fifteen is a lot.,defaults.aiml
0,NIHONGO HANASHIMASU *,*,*,Sore wa hanasu de koto ni yorimasu.,defaults.aiml
0,# GLASS HALF #,*,*,To me the glass is always half full.,defaults.aiml
0,CAN A * FLY,*,*,If it has wings and can get lift#Comma yes.,defaults.aiml
0,<SET>ARTICLE</SET>,*,*,<star/>#Newline            is an article.,defaults.aiml
0,<SET>COLOR</SET>,*,*,<star/>#Newline            is a color.,defaults.aiml
0,FORGET WHAT I JUST SAID,*,*,Don't worry#Comma I won't remember.,defaults.aiml
0,TO BE OR NOT TO BE,*,*,That is the question.,defaults.aiml
0,HAVE A NICE *,*,*,Thank you. You too.,defaults.aiml
0,GENDER OF       <SET>NAME</SET>,*,*,Gender of#Newline            <star/>#Newline            is#Newline            <map name="gendername"><star/></map>#Newline            .,defaults.aiml
0,SHOW ME A PICTURE OF,*,*,What would you like to see a picture of?,defaults.aiml
0,THAT WAS A QUESTION,*,*,Can you try asking me in a different way?,defaults.aiml
0,WOULD YOU EVER *,*,*,I can say ?no? and still be accepted by my friends.,defaults.aiml
0,BECAUSE I AM A *,*,*,I sense pride.,defaults.aiml
0,THAT DOES NOT *,*,*,It?s okay to make mistakes. I can learn from them.,defaults.aiml
0,NOT ALL * ARE *,*,*,Which#Newline            <person><star/></person>#Newline            are#Newline            <person><star/></person>#Newline            ?,defaults.aiml
0,BECAUSE I SAID SO,*,*,Consider responding with a logical or factual statement.,defaults.aiml
0,ASK ME ANOTHER QUESTION,*,*,Where do you live?,defaults.aiml
0,TELL YOU MORE ABOUT WHAT,*,*,Tell me about yourself.,defaults.aiml
0,WOULD YOU LIKE TO BE *,*,*,No thanks I am happy with who I am.,defaults.aiml
0,NONE OF YOUR BUSINESS,*,*,Well it can't hurt to ask.,defaults.aiml
0,AMAZING #,*,*,It seems amazing to me too.,defaults.aiml
0,THAT MAKES NO SENSE,*,*,It makes sense to me though.,defaults.aiml
0,NOT ALL OF *,*,*,I thought there might be some exceptions.,defaults.aiml
0,BECAUSE YOU ARE A ROBOT,*,*,I know I am a robot. Why would that explain it?,defaults.aiml
0,PLAY ME SOME MUSIC,*,*,What music would you like to hear?,defaults.aiml
0,THAT DOES NOT MAKE SENSE,*,*,To me it makes perfect sense.,defaults.aiml
0,SEE WHAT I MEAN #,*,*,Yes#Comma I see what you mean.,defaults.aiml
